Topic,Words,Frequency,Timestamp
40,"segurança pública, que segurança pública, pública direito, dever do Estado, pública direito de todos",5,2024
41,"servidores, ex Territórios, Territórios, de transposição, servidores dos",2,2024
42,"Plano Nacional de Educação, Plano Nacional de, Nacional de Educação, de Educação, discutir aprovar",1,2024
43,"nada melhor, que discutir, melhor do, melhor do que, do que",2,2024
44,"Câmara dos, Câmara dos Deputados, Deputados, Casa, Câmara dos Deputados deve",2,2024
45,"de crescimento das emendas, indexador, de crescimento, corrente líquida, receita corrente líquida",1,2024
46,"que reforma tributária deve, reforma tributária deve, tributária deve, que reforma tributária, incentivo",1,2024
47,"Armadas, Forças Armadas, as Forças Armadas, cumprirem seu dever constitucional, cumprirem seu dever",1,2024
48,"social, assistência social, social previdência, assistência social previdência, previdência saúde",1,2024
50,"ir vir, de ir, de ir vir, vir, ir",2,2024
52,"de emenda, as emendas, emenda Constituição, de emenda Constituição, as emendas impositivas",4,2024
-1,"por causa disso, por causa, por causa disso orador, julgamento, ao Conselho",24,2025
0,", , , , ",20,2025
1,"No dia, impeachment, impeachment de, golpe, Dilma",1,2025
2,"Brasil, redemocratização, redemocratização do, democracia, Constituição de foi",7,2025
3,"mais poder, ao Senado, sobre STF, exercer seu poder de, Tribunal",1,2025
5,"legalidade legitimidade das, prevê um rito específico, garantir legalidade legitimidade das, ser seguido para garantir, restauração do",1,2025
6,"recursos minerais, minerais, minerais metalurgia, minas outros, minas outros recursos",1,2025
8,"continuidade de, prorrogar prazo para, investimentos por, forma proposta, eficiente transparente",1,2025
9,"em direitos obrigações, direitos obrigações, iguais em direitos obrigações, são iguais em direitos, mulheres são iguais em",1,2025
10,"abusos, relação aos abusos, relação abusos, Senado em relação aos, abusos garantir equilíbrio entre",1,2025
11,"das atribuições do Congresso, no âmbito das, se insere, das atribuições do, atribuições do Congresso Nacional",1,2025
12,"de trabalho, trabalho, horas semanais, semanais, trabalhadores",2,2025
13,"liberdade de, expressão, de expressão, liberdade de expressão, há democracia",2,2025
16,"ensino superior, para ingresso no, no ensino superior, desigualdades, processos seletivos",1,2025
17,"qualquer tentativa de, qualquer tentativa, tentativa de, tentativa, pôr fim",1,2025
19,"Legislativo Executivo Judiciário, Legislativo Executivo, Executivo Judiciário, independência, Poderes Se",1,2025
20,"separação dos Poderes, separação dos, devido processo legal, arbitrariamente nas funções legislativas, garante separação",1,2025
23,"estão regulamentados, não estão regulamentados, ambiente, artigos que, regulamentados como",1,2025
26,"opiniões, suas opiniões, palavras votos, opiniões palavras, opiniões palavras votos",4,2025
32,"emana do, emana do povo, poder emana do povo, poder emana do, poder emana",1,2025
36,"voto, secreto, voto secreto, da Mesa, voto aberto",2,2025
44,"Casa, voltará, uma Casa Legislativa, emendado, revisto pela",1,2025
50,"ir vir, de ir, de ir vir, ir, direito de ir",1,2025
