Topic,Words,Frequency,Timestamp
1,"defende, orador defende, defende Constituição de, defende Constituição, que",55,2015
2,"exalta, orador exalta, orador exalta Constituição, orador exalta Constituição de, exalta Constituição de",29,2015
3,"impeachment, de impeachment, processo de impeachment, processo de, Dilma",53,2015
4,"defende, orador defende, que, defende que, Constituição",32,2015
5,"uma visão positiva, visão positiva, uma visão, visão, uma visão positiva sobre",19,2015
6,"No, aplica, se aplica, aplica se, aplica se aplica",10,2015
7,"Tribunal, Supremo Tribunal, Supremo, Supremo Tribunal Federal, Tribunal Federal",7,2015
8,"defende Constituição de como, defende Constituição de, defende Constituição, defende, Constituição de como",17,2015
9,"exalta Constituição de, exalta Constituição, exalta, como uma garantia de, dos portadores de",3,2015
10,"uma opinião clara sobre, uma opinião clara, opinião clara sobre, opinião clara, clara sobre",16,2015
11,"se ela como Constituição, ela como Constituição, referindo se ela como, se ela como, referindo se ela",6,2015
12,"critica Constituição de, critica Constituição, orador critica, orador critica Constituição de, orador critica Constituição",9,2015
13,"Fiscal, Responsabilidade Fiscal, Lei de Responsabilidade Fiscal, de Responsabilidade Fiscal, Lei de Responsabilidade",10,2015
14,"educação, Constituição, alimentação, para, educação como um",7,2015
15,"indígenas, terras, de terras, terras indígenas, de terras indígenas",7,2015
16,"orador critica, critica, que, vinculação, falta de",4,2015
17,"aplica se, aplica se aplica, se aplica se, se aplica se aplica, aplica se aplica se",5,2015
18,"emenda, emenda Constituição, Constituição, expressa, emenda Constituição que",10,2015
19,"Tribunal, Supremo, Supremo Tribunal, do Supremo, do Supremo Tribunal",9,2015
20,"artigo que, sobre, segurança pública, Constituição, Constituição de ao",5,2015
21,"Estados produtores, produtores, energia, petróleo, Estados",1,2015
22,"aplica se, aplica se aplica, se aplica se, se aplica se aplica, aplica se aplica se",6,2015
23,"medidas provisórias, medidas, medidas provisórias que, provisórias que, de medidas provisórias",6,2015
24,"penal, redução da maioridade penal, redução da maioridade, da maioridade penal, maioridade penal",1,2015
25,"orador critica, Brasil, critica Constituição de, critica Constituição, orador critica Constituição de",6,2015
26,"meio ambiente, ambiental, futuras gerações, as futuras gerações, para as futuras",4,2015
27,"adolescentes, crianças adolescentes, crianças, das crianças, das crianças adolescentes",4,2015
28,"SUS, de Saúde SUS, Saúde SUS, Único de Saúde SUS, Único de Saúde",2,2015
29,"recursos, critica Constituição de por, critica Constituição de, critica Constituição, critica",5,2015
30,"Ulysses, Ulysses Guimarães, Guimarães, de Ulysses, de Ulysses Guimarães",2,2015
31,"democrático, regime democrático, exalta Constituição, exalta Constituição de, Constituição de",5,2015
32,"tributária que, tributário, reforma tributária, sistema tributário, Constituição de",4,2015
33,"existente na, elogia postura do Presidente, Constituição elogia postura, por reafirmar, existente na Constituição",1,2015
34,"terceirização, Constituição direitos, garantias individuais coletivas Ele, Presidente do Senado Renan, representa uma revogação",1,2015
-1,"que, Constituição, Constituição de, orador, do",132,2016
0,"Não, aplica, se aplica, aplica se, aplica se aplica",292,2016
1,"defende, defende Constituição de, defende Constituição, orador defende, Constituição",91,2016
2,"exalta Constituição de, exalta, exalta Constituição, como, orador exalta",11,2016
3,"impeachment, de impeachment, processo de impeachment, processo de, que",322,2016
4,"defende, orador defende, defende que, que, orador defende que",35,2016
5,"uma visão, visão, uma visão positiva, visão positiva, visão positiva sobre",17,2016
6,"No, aplica, se aplica, aplica se, aplica se aplica",22,2016
7,"Tribunal, Supremo Tribunal, Supremo, Supremo Tribunal Federal, Tribunal Federal",7,2016
8,"defende Constituição de como, defende Constituição de, defende Constituição, defende, Constituição de como",30,2016
9,"de injunção como uma, sua regulamentação, injunção como uma, para democracia cidadania orador, de sua regulamentação",2,2016
10,"opinião clara, opinião clara sobre, uma opinião clara sobre, uma opinião clara, uma opinião",12,2016
11,"se ela como, referindo se ela como, referindo se ela, referindo se, ela como",9,2016
12,"critica, critica Constituição de, critica Constituição, orador critica, que",10,2016
13,"fiscal, que, Fiscal, de Responsabilidade Fiscal, Lei de Responsabilidade Fiscal",31,2016
14,"educação, Constituição, que, Constituição de, menciona",10,2016
15,"terras, terras indígenas, de terras, de terras indígenas, demarcação de",2,2016
16,"critica, orador critica, Constituição, recondução, situação",8,2016
17,"aplica se, aplica se aplica, se aplica se, se aplica se aplica, aplica se aplica se",14,2016
18,"Constituição brasileira, orador expressa, pela Constituição ressaltando, com violação da Constituição, afirmando que Senado",5,2016
19,"Supremo, Supremo Tribunal, Tribunal, Supremo Tribunal Federal, Tribunal Federal",5,2016
20,"Constituição, menciona Constituição de, menciona Constituição, menciona, inciso",7,2016
22,"aplica se, aplica se aplica, se aplica se, se aplica se aplica, aplica se aplica se",6,2016
23,"medida provisória, medidas provisórias, provisórias, de medidas provisórias, de medidas",2,2016
24,"crimes, de responsabilidade, penal, responsabilidade, crimes de",10,2016
25,"critica Constituição de, orador critica, critica Constituição, orador critica Constituição de, orador critica Constituição",10,2016
26,"ambiental, ambiente, meio ambiente, proteção ambiental, ao meio ambiente",2,2016
27,"adolescentes, crianças adolescentes, uma das, sociais mais, sociais mais avançadas",2,2016
28,"SUS, Único de Saúde SUS, de Saúde SUS, Saúde SUS, Único de Saúde",2,2016
29,"critica Constituição de por, critica Constituição de, critica Constituição, orador critica Constituição de, orador critica Constituição",2,2016
30,"Ulysses, Ulysses Guimarães, Guimarães, de Ulysses, de Ulysses Guimarães",5,2016
31,"democrático, democrático de direito, democrático de, independência, exalta Constituição",3,2016
33,"Presidente, Presidente da, Presidente da República, da República, República",8,2016
34,"presidente Lula, ex presidente Lula, presidente, ex presidente, Presidente",5,2016
35,"oradora critica, educação, áreas, oradora critica PEC, critica PEC",16,2016
-1,"Constituição, que, Constituição de, orador, do",142,2017
0,"Não, aplica, se aplica, aplica se, aplica se aplica",193,2017
1,"defende, defende Constituição de, defende Constituição, orador defende, Constituição",82,2017
2,"exalta Constituição de, exalta Constituição, exalta, orador exalta, orador exalta Constituição",12,2017
3,"impeachment, Dilma, de impeachment, impeachment da, processo de impeachment",17,2017
4,"defende, orador defende, defende que, Constituição, oradora defende",19,2017
5,"uma visão positiva, visão positiva, uma visão positiva sobre, visão positiva sobre, positiva sobre",7,2017
6,"No, aplica, se aplica, aplica se, aplica se aplica",10,2017
7,"Tribunal, Supremo Tribunal, Supremo, Supremo Tribunal Federal, Tribunal Federal",16,2017
8,"defende, defende Constituição de, defende Constituição, defende Constituição de como, de",15,2017
9,"exalta, exalta Constituição de, exalta Constituição, Roraima, oradora exalta",6,2017
10,"opinião clara sobre, opinião clara, uma opinião clara, uma opinião clara sobre, uma opinião",9,2017
11,"se ela como Constituição, ela como Constituição, se ela como, referindo se ela como, referindo se ela",7,2017
12,"critica, Constituição, Constituição de, orador critica, uma",17,2017
13,"fiscal, oradora utiliza Constituição, Federal Emenda, critica medida provisória que, papel constitucional das",3,2017
14,"educação, trabalho infantil, infantil, Constituição, da educação",8,2017
15,"terras, indígenas, de terras, terras indígenas, demarcação de",10,2017
16,"critica, orador critica, Constituição, Código Tributário, falta de",8,2017
17,"aplica se, aplica se aplica, se aplica se, se aplica se aplica, aplica se aplica se",6,2017
18,"orador expressa, expressa, importância, Constituição destacando, Constituição",8,2017
19,"Federal, Supremo Tribunal, do Supremo, do Supremo Tribunal, Supremo Tribunal Federal",2,2017
20,"Constituição, orador menciona Constituição de, não expressa uma opinião, expressa uma opinião, expressa uma opinião clara",2,2017
22,"aplica, se aplica, aplica se aplica se, aplica se, aplica se aplica",1,2017
23,"medidas provisórias, de medidas provisórias, de medidas, orador critica, orador critica uso",3,2017
24,"penal, provisórias sobre, medidas provisórias sobre, de medidas provisórias sobre, vedação de",4,2017
25,"critica Constituição de, critica Constituição, orador critica Constituição de, orador critica Constituição, orador critica",7,2017
26,"ambiente, meio ambiente, proteção do meio ambiente, proteção do meio, do meio ambiente",2,2017
27,"crianças, das crianças, dos direitos das crianças, direitos das crianças, adolescentes",2,2017
29,"critica Constituição de, critica Constituição, aos municípios, orador critica Constituição de, orador critica Constituição",2,2017
30,"Ulysses, Ulysses Guimarães, Guimarães, de Ulysses, de Ulysses Guimarães",3,2017
31,"ao princípio do, para democracia estabilidade política, direito mas não expressa, decisões da Suprema Corte, democracia estabilidade política do",2,2017
32,"mercadorias serviços, compatíveis com Constituição, sobre os impostos, sobre mercadorias serviços, sobre mercadorias",1,2017
33,"Presidente, eleições diretas, do cargo de Presidente, do cargo de, vacância do cargo de",6,2017
34,"da República, República, Presidente, presidente Lula, menciona que as ações",2,2017
35,"critica Emenda, educação, oradora critica, critica Emenda Constitucional que, públicos",6,2017
-1,"Constituição, que, do, Constituição de, orador",106,2018
0,"Não, aplica, se aplica, aplica se, aplica se aplica",131,2018
1,"defende, defende Constituição de, defende Constituição, Constituição, Constituição de",77,2018
2,"Brasil, exalta, exalta Constituição de, exalta Constituição, exalta Constituição de como",13,2018
3,"impeachment, Dilma, Dilma Rousseff, impeachment de, de impeachment",22,2018
4,"defende, orador defende, defende que, defende importância, importância",14,2018
5,"uma visão, visão, uma visão positiva, visão positiva, uma visão positiva sobre",16,2018
6,"No, aplica, se aplica, aplica se, aplica se aplica",10,2018
7,"Tribunal, Supremo Tribunal, Supremo, Tribunal Federal, Supremo Tribunal Federal",27,2018
8,"defende, defende Constituição de como, defende Constituição de, defende Constituição, Constituição de como um",22,2018
9,"exalta, de forma positiva, forma positiva, de de forma positiva, Constituição de de forma",5,2018
10,"uma opinião clara, opinião clara sobre, opinião clara, uma opinião clara sobre, uma opinião",8,2018
11,"como Constituição, se ela como Constituição, ela como Constituição, referindo se ela como, se ela como",8,2018
12,"critica, orador critica, Constituição, Constituição de, orador",10,2018
13,"Fiscal, benefícios tributários, Lei, Lei de Responsabilidade Fiscal, de Responsabilidade Fiscal",4,2018
14,"educação, para, da educação, que Constituição consagra, de planejamento",3,2018
16,"critica, orador critica, da Constituição, Constituição, sendo",15,2018
17,"aplica se, aplica se aplica, se aplica se, se aplica se aplica, aplica se aplica se",4,2018
18,"orador expressa, inclusão, das Nações Unidas, atual sugerindo que, esse direito como",3,2018
19,"Supremo, Supremo Tribunal, Tribunal, Supremo Tribunal Federal, Tribunal Federal",6,2018
20,"artigo, Constituição, art, artigo que, orador",7,2018
22,"aplica se, aplica se aplica, se aplica se, se aplica se aplica, aplica se aplica se",4,2018
24,"cumprimento de pena, necessidade de mudanças legislativas, novo Código Penal, critica nem elogia diretamente, nem elogia diretamente",1,2018
25,"Brasil orador critica Constituição, fronteiras, Brasil orador critica, critica Constituição de, orador critica Constituição de",3,2018
26,"Pantanal, preservação, proteção ambiental, nacional estabelece, ao Código Florestal",3,2018
27,"crianças adolescentes, adolescentes, crianças, das crianças adolescentes, das crianças",4,2018
28,"SUS, Único de Saúde SUS, de Saúde SUS, Saúde SUS, Único de Saúde",1,2018
29,"de obrigações para, Pacto Federativo como, Federativo como, Federação destacando, devida contrapartida",1,2018
31,"democráticas, conquistas de, na convivência democrática, Ele vê como, liberdades direitos",2,2018
33,"compromisso, forte compromisso, expressa um forte compromisso, forte compromisso com, um forte compromisso com",3,2018
34,"Presidente, do ex, orador critica, Presidente Lula, ex Presidente Lula",6,2018
35,"critica Emenda Constitucional, critica Emenda, Emenda Constitucional, Constitucional, critica Emenda Constitucional que",4,2018
-1,"Constituição, que, orador, Constituição de, do",139,2019
0,"Não, aplica, se aplica, aplica se, aplica se aplica",401,2019
1,"defende, defende Constituição de, defende Constituição, orador defende Constituição de, orador defende Constituição",74,2019
2,"orador exalta, exalta, exalta Constituição de, exalta Constituição, orador exalta Constituição",25,2019
3,"em relação omissão, relação omissão, prazos para, para processo de, para processo",1,2019
4,"defende, orador defende, que, defende que, orador defende que",24,2019
5,"uma visão, visão, visão positiva, uma visão positiva, uma visão positiva sobre",25,2019
6,"No, aplica, se aplica, aplica se, aplica se aplica",11,2019
7,"Tribunal, Supremo, Supremo Tribunal, Supremo Tribunal Federal, Tribunal Federal",23,2019
8,"defende Constituição de como, defende, defende Constituição de, defende Constituição, Constituição de como",21,2019
9,"exalta Constituição de, exalta Constituição, exalta, orador exalta Constituição de, orador exalta Constituição",8,2019
10,"clara sobre, clara, mas não expressa, mas não expressa uma, uma opinião clara sobre",12,2019
11,"se ela como Constituição, como Constituição, ela como Constituição, referindo se ela como, se ela como",14,2019
12,"orador critica, Constituição de especialmente em, de especialmente em, de especialmente em relação, critica Constituição de",4,2019
13,"CPI, de uma CPI, uma CPI, instalação de uma, instalação de",8,2019
14,"educação, de, para, da educação, importância",10,2019
15,"terras, terras indígenas, de terras, atividades econômicas, atividades",5,2019
16,"orador critica, critica, sendo, está sendo, Constituição",8,2019
17,"aplica se, aplica se aplica, se aplica se, se aplica se aplica, aplica se aplica se",4,2019
18,"expressa, orador expressa, expressa apoio, orador expressa apoio, importância de modernizar",4,2019
19,"Tribunal, Supremo, Supremo Tribunal, Tribunal Federal, Supremo Tribunal Federal",6,2019
20,"artigo, Constituição, art, não expressa uma, não expressa",12,2019
22,"aplica se, aplica se aplica, se aplica se, se aplica se aplica, aplica se aplica se",3,2019
23,"medidas provisórias, medidas, de medidas provisórias, de medidas, Constituição caracterizando",2,2019
24,"penal, maioridade penal, maioridade, Constituição de, que ele considera",4,2019
25,"critica Constituição, critica Constituição de, critica, orador critica Constituição de, orador critica Constituição",3,2019
26,"ambiente, meio ambiente, meio, ambiental, do meio ambiente",13,2019
27,"da Criança, crianças, adolescentes, crianças adolescentes, políticas sociais",2,2019
28,"SUS, Único de Saúde SUS, Saúde SUS, de Saúde SUS, Único de Saúde",3,2019
29,"critica Constituição, critica Constituição de por, transferir, de recursos, critica Constituição de",3,2019
30,"Ulysses, Ulysses Guimarães, Guimarães, de referindo se ela, de referindo se",4,2019
31,"defesa da cidadania, democrático, democrático de direito, democrático de, Estado democrático de direito",4,2019
32,"que promove justiça, que promove justiça social, documento que promove, documento que promove justiça, promove justiça social",1,2019
33,"tais benefícios, ex Presidentes, entrada, sobre Constituição orador exalta, ter previsão",2,2019
34,"de Sergio, de Sergio Moro, Sergio, orador critica atuação de, afirmando que ele",3,2019
35,"critica Emenda Constitucional que, critica Emenda, critica Emenda Constitucional, oradora critica, critica",2,2019
-1,"Constituição, orador, Constituição de, que, menciona",29,2020
0,"Não, aplica, se aplica, aplica se, aplica se aplica",127,2020
1,"defende, defende Constituição de, defende Constituição, orador defende, orador defende Constituição de",24,2020
2,"principal exalta Constituição, principal exalta Constituição de, orador principal exalta, orador principal exalta Constituição, principal exalta",6,2020
3,"presidente, impeachment, não cassar, do presidente do, desses crimes",2,2020
4,"orador defende, defende, orador defende que, defende que, orador",16,2020
5,"por meio do sistema, texto constitucional como, de discussões, meio do sistema, por meio do",1,2020
6,"No, aplica, se aplica, aplica se, aplica se aplica",3,2020
7,"Tribunal, Supremo Tribunal, Supremo, Tribunal Federal, Supremo Tribunal Federal",6,2020
8,"defende, defende Constituição de, defende Constituição, orador defende, orador defende Constituição de",6,2020
10,"uma opinião clara sobre, uma opinião clara, opinião clara, opinião clara sobre, uma opinião",6,2020
12,"resultou em um, por ser excessivamente, confuso, com boas intenções, criada com boas",1,2020
13,"de já prevê possibilidade, fortunas que, grandes fortunas que, nela Ele vê Constituição, já prevê possibilidade de",1,2020
14,"educação, inclusão do, importância de torná lo, importância de torná, como uma grande vitória",2,2020
15,"que projeto, na Constituição, terras, de Ele enfatiza que, está respaldado",1,2020
16,"orador critica, pública argumentando que, para garantir segurança pública, como Constituição aplicada em, segurança pública argumentando que",2,2020
17,"aplica, se aplica, aplica se aplica se, aplica se, aplica se aplica",1,2020
18,"Constituição destacando, harmonia, eleições durante pandemia, de prorrogação de, de prorrogação de mandatos",3,2020
19,"Federal, Supremo Tribunal, Tribunal, Tribunal Federal, Supremo Tribunal Federal",2,2020
20,"sobre Constituição de Ele, positiva ou negativa sobre, da Constituição Federal mas, negativa sobre Constituição, Constituição Federal mas não",1,2020
22,"aplica se, aplica se aplica, se aplica se, se aplica se aplica, aplica se aplica se",13,2020
23,"sessão legislativa que, parte do Presidente da, louvável, considera uma medida, mesma sessão legislativa que",1,2020
25,"na realidade, um livro, na prática que, realidade brasileira, não funciona",1,2020
26,"ambiental, ambiente, meio ambiente, preservação ambiental, da Zona Franca",2,2020
28,"SUS, Único de Saúde SUS, Saúde SUS, de Saúde SUS, Sistema Único de Saúde",3,2020
30,"Ulysses, Ulysses Guimarães, Guimarães, admite reformas, respeitá la como",1,2020
32,"reforma tributária, verdadeiramente, uma reforma tributária que, de uma reforma tributária, tributária que",2,2020
35,"prejudica investimento, anos como uma, que congelou os recursos, critica Emenda Constitucional que, recursos para saúde educação",1,2020
-1,"Constituição, que, orador, Constituição de, do",115,2021
0,"Não, aplica, se aplica, aplica se, aplica se aplica",291,2021
1,"defende Constituição de, defende Constituição, defende, orador defende, orador defende Constituição de",37,2021
2,"exalta Constituição, exalta, exalta Constituição de, democracia, orador exalta",14,2021
3,"impeachment, de impeachment, que Constituição, constitucional de processar julgar, constitucional de processar",3,2021
4,"defende, orador defende, Constituição Federal, que, Federal",24,2021
5,"uma visão positiva, visão positiva, visão positiva sobre, uma visão positiva sobre, positiva sobre",23,2021
6,"No, aplica, se aplica, aplica se, aplica se aplica",8,2021
7,"Tribunal, Supremo Tribunal, Supremo, Supremo Tribunal Federal, Tribunal Federal",7,2021
8,"democracia, defende Constituição de, defende Constituição, defende, de como um pilar",4,2021
9,"exalta Constituição de, exalta Constituição, exalta Constituição de por, exalta, Constituição de por ter",3,2021
10,"opinião clara, uma opinião clara, uma opinião clara sobre, opinião clara sobre, uma opinião",2,2021
11,"se ela como Constituição, ela como Constituição, se ela como, referindo se ela como, referindo se ela",9,2021
13,"CPI, fiscalização, Constituição, que, fiscal",11,2021
14,"educação, para educação, para, orador, importância",12,2021
15,"terras, Estado em relação aos, de ao reconhecer os, Constituição de ao reconhecer, Ele foca na necessidade",1,2021
16,"orador critica, critica, Constituição, orador, critica proposta de",10,2021
17,"aplica se, aplica se aplica, se aplica se, se aplica se aplica, aplica se aplica se",7,2021
18,"orador expressa, expressa apoio, orador expressa apoio, de emenda Constituição destacando, emenda Constituição destacando",7,2021
19,"Supremo Tribunal, Tribunal, Tribunal Federal, Supremo Tribunal Federal, do Supremo",3,2021
20,"associações, da administração pública, municipais, da administração, Constituição de ao",4,2021
22,"aplica se, aplica se aplica, se aplica se, se aplica se aplica, aplica se aplica se",14,2021
24,"Constituição assegurou uma, que trouxe uma, assegurou uma, refletida, que Constituição assegurou uma",1,2021
26,"ambiente, meio ambiente, ambiental, do meio ambiente, do meio",5,2021
27,"crianças adolescentes, como essenciais, estabelece prioridade, adolescentes, prioridade absoluta para",1,2021
28,"SUS, direito saúde, Único de Saúde SUS, de Saúde SUS, Saúde SUS",1,2021
31,"Estado democrático de direito, democrático de direito, Estado democrático de, democrático de, Estado democrático",3,2021
32,"tributária, reforma tributária, reforma, tributária mas, de uma reforma tributária",3,2021
33,"de destacando compromisso do, destacando compromisso do, garantindo democracia, atuar dentro dos limites, constitucionais garantindo",1,2021
34,"elogiando decisão do, transgressões, da Constituição elogiando, Constituição elogiando, elogiando decisão",1,2021
35,"critica Emenda Constitucional que, critica Emenda, critica Emenda Constitucional, oradora critica Emenda, oradora critica Emenda Constitucional",4,2021
-1,"que, Constituição, orador, Constituição de, com",103,2022
0,"Não, aplica, se aplica, aplica se, aplica se aplica",276,2022
1,"defende, orador defende, defende Constituição de, defende Constituição, orador defende Constituição de",42,2022
2,"Brasil, destacando, orador exalta, exalta, de destacando",9,2022
3,"impeachment, de impeachment, Dilma, Dilma Rousseff, impeachment da",7,2022
4,"defende, orador defende, Constituição Federal, que, Federal",23,2022
5,"uma visão, visão positiva, uma visão positiva, visão, positiva sobre",35,2022
6,"No, aplica, se aplica, aplica se, aplica se aplica",4,2022
7,"Tribunal, Supremo Tribunal, Supremo, Supremo Tribunal Federal, Tribunal Federal",14,2022
8,"defende, defende Constituição de, defende Constituição, orador defende, orador defende Constituição de",7,2022
9,"exalta Constituição de, exalta Constituição, exalta, para, Constituição de",8,2022
10,"uma opinião clara sobre, opinião clara sobre, uma opinião clara, opinião clara, uma opinião",11,2022
11,"se ela como Constituição, ela como Constituição, referindo se ela como, referindo se ela, referindo se",4,2022
12,"critica Constituição de, critica Constituição, orador critica Constituição de, orador critica Constituição, critica",4,2022
13,"fiscalização, fiscal, Fiscal, de Responsabilidade Fiscal, Responsabilidade Fiscal",6,2022
14,"educação, na educação, Educação, educação física, do",9,2022
15,"terras, indígenas, terras indígenas, de terras, temporal",4,2022
16,"orador critica, critica, que, análise, orador",8,2022
17,"aplica se, aplica se aplica, se aplica se, se aplica se aplica, aplica se aplica se",6,2022
18,"expressa apoio, expressa, apoio, orador expressa, orador expressa apoio",19,2022
19,"Supremo, Supremo Tribunal, Tribunal, Supremo Tribunal Federal, Tribunal Federal",6,2022
20,"orador menciona, artigo que, art, orador menciona Constituição de, menciona Constituição de",5,2022
22,"aplica se, aplica se aplica, se aplica se, se aplica se aplica, aplica se aplica se",4,2022
24,"do art do, Constituição de como devido, de como devido processo, de como devido, de lei que busca",1,2022
26,"ambiental, ambiente, meio ambiente, proteção ambiental, Constituição Federal especificamente no",5,2022
27,"centrado na, dotando, direitos garantias fundamentais Ele, um programa, de direitos garantias fundamentais",1,2022
28,"saúde, SUS, de saúde, Saúde SUS, Único de Saúde SUS",2,2022
29,"prefeitos, serviços públicos aos, os recursos financeiros, públicos aos, municípios brasileiros",1,2022
30,"Ulysses, Ulysses Guimarães, Guimarães, citação, importância de combater",3,2022
