Topic,Words,Frequency,Timestamp
31,"mencionando seu papel como, defesa das instituições, um cheque em branco, limitado, cheque em branco",1,2022
32,"necessidade de ação para, questão tributária, que já está previsto, previsto constitucionalmente mas, Constituição em relação uma",1,2022
33,"princípios orador exalta Constituição, defesa desses princípios, elogia condução, de culto destaca, destacando compromisso com",2,2022
34,"Presidente, utiliza medidas provisórias, decisão da Ministra Rosa, utiliza medidas provisórias para, Weber que",2,2022
35,"saúde educação, oradora critica, educação, critica Emenda Constitucional que, critica Emenda",3,2022
-1,"Constituição, que, orador, do, Constituição de",120,2023
0,"Não, aplica, se aplica, aplica se, aplica se aplica",317,2023
1,"defende, orador defende, defende Constituição de, defende Constituição, orador defende Constituição de",72,2023
2,"Brasil, exalta, exalta Constituição de, exalta Constituição, orador exalta",15,2023
3,"impeachment, de Dilma, pedidos, Constituição foi rasgada, que Constituição foi rasgada",3,2023
4,"orador defende, defende, orador defende que, defende que, orador",31,2023
5,"uma visão positiva, visão positiva, positiva sobre, uma visão positiva sobre, visão positiva sobre",15,2023
6,"No, aplica, se aplica, aplica se, aplica se aplica",9,2023
7,"Tribunal, Supremo Tribunal, Supremo, Supremo Tribunal Federal, Tribunal Federal",25,2023
8,"defende, defende Constituição de, defende Constituição, no Brasil, orador defende",8,2023
9,"exalta Constituição de, exalta Constituição, exalta, orador exalta Constituição de, orador exalta Constituição",10,2023
10,"mas não expressa uma, mas não expressa, opinião clara sobre, opinião clara, uma opinião clara sobre",4,2023
11,"se ela como, referindo se ela como, referindo se ela, como Constituição, referindo se",9,2023
12,"critica, orador critica, critica Constituição de, critica Constituição, orador critica Constituição de",6,2023
13,"representação, estados, critica mudança na, aumento significativo, orador critica mudança na",2,2023
14,"educação, para, Constituição, que, na Constituição",12,2023
15,"terras, indígenas, terras indígenas, temporal, de terras",26,2023
16,"orador critica, critica, orador critica atual, critica atual, Constituição",10,2023
17,"aplica se, aplica se aplica, se aplica se, se aplica se aplica, aplica se aplica se",5,2023
18,"orador expressa, emenda, de emenda, Constituição destacando, orador",7,2023
19,"Supremo, Supremo Tribunal, Tribunal, Tribunal Federal, Supremo Tribunal Federal",17,2023
20,"art, segurança viária, viária, da segurança pública, art orador",6,2023
22,"aplica se, aplica se aplica, se aplica se, se aplica se aplica, aplica se aplica se",3,2023
23,"do Parlamento, Parlamento, provisórias, passar pelo crivo do, pelo crivo do",1,2023
24,"crimes, penal, Penal, de Processo Penal, Código de Processo Penal",4,2023
25,"em um estado, Brasil vive, um estado de exceção, não respeitada, estado de exceção",1,2023
26,"ambiente, meio ambiente, ambiental, ao meio ambiente, ao meio",4,2023
27,"crianças, crianças adolescentes, adolescentes, das crianças, família",5,2023
28,"SUS, saúde, Saúde SUS, Único de Saúde SUS, de Saúde SUS",2,2023
30,"Ulysses, Ulysses Guimarães, Guimarães, de Ulysses, de Ulysses Guimarães",2,2023
31,"Estado democrático de direito, democrático de direito, Estado democrático de, democrático de, Estado democrático",2,2023
32,"tributária, reforma, reforma tributária, sistema tributário, tributário",6,2023
33,"Presidente, Presidente do, Presidente do Senado, do Presidente, Constituição de destacando",3,2023
34,"do Presidente, Presidente da República afirmando, em relação política, prerrogativas do Presidente, Congresso Nacional em relação",2,2023
-1,"Constituição, orador, Constituição de, critica, como",98,2024
0,"Não, aplica, se aplica, aplica se, aplica se aplica",974,2024
1,"defende, orador defende, defende Constituição de, defende Constituição, orador defende Constituição de",89,2024
2,"exalta, orador exalta, exalta Constituição, do, exalta Constituição de",11,2024
3,"impeachment, de impeachment, Dilma, abusos de, processo de impeachment",4,2024
4,"defende, orador defende, que, defende que, orador defende que",29,2024
5,"uma visão, visão, uma visão positiva, visão positiva, uma visão positiva sobre",14,2024
6,"No, aplica, se aplica, aplica se, aplica se aplica",8,2024
7,"Tribunal, Supremo, Supremo Tribunal, Tribunal Federal, Supremo Tribunal Federal",23,2024
8,"defende Constituição de, defende Constituição, defende, orador defende Constituição de, orador defende Constituição",16,2024
9,"emenda Constituição que trouxe, Único de Saúde destacando, importância de tal medida, uma das mais importantes, para as empregadas domésticas",2,2024
10,"mas não expressa, mas não expressa uma, opinião clara, uma opinião clara sobre, uma opinião clara",4,2024
11,"se ela como Constituição, ela como Constituição, referindo se ela como, se ela como, referindo se ela",8,2024
12,"critica Constituição de, critica Constituição, afirmando que ela, orador critica Constituição de, orador critica Constituição",3,2024
13,"de crescimento, de ajuste fiscal, que está previsto constitucionalmente, está previsto constitucionalmente, ajuste fiscal",1,2024
14,"educação, que educação, Constituição, para, qualidade",7,2024
15,"terras, de terras, demarcação, demarcação de, demarcação de terras",3,2024
16,"orador critica, critica, sendo, está sendo, orador",21,2024
17,"aplica se, aplica se aplica, se aplica se, se aplica se aplica, aplica se aplica se",8,2024
18,"Constituição destacando, Constituição destacando sua, Constituição destacando sua importância, orador expressa, destacando sua importância",3,2024
19,"Tribunal, Supremo, Supremo Tribunal, Tribunal Federal, Supremo Tribunal Federal",28,2024
20,"art, Constituição, artigo que, menciona, expressa uma opinião clara",9,2024
22,"aplica se, aplica se aplica, se aplica se, se aplica se aplica, aplica se aplica se",5,2024
24,"penal, Penal, legislar sobre, conforme, estados",5,2024
25,"orador critica, critica Constituição de, critica Constituição, orador critica Constituição de, orador critica Constituição",3,2024
26,"ambiental, ambiente, proteção ambiental, meio ambiente, proteção",4,2024
27,"crianças adolescentes, adolescentes, das crianças adolescentes, prioridade absoluta, direitos das crianças",3,2024
28,"saúde são, garantido por ela que, direito fundamental garantido por, fundamental garantido por, protegidos pela Constituição",1,2024
30,"Ulysses, Ulysses Guimarães, Guimarães, de Ulysses, de Ulysses Guimarães",2,2024
31,"defesa do regime democrático, defesa do regime, resistir tentativas de, aqueles que atentaram, em garantir justiça",2,2024
32,"tributária, reforma tributária, reforma, tributário, Braga",5,2024
33,"caminho legal, encontrar soluções, de elogiando, Constituição de elogiando, legal constitucional",1,2024
34,"do Presidente da República, do Presidente da, do Presidente, Presidente da República, Presidente da",2,2024
35,"especulação, oradora critica Proposta, oradora critica Proposta de, propõe extinção dos, ela favorece",1,2024
-1,"Constituição, que, orador, está sendo, sendo",14,2025
0,"Não, aplica, se aplica, aplica se, aplica se aplica",300,2025
1,"defende, orador defende, as ações que considera, de seja respeitada cumprida, criticando as",5,2025
2,"exalta, orador exalta, exalta Constituição de como, exalta Constituição de, exalta Constituição",8,2025
3,"que isso foi um, critica decisão de, de fatiar, oradora critica decisão, que isso foi",1,2025
4,"Parlamento, demonstrando respeito confiança, respeito confiança na, do Executivo destacando, que Comissão de Constituição",2,2025
5,"na Constituição indicando, expressa gratidão pela, do Pantanal, oradora expressa gratidão, Constituição indicando uma visão",1,2025
7,"Tribunal, Supremo Tribunal, Tribunal Federal, Supremo Tribunal Federal, Federal",3,2025
11,"se ela como Constituição, ela como Constituição, exalta Constituição de referindo, ela como Constituição Cidadã, referindo se ela como",2,2025
14,"na Constituição sugerindo, para garantir equidade, garantir equidade, na Constituição sugerindo que, regime de colaboração",1,2025
16,"orador critica, está sendo, sendo, critica, Constituição está sendo",6,2025
18,"principal expressa, do rito constitucional para, provisórias destacando importância de, orador principal expressa, do rito constitucional",1,2025
19,"que os ministros, que os, cumprem Constituição, os ministros não, que os ministros não",1,2025
22,"aplica, se aplica, aplica se aplica se, aplica se, aplica se aplica",1,2025
32,"tributária, respeitado para, documento que precisa, documento que precisa ser, lei geral",1,2025
