Topic,Count,Name,Representation,Aspect1,Representative_Docs
20,120,20_bem estar social_estar social_construir_tem competência,"['bem estar social', 'estar social', 'construir', 'tem competência', 'educação direito', 'bem estar', 'Estado bem estar social', 'Estado bem', 'Estado bem estar', 'Supremo Tribunal Federal', 'Supremo Tribunal', 'Tribunal Federal', 'estar', 'Federal tem competência', 'Supremo', 'Federal', 'país', 'saúde', 'educação', 'energia elétrica']","['bem', 'comércio', 'servidores', 'país', 'saúde', 'educação', 'modelo', 'elétrica', 'contas', 'desenvolvimento', 'livre', 'direito', 'energia', 'União', 'valores', 'competência', 'Estado', 'obrigação', 'interesse', 'competências']","['A Constituição estabelece que o Senado Federal tem a competência para processar e julgar os Ministros do Supremo Tribunal Federal nos crimes de responsabilidade.', 'a Constituição de 1988 consagrou o Sistema Único de Saúde (SUS) e estabeleceu um Estado de bem-estar social com direitos para os cidadãos', 'a Constituição de 1988 começou a construir um Estado de bem-estar social no Brasil']"
21,118,21_soberania_atribui Senado_saúde educação_ensino,"['soberania', 'atribui Senado', 'saúde educação', 'ensino', 'direitos', 'soberania popular', 'Paraguai', 'saúde', 'projeto lei', 'política', 'responsável', 'missão', 'brasileiras', 'casos relevância urgência', 'casos relevância', 'defendida', 'convocação', 'obrigações', 'impeachment', 'Estados Municípios']","['soberania', 'verbas', 'planejamento', 'ensino', 'cargo', 'direitos', 'saúde', 'política', 'responsável', 'missão', 'brasileiras', 'acesso', 'convocação', 'familiar', 'violência', 'livre', 'obrigações', 'impeachment', 'maternidade', 'educação']","['a Constituição estabelece o dever da família, da sociedade e do Estado de assegurar à criança, ao adolescente e ao jovem, com absoluta prioridade, diversos direitos, incluindo o direito à vida, à saúde, à educação e à proteção contra a violência.', 'a Constituição estabelece que a República Federativa do Brasil buscará a integração econômica, política, social e cultural dos povos da América Latina.', 'a Constituição estabelece direitos sociais, como saúde, educação, alimentação, trabalho, moradia, transporte, lazer, segurança, previdência social, proteção à maternidade e à infância e assistência aos desamparados.']"
22,112,22_emenda_plena liberdade_ponto vista_fronteira,"['emenda', 'plena liberdade', 'ponto vista', 'fronteira', 'comum', 'mudar', 'normas', 'todos', 'plena', 'diz', 'independentemente', 'nem', 'liberdade', 'respeitada', 'Nacional', 'deve respeitada não', 'respeitada não', 'Federal', 'igualdade', 'opiniões']","['emenda', 'plena liberdade', 'ponto', 'fronteira', 'vista', 'comum', 'normas', 'plena', 'conquistas', 'liberdade', 'piso', 'informação', 'igualdade', 'opiniões', 'ano', 'fiscais', 'linha', 'espaço', 'quilômetros', 'base']","['a Constituição deve ser cumprida, especialmente no que diz respeito à hierarquia e disciplina das Forças Armadas.', 'a Constituição permitiu a corrupção, a descrença nos políticos, a falta de sonhos utópicos, os partidos sem propostas, sem identidades, nem do ponto de vista moral, nem do ponto de vista ideológico.', 'A Constituição de 1988 determina que os Territórios Federais de Roraima e do Amapá são transformados em Estados Federados, mantidos seus atuais limites geográficos.']"
23,108,23_alterar_votos_territoriais_reforma previdência,"['alterar', 'votos', 'territoriais', 'reforma previdência', 'segurança', 'impeachment só pode', 'circunstâncias', 'impeachment só', 'interesses', 'previdência', 'indisponíveis', 'segurança pública', 'direitos garantias individuais', 'regime', 'brasileiros', 'Parlamentar', 'legislar', 'impeachment', 'garantias individuais', 'garantias']","['votos', 'territoriais', 'individuais', 'segurança', 'circunstâncias', 'interesses', 'previdência', 'indisponíveis', 'regime', 'brasileiros', 'número', 'impeachment', 'garantias', 'cumprimento', 'justa', 'competência', 'questão', 'áreas', 'responsabilidade', 'leis']","['a Constituição assegura a igualdade de todos perante a lei, sem distinção de qualquer natureza, garantindo direitos fundamentais a brasileiros e estrangeiros residentes no País.', 'a Constituição estabelece o instituto do impeachment, que só pode ser autorizado em determinadas circunstâncias, como quando há crime de responsabilidade direta da Presidenta da República.', 'a Constituição estabelece que o Ministério Público deve defender a ordem jurídica, o regime democrático e os interesses sociais e individuais indisponíveis.']"
24,107,24_Congresso_Federal_nos Estados_Congresso Nacional,"['Congresso', 'Federal', 'nos Estados', 'Congresso Nacional', 'fontes financiamento', 'defesa', 'Senado Federal tem', 'fundamento', 'decisões judiciais', 'Nacional', 'República', 'drogas', 'serviços', 'Governo', 'Federal tem', 'fontes', 'tribunais', 'despesas', 'nosso', 'crimes']","['Congresso', 'superiores', 'populares', 'rito', 'defesa', 'fundamento', 'drogas', 'serviços', 'possibilidade', 'fontes', 'tribunais', 'despesas', 'direito', 'promoção', 'tributos', 'crimes', 'sistema', 'prática', 'judiciais', 'contraditório']","['a Constituição estabelece como um dos objetivos fundamentais da República Federativa do Brasil erradicar a pobreza e a marginalização e reduzir as desigualdades regionais.', 'a previdência contributiva pública faz parte do sistema de seguridade social instituído pela Constituição de 1988, e que as fontes de financiamento do sistema cobrem suas despesas, e a pequena parte que não é coberta o Governo Federal, por mandato constitucional, deve cobrir', 'a saúde é direito de todos e dever do Estado, garantido mediante políticas sociais e econômicas que visem à redução do risco de doença e de outros agravos e ao acesso universal e igualitário às ações e serviços para sua promoção, proteção e recuperação.']"
25,103,25_direitos garantias fundamentais_garantias fundamentais_proteção_cidadão brasileiro,"['direitos garantias fundamentais', 'garantias fundamentais', 'proteção', 'cidadão brasileiro', 'assegurado', 'policiais', 'entre direitos', 'direitos garantias', 'tem direito', 'proteção direitos', 'consumidor', 'cidadão', 'brasileiro', 'distinção qualquer natureza', 'distinção qualquer', 'sem distinção', 'garantias', 'crimes', 'distinção', 'condição']","['proteção', 'policiais', 'fronteiras', 'consumidor', 'compromisso', 'cidadão', 'brasileiro', 'combate', 'garantias', 'crimes', 'distinção', 'condição', 'ano', 'voto', 'segurança', 'natureza', 'secreto', 'direitos', 'brasileira', 'constitucional']","['a proteção ao consumidor se insere entre os direitos e garantias fundamentais de nosso País, com status de cláusula pétrea na Constituição.', 'a Constituição agora inclui a proteção de dados pessoais entre os direitos e garantias fundamentais do cidadão.', 'a Constituição estabelece os direitos e garantias fundamentais, incluindo a proteção dos direitos de todas as pessoas, sem distinção de qualquer natureza.']"
26,103,26_advogado_atos manifestações_momentos_processual,"['advogado', 'atos manifestações', 'momentos', 'processual', 'manifestações', 'desrespeitada', 'público', 'mandato', 'apreciação', 'quatro', 'atendimento', 'diz', 'saúde', 'garantir', 'civil', 'educação direito', 'presidencial', 'nas', 'essencial', 'inviolabilidade']","['advogado', 'receita', 'remanescentes', 'momentos', 'atos', 'processual', 'manifestações', 'direito', 'público', 'mandato', 'apreciação', 'atendimento', 'fontes', 'saúde', 'civil', 'terra', 'presidencial', 'Casas', 'essencial', 'inviolabilidade']","['a Constituição estabelece que o Plenário de cada uma das Casas deverá examinar, preliminarmente ao mérito da medida provisória, o atendimento ou não dos pressupostos constitucionais de relevância e urgência e sua adequação financeira e orçamentária.', 'a Constituição valoriza como indispensável a atuação do advogado na administração da justiça e garante a esses profissionais a inviolabilidade, no exercício da profissão, de seus atos e de suas manifestações.', 'A Constituição estabelece o voto secreto nas deliberações sobre perda de mandato, apreciação de veto presidencial, e para a indicação de magistrados, ministros do TCU, Governador de Território, Presidente e diretores do Banco Central, procurador-geral da República e chefes de missão diplomática.']"
27,101,27_mandato_define_Mesa_indicação,"['mandato', 'define', 'Mesa', 'indicação', 'patrimônio', 'normalidade', 'pública gratuita', 'princípios', 'saneamento', 'legislativa', 'gratuita', 'competência legislativa', 'desenvolvimento', 'incentivos fiscais', 'reeleição', 'União', 'competência', 'renda', 'crime responsabilidade', 'incentivos']","['mandato', 'Mesa', 'indicação', 'patrimônio', 'normalidade', 'princípios', 'saneamento', 'partido', 'possibilidade', 'legislativa', 'gratuita', 'desenvolvimento', 'fato', 'reeleição', 'União', 'justa', 'competência', 'renda', 'incentivos', 'questão']","['A Constituição estabelece que a República Federativa do Brasil buscará a integração econômica, política, social e cultural dos povos da América Latina.', 'a Constituição estabelece que a abertura de crédito suplementar ou especial sem prévia autorização legislativa e sem indicação dos recursos correspondentes é vedada.', 'a Constituição estabelece que os membros da Mesa serão eleitos para um mandato de dois anos, vedada a reeleição para período imediatamente subsequente, e que na composição da Mesa é assegurada, tanto quanto possível, a representação proporcional dos partidos.']"
28,99,28_administrativa_legislar_probidade administrativa_eleição,"['administrativa', 'legislar', 'probidade administrativa', 'eleição', 'probidade', 'moralidade', 'Nacional deve', 'Congresso Nacional deve', 'direitos sociais', 'parlamentares', 'impeachment', 'Congresso', 'medidas', 'liberdade expressão', 'proíbe', 'Congresso Nacional', 'constitucionais', 'julgamento', 'educação saúde', 'não podem']","['administrativa', 'eleição', 'probidade', 'moralidade', 'parlamentares', 'impeachment', 'exercício', 'medidas', 'mínimo', 'garantia', 'expressão', 'constitucionais', 'julgamento', 'lei', 'liberdade', 'complementar', 'educação', 'provisórias', 'anos', 'princípios']","['a Constituição estabelece a competência legislativa concorrente entre União, Estados e Distrito Federal para legislar sobre direito urbanístico, proteção ambiental e defesa do solo.', 'a Constituição, por meio do § 9º do art. 14, estabelece que a lei complementar deve proteger a probidade administrativa e a moralidade para o exercício do mandato, considerando a vida pregressa do candidato.', 'a Constituição estabelece que cada uma das Casas reunir-se-á em sessões preparatórias, a partir de 1º de fevereiro, no primeiro ano da legislatura, para a posse de seus membros e eleição das respectivas Mesas, para mandato de 2 anos, vedada a recondução para o mesmo cargo na eleição imediatamente subsequente.']"
29,99,29_dever Estado direito_mandato_presunção_anos mandato,"['dever Estado direito', 'mandato', 'presunção', 'anos mandato', 'perda', 'dever Estado direito cidadão', 'Estado direito cidadão', 'Estado direito', 'casos urgência', 'possibilidade', 'condenação', 'perda mandato', 'direito cidadão', 'Legislativo', 'casos', 'anos', 'garantido', 'crime', 'nacional', 'impostos']","['mandato', 'presunção', 'perda', 'automática', 'empregados', 'direito', 'manifestação', 'leis', 'possibilidade', 'condenação', 'Legislativo', 'casos', 'anos', 'vacância', 'especial', 'crime', 'dever', 'nacional', 'impostos', 'Estado']","['a Constituição de 1988 estabelece a assistência social como um dever do Estado e direito do cidadão, integrando-a no contexto da seguridade social.', 'A Constituição estabelece que a perda do mandato será automática quando a perda dos direitos resultar de condenação por improbidade administrativa ou da prática de crime contra a Administração Pública, com sentença transitada em julgado.', 'a Constituição e as leis são a base para a manifestação independente dos senadores na defesa da ordem jurídica, do regime democrático e dos interesses sociais e individuais indisponíveis.']"
30,98,30_competência julgar_jurídico_direito propriedade_Presidente República,"['competência julgar', 'jurídico', 'direito propriedade', 'Presidente República', 'República', 'responsabilidade', 'crimes responsabilidade', 'Federal', 'federal', 'servidores públicos', 'Supremo Tribunal Federal', 'Tribunal Federal', 'Supremo Tribunal', 'político', 'Supremo', 'desde haja autorização Congresso', 'incluir direito', 'reservas indígenas desde haja', 'pública deve respeitada', 'julgar Presidente República']","['jurídico', 'Presidente', 'direito', 'pagamento', 'responsabilidade', 'tratamento', 'federal', 'político', 'mulheres', 'blocos', 'dependentes', 'Estados', 'propriedade', 'políticos', 'direção', 'obrigatório', 'desenvolvimento', 'formal', 'oficial', 'lei']","['a Constituição atribui ao Senado Federal, autorizado pela Câmara dos Deputados, a competência para julgar o Presidente da República nos crimes de responsabilidade.', 'a Constituição permite a construção de usinas hidrelétricas em reservas indígenas, desde que haja autorização do Congresso Nacional.', 'a Constituição estabelece que compete privativamente ao Presidente da República exercer a direção superior da administração federal e que são crimes de responsabilidade os atos do Presidente que atentem contra a Constituição, especialmente contra a lei orçamentária.']"
31,98,31_saúde direito todos_saúde_saúde direito_direito todos,"['saúde direito todos', 'saúde', 'saúde direito', 'direito todos', 'Saúde', 'saúde direito todos dever', 'Estado garantido mediante políticas', 'Estado garantido', 'mediante políticas sociais econômicas', 'dever Estado garantido mediante', 'Estado garantido mediante', 'mediante políticas sociais', 'todos dever Estado garantido', 'garantido mediante políticas sociais', 'políticas sociais econômicas', 'dever Estado garantido', 'garantido mediante', 'mediante políticas', 'garantido mediante políticas', 'sociais econômicas']","['saúde', 'trânsito', 'julgado', 'formas', 'dever', 'mulher', 'políticas', 'econômicas', 'raça', 'origem', 'cor', 'promoção', 'recursos', 'Estado', 'sociais', 'idade', 'universal', 'ações', 'objetivos', 'redução']","['a Constituição define o Sistema Único de Saúde como um sistema universal, onde a saúde é um direito de todos e um dever do Estado.', 'a Constituição assegura que a saúde é direito de todos e dever do Estado, garantido mediante políticas sociais e econômicas.', 'a saúde é direito de todos e dever do Estado, garantido mediante políticas sociais e econômicas que visem à redução do risco de doença e de outros agravos e ao acesso universal e igualitário às ações e serviços para sua promoção, proteção e recuperação.']"
32,95,32_impeachment_legal_Supremo_crime responsabilidade,"['impeachment', 'legal', 'Supremo', 'crime responsabilidade', 'crédito', 'abertura crédito suplementar', 'crédito suplementar', 'preservação', 'Presidenta Dilma', 'responsabilidade', 'deliberação', 'cidadão', 'abertura crédito', 'autorização legislativa', 'assistência social', 'direito cidadão', 'Presidenta', 'crime', 'Dilma', 'tributária']","['impeachment', 'especial', 'legal', 'vida', 'crédito', 'direito', 'saúde', 'assistência', 'dever', 'preservação', 'responsabilidade', 'deliberação', 'cidadão', 'suplementar', 'patrimônio', 'sociedade', 'crime', 'tributária', 'obrigação', 'abertura']","['a Constituição prevê a responsabilidade conjunta da família, da sociedade e do Estado de assegurar à criança, ao adolescente e ao jovem um amplo elenco de direitos sociais.', 'a Constituição proíbe a abertura de crédito suplementar sem autorização legislativa.', 'a abertura de crédito suplementar ou especial sem prévia autorização legislativa e sem indicação de recursos correspondentes é vedada']"
33,95,33_atribuição_Municípios_Fundo Participação Municípios_Deputados Senado,"['atribuição', 'Municípios', 'Fundo Participação Municípios', 'Deputados Senado', 'Participação Municípios', 'Câmara Deputados Senado', 'Congresso Nacional', 'Congresso', 'exclusiva Congresso Nacional', 'competência exclusiva Congresso Nacional', 'competência exclusiva Congresso', 'exclusiva Congresso', 'CPMF', 'competência exclusiva', 'imunidade parlamentar', 'cidadãos', 'assistência social', 'Estado brasileiro', 'direitos', 'Fundo Participação']","['atribuição', 'Municípios', 'CPMF', 'fonte', 'agentes', 'cidadãos', 'direitos', 'tributos', 'menos', 'Poderes', 'competência', 'investigação', 'imunidade', 'exclusiva', 'povo', 'Estado', 'pública', 'previdência', 'saúde', 'União']","['A Constituição estabelece que é da competência exclusiva do Congresso Nacional zelar pela preservação de sua competência legislativa em face da atribuição normativa dos outros Poderes.', 'a Constituição estabelece a organização do Estado brasileiro sob a forma de uma Federação e a distribuição de receitas para os Estados, Distrito Federal e Municípios através do Fundo de Participação dos Municípios.', 'a Constituição estabelece a publicidade como princípio regente da administração pública e a competência exclusiva do Congresso Nacional para resolver sobre tratados, acordos ou atos internacionais que acarretem encargos ou compromissos gravosos ao patrimônio nacional.']"
34,91,34_direitos deveres_Conselho Nacional_garantias_indígenas,"['direitos deveres', 'Conselho Nacional', 'garantias', 'indígenas', 'garantias individuais', 'União', 'Conselho', 'individuais coletivas', 'direitos garantias', 'Conselho Nacional Justiça', 'direitos', 'Nacional Justiça', 'precisam', 'direitos garantias individuais', 'cidadãos', 'direitos sociais', 'privativamente', 'República', 'Municípios', 'povos indígenas']","['deveres', 'garantias', 'indígenas', 'União', 'individuais', 'coletivas', 'direitos', 'legais', 'cidadãos', 'bens', 'República', 'controle', 'Municípios', 'justiça', 'educação', 'anos', 'princípios', 'povos', 'marinha', 'técnico']","['a Constituição estabelece o Conselho Nacional de Justiça para aperfeiçoar o controle das atividades do Poder Judiciário.', 'a Constituição deve expressar os direitos e deveres dos cidadãos, as garantias individuais e coletivas, a autonomia e o equilíbrio entre os três poderes republicanos.', 'a Constituição estabelece que cabe, privativamente, ao Senado Federal processar e julgar os Ministros do Supremo Tribunal Federal, os membros do Conselho Nacional de Justiça e do Conselho Nacional do Ministério Público, além do Procurador-Geral da República e do Advogado-Geral da União, nos crimes de responsabilidade.']"
35,90,35_limites_férias_ensino_décimo terceiro,"['limites', 'férias', 'ensino', 'décimo terceiro', 'impacto', 'saúde direito', 'direitos sociais', 'criança adolescente', 'terceiro', 'garantindo', 'ambiental', 'adolescente', 'licença', 'criança', 'prioridade', 'cláusula pétrea', 'situações', 'Parlamentares', 'cláusula', 'saúde direito todos dever']","['limites', 'férias', 'pétrea', 'ensino', 'impacto', 'décimo', 'terceiro', 'licença', 'adolescente', 'ambiental', 'remuneração', 'criança', 'prioridade', 'situações', 'Parlamentares', 'forma', 'cláusula', 'poder', 'trabalhistas', 'provisórias']","['A Constituição estabelece que a saúde é direito de todos e dever do Estado, garantindo acesso universal e igualitário às ações e serviços de saúde.', 'a Constituição assegura os direitos sociais da classe trabalhadora brasileira, incluindo férias, décimo terceiro, remuneração, licença maternidade, licença paternidade, adicional de férias, indenização por justa causa e multa de 40%.', 'a Constituição estabelece que é da competência do Congresso Nacional sustar os atos normativos do Poder Executivo que exorbitem do poder regulamentar ou dos limites da delegação legislativa.']"
36,85,36_impeachment_autorização_Dilma_crime responsabilidade,"['impeachment', 'autorização', 'Dilma', 'crime responsabilidade', 'limita', 'crime', 'entidades', 'Presidenta Dilma', 'responsabilidade', 'gastos públicos', 'deve', 'saúde', 'imposto', 'Presidenta', 'pessoas deficiência', 'educação', 'prévia', 'deveria', 'contra', 'Presidente']","['impeachment', 'autorização', 'leis', 'incisos', 'III', 'crime', 'entidades', 'responsabilidade', 'maior', 'despesas', 'saúde', 'operações', 'imposto', 'educação', 'prévia', 'Presidente', 'deficiência', 'tratamento', 'segurança', 'cargo']","['a Presidente Dilma infringiu a Constituição brasileira ao editar decretos de créditos suplementares sem a autorização prévia do Parlamento, desrespeitando a Lei Orçamentária e a Lei de Responsabilidade Fiscal', 'a Constituição, no art. 167, V, veda a abertura de crédito suplementar ou especial sem prévia autorização legislativa e sem indicação dos recursos correspondentes.', 'a Constituição estabelece que um dos fundamentos da República Federativa do Brasil é promover o bem-estar de todos e abolir toda e qualquer forma de discriminação.']"
37,85,37_crime_crime responsabilidade_impeachment_respeito,"['crime', 'crime responsabilidade', 'impeachment', 'respeito', 'responsabilidade atentar', 'crime responsabilidade atentar', 'responsabilidade atentar contra', 'crime responsabilidade atentar contra', 'atentar contra', 'responsabilidade', 'órgãos públicos', 'legítimo', 'originários terras', 'originários terras tradicionalmente ocupam', 'direitos originários terras', 'direitos originários terras tradicionalmente', 'originários terras tradicionalmente', 'direitos originários', 'terras tradicionalmente ocupam', 'tradicionalmente ocupam']","['crime', 'impeachment', 'respeito', 'responsabilidade', 'legítimo', 'mudança', 'originários', 'golpe', 'específica', 'relevância', 'Presidência', 'públicos', 'casos', 'competência', 'órgãos', 'instrumento', 'política', 'União', 'direitos', 'Estado']","['a Constituição estabelece que é crime de responsabilidade atentar contra a Lei Orçamentária e as leis fiscais do País', 'a Constituição reconhece aos índios os direitos originários sobre as terras que tradicionalmente ocupam e dá competência à União para demarcá-las e protegê-las.', 'a Constituição estabelece objetivos fundamentais da República Federativa do Brasil, incluindo promover o bem de todos, sem preconceitos de origem, raça, sexo, cor, idade e quaisquer outras formas de discriminação.']"
38,83,38_Diretrizes Orçamentárias_Orçamentárias_Lei Diretrizes Orçamentárias_não pode candidato,"['Diretrizes Orçamentárias', 'Orçamentárias', 'Lei Diretrizes Orçamentárias', 'não pode candidato', 'pode candidato', 'Parlamentares', 'Diretrizes', 'Lei Diretrizes', 'candidato', 'competência exclusiva Congresso', 'competência exclusiva Congresso Nacional', 'exclusiva Congresso', 'exclusiva Congresso Nacional', 'Emenda Constitucional', 'Constitucional', 'através Emenda Constitucional', 'democrático', 'competência exclusiva', 'outubro', 'Congresso']","['exclusiva', 'Parlamentares', 'candidato', 'sindical', 'público', 'democrático', 'ação', 'outubro', 'Congresso', 'segundo', 'julgamento', 'mandato', 'processo', 'defesa', 'parlamentar', 'brasileira', 'jurídica', 'ruptura', 'normativa', 'decoro']","['a Constituição estabelece que não haverá recesso parlamentar até que a Lei de Diretrizes Orçamentárias seja votada.', 'a Constituição estabelece que a Defensoria Pública é instituição essencial à função jurisdicional do Estado, incumbindo-lhe a orientação jurídica e a defesa, em todos os graus, dos necessitados.', 'a Constituição estabelece que a saúde é direito de todos e dever do Estado, garantido mediante políticas sociais e econômicas que visem à redução do risco de doença e de outros agravos e ao acesso universal e igualitário às ações e serviços para sua promoção, proteção e recuperação.']"
39,83,39_projeto lei_projeto_Poder_prazo,"['projeto lei', 'projeto', 'Poder', 'prazo', 'importante', 'processo impeachment', 'responsabilidades', 'controle', 'criar', 'atribuições', 'Poder Judiciário', 'decisão', 'responsabilidade', 'proteção', 'saúde', 'processo', 'liberdade', 'impeachment', 'desde haja autorização Congresso', 'deficiência não']","['projeto', 'prazo', 'importante', 'lei', 'responsabilidades', 'controle', 'atribuições', 'forma', 'dias', 'matéria', 'decisão', 'responsabilidade', 'proteção', 'saúde', 'processo', 'liberdade', 'impeachment', 'relação', 'tarefa', 'individuais']","['A Constituição estabelece que é vedada a edição de medidas provisórias sobre matéria já disciplinada em projeto de lei aprovado pelo Congresso Nacional e pendente de sanção ou veto do Presidente da República.', 'a Constituição prevê que é permitido explorar recursos minerais em reservas indígenas, desde que haja autorização do Congresso Nacional.', 'a Constituição estabelece que um dos fundamentos da República Federativa do Brasil é promover o bem-estar de todos e abolir toda e qualquer forma de discriminação.']"
