Topic,Count,Name,Representation,Aspect1,Representative_Docs
40,82,40_prioridade_democracia_Armadas_Forças Armadas,"['prioridade', 'democracia', 'Armadas', 'Forças Armadas', 'Social', 'Poderes Executivo', 'profissionalização cultura', 'saúde alimentação educação', 'profissionalização', 'alimentação educação', 'saúde alimentação', 'liberdade', 'constitucional', 'respeito', 'alimentação', 'cultura', 'garantia', 'idade', 'direitos humanos', 'direito vida']","['prioridade', 'democracia', 'profissionalização', 'convivência', 'consumidor', 'gratuita', 'liberdade', 'constitucional', 'Judiciário', 'respeito', 'alimentação', 'cultura', 'inocência', 'garantia', 'idade', 'internacionais', 'família', 'humanos', 'direito', 'ações']","['a Constituição estabelece que todo o poder emana do povo e que os Poderes Executivo, Legislativo e Judiciário são independentes e harmônicos entre si.', 'a Constituição estabelece que é dever da família, da sociedade e do Estado assegurar à criança e ao adolescente, com absoluta prioridade, o direito à vida, à saúde, à alimentação, à educação, ao lazer, à profissionalização, à cultura, à dignidade, ao respeito, à liberdade e à convivência familiar e comunitária, além de colocá-los a salvo de toda forma de negligência, discriminação, exploração, violência, crueldade e opressão.', 'a PEC da Juventude assegura na Constituição prioridade no acesso à saúde, alimentação, educação, emprego, profissionalização e cultura para a juventude.']"
41,82,41_culturais_comunicações_liberdade_direito social,"['culturais', 'comunicações', 'liberdade', 'direito social', 'cultura', 'prioridade', 'direito saúde', 'social', 'Federal deve', 'Federal', 'cidadania', 'legalidade', 'devem estar', 'ameaça', 'crime responsabilidade não', 'pleno exercício direitos', 'lei igual todos', 'Poderes União independentes harmônicos', 'exercício cidadania', 'responsabilização']","['culturais', 'comunicações', 'lazer', 'liberdade', 'cultura', 'prioridade', 'social', 'cargo', 'federal', 'cidadania', 'legalidade', 'ameaça', 'responsabilização', 'anualidade', 'acesso', 'governador', 'hipóteses', 'obediência', 'telefônicas', 'diálogo']","['a Constituição assegura que o Estado garantirá a todos o pleno exercício dos direitos culturais e acesso às fontes da cultura nacional, e apoiará e incentivará a valorização e a difusão das manifestações culturais.', 'A Constituição assegura direitos sociais como educação, saúde, trabalho, moradia, lazer, previdência social, proteção à maternidade e à infância.', 'a prioridade absoluta deve ser dada às crianças, garantindo-lhes o direito à vida, à saúde, à alimentação, à educação, ao lazer, à profissionalização, à cultura, à dignidade, ao respeito, à liberdade e à convivência familiar e comunitária.']"
42,82,42_Brasil_medidas_medidas provisórias_provisórias,"['Brasil', 'medidas', 'medidas provisórias', 'provisórias', 'pessoas deficiência', 'redução desigualdades', 'desigualdades', 'salário', 'cidadã', 'regionais', 'Senado', 'objetivos fundamentais', 'Forças Armadas', 'Forças', 'Armadas', 'instituição', 'critérios', 'relevância urgência', 'constitucionais', 'deficiência']","['medidas', 'opinião', 'provisórias', 'instância', 'especial', 'desigualdades', 'salário', 'cidadã', 'regionais', 'Senado', 'instituição', 'critérios', 'constitucionais', 'deficiência', 'aposentadoria', 'saúde', 'democrático', 'princípio', 'condições', 'objetivos']","['a Constituição prevê como um dos objetivos fundamentais da República Federativa do Brasil a erradicação da pobreza e a redução das desigualdades sociais e regionais.', 'a Constituição veda a abertura de crédito suplementar ou especial sem prévia autorização legislativa e sem indicação dos recursos correspondentes.', 'a Constituição expressamente define o Ministério Público como instituição essencial à função jurisdicional do Estado, incumbindo-lhe a defesa da ordem jurídica, do regime democrático e dos interesses sociais e individuais indisponíveis.']"
43,80,43_regras_parlamentares_escolas_opinião,"['regras', 'parlamentares', 'escolas', 'opinião', 'liberdade imprensa', 'liberdade', 'redução desigualdades', 'imprensa', 'desigualdades', 'regionais', 'deveria', 'econômica', 'julgamento', 'legal', 'povos indígenas', 'Estado direito', 'instituições', 'desigualdades regionais', 'eleições', 'mulheres']","['regras', 'parlamentares', 'escolas', 'assistência', 'opinião', 'direito', 'processo', 'liberdade', 'imprensa', 'desigualdades', 'regionais', 'econômica', 'expressão', 'julgamento', 'legal', 'instituições', 'gastos', 'eleições', 'redução', 'mulheres']","['a Constituição prevê o impeachment como um processo legal, mas exige que haja crime de responsabilidade para que ele seja aberto.', 'a Constituição não é mencionada diretamente como norma jurídica, mas há uma crítica implícita ao sistema político e econômico que não atende aos princípios de justiça social que a Constituição deveria garantir.', 'A Constituição estabelece que os Territórios Federais de Roraima e do Amapá são transformados em Estados Federados, mantidos seus atuais limites geográficos.']"
44,78,44_energia_sexo cor idade quaisquer_idade quaisquer_cor idade quaisquer outras,"['energia', 'sexo cor idade quaisquer', 'idade quaisquer', 'cor idade quaisquer outras', 'cor idade quaisquer', 'idade quaisquer outras formas', 'quaisquer outras formas discriminação', 'idade quaisquer outras', 'origem raça sexo', 'cor idade', 'raça sexo cor', 'origem raça', 'origem raça sexo cor', 'raça sexo cor idade', 'sexo cor idade', 'raça sexo', 'sexo cor', 'permite Presidente República', 'recursos educação', 'permite Presidente']","['energia', 'processual', 'formas', 'raça', 'bem', 'origem', 'cor', 'sexo', 'imunidade', 'idade', 'discriminação', 'Estado', 'venda', 'curso', 'pacíficos', 'nuclear', 'campo', 'mineral', 'grave', 'utilização']","['a Constituição estabelece direitos referentes à vida, saúde, alimentação, educação, esporte, lazer, profissionalização, cultura, dignidade, respeito, liberdade e convivência familiar e comunitária das crianças como uma prioridade absoluta', 'a Constituição estabelece como objetivo da República Federativa do Brasil a promoção do bem-estar de todos, sem preconceito de origem, raça, sexo, cor, idade e quaisquer outras formas de discriminação.', 'a Constituição estabelece que se constitui objetivos fundamentais da República Federativa do Brasil construir uma sociedade livre, justa e solidária, garantir o desenvolvimento nacional, erradicar a pobreza, a marginalização e reduzir as desigualdades sociais e regionais, e promover o bem de todos, sem preconceito de origem, de raça, de sexo, de cor, de idade e quaisquer outras formas de discriminação.']"
45,76,45_entre União Estados Municípios_princípios fundamentais_Sistema Único Saúde_entre União Estados,"['entre União Estados Municípios', 'princípios fundamentais', 'Sistema Único Saúde', 'entre União Estados', 'Sistema Único', 'Único Saúde', 'entre União', 'Único', 'União Estados Municípios', 'representantes', 'Saúde', 'Administração', 'Sistema', 'ministros', 'segurança', 'princípio', 'democracia', 'devem', 'foi elaborada participação', 'nomeados']","['igual', 'sigilo', 'equilíbrio', 'representantes', 'ministros', 'ampla', 'princípio', 'segurança', 'democracia', 'criação', 'fundamentais', 'arcabouço', 'oportunidade', 'participação', 'títulos', 'União', 'sociais', 'grupos', 'orçamentário', 'respeito']","['a Constituição foi escrita por representantes do povo e criou o Sistema Único de Saúde.', 'a Constituição estabelece que todo o poder emana do povo, que o exerce por meio de representantes eleitos ou diretamente.', 'a Constituição define como objetivos fundamentais da República Federativa do Brasil erradicar a pobreza e a marginalização e reduzir as desigualdades sociais e regionais.']"
46,76,46_direito não_penal_garantir_Judiciário,"['direito não', 'penal', 'garantir', 'Judiciário', 'SUS', 'Regimento', 'funções', 'direitos trabalhistas', 'fiscal', 'Emenda Constitucional', 'medidas provisórias', 'provisórias', 'Estado', 'conjunto direitos', 'República seja', 'mandato deve', 'meta fiscal', 'redução maioridade', 'Presidente República casos', 'redução maioridade penal']","['Senadores', 'penal', 'fim', 'Judiciário', 'Regimento', 'funções', 'áreas', 'fiscal', 'financeira', 'trabalhistas', 'provisórias', 'Estado', 'legislativos', 'laicidade', 'relevância', 'medidas', 'relação', 'políticas', 'crime', 'exclusivo']","['a Constituição de 1988 estabelece a possibilidade de edição de medidas provisórias pelo Presidente da República em casos de relevância e urgência.', 'a Constituição preconiza que Estados, Distrito Federal e Municípios têm participação ou compensação financeira pela exploração de recursos naturais.', 'a Constituição estabelece que os Deputados e Senadores são invioláveis, civil e penalmente, por quaisquer de suas opiniões, palavras e votos.']"
47,75,47_reforma trabalhista_trabalhista_propõe_Ulysses,"['reforma trabalhista', 'trabalhista', 'propõe', 'Ulysses', 'tratamento diferenciado', 'autonomia', 'diferenciado', 'privativa', 'direito saúde', 'voto secreto', 'reforma', 'princípio', 'secreto', 'mulheres', 'princípio moralidade', 'melhoria', 'Senado Federal prerrogativa', 'atos Administração', 'Casa Legislativa', 'ratificou']","['trabalhista', 'série', 'autonomia', 'dia', 'matérias', 'rurais', 'privativa', 'tratamento', 'reforma', 'princípio', 'secreto', 'mulheres', 'melhoria', 'exploração', 'propriedades', 'hipótese', 'legislativa', 'avanço', 'sentido', 'campo']","['a Constituição, junto com a Lei Complementar nº 95, estabelece que nenhuma lei pode conter matérias estranhas ao objeto que ela se propõe a alterar ou estabelecer.', 'A Constituição estabelece que um dos fundamentos da República Federativa do Brasil é promover o bem-estar de todos e abolir toda e qualquer forma de discriminação.', 'A Constituição veda a abertura de crédito suplementar sem autorização legislativa.']"
48,74,48_eleições diretas_eleições_voto_Presidente,"['eleições diretas', 'eleições', 'voto', 'Presidente', 'cargo Presidente', 'estabilidade', 'partidos políticos', 'Vice Presidente', 'presidenciais', 'Vice', 'aprovação', 'contra', 'partidos', 'Estado democrático direito', 'deve respeitada base', 'cada Casas Congresso', 'medidas provisórias devem analisadas', 'eleições diretas caso', 'popular direito', 'provisórias devem analisadas']","['diretas', 'eleições', 'voto', 'Presidente', 'ações', 'juiz', 'porte', 'estabilidade', 'presidenciais', 'iguais', 'aprovação', 'partidos', 'cargo', 'terras', 'sindicais', 'constitucional', 'descumprimento', 'preceito', 'cadeia', 'políticos']","['a Constituição estabelece um Estado democrático de direito com poderes harmônicos e independentes, eleições diretas com voto universal e participação de 140 milhões de eleitores.', 'a Constituição estabelece que as medidas provisórias devem ser analisadas por uma comissão mista de Deputados e Senadores antes de serem apreciadas pelo plenário de cada uma das Casas do Congresso Nacional.', 'a vacância do cargo de Presidente e Vice-Presidente da República até o final do terceiro ano do mandato implica em eleições diretas']"
49,73,49_Imposto_serão_independência_Estado deve,"['Imposto', 'serão', 'independência', 'Estado deve', 'Tribunal', 'equilíbrio', 'todo poder emana', 'todo poder emana povo', 'relevância urgência', 'todo poder', 'público', 'saúde', 'universal', 'fiscalizar', 'Executivo', 'poder emana', 'poder emana povo', 'emana povo', 'entre Poderes', 'Federal']","['independência', 'promoção', 'equilíbrio', 'povo', 'demarcação', 'público', 'saúde', 'universal', 'Executivo', 'marco', 'subsídios', 'montante', 'irredutibilidade', 'títulos', 'união', 'parlamentares', 'habitação', 'federativa', 'direito', 'requerimento']","['a Constituição estabelece que todo o poder emana do povo, que o exerce por meio de representantes eleitos ou diretamente.', 'a saúde é direito de todos e dever do Estado, e que deve ser garantido o acesso universal e igualitário às ações e serviços para promoção, proteção e recuperação da saúde.', 'A Constituição estabelece que um dos fundamentos da República Federativa do Brasil é promover o bem-estar de todos e abolir toda e qualquer forma de discriminação.']"
50,72,50_prerrogativa função_não pode_foro privilegiado_privilegiado,"['prerrogativa função', 'não pode', 'foro privilegiado', 'privilegiado', 'proposição', 'crianças adolescentes', 'adolescentes', 'contra', 'crianças', 'decisão', 'autoridades', 'permite', 'impessoalidade', 'cargos', 'prerrogativa', 'Emenda Constitucional', 'moralidade', 'sem crime', 'possível representação', 'possível representação proporcional partidos']","['foro', 'proposição', 'adolescentes', 'atos', 'receita', 'crianças', 'decisão', 'autoridades', 'impessoalidade', 'ampla', 'cargos', 'prerrogativa', 'anos', 'moralidade', 'lucro', 'estimativa', 'faturamento', 'publicidade', 'administração', 'crime']","['a Constituição, através da Emenda Constitucional 95, determina que proposição legislativa que crie renúncia de receita deverá ser acompanhada da estimativa do seu impacto orçamentário.', 'a Constituição assegura, tanto quanto possível, a representação proporcional dos partidos ou blocos parlamentares na constituição das Mesas e de cada comissão.', 'A Constituição estabelece que a administração pública deve obedecer aos princípios da legalidade, impessoalidade, moralidade, publicidade e eficiência.']"
51,70,51_cidadania dignidade pessoa humana_cidadania dignidade pessoa_cidadania dignidade_Democrático,"['cidadania dignidade pessoa humana', 'cidadania dignidade pessoa', 'cidadania dignidade', 'Democrático', 'pessoa', 'Senado', 'direitos povos indígenas', 'dignidade', 'direitos povos', 'brasileira', 'liberdade', 'Territórios', 'Poder Legislativo', 'dignidade pessoa humana', 'dignidade pessoa', 'interesses', 'pessoa humana', 'povos indígenas', 'três', 'públicos']","['reeleição', 'Câmara', 'pessoa', 'Senado', 'dignidade', 'brasileira', 'liberdade', 'fundamentos', 'servidores', 'expressão', 'atribuições', 'leis', 'interesses', 'financeira', 'públicos', 'humana', 'cidadania', 'jurídica', 'povos', 'continuidade']","['a Constituição confere ao Senado a competência para autorizar operações externas de natureza financeira de interesse da União, dos estados, do Distrito Federal e dos municípios.', 'a Constituição estabelece a cidadania e a dignidade da pessoa humana como fundamentos da República Federativa do Brasil.', 'a Constituição brasileira se organiza como Estado Democrático que tem como fundamentos a cidadania e a dignidade da pessoa humana.']"
52,70,52_Desenvolvimento_competência concorrente União_desigualdades regionais_competência concorrente,"['Desenvolvimento', 'competência concorrente União', 'desigualdades regionais', 'competência concorrente', 'concorrente União', 'outubro', 'área', 'direitos políticos', 'desigualdades', 'concorrente', 'Federal', 'regionais', 'recursos', 'direitos', 'saúde', 'ninguém', 'fiscalizar', 'eleição', 'anos', 'deve']","['orientação', 'partir', 'outubro', 'área', 'desigualdades', 'concorrente', 'regionais', 'recursos', 'direitos', 'saúde', 'mesmo', 'eleição', 'anos', 'detentor', 'identidade', 'mesmo cargo', 'recondução', 'universalidade', 'competência', 'políticos']","['A Constituição estabelece que ninguém será considerado culpado até o trânsito em julgado de sentença penal condenatória.', 'a Constituição estabelece a competência concorrente da União, dos estados e do Distrito Federal para legislar sobre fauna, ciência, tecnologia, pesquisa, desenvolvimento, inovação e defesa da saúde.', 'A Constituição estabelece que o Congresso Nacional deve se reunir anualmente a partir do dia 2 de fevereiro e que cada Casa deve realizar sessões preparatórias a partir de 1º de fevereiro para a posse de seus membros e eleição das respectivas mesas, vedada a recondução para o mesmo cargo na eleição imediatamente subsequente.']"
53,70,53_Estatuto_urgência_servidores públicos_fato determinado,"['Estatuto', 'urgência', 'servidores públicos', 'fato determinado', 'comissões', 'públicos', 'fato', 'Educação', 'urgência relevância', 'exercício', 'medidas', 'determinado', 'direito ir vir', 'eficiência', 'salarial', 'ir vir', 'ministros', 'impõe', 'CPI', 'país']","['urgência', 'relevância', 'comissões', 'públicos', 'fato', 'exercício', 'dia', 'medidas', 'servidores', 'eficiência', 'salarial', 'ministros', 'CPI', 'mesmo', 'país', 'provisórias', 'critério', 'mensal', 'consequência', 'políticas']","['a Constituição permite a convocação de ministros para prestar esclarecimentos ao Senado.', 'a regulamentação do Sistema Nacional de Educação é uma demanda histórica do país, conforme a Constituição Federal e a Lei de Diretrizes e Bases da Educação, que mencionam a importância da colaboração e da cooperação entre os entes federados', 'a Constituição estabelece que a saúde é um direito de todos e dever do Estado, garantido mediante políticas sociais e econômicas.']"
54,67,54_emendas constitucionais_pública direito todos_Eleitoral_mulheres,"['emendas constitucionais', 'pública direito todos', 'Eleitoral', 'mulheres', 'pública direito', 'emendas', 'Participação', 'homens mulheres', 'Tribunal', 'constitucionais', 'Federal', 'indígenas', 'princípios', 'recepcionou Lei', 'imparcialidade', 'adequação financeira orçamentária', 'incluir direito', 'independência poderes', 'crime político', 'provisórias devem analisadas']","['terra', 'estrangeiro', 'homens', 'orçamentárias', 'mulheres', 'popular', 'emendas', 'constitucionais', 'indígenas', 'princípios', 'imparcialidade', 'empregadores', 'direito', 'biomas', 'presidencialismo', 'participação', 'livres', 'penas', 'adequação', 'cálculo']","['A Constituição exige notável saber jurídico e reputação ilibada para a escolha dos ministros do Supremo.', 'a Constituição estabelece que a administração pública deve obedecer aos princípios de legalidade, impessoalidade, moralidade, publicidade e eficiência.', 'A Constituição assegura a soberania popular através do sufrágio universal e do voto direto e secreto, além de prever instrumentos de participação popular como plebiscito, referendo e iniciativa popular.']"
55,66,55_orçamentos_exige medidas provisórias_exige medidas_estabelecida,"['orçamentos', 'exige medidas provisórias', 'exige medidas', 'estabelecida', 'municipais', 'deliberação', 'justiça', 'ensino', 'Estado', 'exige', 'parlamentar', 'financeira exploração recursos', 'índios direitos originários', 'liberdade expressão imprensa', 'distribuição Fundo Participação Estados', 'combate corrupção', 'índios direitos originários terras', 'expressão imprensa', 'distribuição Fundo', 'distribuição Fundo Participação']","['estaduais', 'orçamentos', 'municipais', 'deliberação', 'prática', 'justiça', 'ensino', 'condições', 'Estado', 'parlamentar', 'audiências', 'idosas', 'fundamental', 'acesso', 'mobilidade', 'escolar', 'alíquota', 'obrigatório', 'interna', 'reputação']","['a Constituição reconhece aos índios os direitos originários sobre as terras que tradicionalmente ocupam.', 'a Constituição, através da Lei de Lavagem de Dinheiro e da Lei de Combate ao Crime Organizado, permite a cooperação entre as instituições oficiais nacionais, estaduais e municipais para a investigação de crimes', 'a Constituição Federal faz constar entre os objetivos fundamentais da República Federativa do Brasil construir uma sociedade livre, justa e solidária, bem como erradicar a pobreza e a marginalização e reduzir as desigualdades sociais e regionais.']"
56,66,56_Ministério Público_Público deve_Ministério Público deve_Ministério,"['Ministério Público', 'Público deve', 'Ministério Público deve', 'Ministério', 'sociais individuais', 'deve respeitada', 'respeitada', 'proteger', 'fiscal', 'mandato', 'cargos', 'normas constitucionais', 'Senado tem prerrogativa', 'União tem competência', 'suprema', 'legitima', 'governos estaduais', 'detentor', 'emendada tornar', 'direito trabalho']","['partido', 'anos', 'fiscal', 'mandato', 'cargos', 'separação', 'detentor', 'republicana', 'legitima', 'inerentes', 'suprema', 'estupro', 'regime', 'regras', 'respectiva', 'tarefa', 'individuais', 'desenvolvimento', 'planos', 'lugar']","['a Constituição estabelece que o Ministério Público deve ser o defensor dos índios e o fiscal da lei.', 'a Constituição de 1988 deu ao Ministério Público a nobre tarefa de ser fiscal da lei, defensora da democracia e dos direitos sociais e individuais indisponíveis, e garantiu sua autonomia para atuar de forma independente em relação ao Executivo, Legislativo e Judiciário', 'a Constituição deve ser respeitada e que o Ministério Público deve agir em defesa da ordem jurídica, dos interesses sociais e individuais, e do próprio regime democrático.']"
57,66,57_exceção_políticas_regra_pessoas deficiência,"['exceção', 'políticas', 'regra', 'pessoas deficiência', 'crimes', 'não deve', 'deficiência', 'Defensoria Pública', 'Ministros', 'Defensoria', 'soberania', 'CPI', 'parlamentar', 'social brasileira', 'Defensorias Públicas', 'segurança saúde', 'Defensorias', 'princípio anualidade', 'mobilização', 'eleitorais devem']","['exceção', 'políticas', 'fato', 'regra', 'crimes', 'prática', 'deficiência', 'soberania', 'salarial', 'ensino', 'CPI', 'assistência', 'parlamentar', 'metas', 'mobilização', 'determinação', 'anualidade', 'decoro', 'ilícito', 'programa']","['a Constituição estabelece que a lei considerará crimes inafiançáveis e insuscetíveis de graça ou anistia a prática da tortura, o tráfico ilícito de entorpecentes e drogas afins, o terrorismo e os definidos como crimes hediondos.', 'a Constituição de 1988 foi produzida com a mobilização da sociedade e estabelece condições para um processo de desenvolvimento no país, incluindo a igualdade de direitos previdenciários entre trabalhadores do campo e da cidade, o programa de seguro-desemprego, benefícios sociais como o valor do salário mínimo, e a criação de uma política de assistência social para pessoas com deficiência e em situação de vulnerabilidade social.', 'a Constituição estabelece que a criação de Comissões Parlamentares de Inquérito está condicionada a três requisitos: subscrição do requerimento por um terço dos membros, determinação do fato a ser apurado e fixação do prazo certo para investigação.']"
58,64,58_Fundo Constitucional_todos cidadãos_cidadãos_regra,"['Fundo Constitucional', 'todos cidadãos', 'cidadãos', 'regra', 'garantia', 'funções', 'democrática', 'Estado direito', 'protege', 'terras', 'direitos', 'Estado', 'Fundo Constitucional Financiamento', 'necessidade equilíbrio', 'suprema', 'educação dever', 'responsáveis', 'princípio anualidade', 'taxas', 'turnos nas']","['cidadãos', 'regra', 'garantia', 'funções', 'democrática', 'partidos', 'terras', 'direitos', 'Estado', 'suprema', 'responsáveis', 'tamanho', 'taxas', 'constitucional', 'direito', 'anualidade', 'conselhos', 'excesso', 'demarcações', 'região']","['A Constituição estabelece a independência e harmonia entre os Poderes Executivo, Legislativo e Judiciário.', 'a Constituição, através do art. 159, inciso I, alínea “c”, estabelece a criação do Fundo Constitucional de Financiamento do Centro-Oeste (FCO) para contribuir para o desenvolvimento econômico e social da região.', 'a Constituição estabelece que é vedada a reedição, na mesma sessão legislativa, de medida provisória que tenha sido rejeitada ou que tenha perdido sua eficácia por decurso de prazo.']"
59,64,59_poderes necessidade_distribuição recursos_princípio_Estados,"['poderes necessidade', 'distribuição recursos', 'princípio', 'Estados', 'separação poderes', 'recursos', 'distribuição', 'notável saber jurídico reputação', 'petróleo energia', 'direitos civis', 'reservas indígenas desde haja', 'qualquer restrição', 'investimentos educação', 'petróleo energia elétrica', 'recursos União', 'escolhidos', 'princípio separação', 'amparar pessoas', 'preservação ordem pública', 'preservação ordem']","['princípio', 'Estados', 'profissão', 'renda', 'recursos', 'distribuição', 'família', 'separação', 'usinas', 'quarto', 'idosas', 'ordem', 'transferências', 'comunidade', 'comunitários', 'hidrelétricas', 'notável', 'necessidade', 'endemias', 'reputação']","['a Constituição estabelece que o Congresso Nacional é competente para sustar os atos normativos do Poder Executivo que exorbitam o poder de regular os limites da delegação legislativa.', 'A Constituição estabelece que o Supremo Tribunal Federal compõe-se de onze Ministros, escolhidos dentre cidadãos com mais de 35 anos e menos de 65 anos de idade, de notável saber jurídico e reputação ilibada.', 'A Constituição estabelece que ninguém será considerado culpado até o trânsito em julgado da sentença penal condenatória.']"
