Topic,Count,Name,Representation,Aspect1,Representative_Docs
-1,3732,-1_deve_direitos_Federal_Estado,"['deve', 'direitos', 'Federal', 'Estado', 'Senado', 'União', 'permite', 'saúde', 'República', 'devem', 'Estados', 'Presidente', 'liberdade', 'impeachment', 'Municípios', 'Brasil', 'brasileira', 'responsabilidade', 'fundamentais', 'pública']","['direito', 'direitos', 'Estado', 'lei', 'Senado', 'União', 'processo', 'saúde', 'República', 'Estados', 'Presidente', 'liberdade', 'impeachment', 'social', 'Municípios', 'brasileira', 'responsabilidade', 'fundamentais', 'recursos', 'pública']","['a Constituição estabelece que, quando o Presidente da República comete um crime de responsabilidade, é julgado pelo Congresso.', 'a Constituição do Brasil condiciona que todos são iguais perante a lei.', 'A Constituição estabelece que todos são iguais perante a lei, sem distinção de qualquer natureza, e que é dever do Estado garantir direitos como educação, saúde e segurança.']"
0,1741,0_direitos_não_Federal_Presidente,"['direitos', 'não', 'Federal', 'Presidente', 'Estado', 'Nacional', 'República', 'permite', 'Congresso Nacional', 'Congresso', 'pública', 'União', 'constitucional', 'Presidente República', 'saúde', 'Senado', 'respeitada', 'trabalhadores', 'Brasil', 'Estados']","['direitos', 'direito', 'Estado', 'lei', 'pública', 'social', 'União', 'constitucional', 'saúde', 'recursos', 'Senado', 'trabalhadores', 'Estados', 'liberdade', 'iguais', 'princípio', 'política', 'anos', 'emenda', 'Municípios']","['a Constituição estabelece que o Ministério Público é essencial à função jurisdicional do Estado e que a ele incumbe a defesa da ordem jurídica, do regime democrático e dos interesses sociais e individuais.', 'a Constituição estabelece que cabe ao Congresso Nacional sustar atos normativos do Poder Executivo que exorbitem do poder regulamentar ou dos limites de delegação legislativa.', 'A Constituição estabelece a competência privativa do Congresso Nacional para sustar os atos normativos do Poder Executivo que exorbitem do poder regulamentar ou dos limites de delegação legislativa.']"
1,448,1_direitos_sociais_parlamentares_princípios,"['direitos', 'sociais', 'parlamentares', 'princípios', 'Estado', 'direito', 'Municípios', 'democrático', 'permite', 'papel', 'liberdade', 'Estados', 'saúde', 'impessoalidade', 'publicidade eficiência', 'direitos sociais', 'emendas', 'Presidente', 'legalidade', 'moralidade']","['direitos', 'sociais', 'parlamentares', 'princípios', 'Estado', 'direito', 'Municípios', 'democrático', 'papel', 'liberdade', 'dever', 'trabalho', 'Estados', 'saúde', 'impessoalidade', 'processo', 'emendas', 'Presidente', 'legalidade', 'moralidade']","['a Constituição estabelece que é dever da família, da sociedade e do Estado assegurar à criança e ao adolescente, com absoluta prioridade, o direito à vida, à saúde, à alimentação, à educação, ao lazer, à profissionalização, à cultura, à dignidade, ao respeito, à liberdade e à convivência familiar e comunitária, além de colocá-los a salvo de toda forma de negligência, discriminação, exploração, violência, crueldade e opressão.', 'a Constituição consagra um sistema de princípios para a administração pública, incluindo legalidade, impessoalidade, moralidade, publicidade e eficiência.', 'a saúde é um direito de todos e dever do Estado, garantido mediante políticas sociais e econômicas que visem à redução do risco de doenças e de outros agravos e ao acesso universal e igualitário às ações e aos serviços para sua promoção, proteção e recuperação.']"
2,404,2_Nacional_direitos_Congresso_Federal,"['Nacional', 'direitos', 'Congresso', 'Federal', 'não', 'Congresso Nacional', 'responsabilidade', 'indígenas', 'direito', 'impeachment', 'crimes', 'salários', 'conforme', 'Estado', 'projetos', 'invioláveis', 'partidos políticos', 'privada', 'País', 'projetos lei']","['lei', 'direitos', 'responsabilidade', 'indígenas', 'direito', 'meio', 'impeachment', 'leis', 'crimes', 'salários', 'Estado', 'projetos', 'invioláveis', 'privada', 'pessoas', 'País', 'operações', 'Senado', 'ambiente', 'social']","['a Constituição estabelece que o País tem três Poderes: Executivo, Legislativo e Judiciário, que são independentes e harmônicos entre si, e que esses Poderes vêm das urnas, do povo, da soberania popular, do voto', 'a Constituição estabelece que todo o poder emana do povo, que o exerce por meio de representantes eleitos ou diretamente.', 'a Constituição estabelece que todo poder emana do povo, que o exerce por meio de representantes eleitos ou diretamente.']"
3,365,3_sociais_direito_direitos_nova,"['sociais', 'direito', 'direitos', 'nova', 'Estados', 'educação', 'Estado', 'Amapá', 'públicos', 'dever Estado', 'saúde', 'Federal', 'Presidente', 'direito todos', 'voto', 'direito todos dever Estado', 'direito todos dever', 'todos dever', 'todos dever Estado', 'deve']","['sociais', 'direito', 'direitos', 'nova', 'Estados', 'dever', 'educação', 'Estado', 'públicos', 'caminho', 'saúde', 'Presidente', 'voto', 'servidores', 'União', 'previdenciários', 'indígenas', 'anos', 'principais', 'organização']","['a saúde é um direito de todos e um dever do Estado, e que os impostos devem ter caráter pessoal e serem graduados segundo a capacidade econômica do contribuinte.', 'a Constituição de 1988 consagra ideais igualitários e estabelece que a saúde é um direito de todos e dever do Estado.', 'a saúde é um direito de todos e dever do Estado.']"
4,354,4_Brasil_educação_fundamentais_direitos,"['Brasil', 'educação', 'fundamentais', 'direitos', 'deve', 'Estado', 'República', 'públicas', 'poderes', 'governo', 'Distrito', 'Distrito Federal', 'devem', 'direito', 'social', 'direitos fundamentais', 'criação', 'princípios', 'sociais', 'trabalho']","['educação', 'fundamentais', 'direitos', 'Estado', 'públicas', 'poderes', 'governo', 'direito', 'social', 'popular', 'criação', 'princípios', 'exercício', 'sociais', 'gastos', 'trabalho', 'igualdade', 'União', 'povo', 'tipo']","['a Constituição estabelece objetivos fundamentais como construir uma sociedade livre, justa e solidária, erradicar a pobreza e a marginalização, reduzir as desigualdades sociais e regionais, e promover o bem de todos sem discriminação.', 'a Constituição estabelece que é dever da família, da sociedade e do Estado assegurar à criança, ao adolescente e ao jovem, com absoluta prioridade, o direito à vida, à saúde, à alimentação, à educação, ao lazer, à profissionalização, à cultura, à dignidade, ao respeito, à liberdade e à convivência familiar e comunitária, além de colocá-los a salvo de toda forma de negligência, discriminação, exploração, violência, crueldade e opressão.', 'a Constituição estabelece que é objetivo fundamental da República Federativa do Brasil erradicar a pobreza e a marginalização e reduzir as desigualdades sociais e regionais.']"
5,351,5_direitos_Federal_devem_Presidente República,"['direitos', 'Federal', 'devem', 'Presidente República', 'República', 'Senado', 'responsabilidade', 'Presidente', 'crime', 'provisórias', 'medidas provisórias', 'eleitorais', 'públicas', 'educação', 'medidas', 'medidas provisórias casos', 'provisórias casos', 'Estado', 'compensação', 'poderes']","['direitos', 'recursos', 'Senado', 'responsabilidade', 'Presidente', 'União', 'crime', 'social', 'provisórias', 'eleitorais', 'públicas', 'educação', 'medidas', 'Estado', 'compensação', 'direito', 'poderes', 'exploração', 'medida', 'meio']","['a Constituição permite a edição de medidas provisórias em casos de emergência.', 'a Constituição permite a edição de medidas provisórias em casos de urgência e relevância.', 'a Constituição estabelece que o Ministério Público é uma instituição permanente, essencial à função jurisdicional do Estado, incumbindo-lhe a defesa da ordem jurídica, do regime democrático e dos interesses sociais, individuais e indisponíveis.']"
6,241,6_permite_educação_polícia_República,"['permite', 'educação', 'polícia', 'República', 'STF', 'Governador', 'social', 'direitos', 'advogado', 'pode alterada', 'atribuição', 'provisórias', 'medidas provisórias', 'Distrito Federal', 'Distrito', 'penal', 'Federal', 'medidas', 'igualdade todos perante', 'igualdade todos perante lei']","['lei', 'educação', 'polícia', 'Governador', 'social', 'direitos', 'advogado', 'atribuição', 'provisórias', 'penal', 'medidas', 'federais', 'mandato', 'propostas', 'serviço', 'condição', 'Executivo', 'casos', 'pública', 'Judiciário']","['a Constituição garante a igualdade de todos perante a lei.', 'a Constituição define o crime de responsabilidade como atentar contra a Lei Orçamentária, ordenar ou autorizar, em desacordo com a lei, a realização de operação de crédito com qualquer um dos demais entes da Federação', 'A Constituição estabelece que uma lei complementar determinará outros casos de inelegibilidade para proteger a probidade administrativa e a moralidade no exercício do mandato.']"
7,211,7_União_Federal_política_medidas provisórias não,"['União', 'Federal', 'política', 'medidas provisórias não', 'provisórias não', 'Estados Distrito', 'Estados Distrito Federal', 'mulheres', 'provisórias', 'medidas provisórias', 'Estados', 'medidas', 'saúde', 'Municípios', 'Distrito Federal', 'Distrito', 'contra', 'constitucional', 'proposta', 'União Estados']","['União', 'política', 'mulheres', 'extraordinário', 'provisórias', 'Estados', 'medidas', 'saúde', 'País', 'Municípios', 'recursos', 'constitucional', 'proposta', 'possibilidade', 'piso', 'Presidente', 'participação', 'controle', 'direito', 'independência']","['a Constituição estabelece que a União deverá prestar assistência financeira complementar a Estados, Distrito Federal e Municípios para que o piso salarial dos agentes comunitários de saúde e de endemias seja implantado.', 'a Constituição estabelece a competência concorrente entre União, Estados e Distrito Federal para legislar em matéria ambiental.', 'a Constituição estabelece a competência concorrente da União, dos Estados e do Distrito Federal para legislar sobre proteção à infância e à juventude, e a competência privativa da União para legislar sobre Direito Penal e Direito Processual Penal']"
8,210,8_crimes_eleições_nacional_não,"['crimes', 'eleições', 'nacional', 'não', 'devem', 'não há', 'Senado', 'aprovar', 'Estado', 'nem', 'República Federativa Brasil', 'Federativa Brasil', 'República Federativa', 'Federativa', 'voto', 'após condenação', 'Brasil', 'República', 'condenação segunda instância', 'lei direito']","['crimes', 'eleições', 'nacional', 'competências', 'Plenário', 'Senado', 'Estado', 'voto', 'construção', 'leis', 'matérias', 'desenvolvimento', 'segurança', 'prisão', 'Regimento', 'abertura', 'criação', 'anos', 'tortura', 'crédito']","['a prisão após condenação em segunda instância é uma questão de segurança jurídica e que o Senado tem a prerrogativa de alterar o Código de Processo Penal para incluir essa hipótese de prisão.', 'a Constituição estabelece objetivos fundamentais para a República Federativa do Brasil, incluindo garantir o desenvolvimento nacional e erradicar a pobreza e a marginalização.', 'a Constituição estabelece objetivos fundamentais para a República Federativa do Brasil, incluindo a construção de uma sociedade livre, justa e solidária, a garantia do desenvolvimento nacional, a erradicação da pobreza e da marginalização e a redução das desigualdades sociais e regionais, além da promoção do bem de todos, sem preconceitos de origem, raça, sexo, cor, idade e quaisquer outras formas de discriminação.']"
9,196,9_sem preconceitos_preconceitos_direito_sistema,"['sem preconceitos', 'preconceitos', 'direito', 'sistema', 'sociedade', 'social', 'possibilidade', 'liberdade', 'nuclear', 'todos sem preconceitos', 'bem todos sem preconceitos', 'democracia', 'pode emendada', 'discriminação', 'transparência publicidade atos', 'exclusivamente', 'promover', 'emendada', 'Presidente', 'subsídio']","['bem', 'preconceitos', 'processo', 'direito', 'sociedade', 'sistema', 'social', 'possibilidade', 'liberdade', 'nuclear', 'democracia', 'grave', 'discriminação', 'Presidente', 'subsídio', 'vigência', 'lei', 'calamidade', 'Estado', 'eleições']","['a Constituição estabelece que o Presidente da República deve manter, defender e fazer cumprir a Constituição, observar as leis, bem como promover o bem geral do povo brasileiro, sustentar a União, a integridade e a independência do Brasil', 'a Constituição arrola entre os seus objetivos o de promover uma sociedade livre, justa e solidária, e de promover o bem de todos, sem preconceitos relativos ao sexo ou a qualquer forma de discriminação.', 'a Constituição estabelece a dignidade da pessoa humana como fundamento e princípio basilar, e busca a promoção do bem de todos, sem preconceitos de origem, raça, sexo, cor, idade e quaisquer outras formas de discriminação.']"
10,188,10_Poder_Brasil_deve_não,"['Poder', 'Brasil', 'deve', 'não', 'União', 'abusos', 'despesa', 'crianças', 'Judiciário', 'adolescentes', 'Público', 'capital', 'nacional', 'redução', 'base', 'República', 'Presidente', 'famílias', 'impeachment', 'Congresso']","['prevista', 'União', 'abusos', 'despesa', 'crianças', 'direito', 'Judiciário', 'adolescentes', 'criação', 'capital', 'nacional', 'lei', 'redução', 'base', 'distinção', 'famílias', 'fixa', 'impeachment', 'Congresso', 'classe']","['A Constituição estabelece a dignidade da pessoa humana como um dos fundamentos da República Federativa do Brasil e a igualdade de todos perante a lei, sem distinção de qualquer natureza.', 'a PEC 241 fixa, para cada exercício, durante 20 anos, limites individualizados para despesa primária total do Poder Executivo, do Poder Judiciário, do Poder Legislativo, inclusive o Tribunal de Contas da União, do Ministério Público da União e da Defensoria Pública da União.', 'A Constituição estabelece que todos são iguais perante a lei, sem distinção de qualquer natureza, garantindo-se a inviolabilidade do direito à vida, à liberdade, à igualdade, à segurança e à propriedade.']"
11,185,11_salário_cidadãos_Federal_Tribunal,"['salário', 'cidadãos', 'Federal', 'Tribunal', 'União', 'Estado', 'permite', 'cor', 'estado', 'civil', 'salário mínimo', 'educação direito', 'acesso', 'Contas União', 'Tribunal Contas União', 'Tribunal Contas', 'benefícios', 'Supremo Tribunal Federal', 'Supremo Tribunal', 'Tribunal Federal']","['salário', 'cidadãos', 'forma', 'União', 'Estado', 'direito', 'sexo', 'cor', 'estado', 'civil', 'acesso', 'benefícios', 'capaz', 'reputação', 'ilibada', 'mínimo', 'calamidade', 'lei', 'Justiça', 'sessão']","['a Constituição veda a reedição, na mesma sessão legislativa, de medida provisória que tenha sido rejeitada ou perdido a sua eficácia no decurso de prazo.', 'a Constituição estabelece a construção de uma sociedade livre, justa e solidária, capaz de promover o bem de todos, sem preconceitos de origem, raça, sexo, cor, idade ou qualquer outra forma de discriminação.', 'a Constituição permite que cidadãos sem diploma de curso superior sejam indicados para o Supremo Tribunal Federal e o Tribunal de Contas da União, desde que possuam notável saber jurídico e reputação ilibada.']"
12,172,12_competência_legislativa_trabalhadores_Estado,"['competência', 'legislativa', 'trabalhadores', 'Estado', 'União', 'segurança', 'crianças adolescentes', 'Presidente', 'Congresso', 'competência legislativa', 'pública', 'militares', 'organizar', 'Senado', 'CCJ', 'Executivo', 'última instância', 'educação', 'permite', 'Sistema Nacional']","['competência', 'legislativa', 'trabalhadores', 'última', 'Estado', 'União', 'segurança', 'Presidente', 'adolescentes', 'trabalho', 'Congresso', 'pública', 'ambiente', 'militares', 'Senado', 'período', 'Executivo', 'última instância', 'educação', 'receita']","['a Constituição estabelece que é dever da família, da sociedade e do Estado assegurar à criança e ao adolescente, com absoluta prioridade, entre outros direitos, o direito à liberdade, à educação e à convivência familiar e comunitária.', 'a Constituição de 1988 no § 1º do art. 20 previu como receita originária dos Estados e Municípios participação no resultado da exploração de petróleo ou gás natural ou compensação financeira por esta exploração.', 'a Constituição permite ao Congresso Nacional sustar atos normativos do Poder Executivo que exorbitem do poder regulamentar ou dos limites de delegação legislativa.']"
13,160,13_democracia_liberdade_Constitucional_permitiu,"['democracia', 'liberdade', 'Constitucional', 'permitiu', 'legal', 'educação', 'direitos', 'Supremo Tribunal Federal', 'Supremo Tribunal', 'Tribunal Federal', 'menores anos', 'liberdade expressão', 'democracia liberdade', 'Supremo', 'Federal', 'princípios', 'exercício direitos', 'consolidação', 'União tem', 'Brasil']","['democracia', 'liberdade', 'básica', 'legal', 'direito', 'educação', 'direitos', 'exercício', 'trabalho', 'princípios', 'consolidação', 'cargos', 'nacional', 'expressão', 'manifestação', 'cidadania', 'gastos', 'pleno', 'precatórios', 'pessoa']","['a Constituição estabelece que todos têm direito ao meio ambiente ecologicamente equilibrado.', 'a Constituição estabelece que compete ao Senado Federal processar e julgar os Ministros do Supremo Tribunal Federal nos crimes de responsabilidade.', 'a Constituição assegura aos Estados, Distrito Federal e Municípios participação no resultado ou compensação financeira pela exploração de recursos hídricos para fins de geração de energia elétrica.']"
14,154,14_votos_democracia_trabalhistas_maioria,"['votos', 'democracia', 'trabalhistas', 'maioria', 'todos', 'Senado', 'pacto social', 'social direitos', 'opiniões', 'federativo', 'Defensoria Pública', 'direitos trabalhistas', 'transparência', 'Defensoria', 'foi alterada', 'administração pública deve', 'Brasil', 'todos têm direito', 'eleito', 'direitos']","['exercício', 'votos', 'democracia', 'trabalhistas', 'maioria', 'Senado', 'populares', 'opiniões', 'livre', 'federativo', 'história', 'transparência', 'direitos', 'voto', 'Estado', 'legalidade', 'livre exercício', 'sessões', 'pública', 'direito']","['A Constituição estabelece que os deputados e senadores são invioláveis, civil e penalmente, por quaisquer de suas opiniões, palavras e votos, e que em caso de flagrante de crime inafiançável, os autos serão remetidos à Casa respectiva para que, pelo voto da maioria de seus membros, resolva sobre a prisão.', 'a Constituição estabelece que a Defensoria Pública é instituição essencial à função jurisdicional do Estado, incumbindo-lhe a orientação jurídica e a defesa, em todos os graus, dos necessitados.', 'A Constituição estabelece que é vedada a reedição, na mesma sessão legislativa, de medida provisória que tenha sido rejeitada ou que tenha perdido sua eficácia por decurso de prazo.']"
15,148,15_concorrente União_Distrito_Distrito Federal_escolha,"['concorrente União', 'Distrito', 'Distrito Federal', 'escolha', 'União', 'curso', 'Estados', 'União Estados Distrito', 'União Estados Distrito Federal', 'concorrente', 'concorrente União Estados Distrito', 'legislativa concorrente União', 'competência legislativa concorrente União', 'oito anos', 'concorrente União Estados', 'educação saúde', 'legislativa concorrente', 'competência legislativa concorrente', 'entre direitos', 'Federal direito']","['digna', 'iniciativa', 'escolha', 'União', 'direito', 'curso', 'Estados', 'concorrente', 'inabilitação', 'mínimo', 'repartição', 'saúde', 'direitos', 'tributárias', 'social', 'sigilo', 'pena', 'pagamento', 'educação', 'realização']","['A Constituição estabelece que todos têm direito ao meio ambiente ecologicamente equilibrado, impondo-se ao Poder Público e à coletividade o dever de defendê-lo e preservá-lo.', 'a Constituição estabelece a distribuição de receitas tributárias entre a União, os Estados, o Distrito Federal e os Municípios.', 'a Constituição estabelece que a defesa da saúde é matéria de competência legislativa concorrente da União, Estados e Distrito Federal.']"
16,143,16_sessão legislativa_igualdade entre_proíbe_exige,"['sessão legislativa', 'igualdade entre', 'proíbe', 'exige', 'partidária', 'correção', 'Estado direito responsabilidade', 'mais anos', 'dever Estado direito responsabilidade', 'Estado direito responsabilidade todos', 'Militar', 'direito responsabilidade', 'direito responsabilidade todos', 'pública dever Estado direito', 'responsabilidade todos', 'Estado direito', 'proporcionalidade', 'entre Estados', 'saneamento', 'federal']","['sessão', 'partidária', 'correção', 'princípio', 'diferentes', 'direito', 'mudança', 'proporcionalidade', 'saneamento', 'federal', 'saúde', 'provisória', 'povos', 'serviços', 'Estados', 'medida', 'governo', 'legislativa', 'mesma', 'direitos']","['a Constituição estabelece que a segurança pública é dever do Estado, direito e responsabilidade de todos.', 'a Constituição estabelece que a segurança pública é dever do Estado, direito e responsabilidade de todos, conforme o art. 144.', 'a Constituição veda a reedição, na mesma sessão legislativa, de medida provisória que tenha sido rejeitada ou que tenha perdido sua eficácia por decurso de prazo.']"
17,136,17_impeachment_valor_aposentadorias_novos Estados,"['impeachment', 'valor', 'aposentadorias', 'novos Estados', 'votação', 'dá Presidente', 'viver', 'secreta', 'terras', 'verbas', 'proteção social', 'indígenas', 'Nacional Educação', 'salário', 'crimes responsabilidade', 'limita', 'proteção', 'direito educação', 'administração', 'responsabilidade']","['impeachment', 'valor', 'novos Estados', 'aposentadorias', 'votação', 'secreta', 'terras', 'dias', 'verbas', 'indígenas', 'sistema', 'salário', 'mínimo', 'proteção', 'administração', 'responsabilidade', 'deliberação', 'regras', 'legislativa', 'dignidade']","['o processo de impeachment está previsto na Constituição, mas deve ser baseado em razões legais específicas, como crimes de responsabilidade, e não apenas em impopularidade ou insatisfação popular', 'a Constituição estabelece que os vetos presidenciais devem ser apreciados em sessão conjunta dentro de 30 dias, a contar de seu recebimento, e que, esgotado esse prazo sem deliberação, o veto será colocado na ordem do dia da sessão imediata, sobrestadas as demais proposições até sua votação final.', 'a Constituição estabelece que a abertura de crédito suplementar ou especial sem prévia autorização legislativa e sem indicação dos recursos correspondentes não pode ser feita.']"
18,123,18_setor_orçamentos_impeachment_saúde,"['setor', 'orçamentos', 'impeachment', 'saúde', 'Poderes União', 'eleição', 'devem', 'cidadania', 'regiões', 'deve respeitada', 'instituir', 'impeachment processo', 'Federal tem', 'iguais perante lei sem', 'direito cidadão', 'lei sem distinção qualquer', 'sem distinção qualquer natureza', 'perante lei sem distinção', 'lei sem distinção', 'Supremo']","['setor', 'orçamentos', 'impeachment', 'saúde', 'eleição', 'cidadania', 'vigor', 'regiões', 'fundamental', 'direito', 'processo', 'liberdade', 'tributos', 'existência', 'Estado', 'legislação', 'condições', 'educação', 'provisórias', 'cartões']","['a Constituição assegura a inviolabilidade do direito à vida, à liberdade, à igualdade, à segurança e à propriedade.', 'a Constituição estabelece que todos são iguais perante a lei, sem distinção de qualquer natureza.', 'A Constituição estabelece que todos são iguais perante a lei, sem distinção de qualquer natureza, e que homens e mulheres são iguais em direitos e obrigações.']"
19,123,19_não pode_não_indígenas_Deputados Senadores,"['não pode', 'não', 'indígenas', 'Deputados Senadores', 'acesso', 'Militar', 'obrigatória', 'suplentes', 'deve cumprida', 'pertence', 'especialmente diz respeito', 'normativos', 'Nacional', 'básicos', 'acesso universal', 'publicidade atos', 'mínimo deve', 'Congresso Nacional', 'protege direitos', 'saúde direito']","['indígenas', 'acesso', 'obrigatória', 'suplentes', 'meio', 'normativos', 'Senadores', 'próprio', 'básicos', 'políticas', 'adolescentes', 'brasileiros', 'públicos', 'condenação', 'integração', 'respeito', 'atos', 'informações', 'termos', 'Estado']","['A Constituição estabelece que Deputados e Senadores são invioláveis, civil e penalmente, por quaisquer de suas opiniões, palavras e votos.', 'a Constituição estabelece que a saúde é direito de todos e dever do Estado, garantido mediante políticas sociais e econômicas.', 'a Constituição estabelece que compete privativamente ao Senado Federal processar e julgar os Ministros do Supremo Tribunal Federal nos crimes de responsabilidade.']"
