Topic,Words,Frequency,Timestamp
20,"precisa, Constituição Federal precisa, Federal precisa, exige nossa Constituição, uma imensa",2,2017
22,"provisória, essa medida provisória, proposição, Emenda Constitucional, por lei um",4,2017
23,"se punam os, Câmara, que erraram, que se punam, que se punam os",3,2017
24,"de qualidade que, qualidade que se, educação de qualidade que, prioridade aos, permanência de",2,2017
25,"conquistas da, as conquistas, conquistas, nosso País, com as conquistas",3,2017
26,"terra, terras, tinha direito, na terra, da terra",5,2017
27,"Ulysses, Ulysses Guimarães, Guimarães, de Ulysses, equívoco",7,2017
28,"adquiridos, ambiente, meio ambiente, ao meio ambiente, da Constituição também",3,2017
29,"perante lei, limitado, todos são iguais perante, todos são iguais, todos são",5,2017
30,"judicial, decisão judicial, acima da lei mas, plenário do Senado da, fundamentada em",4,2017
31,"Código Tributário, Tributário, tributária, contribuições, Código Tributário Nacional",3,2017
32,"urgência Presidente, urgência Presidente da, República poderá, da República poderá, Presidente da República poderá",3,2017
33,"que as funções, serão preenchidas, diz Carta, através de concurso, as funções de",1,2017
35,"independentes, que os Poderes, harmônicos, diz que os Poderes, que os Poderes são",4,2017
36,"democracia, uma Constituição, da democracia, numa democracia, enfrentados numa",3,2017
37,"que não depende, maioria legislativa, CPI que, os requisitos constitucionais, impõe se",1,2017
38,"cláusula pétrea, cláusula, pétreas, cláusulas, cláusulas pétreas",4,2017
39,"que defendo, defendo, defendemos, defender, nós defendemos",4,2017
41,"Ministério Público, Público, da ordem jurídica, do regime democrático, interesses sociais",3,2017
43,"emana, emana do, emana do povo, poder emana do povo, poder emana do",3,2017
44,"Transitórias, inclusão do art, art ao Ato das, art ao Ato, ao Ato das Disposições",1,2017
45,"quanto ele, respeitado, da cassação do, da cassação do mandato, cassação do mandato",6,2017
46,"tenho dúvidas, com absoluta, autonomia, Senador tenho, da tribuna que",1,2017
47,"deve garantir, Estado deve, cidadãos, constituir família, por escrito",2,2017
48,"devemos reconhecer, significado, da diversidade, inclusão do art, foi inclusão do",1,2017
50,"empresa, estatal, podiam, uma empresa, limites",3,2017
51,"Cofins Contribuição Social sobre, Cofins Contribuição Social, Cofins Contribuição, Social sobre Lucro Líquido, sobre Lucro Líquido",4,2017
52,"televisão, internet, partidos políticos com, da Agência Nacional, sejam prestadas pelo Ministro",2,2017
53,"temporal, data da promulgação, data da promulgação da, data da, da promulgação",3,2017
55,"trabalhador, trabalho, um trabalhador, trabalhadores, de trabalho",7,2017
56,"responder em liberdade, responder em, verdade está, liberdade, última decisão",1,2017
-1,"em julgado, julgado, direitos, trânsito em julgado, trânsito em",202,2018
0,"Constituição de, da Constituição de, na Constituição de, pacto, Constituição cidadã",39,2018
1,"art da Constituição, art da, do art, da Constituição Federal, art da Constituição Federal",30,2018
2,"Presidente, Presidente Lula, da República, Sr Presidente, República",16,2018
3,"Tribunal, Tribunal Federal, Supremo Tribunal, Supremo Tribunal Federal, Supremo",26,2018
4,"crime, seja porque, crime de, de responsabilidade, responsabilidade",13,2018
5,"manifestação, direito livre manifestação, direito livre, assegura, de emenda",11,2018
6,"brasileira, Constituição brasileira, Brasil, na Constituição brasileira, os pilares da",16,2018
7,"impeachment, do impeachment, melhor do que, nada melhor, que discutir",10,2018
8,"arrecadar impostos, intervenção, federal, ente público, só quem pode",12,2018
9,"Implícito, com clareza, execução, que os, anterior",12,2018
10,"educação, dever do Estado, que dever do Estado, que dever do, do Estado",8,2018
11,"privatizar, desigualdades, reduzir as desigualdades, que estabelece, Federativa do Brasil",4,2018
12,"Casa, esta Casa, nesta, nesta Casa, Casas",11,2018
13,"precisa ter, precisa, um papel, precisa ver, ou privados",2,2018
14,"Implícito, critica, menciona importância, importância, Implícito orador",3,2018
15,"publicidade, legalidade, moralidade, princípios da legalidade, da legalidade",5,2018
16,"mínimo, Ministro, salário, salário mínimo, intermitente",9,2018
17,"aqui cheguei, quando aqui cheguei, jurei, cheguei, Regimento",2,2018
18,"PECs, Congresso, da intervenção, temos como, as convenções",2,2018
19,"de homens, por nós Senador, como estabelecer, se legislação, Sr Presidente se",2,2018
20,"brasileira, Constituição brasileira, Implícito, Lei de Segurança, de Segurança Nacional",8,2018
21,"sem qualquer consulta ao, Agência Nacional do, qualquer consulta, Petróleo, Nacional do Petróleo",1,2018
23,"vale destacar que, vale destacar, que iniciou, assessor, honra de ter sido",1,2018
24,"adolescentes, adolescente, da família da, família da, família",4,2018
25,"democrático, para que, democráticas, instituições democráticas, processo democrático",6,2018
26,"terras, Se Constituição Federal, três não, de demarcá, que as terras tradicionalmente",2,2018
27,"cidadã do Dr, Constituição cidadã do Dr, cidadã do Dr Ulysses, uma constituição que, para educação pública",1,2018
28,"ambiente, meio ambiente, interventor, gerações, previsto inclusive na Constituição",4,2018
29,"portanto ele, seja aplicada, apenas que, portanto, que seja",3,2018
30,"Judiciário, juízes, de ela, Judiciário brasileiro, pressionando",4,2018
31,"benefícios tributários, tributários, benefícios, demonstrativo, do quadro",2,2018
32,"interrompida, determina em seu artigo, Sessão Legislativa, Constituição determina em, não deve ser",1,2018
33,"Carta Magna, Magna, Carta, nossa Carta Magna, Magna No",4,2018
35,"Poderes, harmônicos, independentes, os Poderes, independentes harmônicos",3,2018
36,"democracia, Constituição como nossa, simulacro de, tornando cada vez mais, uma Constituição como nossa",2,2018
37,"de um terço, CPI, Câmara dos, Câmara dos Deputados, nesta Casa de",1,2018
38,"cláusula pétrea, País diminuindo, obrigação nossa, pétrea, como cláusula pétrea que",1,2018
39,"defender, de mais sagrado, ela tem de mais, mais sagrado, tem de mais",3,2018
40,"veto, dos casos, veto do, se lei, veto do Presidente",1,2018
41,"responsáveis pelo, Constituinte fui, fui um dos, independência de, capítulo que",1,2018
42,"legal, processo legal, devido processo, devido processo legal, funcionamento de uma",3,2018
43,"povo, do povo, poder emana do, poder emana do povo, emana do",2,2018
45,"trabalhei, olha que, gente tinha que, gente tinha, Policial",5,2018
46,"autonomia, autonomia independência dos, art possibilidade de, art possibilidade, com intuito de",1,2018
48,"questionados, irmãos, categoria, social, estão sendo",1,2018
50,"microempresas empresas, microempresas empresas de, microempresas empresas de pequeno, manda art inciso, indício de",2,2018
54,"realizam, Destaca se que os, pelo MEC, gestão orçamentária, de gestão orçamentária",1,2018
55,"reforma trabalhista, trabalhador, trabalhadores, trabalhista, trabalho",3,2018
56,"liberdade de, liberdade, presente que, para futuro, queremos para",1,2018
-1,"no direito, direito vida, nós, art da, Presidente",234,2019
0,"Constituição de, social, da Constituição de, na Constituição de, seguridade",63,2019
1,"art da, art da Constituição, da Constituição Federal, do art, no art",43,2019
2,"Presidente, Sr Presidente, Presidente da, Presidente da República, da República",14,2019
3,"Tribunal, Supremo Tribunal, Tribunal Federal, Supremo Tribunal Federal, Supremo",29,2019
4,"crime, penal, crime de, de responsabilidade, responsabilidade",16,2019
5,"proposta, de emenda, de emenda Constituição, emenda Constituição, proposta de emenda",22,2019
6,"brasileira, Constituição brasileira, em nenhuma, Brasil um, no Brasil",13,2019
7,"impeachment, Constituição que ajudei, que ajudei escrever, aos gastos públicos, anos da Constituinte da",2,2019
8,"Procuradoria, Distrito Federal, Parlamentares, está escrito aqui, programação orçamentária",7,2019
9,"Implícito, as obras, alguém que, prerrogativa de, sistema de",11,2019
10,"educação, Educação, que educação, da educação, ensino",23,2019
11,"desigualdades, regionais, Brasil, latino americana, política social cultural",7,2019
12,"Casa, nesta Casa, esta Casa, nesta, de emenda Constituição",14,2019
13,"fiscalizar, interessa, Fiscal, Responsabilidade, Responsabilidade Fiscal",8,2019
14,"Implícito, Implícito orador, Implícito orador menciona, orador menciona, menciona importância",13,2019
15,"administração, Polícia, art da Constituição, publicidade, moralidade",10,2019
16,"do salário mínimo, um quarto, Ministro, um quarto do salário, quarto do salário",12,2019
17,"Regimento, Regimento Interno, Interno, no Regimento, Exa",14,2019
18,"Congresso, do Congresso, Congresso Nacional, do Congresso Nacional, uma lei",6,2019
19,"educação, educação superior, graças aos, que não vão, Governador ou",4,2019
20,"do Brasil, Implícito, os interesses, brasileira, afronta Constituição nós",6,2019
21,"petróleo, onde for, exploração, explorado, que se deu",2,2019
22,"provisória, de urgência, por motivo, por motivo de sexo, por motivo de",4,2019
23,"Câmara, dos Deputados, Câmara dos, Câmara dos Deputados, Deputados",9,2019
24,"adolescente, da Criança, prioridade, Estatuto da Criança, adolescentes",4,2019
25,"democrático, democráticas, daquela população, de forma transparente, brasileiro que criou",3,2019
26,"terra, da propriedade privada, sua propriedade, terras, propriedade privada",3,2019
27,"Ulysses, Ulysses Guimarães, Guimarães, de Ulysses, de Ulysses Guimarães",7,2019
28,"ambiente, meio ambiente, ecologicamente equilibrado, ecologicamente, equilibrado",13,2019
29,"absolvido, compatibilizar, os anseios, anseios da, sociedade em",2,2019
30,"judicial, ativismo, Judiciário, Judiciário que, do Judiciário que",4,2019
31,"tributária, reforma tributária, reforma, que pertence União, tema que",4,2019
32,"que tenha, medida provisória, na mesma sessão legislativa, mesma sessão legislativa, mesma sessão",6,2019
33,"Carta Magna, Magna, Carta, da Carta Magna, não teremos mais",5,2019
35,"harmônicos, harmônicos independentes, que os Poderes, Poderes, ser harmônicos",4,2019
36,"democracia, da democracia, democracia não, numa democracia, que numa democracia",4,2019
37,"CPI, instalada, assinaturas, fato determinado, Casa Legislativa",8,2019
38,"cláusula pétrea, cláusula, pétreas, cláusulas pétreas, cláusulas",6,2019
40,"Com base no, art da Constituição Presidente, veto, enviou, para promulgação",1,2019
41,"Ministério Público, como instituição essencial, interesses sociais individuais, jurídica do, interesses sociais individuais indisponíveis",1,2019
42,"devido processo, processo legal, legal, devido processo legal, obediência",4,2019
43,"poder emana do povo, poder emana do, poder emana, emana do povo, todo poder emana",2,2019
44,"Transitórias, condições de cumprir, seu ofício, Atos das Disposições, de trânsito",3,2019
45,"respeitado, quanto ele, vota, educação, favor",9,2019
47,"que ter direito, cidadão, do Estado um, direito do cidadão, do cidadão",5,2019
48,"em áreas indígenas, originários, tradicionalmente, direitos originários, direitos originários sobre",2,2019
49,"respeitando, respeitando os direitos, respeitando os, desenvolvimento econômico, do desenvolvimento",2,2019
50,"empresa, mas principalmente, na Capital da República, na Capital, pública tem que",2,2019
51,"seguridade social, seguridade, social, social que, seguridade social que",4,2019
54,"didático científica administrativa de, de gestão financeira, didático científica administrativa, científica administrativa de gestão, científica administrativa de",1,2019
55,"Direito do Trabalho, Direito do, Direito, do Direito, do Trabalho",2,2019
56,"liberdade, liberdade de, da defesa, de expressão, liberdade de expressão",5,2019
-1,"liberdade, na Constituição Federal, do Estado, impostos, República",62,2020
0,"Constituição de, que nós, seguridade, nós temos, de doenças graves",5,2020
1,"da Constituição Federal, de reeleição, art da, do art, art da Constituição",10,2020
2,"do presidente, ministro da, foi feita, de crise, reeleição",6,2020
3,"Tribunal, Tribunal Federal, Supremo Tribunal, Supremo Tribunal Federal, Supremo",4,2020
4,"crimes, coletivos na, mesmo tempo gente, branda, atribuições que lhes",3,2020
5,"opinião, de mandatos, prorrogação, extensão, legitimidade",5,2020
6,"brasileira, os Poderes, protege, aborto, Brasil",6,2020
7,"contida no art, contida no art da, caso de crime de, está contida, caso de crime",1,2020
8,"na Constituição Federal, no próprio corpo, Eu fiz um, respeitamos Constituição, resguardar Constituição",5,2020
9,"Implícito, eleição, sim, ao lado da Constituição, da estrutura da",9,2020
10,"pelo Ministério da, pelo Ministério, educação, Ministério da, mas realidade",2,2020
11,"um pacto federativo, Precisamos de um, que estabelece nossa, que estabelece nossa Constituição, que atenda",1,2020
12,"Casa, uma Casa política, Casa política, uma Casa, do Executivo",2,2020
13,"papel nosso, fiscal, fiscalizar, Senado Federal junto com, Exa mesmo",4,2020
14,"Implícito orador, importância de, Implícito, menciona, Implícito orador menciona",43,2020
15,"os princípios que regem, Ministro da Educação, que os princípios, sistematicamente, os princípios que",1,2020
16,"sem mínimo de, que direito saúde pública, para ações, hoje sem, de condições adequadas",2,2020
17,"não vai, Regimento, um rito ser, questões que são, não vai votar",2,2020
18,"em cima do, Congresso, em cima, cima, causador",3,2020
22,"ficou, provisória, de urgência, por motivo de, por motivo",4,2020
27,"Cidadã Constituição de, Constituição Cidadã Constituição de, textual, está lá no art, Constituição Cidadã Constituição",1,2020
28,"ambiente, meio ambiente, ecologicamente, ecologicamente equilibrado, ambiente ecologicamente equilibrado",2,2020
29,"sentido na, Não vejo, tinha que ser, nossa Constituição somos todos, nossa Constituição somos",2,2020
30,"previstos nas, leis na Constituição, nas leis na Constituição, competente nos, por autoridade",1,2020
31,"reforma tributária que, tributária que, reforma tributária, tributária, reforma",1,2020
32,"iniciada na, particularmente no, iniciadora do processo, Casa iniciadora do processo, determina que as medidas",1,2020
33,"rasgar Constituição Federal, vai rasgar Constituição, defender cumprimento, Nacional vai, Constituição Federal deverá",1,2020
38,"cláusula pétrea, das causas mais, Constituição Federal cláusula pétrea, hoje sobre, Federal cláusula pétrea",1,2020
40,"de forma legal, manifestarem de, de se manifestarem, que prescrevem, Senadores de se",1,2020
43,"emana da, decisão popular, da Constituição todo, Constituição todo, da decisão",1,2020
44,"primeiro um, no parágrafo do artigo, mobilidade urbana, direitos dos cidadãos, são direitos dos",1,2020
48,"originários, direitos originários sobre, direitos originários, originários sobre, tradicionalmente",2,2020
55,"são direitos dos trabalhadores, presentes na Constituição, são direitos dos, basilares, direitos dos trabalhadores",1,2020
-1,"art da, social, todos, art da Constituição, da Constituição Federal",145,2021
0,"Constituição de, menciona que Constituição, orador menciona que Constituição, menciona que Constituição de, da Constituição de",20,2021
1,"do art, da Constituição Federal, competência, art da, art da Constituição",41,2021
2,"Presidente, Sr Presidente, os precatórios, Presidente da, da República",13,2021
3,"Tribunal, Tribunal Federal, Supremo Tribunal, Supremo Tribunal Federal, Supremo",11,2021
4,"crime, pena de, reclusão, prática do racismo, crime inafiançável imprescritível",5,2021
5,"proposta, de emenda, de emenda Constituição, emenda Constituição, proposta de emenda",15,2021
6,"Brasil, postal, brasileiros, brasileira, Constituição brasileira",8,2021
7,"deliberar, CPI da Lava Toga, CPI da Lava, Lava Toga, da Lava Toga",1,2021
8,"Nós temos, obediência Constituição Federal, lei ou, Senado Federal, acessibilidade",16,2021
9,"Implícito, Constituição Implícito, direito social, direito Implícito, uma das instituições",12,2021
10,"educação, de qualidade, professores, educação um direito, educação um",9,2021
11,"República Federativa do Brasil, Federativa do Brasil, República Federativa do, Federativa do, República Federativa",8,2021
12,"Casa, esta Casa, nesta, nesta Casa, definido",9,2021
13,"fiscal, Fiscal, Responsabilidade, Responsabilidade Fiscal, de Responsabilidade Fiscal",7,2021
14,"Implícito orador, Implícito, importância de, menciona, Implícito orador menciona",33,2021
15,"pública, moralidade, publicidade, administração pública, segurança pública",15,2021
16,"Ministro, são as condições, do Brasil Ou seja, do Brasil Ou, os requisitos do",6,2021
17,"Regimento, Regimento Interno, Interno, as leis, Constituição as leis",9,2021
18,"de acordo com, de acordo, com desejo, famílias com, prejudicando",2,2021
19,"educação, na educação, investimento, Governo Federal, da educação",6,2021
20,"que Constituição da República, que Constituição da, espinha dorsal, do Brasil, Constituição da República Federativa",6,2021
21,"Constituição de sabiamente, nossa Constituição de sabiamente, autorizações, concentração da, de sabiamente",1,2021
22,"ao encontro do, porque claramente, eivada de inconstitucionalidade, Essa medida provisória, encontro do",2,2021
23,"Câmara, da Câmara, não podemos, uma divergência, porque Orçamento",4,2021
24,"criança adolescente jovem, Constituição Federal clara ao, Federal clara ao dizer, adolescente jovem, clara ao dizer que",1,2021
25,"que nós na, da Constituição Estado, na mobilização, conceitos, uma Constituição que tem",1,2021
26,"ambiental, áreas, área, constitucionalmente não, de diminuição",1,2021
28,"ambiente, meio ambiente, meio, ecologicamente, ecologicamente equilibrado",4,2021
29,"aprovada essa, meu pedido, votação seja, reiterada, exatamente que",1,2021
30,"judicial, decisão judicial, Judiciário, orçamento, investidores",5,2021
31,"tributária, reforma tributária, que se tenta, reforma, Desde Constituição de",6,2021
32,"de relevância urgência, relevância urgência, de relevância, urgência, da Constituição Federal",7,2021
33,"Carta Magna, Magna, Carta, observância aos, concorrente da União Estados",2,2021
34,"crédito, de crédito, de interesse da União, financeira de, externas de",2,2021
35,"harmônicos, si, harmônicos entre, harmônicos entre si, que os Poderes",2,2021
36,"maior da nossa, conquista do nosso, nossa Constituição maior, Constituição maior, maior da nossa Constituição",1,2021
37,"CPI, Covid, da Minoria, CPI da, estava na",6,2021
38,"cláusula pétrea, cláusula, pétreas, cláusulas pétreas, cláusulas",5,2021
39,"defender, dizer que nós, um dos direitos mais, pela Constituição direito de, de defender um",3,2021
41,"Ministério Público, do regime democrático, instituição permanente, instituição permanente essencial, instituição permanente essencial função",2,2021
43,"do povo, emana do povo, poder emana do, poder emana do povo, poder emana",2,2021
44,"do nosso querido, podemos sim, apesar de ainda, seu art das, seu art das Disposições",1,2021
46,"autonomia, autonomia dos, na autonomia, ferir autonomia, não ferir Constituição",2,2021
48,"irmãos indígenas, reconhece os direitos, Federal em seus arts, Constituição Federal em seus, originais",1,2021
49,"humano, direito humano, humano essencial, direito humano essencial, um direito humano",3,2021
50,"um projeto, efeitos para, pequenas empresas, decorre da, que se aprove",1,2021
51,"que assegura os, em que estamos vivendo, vai contra Constituição, importante que esteja, que assegura os direitos",2,2021
52,"incisos XII, dispor sobre tributação, competência para dispor sobre, competência para dispor, sobre tributação",1,2021
54,"financeira, financeiro, financeiras, das fontes, na hipótese de",4,2021
55,"ter oportunidade de, ter oportunidade, sem proteção, direito sem, conquistar",1,2021
56,"liberdade, liberdade de, liberdade de expressão, de expressão, liberdade liberdade de expressão",1,2021
-1,"art da, nós, da Constituição Federal, art da Constituição, saúde",171,2022
0,"Constituição de, Constituição Federal de, na Constituição desde, Constituição desde, no texto constitucional",15,2022
1,"do art, art da, da Constituição Federal, art da Constituição, do art da",65,2022
2,"Presidente, Sr Presidente, desconto, também, de aprovar",8,2022
3,"Tribunal, Tribunal Federal, Supremo Tribunal, Supremo Tribunal Federal, Supremo",12,2022
4,"crime, consoante dispõe art, crime de, consoante, de responsabilidade",9,2022
5,"de emenda, de emenda Constituição, proposta de emenda, proposta de emenda Constituição, emenda Constituição",14,2022
6,"do Brasil, Brasil, da ciência, ao art inciso da, de apresentada",5,2022
7,"impeachment, de impeachment, impeachment de, processo de impeachment, quatro linhas",5,2022
8,"de estado de, de estado, Senado Federal, estado, Constituição Federal que",8,2022
9,"Implícito, dos seus direitos, obedecendo, própria, seus direitos",18,2022
10,"educação, Educação, Sistema Nacional de Educação, educação básica, Sistema Nacional de",6,2022
11,"Federativa do Brasil, República Federativa do Brasil, República Federativa do, Federativa do, República Federativa",7,2022
12,"Casa, que secreto, nesta Casa, dos limites da Constituição, por todos os Poderes",5,2022
13,"fiscal, Fiscal, Responsabilidade, Responsabilidade Fiscal, de Responsabilidade Fiscal",14,2022
14,"Implícito, Implícito orador, Implícito discurso, Implícito orador menciona, orador menciona",5,2022
15,"pública, administração pública, publicidade, moralidade, moralidade publicidade",11,2022
16,"mínimo, Ministro, salário mínimo, Ministro do, nada disso",7,2022
17,"Quero cumprimentar, Quero cumprimentar Exa, pela condução, cumprimentar Exa, da República com",1,2022
18,"Congresso, Congresso Nacional, piso salarial da, mudar aquilo que, que se respeite",3,2022
19,"repasses que, uma reunião com os, reunião com, reunião com os, de repasses",1,2022
20,"Brasil, Parlamento brasileiro, do Brasil, brasileiro, Parlamento",6,2022
21,"combustíveis, petróleo, dos combustíveis, de petróleo, da União",5,2022
22,"medida provisória, medida, urgência, Chefe, edição de medida provisória",5,2022
23,"Câmara dos, Câmara dos Deputados, dos Deputados, Deputados, porque tem que",3,2022
24,"da família da, família da, da sociedade do Estado, sociedade do Estado, da sociedade do",5,2022
25,"democrática, democrático, numa, você, expressão",5,2022
26,"terras, terra, por objeto, indígenas, transmissão",3,2022
27,"Ulysses, quem lê, quem mora, que está na Carta, está na Carta Magna",1,2022
28,"ambiente, meio ambiente, ecologicamente equilibrado, ecologicamente, ambiente ecologicamente",2,2022
29,"materializa, na Constituição portanto, com preservação, piso salarial dos, garantiu que",2,2022
30,"que garanta, porque ele, competitividade dos, que traga, ao Judiciário para",2,2022
31,"tributária, tribunais de, tribunais de contas, tribunais, diferencial",4,2022
32,"de relevância urgência, de relevância, relevância urgência, pelo Presidente da República, casos de relevância urgência",10,2022
33,"Carta Magna, Magna, Carta, nossa Carta Magna, nossa Carta Magna que",4,2022
34,"crédito, de crédito, operações, crédito extraordinário, art inciso da",6,2022
35,"harmônicos, Poderes, que esses, independentes, Poderes devem ser",2,2022
36,"democracia, democracia da Constituição, da democracia da Constituição, da democracia da, democracia da",2,2022
38,"Ninguém está, são cláusulas pétreas da, pétreas da Constituição Federal, são cláusulas, são cláusulas pétreas",1,2022
39,"Defender, defender, de cidadão, eu venho aqui, tribuna para defender",3,2022
40,"Nacional tem que, Congresso Nacional tem que, veto, diz que Congresso Nacional, diz que Congresso",1,2022
41,"força de nossa Constituição, por força de nossa, independência funcional, Lembro que, que Ministério Público",1,2022
42,"legal, disciplinado pela, para administração, iniciativa não, ser revogada",2,2022
43,"do povo, emana do povo, emana do, poder emana do povo, poder emana do",2,2022
46,"tardiamente, Defensoria Pública da, Pública da União, Defensoria Pública da União, sua autonomia",1,2022
49,"que as ações, livre iniciativa privada, que Constituição reconhece, por pessoa física, obrigação do Estado mas",1,2022
52,"programação, da competência legislativa, competência legislativa, telecomunicações, da competência",3,2022
53,"na data em que, reconhecidas, na data em, em que foi promulgada, tese do marco temporal",1,2022
54,"financeira, de agente, dos profissionais, financeiro, assistência financeira",4,2022
55,"de trabalho como, como fontes, coletivos de trabalho, as convenções, acordos coletivos de trabalho",1,2022
56,"liberdade de, liberdade, de expressão, liberdade de expressão, expressão de manifestação",3,2022
-1,"art da, art da Constituição, da Constituição Federal, Senado, porque",200,2023
0,"Constituição de, da Constituição de, na Constituição de, Roraima, de outubro de",33,2023
1,"do art, art da, da Constituição Federal, art da Constituição, art inciso",59,2023
