Topic,Words,Frequency,Timestamp
4,"crime, de responsabilidade, responsabilidade, crime de, crime de responsabilidade",10,2012
5,"emenda, de emenda, propostas de emenda, propostas de, propostas",12,2012
6,"Brasil, brasileira, no Brasil, Constituição brasileira, do Brasil",20,2012
7,"Constituição do Paraguai, impeachment, Constituição do, desempenho de suas funções, que os parlamentares",2,2012
8,"Governo Federal, por meio, sua receita, Governo, na Constituição Federal",19,2012
9,"Implícito, Constituição do país, aquilo que, Constituição do, nós teríamos que",7,2012
10,"educação, da educação, dever do Estado, escolas, professores",10,2012
11,"desigualdades, desigualdades regionais, desigualdades sociais, desigualdades sociais regionais, sociais regionais",19,2012
12,"Casa, esta Casa, nesta Casa, um pressuposto, representação",10,2012
13,"fiscalizar, Fiscal, Responsabilidade, Responsabilidade Fiscal, de Responsabilidade Fiscal",5,2012
14,"Implícito, Implícito orador, necessidade de, Implícito orador menciona, necessidade",2,2012
15,"publicidade, pública, moralidade, moralidade publicidade, legalidade",8,2012
16,"foro privilegiado, privilegiado, segundo, para julgar autoridades, trimestre",3,2012
17,"Regimento, nenhum processo, processo legislativo de, sessão que, Interno não",7,2012
18,"Congresso, Congresso Nacional, do Congresso, do Congresso Nacional, como dever constitucional",4,2012
19,"investir, está estabelecido, Dizem que, de droga, droga",3,2012
20,"da República Implícito, sabatinar, não sigam, processos da, não estou defendendo",3,2012
21,"petróleo, royalties, de petróleo, do petróleo, no mar",15,2012
22,"provisória, medida provisória, medida, medidas, medidas provisórias",7,2012
23,"Câmara, algum problema, dos Deputados, Câmara dos Deputados, Câmara dos",4,2012
24,"Criança, da Criança, Estatuto da Criança, adolescente, pelo Estatuto",7,2012
25,"democrático, Vale lembrar, do voto, sentido, democrática",5,2012
26,"terra, terras, terras indígenas, indígenas, terra de",11,2012
27,"Ulysses, Ulysses Guimarães, Guimarães, qualquer tipo de, tipo",5,2012
28,"ambiente, meio ambiente, ecologicamente equilibrado, ecologicamente, vida",3,2012
29,"igualdade de todos, acima da, igualdade de, não está acima da, caso Procurador",6,2012
30,"Judiciário, Judiciário que, publicidade, judicial, delegou ao",4,2012
31,"tributária, tributário, sistema tributário, Tributário, reforma tributária",8,2012
32,"medida provisória, provisória, de relevância urgência, relevância urgência, de relevância",3,2012
33,"previstos na Constituição nossa, dos termos, deve ser respeitada, na Constituição nossa, de ninguém",1,2012
34,"abertura de, crédito, de crédito, abertura de crédito, créditos",2,2012
35,"harmônicos, independentes, independentes harmônicos, que os Poderes, Diz Constituição Federal",2,2012
36,"promotor, ferido, ato, defesa Constituição, cometeu um",1,2012
37,"CPI, CPI não, de CPI, investigar, da CPI",4,2012
38,"cláusula pétrea, cláusula, pétreas, cláusulas pétreas, como cláusula pétrea",4,2012
39,"defender que, defender, Estatuto da Cidade, vou defender, espera de",3,2012
40,"veto, vetos, seu recebimento, pauta, do veto",12,2012
41,"Ministério Público, Público, do Ministério Público, do Ministério, Judiciário",3,2012
42,"legal, processo legal, devido processo, devido processo legal, processo legal não",4,2012
43,"emana, emana do, emana do povo, poder emana do povo, poder emana do",6,2012
44,"Transitórias, Disposições, Ato das Disposições, Constitucionais Transitórias, das Disposições Constitucionais Transitórias",2,2012
46,"autonomia, autonomia dos, da autonomia, administrativa, autonomia funcional",8,2012
47,"dever do Estado, direito do cidadão, cidadão, do cidadão, do Estado",4,2012
48,"terras, tradicionalmente, originários, originários sobre, direitos originários sobre",1,2012
49,"todos dever do Estado, todos dever do, direito de todos, visem redução do, serviços para",4,2012
50,"do ICMS da comercialização, ICMS da comercialização, empresas do setor, para discutirmos, ICMS da comercialização da",2,2012
51,"da sua condição, sua condição, sua condição econômica da, independentemente da sua condição, da sua condição econômica",1,2012
54,"financeira, financeiros, capacidade, fiscais ou, objetivo da Constituição",4,2012
55,"estão na Constituição brasileira, reais ao, que hoje estão, na Constituição brasileira em, CUT",1,2012
56,"liberdade de, liberdade, determina que nós tenhamos, de expressão eu, expressar sua",1,2012
-1,"direitos, porque, médico, emenda Constituição, Brasil",380,2013
0,"Constituição de, da Constituição de, Constituinte, Constituinte de, direitos",109,2013
1,"art da, do art, art da Constituição, da Constituição Federal, art da Constituição Federal",69,2013
2,"Presidente, Sr Presidente, República, da República, Presidente da",35,2013
3,"Tribunal Federal, Supremo Tribunal, Supremo Tribunal Federal, do Supremo Tribunal, do Supremo Tribunal Federal",34,2013
4,"crime, crime de, crimes, de responsabilidade, crime de responsabilidade",18,2013
5,"emenda, emenda Constituição, de emenda, de emenda Constituição, proposta de emenda",52,2013
6,"brasileira, Constituição brasileira, Brasil, brasileiro, Constituição brasileira para",28,2013
7,"impeachment, entrar no mérito, Presidente Lugo, talvez maior, país que quer",2,2013
8,"Distrito Federal, Distrito, na Constituição Federal, Federal Constituição Federal, Senado Federal",20,2013
9,"Implícito, para diminuir as desigualdades, publicações, para diminuir as, para diminuir",14,2013
10,"educação, Educação, de um Estado, de Educação, Plano Nacional de Educação",15,2013
11,"desigualdades, desigualdades regionais, redução das desigualdades, desigualdades sociais, objetivos fundamentais",14,2013
12,"Casa, nesta Casa, Casas, nesta, Casas do Congresso",8,2013
13,"Fiscal, fiscalizar, Responsabilidade, Responsabilidade Fiscal, Lei de Responsabilidade Fiscal",19,2013
14,"Implícito, menciona, Implícito orador, Implícito orador menciona, orador menciona",13,2013
15,"moralidade, Administração Pública, art da, art da Constituição, Pública",8,2013
16,"Ministro, mínimo, Ministros, vários de, cinco Ministros",5,2013
17,"Regimento, no Regimento, assento, Regimento Interno, Interno",8,2013
18,"Congresso, Congresso Nacional, do Congresso, do Congresso Nacional, âmbito",21,2013
19,"para os, do que, os Municípios, que era, da sua",9,2013
20,"Constituição brasileira, brasileira, Implícito, direito de cada, das Regiões",5,2013
21,"petróleo, do petróleo, compensação, exploração, de petróleo",9,2013
22,"provisória, medida provisória, urgência, de urgência, aprová",12,2013
23,"Câmara, Deputados, dos Deputados, Câmara dos, Câmara dos Deputados",13,2013
24,"criança, da família da, família da, adolescente, família",10,2013
25,"democrático, processo democrático, democrática, respeito Constituição, temos buscado",7,2013
26,"terras, indígenas, terras indígenas, terra, demarcação",8,2013
27,"Ulysses, Ulysses Guimarães, Guimarães, Pinto, Constituição cidadã",6,2013
29,"Portanto, clara os, clara os Poderes, no Diário, para burlar Constituição",3,2013
31,"tributária, tributar, tribunais, Tribunais Regionais Federais, Regionais Federais",8,2013
32,"medidas provisórias, Congresso Nacional, art da Constituição, art da, Congresso",9,2013
33,"Carta, Carta Magna, Magna, nossa Carta, nossa Carta Magna",5,2013
34,"TCE, Certidão, Estado cumpre, Consta da, para contratação de",1,2013
35,"harmônicos, independentes, entre si, si, harmônicos entre",2,2013
36,"democracia, democracia representativa, de que democracia, que democracia, uma Constituição",7,2013
37,"CPI, da CPI, comissão, investigação, terço dos membros da",2,2013
38,"cláusula, cláusula pétrea, pétrea da, cláusula pétrea da, pétreas",9,2013
39,"defender, em que não, para defender, defender que, que estes",4,2013
40,"veto, vetos, do veto, de dias, Congresso",17,2013
41,"Ministério Público, Ministério, Público, dos interesses, do Ministério Público",6,2013
42,"processo legal, legal, seja feita, devido processo, devido processo legal",3,2013
43,"emana do povo, emana do, poder emana do, poder emana do povo, poder emana",7,2013
44,"estrada, fica, fica de, impedido de, às da",1,2013
46,"autonomia, têm autonomia, do nobre Senador, Senador Ataídes, sindicais que",3,2013
47,"garantias individuais, individuais, Constituição cidadã, foi aprovado pela Comissão, pela Comissão de",4,2013
48,"terras, originários, tradicionalmente, direitos originários sobre, originários sobre",5,2013
49,"dever do Estado, nacional de educação, que visem redução do, acesso universal igualitário às, outros agravos",3,2013
50,"participa, dependem, do ICMS, ICMS, energia",4,2013
51,"universal, Sistema Único de Saúde, Sistema Único de, Único de Saúde, Sistema Único",8,2013
52,"comunicações, sigilo, das comunicações, rádio, judicial",9,2013
53,"terras, indígenas, terras indígenas, do território nacional, do território",4,2013
54,"redução de, financeira, financeiras, fiscais ou, financeiros",6,2013
55,"trabalho, de trabalho, trabalhadores, os demais trabalhadores, relação de trabalho",6,2013
-1,"art da, art da Constituição, direitos, todos, pode",143,2014
0,"Constituição de, na Constituição de, promulgação da Constituição, promulgação da, promulgação",35,2014
1,"art da, art da Constituição, do art, da Constituição Federal, art inciso",23,2014
2,"Presidente, para que ele, para que ele possa, que ele possa, reafirmamos",11,2014
3,"Tribunal, Tribunal Federal, Supremo Tribunal, Supremo Tribunal Federal, Tribunal de",16,2014
4,"crime, terrorismo, crime de, de terrorismo, penal",11,2014
5,"de quórum, emenda Constituição, de emenda, de emenda Constituição, uma emenda",7,2014
6,"Brasil, brasileira, Constituição brasileira, Centro Oeste, todos os",8,2014
7,"baseado no art, fundamentado, pedido de, impeachment, de impeachment",2,2014
8,"justificativa, tributação das grandes fortunas, tributação das, Federal assegurou, tributação das grandes",14,2014
9,"Constituição Implícito, Implícito, apenas regulamenta, vim para cá, Política Nacional de Participação",3,2014
10,"educação, suma importância para, Está lá colocado, absolutamente equivocada, Mas ela",3,2014
11,"desigualdades, desigualdades regionais, objetivos fundamentais da República, fundamentais da República, objetivos fundamentais da",10,2014
12,"Casa, para crimes, nesta Casa, crimes, de emenda Constituição",4,2014
13,"fiscalizar, Fiscal, Responsabilidade, Responsabilidade Fiscal, Lei de Responsabilidade Fiscal",8,2014
14,"Implícito, mediante concurso público de, emenda Constituição estabelece que, de emenda Constituição estabelece, de Ministro do Tribunal",1,2014
15,"pública, Administração Pública, Administração, legalidade, art da",6,2014
16,"Ministro, mínimo, salário mínimo, Constituição em primeiro lugar, Constituição em primeiro",5,2014
17,"Regimento, dizendo que, para CCJ, rotina, mandar para",2,2014
18,"Congresso, terminantemente, um problema, problema do, manda Constituição",4,2014
19,"pelo Rio, senhor sabe, lei Senador, em saúde, Rio Grande",1,2014
20,"posse no, seu legítimo, legítimo direito, que lhes dá, suas mãos",1,2014
22,"do Programa Mais, os estrangeiros, aí também, do Programa Mais Médicos, cor ou estado civil",1,2014
23,"Câmara, na Câmara, Deputados, gravado, dos Deputados",5,2014
24,"família, adolescente, ao adolescente, criança ao, criança ao adolescente",2,2014
25,"tal como previsto no, tal como previsto, mediante processo, previsto no parágrafo, como previsto no",1,2014
26,"que reconhece direito de, para as comunidades, Reforma Agrária, que reconhece direito, titulação",2,2014
28,"que todos temos, ambiente, meio ambiente, Constituição dispõe que, Público coletividade dever de",1,2014
29,"por lei não, Quem deveria, que por lei, emenda Constituição que se, se mostra",3,2014
30,"Judiciário, do juiz, judicial, Poder Judiciário, autoridade competente",5,2014
33,"ao Partido, tenho direito, carta, anos eu, para que eu",1,2014
34,"inciso XII alínea, no art inciso XII, XII alínea da Constituição, isenções incentivos benefícios, decorrência de",1,2014
35,"harmônicos, independentes, entre si, si, Poderes",6,2014
36,"democracia, população não, se contenta, não se contenta, devemos nos",2,2014
37,"CPI, uma CPI, instalar, determinado, investigação",14,2014
38,"Petrobras, cláusula pétrea, pétrea, pôde fazer, seria inconstitucional",2,2014
39,"ordenamento jurídico ainda, Lei da Anistia, que cometeram, jurídico ainda, da Anistia",1,2014
41,"Ministério Público, Ministério, Público, atribuição, do Ministério Público",3,2014
42,"conforme Constituição que, de entrar em, Constituição que seja, com julgamento, ter as condições",1,2014
43,"emana do, emana do povo, poder emana do povo, poder emana do, poder emana",5,2014
44,"Transitórias, Disposições, Amapá, de Roraima, Ato das Disposições",6,2014
46,"autonomia, federativo para, CPI no, constitucionais que não, uma certa",2,2014
48,"da mineração, que regulamenta os, arts da Constituição que, Constituição que tratam, projeto que regulamenta",1,2014
50,"Fundo de, uma emenda Constituição, micro, Desenvolvimento Econômico, total desrespeito ao",3,2014
52,"bancário fiscal, tem prerrogativas, empresas do setor, direitos deveres dos, Segundo Constituição",2,2014
53,"terras, terras que, as terras que, as terras, temporal",3,2014
54,"das receitas tributárias, preciso reconhecer que, razões que, que uma das principais, que levaram",1,2014
55,"afrontando Constituição do País, direitos adquiridos daqueles, subtraindo, para eliminar as desigualdades, ação que",2,2014
56,"liberdade, expressão, liberdade de, liberdade de expressão, de expressão",2,2014
-1,"Presidente, porque, todos, direitos, art da",227,2015
0,"Constituição de, da Constituição de, Constituinte, Constituição Federal de, direitos",48,2015
1,"do art, art da, art da Constituição, da Constituição Federal, do art da",30,2015
2,"Presidente, Sr Presidente, da República, República, Presidente da",25,2015
3,"Tribunal, Tribunal Federal, Supremo Tribunal, Supremo Tribunal Federal, Supremo",25,2015
4,"crime, de responsabilidade, responsabilidade, crime de responsabilidade, lei orçamentária",17,2015
5,"emenda, de emenda, emenda Constituição, proposta de emenda, proposta de",24,2015
6,"brasileira, Constituição brasileira, Governo brasileiro, Governo, brasileiros",24,2015
7,"vai conseguir, conseguir, impeachment, eu, que isso seja",44,2015
8,"que nem sequer, que nem, na Constituição Federal, Governo Federal, que determina",16,2015
9,"Implícito, imposto, constituição, na nossa Constituição, todos os Senadores Senadoras",6,2015
10,"educação, professores, dever do Estado, dever do, de todos dever do",14,2015
11,"desigualdades, as desigualdades, República Federativa do Brasil, Federativa do Brasil, República Federativa do",15,2015
12,"Casa, nesta Casa, Casa uma, uma proposta de emenda, tributação sobre",9,2015
13,"Fiscal, Responsabilidade, Responsabilidade Fiscal, de Responsabilidade Fiscal, Lei de Responsabilidade Fiscal",14,2015
14,"Implícito, menciona, Implícito orador, Implícito discurso, Implícito orador menciona",6,2015
15,"segurança pública, pública, Administração Pública, da Administração Pública, Administração",8,2015
16,"Ministro, mínimo, previsto na Constituição, decisão favorável, mínimo previsto na",5,2015
17,"Regimento, Regimento Interno, Interno, pelo Regimento, Constituição Regimento",9,2015
18,"Congresso, Congresso Nacional, do Congresso, do Congresso Nacional, num sistema",7,2015
19,"Municípios, em alguns, nós fizemos, para os Estados, prefeitos",5,2015
20,"legislação daqueles países, legislação daqueles, não quero, pode, legislação",4,2015
21,"petróleo, de petróleo, Viemos, passamos ser, fonte de receita",2,2015
22,"medidas provisórias, provisórias, medidas, medida, medida provisória",9,2015
23,"Câmara, Deputados, dos Deputados, Câmara dos, Câmara dos Deputados",9,2015
24,"Criança, da Criança, Estatuto da Criança, adolescente, família",9,2015
25,"não tem base, que não tem base, que não tem, democrático, política que",9,2015
26,"terra, terra de, da terra, discute, terras",2,2015
27,"Ulysses, Ulysses Guimarães, Guimarães, como titular, dia da promulgação de",1,2015
28,"ambiente, meio ambiente, um rito de, nossos problemas, redemocratização em",3,2015
30,"judicial, Judiciário, confundido com, ser confundido, roubar",3,2015
31,"onde estão, tributária, nos Estados, sendo construídas, nos Estados produtores de",2,2015
32,"medidas provisórias, provisórias, de relevância urgência, de relevância, relevância urgência",3,2015
33,"Carta Magna, Magna, nossa Carta Magna, tratado, Magna No",6,2015
35,"que já existe, já existe na, uma condição que, condição que, Poderes são harmônicos",1,2015
36,"democracia, que temos na nossa, nossa Constituição princípio do, nossa Constituição princípio, democracia que não",2,2015
37,"CPIs, de investigação próprios das, poderes de investigação próprios, próprios das autoridades, investigação próprios das autoridades",2,2015
38,"cláusula pétrea, pétrea, cláusula, rol taxativo, inocência uma",2,2015
39,"defender, legitimamente eleitos, isso um atentado, defenda, contra quem quer que",2,2015
40,"veto, uma divergência, Presidente da República quando, outras unidades, como política pública",1,2015
41,"Ministério Público, Ministério, Público, do regime democrático, regime democrático",5,2015
42,"devido, processo legal, devido processo, devido processo legal, direito ao exercício",1,2015
43,"emana do povo, emana do, poder emana do povo, poder emana do, poder emana",3,2015
45,"quanto ele, respeitado, negociação, negociações, não conseguem",4,2015
46,"autonomia, autonomia administrativa, administrativa, com autonomia, autonomia dos",6,2015
48,"originários, originários sobre, direitos originários, direitos originários sobre, os direitos originários",2,2015
49,"redução do risco de, redução do risco, visem redução, visem redução do, visem redução do risco",3,2015
50,"empresas, empresarial, do ICMS, ICMS, financiamento empresarial",9,2015
51,"Público tem, Constituição Poder Público, na Constituição Poder Público, na Constituição Poder, tem obrigação constitucional de",1,2015
52,"desrespeito Constituição Federal que, desmoralização da, da chapa, que coordenou, dos Parlamentares em",1,2015
53,"adquirido, terras, se realmente, deu direito de, que antecede",2,2015
54,"da Constituição Federal pela, médio longo, com determinação do, financeiro atuarial, equilíbrio financeiro atuarial",1,2015
55,"aos direitos dos, dos trabalhadores Constituição, Constituição especialmente, trabalhadores Constituição, direitos dos trabalhadores",3,2015
-1,"Presidente, vai, pode, República, da República",316,2016
0,"Constituição de, da Constituição de, Constituição de que, na Constituição de, pela Constituição de",52,2016
1,"do art, da Constituição Federal, art da, art da Constituição, do art da",36,2016
2,"Presidente, República, da República, Presidente da, Sr Presidente",60,2016
3,"Tribunal, Tribunal Federal, Supremo Tribunal, Supremo Tribunal Federal, do Supremo Tribunal",39,2016
4,"crime, de responsabilidade, responsabilidade, crime de, crime de responsabilidade",111,2016
5,"mandato, emenda, de emenda, emenda Constituição, de emenda Constituição",24,2016
6,"brasileira, Constituição brasileira, que não se, de que não se, no Brasil",18,2016
7,"impeachment, de impeachment, melhor do que, nada melhor, que discutir",158,2016
8,"do segundo ano, segundo ano, supersalários, do segundo, Senado Federal",7,2016
9,"Implícito, mas nem, nem por, excessos, denúncia",20,2016
10,"educação, Educação, ele coloca, da Educação, do ensino",12,2016
11,"desigualdades, República Federativa do Brasil, Federativa do Brasil, República Federativa do, República Federativa",10,2016
12,"Casa, esta Casa, um dever, nesta Casa, nesta",11,2016
13,"Fiscal, Responsabilidade Fiscal, Responsabilidade, Lei de Responsabilidade Fiscal, de Responsabilidade Fiscal",25,2016
14,"Implícito, Implícito orador, Implícito orador menciona, orador menciona, Implícito oradora",5,2016
15,"moralidade, publicidade, moralidade publicidade, impessoalidade moralidade, pública",10,2016
16,"Ministro, mínimo, salário mínimo, notório saber, notório saber jurídico",12,2016
17,"Regimento, Regimento Interno, Interno, Interno da, Regimento Interno da",11,2016
18,"Congresso, invadindo, Congresso não, por lei complementar, Congresso Nacional",5,2016
19,"educação, em educação, Municípios, Estados, para os",12,2016
20,"Implícito, que determina Constituição que, Ela tem que, praça pública, prevê isto",5,2016
21,"foi tratado, invade, dos Estados da Federação, competência dos Estados, alterar lei que",1,2016
22,"nunca vi, Eu nunca vi, Eu nunca, de emendas constitucionais, emendas constitucionais",2,2016
23,"Câmara, não deu, dos Deputados, Câmara dos, Câmara dos Deputados",4,2016
24,"família base da, família base da sociedade, família base, base da sociedade, proteção do Estado",1,2016
25,"democrático, Estado de direito, espírito democrático, Estado de, são princípios",5,2016
26,"Congresso Nacional até, aprovar uma lei, das riquezas minerais, de aprovar uma lei, não fomos",1,2016
27,"Ulysses, Ulysses Guimarães, Guimarães, de Ulysses, de Ulysses Guimarães",5,2016
28,"ambiente, meio ambiente, ao meio ambiente, ambiental, na área",4,2016
29,"foi constitucional, expressa previsão, legal constitucional não havendo, legal constitucional não, hora para",4,2016
30,"Judiciário, Poder Judiciário, judicial, do Poder Judiciário, do mérito da",4,2016
32,"provisórias, medidas provisórias, devendo, medidas, de relevância urgência",2,2016
33,"Carta Magna, Magna, nossa Carta Magna, nossa Carta, na Carta Magna",5,2016
34,"crédito, de crédito, abertura de, crédito suplementar, de crédito suplementar",31,2016
35,"independentes, harmônicos, ser independentes, os Poderes, independentes harmônicos",7,2016
36,"democracia, da democracia, de democracia, do respeito aos, ato legislativo",4,2016
39,"defender, para defender, defender Constituição, de defender, brasileiro",8,2016
40,"aprovado no Congresso, que rejeitou, incompreensível, da seletividade, veto",1,2016
41,"Ministério Público, Público, da ordem jurídica, ordem jurídica, defesa da",4,2016
42,"processo legal, devido processo, legal, processo, devido processo legal",6,2016
43,"Está lá no art, seu nome será exercido, seu nome será, em seu nome será, nome será exercido",1,2016
44,"da forma do, um plebiscito para, inclusive no art, no art das Disposições, das Disposições Transitórias da",1,2016
45,"quanto ele, respeitado, essa questão, cassação, ficar",11,2016
46,"autonomia, autonomia administrativa, administrativa, autonomia funcional, que Brasil uma",3,2016
47,"muitos direitos, do Estado, dever do Estado, que saúde, efetividade",4,2016
49,"que visem redução do, serviços para, que visem redução, mediante políticas, visem redução",2,2016
50,"Abro, Federal aprovar, ser responsabilidade, Senado Federal aprovar, nesse aspecto",2,2016
51,"Previdência, social, Social, seguridade, assistência",3,2016
52,"de Paulo, Paulo, Estado de Paulo, objetivo segundo, jornal Estado",1,2016
54,"sistema financeiro, financeiro, em todas as partes, aos interesses da, previstos na Constituição com",2,2016
56,"liberdade de, liberdade, liberdade de expressão, liberdade de imprensa, de informação jornalística",5,2016
-1,"Brasil, Presidente, direitos, porque, art da",246,2017
0,"Constituição de, na Constituição de, da Constituição de, social, trabalhadores",56,2017
1,"iguais perante lei, iguais perante, perante lei, art da Constituição, do art",17,2017
2,"Presidente, de Presidente, vacância do cargo de, cargo de Presidente, do cargo de Presidente",19,2017
3,"Tribunal, Tribunal Federal, Supremo Tribunal, Supremo Tribunal Federal, Supremo",17,2017
4,"crime, crime de, crimes, penal, de responsabilidade",23,2017
5,"emenda, de emenda, de emenda Constituição, emenda Constituição, um projeto",10,2017
6,"brasileira, Brasil, Constituição brasileira, Constituição do Brasil, no Brasil",14,2017
7,"impeachment, de impeachment, Temer, melhor do que, nada melhor",10,2017
8,"vacância ocorrer, ocorrer, vacância ocorrer até, prevê eleições, segundo ano do",10,2017
9,"Implícito, Federal Implícito, aviação, quero ser, que os trabalhadores",17,2017
10,"educação, creche, Educação, que mulher, de idade",11,2017
11,"desigualdades, desigualdades sociais regionais, sociais regionais, desigualdades sociais, reduzir as desigualdades",4,2017
12,"Casa, nesta Casa, nesta, minha primeira, como Senador",10,2017
13,"fiscal, uma política, deste País, as estruturas, pela Constituição de zelar",4,2017
14,"Implícito orador, Implícito, Implícito orador menciona, orador menciona, proibir tributação",2,2017
15,"pública, art da, art da Constituição, segurança pública, Público Geral",3,2017
16,"mínimo, salário mínimo, um salário mínimo, um salário, direito ao salário",10,2017
17,"tempo para, Regimento, reforma, mencionou, essa reforma",4,2017
18,"Congresso, Congresso Nacional, legislação sobre, uma eleição, do Congresso",7,2017
19,"bolo tributário nacional, do bolo tributário nacional, bolo tributário, do bolo tributário, tributário nacional",4,2017
