Topic,Words,Frequency,Timestamp
2,"Presidente, Sr Presidente, Presidente da, Presidente da República, da República",16,2023
3,"Tribunal, Supremo Tribunal, Supremo Tribunal Federal, do Supremo Tribunal, do Supremo Tribunal Federal",21,2023
4,"crime, racismo, responsabilidade, crime de, de responsabilidade",15,2023
5,"de emenda, de emenda Constituição, proposta de emenda, emenda, proposta de emenda Constituição",12,2023
6,"brasileiros, do Brasil, brasileira, Constituição brasileira, Constituição do Brasil",10,2023
7,"impeachment, de impeachment, pelo Presidente do Supremo, pelo Presidente, rasgada aqui",4,2023
8,"itens da Constituição, Constituição Federal que garante, que garante direito, Federal que garante, na Constituição Federal",10,2023
9,"Implícito, não fazem, direito de, nós, os primeiros",19,2023
10,"educação, Educação, educação direito de, educação direito de todos, que educação",12,2023
11,"República Federativa do Brasil, Federativa do Brasil, Federativa do, República Federativa do, República Federativa",6,2023
12,"Casa, esta Casa, nesta Casa, nesta, Casas",17,2023
13,"Fiscal, fiscalizar, Responsabilidade, Responsabilidade Fiscal, Lei de Responsabilidade Fiscal",4,2023
14,"Implícito orador, Implícito, Implícito orador menciona, orador menciona, menciona importância",4,2023
15,"pública, segurança pública, publicidade, art da, no art",9,2023
16,"Ministro, mau exemplo, porque lá, que precisamos, requisitos",4,2023
17,"Regimento, regimental, também por, uma questão de ordem, cadeira",8,2023
18,"Congresso Nacional, Congresso em, do Congresso, gravosos ao patrimônio, atos internacionais que",5,2023
19,"do fundo, fundo, fundo em, constituição do, se você",1,2023
20,"brasileira, Implícito, pessoas que, veio, Constituição brasileira",6,2023
21,"através de uma medida, forma com que, que se trabalha, obtenção de, princípio constitucional da anterioridade",1,2023
22,"provisórias, medidas provisórias, fusão de, de medidas provisórias, as medidas provisórias",4,2023
23,"Câmara, Deputados, dos Deputados, Câmara dos, Câmara dos Deputados",3,2023
24,"prioridade, família, adolescente, família da, da família da",6,2023
25,"ordem jurídica democrática, protetor, democrático de direito tão, da República poder, funcionamento da democracia",2,2023
26,"terra, terras, terras indígenas, da terra, de terras",8,2023
27,"Ulysses, Ulysses Guimarães, Guimarães, de Ulysses Guimarães, de Ulysses",2,2023
28,"ambiente, meio ambiente, ao meio ambiente, ao meio, impacto ambiental",3,2023
29,"somos três, Assim diz, quando fala em, nenhum porque, existe exatamente para",3,2023
30,"que existem na, Constituição claramente, contendas, dificuldades as, as dificuldades as",1,2023
31,"tributária, tributário, reforma tributária, sistema tributário, reforma",5,2023
32,"Constituição de este, PDL que, instituto da medida, desde advento, instituto da medida provisória",2,2023
33,"Carta Magna, Magna, Carta, nossa Carta Magna, nossa Carta",5,2023
34,"de destino, Unidade, do inciso IV do, do inciso IV, de transferência de",1,2023
35,"Poderes, harmônicos, independentes, si, harmônicos entre si",13,2023
37,"estão indo para, casa em, por dias, pessoas estão, para casa",1,2023
38,"cláusula pétrea, como cláusula pétrea, que direito vida, entre os direitos garantias, como cláusula",3,2023
39,"se lembre, Constituição para defender, dia fez, juiz se, de que um dia",1,2023
40,"Nacional conforme, do Congresso Nacional conforme, umas, mais importantes do, Congresso Nacional conforme",1,2023
42,"processo legal, devido processo, devido processo legal, devido, legal",4,2023
43,"poder emana do povo, poder emana do, emana do, emana do povo, poder emana",2,2023
48,"terras, originários, tradicionalmente, direitos originários, originários sobre",6,2023
49,"sangue, isso está no, coleta de, que Constituição em seu, Ressalte se que",2,2023
52,"de expressão de imprensa, asseguradas que, que diz Associação, expressão de imprensa, do Estado de São",1,2023
53,"terras, temporal, terras indígenas, de terras indígenas, da promulgação",12,2023
55,"trabalho, especialmente ao, que livre exercício de, que livre exercício, de todo brasileiro",1,2023
56,"liberdade de, direito liberdade de, liberdade, direito liberdade, liberdade de expressão",2,2023
-1,"art da, art da Constituição, Presidente, todos, da Constituição Federal",211,2024
0,"Constituição de, da Constituição de, Constituição Federal de, Assembleia, Constituinte",23,2024
1,"do art, art da, art da Constituição, da Constituição Federal, do art da",49,2024
2,"Presidente, Sr Presidente, harmonia entre os Poderes, República, harmonia entre os",14,2024
3,"Tribunal, Tribunal Federal, Supremo Tribunal, Supremo Tribunal Federal, Supremo",15,2024
4,"crime, crimes, penal, crime de, de responsabilidade",19,2024
5,"emenda, de emenda, de emenda Constituição, proposta de emenda, proposta de emenda Constituição",12,2024
6,"Brasil, brasileiros, brasileiro, brasileira, Constituição brasileira",17,2024
7,"nada melhor, que discutir, melhor do que, melhor, do que",16,2024
8,"administração da justiça, administração, na Constituição Federal, no exercício da, administração da",7,2024
9,"Implícito, Constituição Implícito, país Implícito, nossa Constituição Implícito, do que nossa",16,2024
10,"educação, Educação, educacional, Fundeb para, educação básica",9,2024
11,"desigualdades, Federativa do Brasil, República Federativa do Brasil, República Federativa do, República Federativa",7,2024
12,"Casa, esta Casa, porta, que esta Casa, que esta",8,2024
13,"fiscal, pelo descumprimento, das metas, Fiscal, fiscalizar",7,2024
14,"Implícito orador, Implícito, menciona, Implícito orador menciona, Constituição Implícito",3,2024
15,"pública, administração pública, moralidade, publicidade, administração",12,2024
16,"mínimo, salário mínimo, salário, do Ministro, Ministros",18,2024
17,"Regimento, urgência, regimental, ao Presidente, caminho",7,2024
18,"Congresso, três emendas constitucionais, de ciência tecnologia, de ciência, ciência tecnologia",4,2024
19,"de crescimento das, indexador, de crescimento das emendas, crescimento das emendas, de crescimento",1,2024
20,"Brasil, que nos, brasileira, do Brasil, Constituição brasileira",13,2024
22,"direitos fundamentais garantidos pela, formulado, enfatizar, constitucionalidade de, direitos fundamentais garantidos",1,2024
24,"princípio constitucional, adolescente, da família da, família da, da sociedade do Estado",2,2024
25,"democrático, respeitada, pleno respeito, sagrados direitos, que censura",2,2024
26,"terras, Constituição Federal assegura, exerça seu, indígenas por, os critérios para",2,2024
27,"Cidadã de Ulysses Guimarães, Cidadã de Ulysses, Constituição Cidadã de Ulysses, Constituinte da, da Constituição Cidadã de",1,2024
28,"ambiente, meio ambiente, ambiental, coletividade, impacto ambiental",3,2024
29,"princípio da Constituição, verde, para futuro, que gente precisa, Constituição que se chama",3,2024
30,"nada mais, isso nada, mais do que isso, Só isso, do que isso",1,2024
31,"tributária, reforma tributária, trava, constitucional da, reforma",5,2024
32,"Congresso Nacional, Congresso, da Constituição Federal, medida, medidas provisórias",3,2024
33,"que deveria estar, Constituição Quem, não está cumprindo, estar defendendo, Quem não",1,2024
34,"crédito, de crédito, de interesse da União, externas de, interesse da União",6,2024
35,"são harmônicos entre si, são harmônicos entre, harmônicos, são harmônicos, harmônicos entre",3,2024
36,"democracia, respeitem, democracia mas, nossa democracia, respeito",5,2024
37,"Constituição para poder, para poder, que ele usa, deste Brasil, Brasil nós temos",1,2024
38,"cláusula pétrea, cláusula, como cláusula pétrea, como cláusula, pétreas",6,2024
39,"defender, juramos defender, nacionais foram, de fato para, que funcionar de",3,2024
42,"legal, processo legal, devido processo, devido processo legal, ao devido processo legal",7,2024
43,"Não isso, vai dizer, Mas quando, povo, do povo Mas",1,2024
44,"para cobrar, das disposições, das disposições transitórias, cobrar do, disposições transitórias",1,2024
45,"abusando, quanto ele, respeitado, uma criança, de uma criança",1,2024
46,"autonomia, Estado para defender, orgânica, seu plano, de concedeu",2,2024
47,"sejam eles, em qualquer, sejam, civis sejam, às leis do",1,2024
48,"terras, originários, os arts da Constituição, originários sobre, direitos originários",3,2024
50,"empresas, como primeira, concorrência que, exige participação, que envolve",3,2024
51,"garantido na Constituição Federal, gratuito universal, atendimento público, constitucional de todo, fundamental no",2,2024
52,"fundamentação, de quebra, não veio, canal, direcionada",1,2024
53,"marco temporal, terras, para demarcação, terras indígenas no Brasil, de que estabeleceu",1,2024
54,"agência de, uma agência, nós não podemos ter, tenha condições, ter iniciativa",1,2024
55,"trabalhadores do, do mundo do, fundamental constitucional, constitucional de garantir, de garantir os",1,2024
56,"liberdade de, liberdade, liberdade de expressão, de expressão, liberdade de imprensa",7,2024
-1,"STF, monocrática, voto, suas opiniões, opiniões palavras votos",27,2025
0,"Constituição de, Presidente Sarney, iniciativa do, redemocratização, os direitos",8,2025
1,"art da Constituição Federal, art da Constituição, da Constituição Federal, art da, no art da Constituição",4,2025
2,"Muito obrigada, obrigada, Presidente, Sr Presidente, República",1,2025
3,"os outros Poderes, Constituição que confere, que os outros, já chegou, aqui ao",1,2025
5,"por parte do Executivo, nos garante direito, de corrigir, nos garante direito de, parte do Executivo",2,2025
6,"todos como estabelece, direito igualdade liberdade, todos como estabelece nossa, Constituição direito igualdade liberdade, como estabelece nossa Constituição",1,2025
7,"No dia, Magno Malta do, Senador Caiado, fatia, Malta do Senador",1,2025
8,"travestido, de respeito aos, de respeito, respeito aos, na Constituição Federal",1,2025
9,"Implícito, todas as regiões, Implícito Eu, pagar não, Comissão de Constituição",3,2025
10,"de colaboração, ao regime de, ação da, regime de colaboração, maior relevância para",1,2025
11,"no financiamento da educação, no financiamento, no financiamento da, exatamente isto, organizar segurança",1,2025
12,"Casa, Federal projeto de, uma Casa Legislativa, Constituição Federal projeto, da Constituição Federal projeto",1,2025
14,"Implícito orador, menciona, Implícito, critica, Implícito orador menciona",2,2025
17,"mensagem do, do Governo de, de Exa, Governo de, nação",1,2025
18,"nós Congresso, porque de fato não, de fato não, fato não, extrapolação do",1,2025
22,"sobre as medidas provisórias, sobre as medidas, Constituição sobre, as medidas provisórias, as medidas",1,2025
25,"sabia, Constituinte livre soberana, Constituinte livre, livre soberana, uma transformação",1,2025
32,"insere no âmbito, se insere no âmbito, se insere no, das atribuições do Congresso, matéria se",1,2025
33,"mulheres, ainda enfrenta, proibir discriminação, proibir discriminação de, Não obstante",1,2025
35,"Constituição nunca, delicado, harmônica entre, entre Legislativo Executivo Judiciário, entre Legislativo Executivo",1,2025
39,"acesso esse, para se defender, sobre determinados assuntos, sobre determinados, determinados assuntos",1,2025
43,"emana, do povo, constitucional todo, povo, está lá no",1,2025
