Topic,Count,Name,Representation,Aspect1,Representative_Docs
-1,33923,-1_FISCAL_ALTERAÇÃO LEI_LEI COMPLEMENTAR_DISTRITO FEDERAL,"['FISCAL', 'ALTERAÇÃO LEI', 'LEI COMPLEMENTAR', 'DISTRITO FEDERAL', 'CRITERIOS', 'REGIME', 'PETROLEO', 'ALTERAÇÃO LEI FEDERAL', 'FEDERAL DF', 'DISTRITO FEDERAL DF', 'BRASILEIRO', 'UNIÃO FEDERAL', 'ESPECIFICAÇÃO', 'ORIENTAÇÃO BANCADA', 'PRODUÇÃO', 'PROJETO DE LEI ALTERAÇÃO', 'PROVISORIA MPV', 'MEDIDA PROVISORIA MPV', 'TRANSPORTE', 'FINANCIAMENTO']","['ORIENTAÇÃO', 'PRODUÇÃO', 'TRANSPORTE', 'MEIO', 'PESQUISA', 'EXPLORAÇÃO', 'FALTA', 'ELETRICA', 'EFEITO', 'PENAL', 'OBRAS', 'TRANSCRIÇÃO', 'VINCULAÇÃO', 'ANAIS', 'DIFICULDADE', 'FORMAÇÃO', 'RECONHECIMENTO', 'EXECUÇÃO', 'SERVIÇOS', 'POSSE', 'RODOVIA', 'NUMERO', 'DEMONSTRAÇÃO', 'CONTRATAÇÃO', 'COMPENSAÇÃO', 'PODER', 'CONGRATULAÇÕES', 'DISCRIMINAÇÃO', 'DESIGUALDADE', 'JUROS']","['ORIENTAÇÃO, BANCADA, DESTAQUE, VOTAÇÃO EM SEPARADO, PROJETO DE LEI, ALTERAÇÃO, LEI FEDERAL, NORMAS, SANÇÃO, IMPROBIDADE ADMINISTRATIVA, UNIÃO FEDERAL, ESTADOS, DISTRITO FEDERAL (DF), MUNICIPIOS, DISPOSIÇÕES GERAIS, DEFINIÇÃO, AGENTE PUBLICO, AMBITO, APLICAÇÃO, ATO ADMINISTRATIVO, ENRIQUECIMENTO ILICITO, PREJUIZO, FAZENDA NACIONAL, PATRIMONIO PUBLICO, VIOLAÇÃO, PRINCIPIO JURIDICO, ADMINISTRAÇÃO PUBLICA, PENA, DECLARAÇÃO DE BENS, PROCEDIMENTO ADMINISTRATIVO, PROCESSO JUDICIAL, DISPOSITIVOS, DIREITO PENAL, CRIME, PRESCRIÇÃO.', 'ORIENTAÇÃO, BANCADA, DESTAQUE, VOTAÇÃO EM SEPARADO, PROJETO DE LEI COMPLEMENTAR (PLP), REGULAMENTAÇÃO, DISPOSITIVOS, CONSTITUIÇÃO FEDERAL, REFORMA TRIBUTARIA, CRIAÇÃO, Imposto sobre Bens e Serviços (IBS), Contribuição Social sobre Bens e Serviços (CBS), NORMAS GERAIS, INCIDENCIA, FATO GERADOR, IMUNIDADE TRIBUTARIA, BASE DE CALCULO, ALIQUOTA, DEFINIÇÃO, CONTRIBUINTE, PAGAMENTO, ADMINISTRAÇÃO, COMITE GESTOR, CADASTRO, IDENTIFICAÇÃO, PESSOA FISICA, PESSOA JURIDICA, PERIODO, APURAÇÃO, RECOLHIMENTO, IMPORTAÇÃO, EXPORTAÇÃO, REGIME ADUANEIRO, ZONA DE PROCESSAMENTO DE EXPORTAÇÃO (ZPE), REGIME, BENS DE CAPITAL, HIPOTESE, DEVOLUÇÃO, FAMILIA, BAIXA RENDA, ISENÇÃO, CESTA DE ALIMENTOS BASICOS, LISTA FECHADA, SERVIÇO, REDUÇÃO, IMPOSTOS, SAUDE, EDUCAÇÃO, TRANSPORTE COLETIVO, COMBUSTIVEL, AUTOMOVEL, PRODUTO DE HIGIENE, EQUIPAMENTOS, PESSOA COM DEFICIENCIA, ARRENDAMENTO MERCANTIL, CONSORCIO, FUNDO DE INVESTIMENTO, FUNDOS PUBLICOS, PLANO DE SAUDE, CONCURSO DE PROGNOSTICO, BENS IMOVEIS, COOPERATIVA, BAR, RESTAURANTE, HOTEL, AGENCIA DE TURISMO, TRATADO, ATO INTERNACIONAL, PROGRAMA UNIVERSIDADE PARA TODOS (PROUNI), VEICULOS, MOTOR, ENERGIA ELETRICA, REGULAMENTO, FISCALIZAÇÃO, DOMICILIO TRIBUTARIO, PLANEJAMENTO, ALTERAÇÃO, DISPOSIÇÕES GERAIS, Imposto Seletivo (IS), ZONA FRANCA, AREA DE LIVRE COMERCIO, RESSARCIMENTO, TURISTA, DISPOSIÇÕES TRANSITORIAS, LEGISLAÇÃO TRIBUTARIA, CORRELAÇÃO.', 'ORIENTAÇÃO, BANCADA, DESTAQUE, VOTAÇÃO EM SEPARADO, PROJETO DE LEI COMPLEMENTAR (PLP), ALTERAÇÃO, LEI KANDIR, ISENÇÃO FISCAL, IMPOSTO SOBRE CIRCULAÇÃO DE MERCADORIAS E SERVIÇOS (ICMS), TRANSMISSÃO, DISTRIBUIÇÃO, ENERGIA ELETRICA, ENCARGO, VINCULAÇÃO, OPERAÇÃO, LEI COMPLEMENTAR, BASE DE CALCULO, SUBSTITUIÇÃO, TRIBUTOS, OLEO DIESEL, CODIGO TRIBUTARIO NACIONAL, DEFINIÇÃO, BENS, SERVIÇO, ATIVIDADE ESSENCIAL, COMBUSTIVEL, GAS NATURAL, COMUNICAÇÕES, TRANSPORTE COLETIVO, OBJETIVO, INCIDENCIA, CRITERIOS, FIXAÇÃO, ALIQUOTA, PROIBIÇÃO, EQUIPARAÇÃO, PRODUTO SUPERFLUO, RESSALVA, DISPOSITIVOS, LEI FEDERAL, ADEQUAÇÃO ORÇAMENTARIA E FINANCEIRA, LEGISLAÇÃO, DEDUÇÃO, UNIÃO FEDERAL, VALOR, PARCELA, DIVIDA PUBLICA, ESTADOS, DISTRITO FEDERAL (DF), PERDA, ARRECADAÇÃO, CORRELAÇÃO, REDUÇÃO, TRANSFERENCIA, QUOTAS, MUNICIPIOS, LEI DE RESPONSABILIDADE FISCAL, RENUNCIA, RECEITA, OPERAÇÃO FINANCEIRA, ENTE FEDERADO, COMPOSIÇÃO, CONSELHO DE SUPERVISÃO, REGIME DE RECUPERAÇÃO FISCAL.']"
0,2294,0_TRIBUNAL FEDERAL_SUPREMO TRIBUNAL FEDERAL STF_SUPREMO TRIBUNAL FEDERAL_SUPREMO TRIBUNAL,"['TRIBUNAL FEDERAL', 'SUPREMO TRIBUNAL FEDERAL STF', 'SUPREMO TRIBUNAL FEDERAL', 'SUPREMO TRIBUNAL', 'FEDERAL STF', 'TRIBUNAL FEDERAL STF', 'MINISTRO SUPREMO TRIBUNAL', 'MINISTRO SUPREMO', 'MINISTRO SUPREMO TRIBUNAL FEDERAL', 'JUDICIAL', 'ALEXANDRE DE MORAES', 'DECISÃO JUDICIAL', 'TRIBUNAL SUPERIOR', 'JUDICIARIO', 'TRIBUNAL SUPERIOR ELEITORAL TSE', 'TRIBUNAL SUPERIOR ELEITORAL', 'SUPERIOR ELEITORAL', 'SUPERIOR ELEITORAL TSE', 'IMPEACHMENT', 'DECISÃO SUPREMO TRIBUNAL']","['JULGAMENTO', 'AÇÃO', 'LAVA', 'OPERAÇÃO', 'TRANSCRIÇÃO', 'ANAIS', 'ACUSAÇÃO', 'RESPEITO', 'EFEITO', 'CONTESTAÇÃO', 'PISO', 'FINANCEIROS', 'PESQUISA', 'PROXIMIDADE', 'PORTARIA', 'JURISDIÇÃO', 'DOENÇA', 'SALARIAL', 'DIVERSIDADE', 'DIFICULDADE', 'DIRETORIA', 'REPUTAÇÃO', 'GADO', 'PARTE', 'MODERNIZAÇÃO', 'OBRAS', 'CIENCIA', 'CONSOLIDAÇÃO', 'BIOTECNOLOGIA', 'REGIONALIZAÇÃO']","['CRITICA, INTERFERENCIA, SUPREMO TRIBUNAL FEDERAL (STF), JURISDIÇÃO, LEGISLATIVO, ASSUNTO, ABORTO, PORTE DE DROGAS, UTILIZAÇÃO, DROGA, DEMARCAÇÃO, TERRAS INDIGENAS, LIBERDADE DE EXPRESSÃO.\nCRITICA, ATUAÇÃO, ALEXANDRE DE MORAES, MINISTRO, SUPREMO TRIBUNAL FEDERAL (STF), DECISÃO MONOCRATICA, VIOLAÇÃO, IMUNIDADE PARLAMENTAR, CENSURA, LIBERDADE DE EXPRESSÃO.\nCOMENTARIO, PERSEGUIÇÃO, NATUREZA POLITICA, AUTORIA, ALEXANDRE DE MORAES, MINISTRO, SUPREMO TRIBUNAL FEDERAL (STF), OPOSIÇÃO, ATUAÇÃO PARLAMENTAR, ORADOR, RETENÇÃO, COMPUTADOR, PROPRIEDADE, MARCOS DO VAL, SENADOR.', 'DENUNCIA, ATIVIDADE POLITICA, MINISTRO, SUPREMO TRIBUNAL FEDERAL (STF), TRIBUNAL SUPERIOR ELEITORAL (TSE), PREOCUPAÇÃO, PERSEGUIÇÃO, SETOR, TRADIÇÃO, SOCIEDADE, SITE, INTERNET, REMUNERAÇÃO.\nDEFESA, INCLUSÃO, PAUTA, SENADO, PEDIDO, IMPEACHMENT, MINISTRO, SUPREMO TRIBUNAL FEDERAL (STF).', 'CRITICA, ALEXANDRE DE MORAES, MINISTRO, SUPREMO TRIBUNAL FEDERAL (STF), DECISÃO, SUSPENSÃO, NOMEAÇÃO, DIRETOR GERAL, POLICIA FEDERAL.\nCOMENTARIO, AVALIAÇÃO, POPULAÇÃO, ATUAÇÃO, SUPREMO TRIBUNAL FEDERAL (STF), DEFESA, CRIAÇÃO, COMISSÃO PARLAMENTAR DE INQUERITO (CPI), LAVA-TOGA, PROCESSO, IMPEACHMENT, MINISTRO, SUPREMO TRIBUNAL FEDERAL (STF).\n']"
1,1794,1_SÃO PAULO_DE SÃO PAULO_DE SÃO_PAULO SP,"['SÃO PAULO', 'DE SÃO PAULO', 'DE SÃO', 'PAULO SP', 'SÃO PAULO SP', 'ESTADO DE SÃO PAULO', 'ESTADO DE SÃO', 'DE SÃO PAULO SP', 'ESPECIFICAÇÃO', 'CANDIDATO', 'JANEIRO', 'DE JANEIRO RJ', 'RIO DE JANEIRO RJ', 'JANEIRO RJ', 'DE JANEIRO', 'RIO DE JANEIRO', 'RIO DE', 'DO RIO DE', 'DO RIO DE JANEIRO', 'ESTADO DO RIO DE']","['FALTA', 'GRAVIDADE', 'TENTATIVA', 'COMPARAÇÃO', 'COMPROMISSO', 'DROGA', 'DIVERSIDADE', 'CAPITAL', 'DIFICULDADE', 'DEMONSTRAÇÃO', 'CONTINUAÇÃO', 'CONFIANÇA', 'PESQUISA', 'PODER', 'PUNIÇÃO', 'RECONHECIMENTO', 'RELEVANCIA', 'GLOBO', 'PODERES', 'VINCULAÇÃO', 'PROXIMIDADE', 'ENTREVISTA', 'CONSTITUCIONAIS', 'FORMAÇÃO', 'SOCIAIS', 'PENAL', 'PARALISAÇÃO', 'ERRO', 'ERRADICAÇÃO', 'CONSOLIDAÇÃO']","['APOIO, ANALISE, FRANCISCO DORNELLES, SENADOR, INDICIO, INCONSTITUCIONALIDADE, PROPOSTA, APROVAÇÃO, CAMARA DOS DEPUTADOS, DEFESA, ENTENDIMENTO, SENADO, PREVENÇÃO, DIFICULDADE, ESTADO DO RIO DE JANEIRO (RJ), ESTADO DO ESPIRITO SANTO (ES).\nQUESTIONAMENTO, CONDUTA, PRESIDENTE DA REPUBLICA, APOIO, AUTORITARISMO, PRESIDENTE DE REPUBLICA ESTRANGEIRA, SEMELHANÇA, DITADURA, PAIS ESTRANGEIRO, VENEZUELA, CUBA, IRÃ, ILEGALIDADE, ANTECIPAÇÃO, CAMPANHA ELEITORAL, IMPUNIDADE, MANIPULAÇÃO, ESTADO, FAVORECIMENTO, CANDIDATO, SUCESSÃO, OMISSÃO, JUSTIÇA ELEITORAL, PREJUIZO, DEMOCRACIA.\nCOMENTARIO, NOTICIARIO, PERIODICO, VEJA, ESTADO DE SÃO PAULO (SP), DENUNCIA, CONTINUAÇÃO, SISTEMA, CORRUPÇÃO, PARTIDO POLITICO, PARTIDO DOS TRABALHADORES (PT), PROPINA, FAVORECIMENTO, CAMPANHA ELEITORAL.\nPROTESTO, GOVERNO, MANIPULAÇÃO, OPINIÃO PUBLICA, INEXATIDÃO, DADOS, ANDAMENTO, OBRAS, PROGRAMA, ACELERAÇÃO, CRESCIMENTO ECONOMICO, ESPECIFICAÇÃO, ABANDONO, ESTADO DO AMAPA (AP), INCOMPETENCIA, GESTÃO, AREA, SANEAMENTO BASICO, LEITURA, TRECHO, ARTIGO DE IMPRENSA, JORNAL, FOLHA DE S.PAULO, ESTADO DE SÃO PAULO (SP), CORREIO BRAZILIENSE, DISTRITO FEDERAL (DF), DENUNCIA, ATRASO, MAIORIA, OBRA PUBLICA, FALTA, PRIORIDADE, REGIÃO SUBDESENVOLVIDA, ERRO, PLANEJAMENTO, OMISSÃO, TREINAMENTO, QUALIFICAÇÃO, GESTOR, ESTADOS.\nAPRESENTAÇÃO, DADOS, INFERIORIDADE, EXECUÇÃO, LIBERAÇÃO, RECURSOS, OBRAS, ESTADO DO AMAPA (AP).\n.', 'COMENTARIO, PROCESSO, ESCOLHA, CANDIDATO, PARTIDO POLITICO, PARTIDO DOS TRABALHADORES (PT), PARTIDO DA SOCIAL DEMOCRACIA BRASILEIRA (PSDB), ELEIÇÃO, PREFEITO, ESTADO DE SÃO PAULO (SP).\nCOMENTARIO, APRESENTAÇÃO, ORADOR, PROJETO DE LEI, LOCAL, COMISSÃO DE CONSTITUIÇÃO JUSTIÇA E CIDADANIA, REFERENCIA, INSTITUCIONALIZAÇÃO, REALIZAÇÃO, ELEIÇÃO, PARTIDO POLITICO, ESCOLHA, CANDIDATO.\nLEITURA, ARTIGO DE IMPRENSA, PUBLICAÇÃO, JORNAL, FOLHA DE S.PAULO, ESTADO DE SÃO PAULO (SP), ASSUNTO, CORRUPÇÃO, EPOCA, GESTÃO, LUIZ INACIO LULA DA SILVA, EX PRESIDENTE DA REPUBLICA.\nSOLICITAÇÃO, TRANSCRIÇÃO, ANAIS DO SENADO, ARTIGO DE IMPRENSA, IMAGEM VISUAL, PUBLICAÇÃO, JORNAL, FOLHA DE S.PAULO, ESTADO DE SÃO PAULO (SP), ASSUNTO, ADMINISTRAÇÃO MUNICIPAL, ELEIÇÕES.', 'QUESTIONAMENTO, APOIO, PRESIDENTE DA REPUBLICA, CANDIDATO, SEGUNDO TURNO, PARTIDO POLITICO, PARTIDO DO MOVIMENTO DEMOCRATICO BRASILEIRO (PMDB), CAPITAL DE ESTADO, ESTADO DO RIO DE JANEIRO (RJ).\nREGISTRO, APOIO, PRESIDENTE DA REPUBLICA, CANDIDATO, PARTIDO POLITICO, PARTIDO DOS TRABALHADORES (PT), SEGUNDO TURNO, MUNICIPIO, SÃO PAULO (SP), ESTADO DE SÃO PAULO (SP).\nQUESTIONAMENTO, SOLICITAÇÃO, PRESIDENTE DA REPUBLICA, PROVIDENCIA, GOVERNADOR, ESTADO DE SÃO PAULO (SP), DECLARAÇÃO, PARTICIPAÇÃO, MEMBROS, PARTIDO POLITICO, PARTIDO DOS TRABALHADORES (PT), CONFLITO, CAPITAL DE ESTADO.\nCRITICA, DECLARAÇÃO, MARTA SUPLICY, CANDIDATO, PARTIDO POLITICO, PARTIDO DOS TRABALHADORES (PT), SEGUNDO TURNO, ELEIÇÕES, MUNICIPIO, SÃO PAULO (SP), ESTADO DE SÃO PAULO (SP), DISCRIMINAÇÃO, POPULAÇÃO, REGIÃO NORDESTE, ESPECIFICAÇÃO, PERIODO, ATUAÇÃO, MINISTRO DE ESTADO, MINISTERIO DO TURISMO, AMPLIAÇÃO, EXCESSO, TAXAS, GESTÃO, PREFEITO, CAPITAL DE ESTADO.\nELOGIO, ATUAÇÃO, DEBATE, EMISSORA, TELEVISÃO, CANDIDATO, PARTIDO POLITICO, DEMOCRATAS (DEM), SEGUNDO TURNO, ELEIÇÕES, MUNICIPIO, SÃO PAULO (SP), ESTADO DE SÃO PAULO (SP), COMENTARIO, EVOLUÇÃO, ADMINISTRAÇÃO, EXPECTATIVA, VITORIA, REELEIÇÃO.\nDEFESA, CANDIDATO, PARTIDO POLITICO, PARTIDO VERDE (PV), SEGUNDO TURNO, ELEIÇÕES, MUNICIPIO, RIO DE JANEIRO (RJ), ESTADO DO RIO DE JANEIRO (RJ), CRITICA, CAMPANHA ELEITORAL, REELEIÇÃO, REPRESENTAÇÃO PARTIDARIA, PARTIDO DO MOVIMENTO DEMOCRATICO BRASILEIRO (PMDB), TENTATIVA, CONTESTAÇÃO, VIDA, CANDIDATURA, OPOSIÇÃO.\nCOMENTARIO, DIFICULDADE, CANDIDATO, PARTIDO POLITICO, PARTIDO DO MOVIMENTO DEMOCRATICO BRASILEIRO (PMDB), PREFEITURA MUNICIPAL, CAPITAL DE ESTADO, ESTADO DE MINAS GERAIS (MG), QUESTIONAMENTO, WELLINGTON SALGADO DE OLIVEIRA, SENADOR, CAMPANHA ELEITORAL.']"
2,1520,2_CORONAVIRUS COVID_COVID_NOVO CORONAVIRUS COVID_CORONAVIRUS,"['CORONAVIRUS COVID', 'COVID', 'NOVO CORONAVIRUS COVID', 'CORONAVIRUS', 'NOVO CORONAVIRUS', 'PANDEMIA NOVO CORONAVIRUS', 'PANDEMIA NOVO CORONAVIRUS COVID', 'VACINA', 'NOVO CORONAVIRUS COVID COMENTARIO', 'COVID COMENTARIO', 'CORONAVIRUS COVID COMENTARIO', 'COVID PANDEMIA', 'CORONAVIRUS COVID PANDEMIA', 'NOVO CORONAVIRUS COVID PANDEMIA', 'EPIDEMIA NOVO CORONAVIRUS', 'EPIDEMIA NOVO CORONAVIRUS COVID', 'PANDEMIA EPIDEMIA NOVO', 'PANDEMIA EPIDEMIA NOVO CORONAVIRUS', 'COMBATE PANDEMIA NOVO CORONAVIRUS', 'COMBATE PANDEMIA NOVO']","['CORRELAÇÃO', 'FINANCEIROS', 'DOENÇA', 'DISPENSA', 'EFEITO', 'RECONHECIMENTO', 'ESSENCIAL', 'OPERAÇÃO', 'MEDICO', 'CIENCIA', 'CONTAMINAÇÃO', 'PESQUISA', 'FABRICAÇÃO', 'DESIGUALDADE', 'MEDICINA', 'OFERTA', 'CENTRAL', 'RISCO', 'EQUIPAMENTOS', 'CONDIÇÕES', 'PERIGO', 'ATESTADO', 'CELULAR', 'LAVA', 'CONCENTRAÇÃO', 'ATESTADO MEDICO', 'CENSURA', 'ENTRADA', 'CIVILIZAÇÃO', 'ESPIRITISMO']","['EXPOSIÇÃO, TRABALHO, COMISSÃO TEMPORARIA, ACOMPANHAMENTO, PANDEMIA, NOVO CORONAVIRUS (COVID-19).\nCOMENTARIO, DISCUSSÃO, INTERRUPÇÃO, CAMPANHA, VACINAÇÃO, COMBATE, NOVO CORONAVIRUS (COVID-19), ADOLESCENTE, EXPECTATIVA, ALCANCE, IMUNIZAÇÃO, POPULAÇÃO.', 'COMENTARIO, RETOMADA, ATIVIDADE, PANDEMIA, NOVO CORONAVIRUS (COVID-19), RELACIONAMENTO, PESSOAS.\n', 'COMENTARIO, POSIÇÃO, BRASIL, NUMERO, MORTE, PANDEMIA, NOVO CORONAVIRUS (COVID-19).\nCOMENTARIO, EFICACIA, VACINA, NOVO CORONAVIRUS (COVID-19), ESTUDO, DIVULGAÇÃO, INSTITUTO OSWALDO CRUZ.\nPREOCUPAÇÃO, VARIANTE, NOVO CORONAVIRUS (COVID-19).']"
3,1175,3_LULA DA SILVA_LUIZ INACIO_LUIZ INACIO LULA DA_LUIZ INACIO LULA,"['LULA DA SILVA', 'LUIZ INACIO', 'LUIZ INACIO LULA DA', 'LUIZ INACIO LULA', 'INACIO LULA', 'INACIO LULA DA', 'INACIO LULA DA SILVA', 'LULA DA', 'CRITICA GOVERNO', 'DA SILVA', 'LUIZ', 'CRITICA GOVERNO FEDERAL', 'EX PRESIDENTE DA REPUBLICA', 'EX PRESIDENTE DA', 'ROUSSEFF PRESIDENTE', 'DILMA ROUSSEFF PRESIDENTE', 'ROUSSEFF PRESIDENTE DA REPUBLICA', 'ROUSSEFF PRESIDENTE DA', 'DILMA ROUSSEFF PRESIDENTE DA', 'TEMER PRESIDENTE DA']","['FALTA', 'CANDIDATURA', 'TENTATIVA', 'NOMEAÇÃO', 'JUROS', 'TRANSPORTE', 'OBRAS', 'CONCLUSÃO', 'MANIPULAÇÃO', 'ERRO', 'CONSOLIDAÇÃO', 'RECONHECIMENTO', 'NOME', 'ARTICULAÇÃO', 'DIVERSIDADE', 'RELEVANCIA', 'OBTENÇÃO', 'DIFICULDADE', 'CREDITOS', 'FUNÇÃO', 'EFETIVAÇÃO', 'BLOCO', 'ANAIS', 'EXPERIENCIA', 'TRANSCRIÇÃO', 'VELOCIDADE', 'DIGNIDADE', 'URBANO', 'TOTAL', '']","['COMENTARIO, DEFESA, GOVERNO FEDERAL, MICHEL TEMER, PRESIDENTE DA REPUBLICA, CRITICA, GESTÃO, GOVERNO, LUIZ INACIO LULA DA SILVA, DILMA ROUSSEFF, EX PRESIDENTE DA REPUBLICA, DISCURSO, OPOSIÇÃO, ASSUNTO, POPULARIDADE, ILEGITIMIDADE, PRESIDENTE.', 'CRITICA, POLICIA FEDERAL, DIVULGAÇÃO, DIALOGO, CARATER PRIVADO, DILMA ROUSSEFF, PRESIDENTE DA REPUBLICA, LUIZ INACIO LULA DA SILVA, EX PRESIDENTE DA REPUBLICA, NECESSIDADE, INVESTIGAÇÃO.', 'CRITICA, POLICIA FEDERAL, DIVULGAÇÃO, DIALOGO, CARATER PRIVADO, DILMA ROUSSEFF, PRESIDENTE DA REPUBLICA, LUIZ INACIO LULA DA SILVA, EX PRESIDENTE DA REPUBLICA, VIOLAÇÃO, LEI DE SEGURANÇA NACIONAL.']"
4,1148,4_AMAZONAS_DO AMAZONAS_AMAZONAS AM_DO AMAZONAS AM,"['AMAZONAS', 'DO AMAZONAS', 'AMAZONAS AM', 'DO AMAZONAS AM', 'ESTADO DO AMAZONAS AM', 'ESTADO DO AMAZONAS', 'AMAZONICA', 'AM ESTADO', 'AM ESTADO DO', 'AM ESTADO DO AMAZONAS', 'REGIÃO AMAZONICA', 'MANAUS AM ESTADO DO', 'MANAUS AM ESTADO', 'MUNICIPIO MANAUS AM', 'MUNICIPIO MANAUS AM ESTADO', 'FLORESTA AMAZONICA', 'MEIO AMBIENTE', 'AM ELOGIO', 'AMAZONAS AM ELOGIO', 'DO AMAZONAS AM ELOGIO']","['ZONA', 'MEIO', 'AMAZONIA', 'PRODUÇÃO', 'RODOVIA', 'FALTA', 'UNIVERSIDADE', 'NATURAIS', 'ENTIDADE', 'ARMADAS', 'DESIGUALDADE', 'DIVERSIDADE', 'RECLAMAÇÃO', 'EQUIPAMENTOS', 'PARALISAÇÃO', 'VINCULAÇÃO', 'COLONIZAÇÃO', 'EXCLUSIVIDADE', 'OFICIAL', 'OCUPAÇÃO', 'VIGILANCIA', 'RELAÇÕES', 'MANEJO', 'EVOLUÇÃO', 'SOLENIDADE', 'SIVAM', 'OPERAÇÃO', 'TRATADO', 'NOTA', 'COMPARECIMENTO']","['VOTO DE PESAR, MORTE, ATLETA PROFISSIONAL, ESPORTE AQUATICO, PARENTE, DESEMBARGADOR, ESTADO DO AMAZONAS (AM), MÃE, MARISA SERRANO, SENADOR.\nHOMENAGEM, ANIVERSARIO DE FUNDAÇÃO, MUNICIPIO, ENVIRA (AM), ESTADO DO AMAZONAS (AM).\nHOMENAGEM, PIONEIRO, PROPRIETARIO, FARMACIA, MUNICIPIO, MANAUS (AM), ESTADO DO AMAZONAS (AM), ATLETA PROFISSIONAL, FUTEBOL, PROFESSOR, COLECIONADOR.', 'HOMENAGEM, ANIVERSARIO DE FUNDAÇÃO, ZONA FRANCA, MUNICIPIO, MANAUS (AM), ESTADO DO AMAZONAS (AM).', 'LEITURA, MENSAGEM (MSG), PROFESSOR, ARQUITETURA, UNIVERSIDADE, MUNICIPIO, MANAUS (AM), DENUNCIA, APREENSÃO, POPULAÇÃO, DESTRUIÇÃO, PATRIMONIO CULTURAL, ESTADO DO AMAZONAS (AM).\nSAUDAÇÃO, INICIATIVA, PREFEITO, MUNICIPIO, MANAUS (AM), ESTADO DO AMAZONAS (AM), CRIAÇÃO, LOCAL, DESTINAÇÃO, CARVOEIRO, GARANTIA, LIMPEZA, PROTEÇÃO, TRABALHO, REGISTRO, ARTIGO DE IMPRENSA, JORNAL.\nCOMENTARIO, TRANSCRIÇÃO, ANAIS DO SENADO, ARTIGO DE IMPRENSA, JORNAL, A CRITICA, ESTADO DO AMAZONAS (AM), ADVERTENCIA, POSSIBILIDADE, COMPROMETIMENTO, PREPARAÇÃO, CAMPEONATO MUNDIAL, FUTEBOL, BRASIL, NECESSIDADE, AGILIZAÇÃO, INFRAESTRUTURA, MUNICIPIOS, SEDE, ESPECIFICAÇÃO, MUNICIPIO, MANAUS (AM).\nTRANSCRIÇÃO, ANAIS DO SENADO, EDITORIAL, JORNAL, O ESTADO DE S.PAULO, ESTADO DE SÃO PAULO (SP), REFERENCIA, CRISE, SENADO.\nIMPORTANCIA, EFICACIA, RESULTADO, POLO INDUSTRIAL, MUNICIPIO, MANAUS (AM), ESTADO DO AMAZONAS (AM), CONTRIBUIÇÃO, AMPLIAÇÃO, EXPORTAÇÃO, BRASIL.\nTRANSCRIÇÃO, ANAIS DO SENADO, ARTIGO DE IMPRENSA, PERIODICO, ESTADO DO AMAZONAS (AM), HOMENAGEM POSTUMA, JORNALISTA, ESPORTE.\nREGISTRO, PROTESTO, POPULAÇÃO, MUNICIPIOS, HUMAITA (AM), ESTADO DO AMAZONAS (AM), IMPASSE, DECISÃO, Instituto Brasileiro do Meio Ambiente e dos Recursos Naturais Renováveis (IBAMA), OPOSIÇÃO, RECONSTRUÇÃO, RODOVIA.\nDEFESA, NECESSIDADE, APOIO, AUMENTO, RECURSOS, SETOR PUBLICO, INCENTIVO, DESENVOLVIMENTO, CIENCIA E TECNOLOGIA, PESQUISA CIENTIFICA, ESTADO DO AMAZONAS (AM), VOTO, CONGRATULAÇÕES, SOCIEDADE BRASILEIRA PARA O PROGRESSO DA CIENCIA (SBPC), HOMENAGEM, PROFESSOR, GENETICA.\nCOMENTARIO, ARTIGO DE IMPRENSA, JORNAL, FOLHA DE S.PAULO, ESTADO DE SÃO PAULO (SP), DENUNCIA, EXPLORAÇÃO SEXUAL, PROSTITUIÇÃO, CRIANÇA, ILHA DE MARAJO, ESTADO DO AMAZONAS (AM).\nSOLICITAÇÃO, GARANTIA, ASSISTENCIA MEDICA, POPULAÇÃO, MUNICIPIO, ESTADO DO AMAZONAS (AM).']"
5,1135,5_SÃO PAULO SP_ESTADO DE SÃO PAULO_ESTADO DE SÃO_DE SÃO PAULO SP,"['SÃO PAULO SP', 'ESTADO DE SÃO PAULO', 'ESTADO DE SÃO', 'DE SÃO PAULO SP', 'SÃO PAULO', 'DE SÃO PAULO', 'TRANSCRIÇÃO ANAIS DO SENADO', 'TRANSCRIÇÃO ANAIS DO', 'TRANSCRIÇÃO ANAIS', 'DE PAULO', 'SENADO ARTIGO DE IMPRENSA', 'DO SENADO ARTIGO DE', 'ANAIS DO SENADO ARTIGO', 'PAULO ESTADO', 'DE PAULO ESTADO', 'PAULO ESTADO DE', 'DE PAULO ESTADO DE', 'PAULO ESTADO DE SÃO', 'SOLICITAÇÃO TRANSCRIÇÃO', 'SOLICITAÇÃO TRANSCRIÇÃO ANAIS DO']","['TRANSCRIÇÃO', 'ANAIS', 'ACUSAÇÃO', 'TENTATIVA', 'PROFESSOR', 'ADMINISTRATIVA', 'PROBLEMAS', 'TRANSPOSIÇÃO', 'DOUTRINA', 'DESIGNAÇÃO', '', '', '', '', '', '', '', '', '', '', '', '', '', '', '', '', '', '', '', '']","['SOLICITAÇÃO, TRANSCRIÇÃO, ANAIS DO SENADO, ARTIGO DE IMPRENSA, PUBLICAÇÃO, JORNAL, O ESTADO DE S.PAULO, ESTADO DE SÃO PAULO (SP), REFERENCIA, DENUNCIA, CORRUPÇÃO, GOVERNO FEDERAL, GESTÃO, DILMA ROUSSEFF, PRESIDENTE DA REPUBLICA.\nSOLICITAÇÃO, TRANSCRIÇÃO, ANAIS DO SENADO, ARTIGO DE IMPRENSA, PUBLICAÇÃO, JORNAL, O ESTADO DE S.PAULO, ESTADO DE SÃO PAULO (SP), RELAÇÃO, CORRUPÇÃO, GESTÃO, EX PRESIDENTE DA REPUBLICA.', 'SOLICITAÇÃO, TRANSCRIÇÃO, ANAIS DO SENADO, ARTIGO DE IMPRENSA, PUBLICAÇÃO, JORNAL, O ESTADO DE S.PAULO, ESTADO DE SÃO PAULO (SP), ASSUNTO, EXCESSO, CORRUPÇÃO, GOVERNO, BRASIL.', 'SOLICITAÇÃO, TRANSCRIÇÃO, ANAIS DO SENADO, ARTIGO DE IMPRENSA, JORNAL, ESTADO DE S.PAULO, ESTADO DE SÃO PAULO (SP), CRITICA, GOVERNO FEDERAL, COMPARAÇÃO, MANDATO, PRESIDENTE DA REPUBLICA.']"
6,857,6_REGISTRO APRESENTAÇÃO_REGISTRO PARTICIPAÇÃO_REGISTRO PARTICIPAÇÃO ORADOR_APRESENTAÇÃO PROJETO,"['REGISTRO APRESENTAÇÃO', 'REGISTRO PARTICIPAÇÃO', 'REGISTRO PARTICIPAÇÃO ORADOR', 'APRESENTAÇÃO PROJETO', 'REGISTRO APRESENTAÇÃO PROJETO DE', 'REGISTRO APRESENTAÇÃO PROJETO', 'SENADO REGISTRO', 'APRESENTAÇÃO PROJETO DE LEI', 'AUDIENCIA PUBLICA', 'REALIZAÇÃO AUDIENCIA', 'PROPOSTA EMENDA CONSTITUCIONAL', 'REALIZAÇÃO AUDIENCIA PUBLICA', 'REGISTRO NECESSIDADE', 'AUTORIA ORADOR ASSUNTO', 'REGISTRO REALIZAÇÃO AUDIENCIA', 'REGISTRO APROVAÇÃO', 'REGISTRO REALIZAÇÃO AUDIENCIA PUBLICA', 'REFORMA POLITICA', 'REGISTRO PRESENÇA', 'COMISSÃO DE CONSTITUIÇÃO']","['PREVIDENCIA', 'RELEVANCIA', 'EXECUÇÃO', 'REESTRUTURAÇÃO', 'ACUSAÇÃO', 'DIVERSIDADE', 'USO', 'APOSENTADO', 'PALAVRA', 'PSICOLOGIA', 'REAVALIAÇÃO', 'RECEPÇÃO', 'DESTRUIÇÃO', '', '', '', '', '', '', '', '', '', '', '', '', '', '', '', '', '']","['REGISTRO, APRESENTAÇÃO, PROJETO DE LEI, AUTORIA, ORADOR, ASSUNTO, ALEITAMENTO MATERNO, PERIODO, REALIZAÇÃO, CONCURSO PUBLICO.', 'REGISTRO, APRESENTAÇÃO, PROJETO DE LEI, AUTORIA, ORADOR, ASSUNTO, ESTABELECIMENTO, PERCENTAGEM, CACAU, CHOCOLATE.', 'REGISTRO, APRESENTAÇÃO, PROJETO DE LEI, AUTORIA, ORADOR, ASSUNTO, DETERMINAÇÃO, RESERVA, VAGA, GRATUIDADE, PARTICIPAÇÃO, CURSO TECNICO, INSTITUIÇÃO PARAESTATAL, BENEFICIO, MULHER, VITIMA, VIOLENCIA.\nREGISTRO, APRESENTAÇÃO, PROJETO DE LEI, AUTORIA, ORADOR, ASSUNTO, DETERMINAÇÃO, INSTITUIÇÃO PARAESTATAL, OFERECIMENTO, ENSINO PROFISSIONAL, BENEFICIO, PRESO, REGIME SEMI ABERTO, USUARIO, DROGA.']"
7,854,7_MEDIDA PROVISORIA MPV_PROVISORIA MPV_MPV_PROVISORIA MPV ASSUNTO,"['MEDIDA PROVISORIA MPV', 'PROVISORIA MPV', 'MPV', 'PROVISORIA MPV ASSUNTO', 'MPV ASSUNTO', 'MEDIDA PROVISORIA MPV ASSUNTO', 'APROVAÇÃO MEDIDA PROVISORIA', 'APROVAÇÃO MEDIDA PROVISORIA MPV', 'APROVAÇÃO MEDIDA', 'MEDIDA PROVISORIA MPV ALTERAÇÃO', 'PROVISORIA MPV ALTERAÇÃO', 'MPV ALTERAÇÃO', 'DEVOLUÇÃO MEDIDA PROVISORIA', 'DEVOLUÇÃO MEDIDA PROVISORIA MPV', 'MEDIDA PROVISORIA MPV REFERENCIA', 'MPV REFERENCIA', 'PROVISORIA MPV REFERENCIA', 'PROVISORIA MPV ALTERAÇÃO LEI', 'MPV ALTERAÇÃO LEI', 'MPV ALTERAÇÃO LEI FEDERAL']","['DEVOLUÇÃO', 'EDIÇÃO', 'RESPOSTA', 'REMESSA', 'PROXIMIDADE', 'FALTA', 'DEMONSTRAÇÃO', 'DETERMINAÇÃO', 'DESIGUALDADE', 'OPERAÇÃO', 'REDAÇÃO', 'ZONA', 'PARALISAÇÃO', 'POSSE', 'VINCULAÇÃO', 'PUNIÇÃO', 'CHEGADA', 'ANULAÇÃO', '', '', '', '', '', '', '', '', '', '', '', '']","['ORIENTAÇÃO, BANCADA, DESTAQUE, VOTAÇÃO EM SEPARADO, MEDIDA PROVISORIA (MPV), ALTERAÇÃO, LEI FEDERAL, NORMAS, PROCESSO ADMINISTRATIVO, ATUALIZAÇÃO, COBERTURA, MEDICAMENTOS, PROCEDIMENTO, PRODUTO FARMACEUTICO, AMBITO, SUPLEMENTAÇÃO, SAUDE, COMPETENCIA, AGENCIA NACIONAL DE SAUDE SUPLEMENTAR (ANS), CRIAÇÃO, COMISSÃO, ASSESSORIA, COMPOSIÇÃO.', 'ORIENTAÇÃO, BANCADA, DESTAQUE, VOTAÇÃO EM SEPARADO, MEDIDA PROVISORIA (MPV), ALTERAÇÃO, LEI FEDERAL, NORMAS, PROCESSO ADMINISTRATIVO, ATUALIZAÇÃO, COBERTURA, MEDICAMENTOS, PROCEDIMENTO, PRODUTO FARMACEUTICO, AMBITO, SUPLEMENTAÇÃO, SAUDE, COMPETENCIA, AGENCIA NACIONAL DE SAUDE SUPLEMENTAR (ANS), CRIAÇÃO, COMISSÃO, ASSESSORIA, COMPOSIÇÃO.', 'ORIENTAÇÃO, BANCADA, DESTAQUE, VOTAÇÃO EM SEPARADO, MEDIDA PROVISORIA (MPV), ALTERAÇÃO, LEI FEDERAL, NORMAS, PROCESSO ADMINISTRATIVO, ATUALIZAÇÃO, COBERTURA, MEDICAMENTOS, PROCEDIMENTO, PRODUTO FARMACEUTICO, AMBITO, SUPLEMENTAÇÃO, SAUDE, COMPETENCIA, AGENCIA NACIONAL DE SAUDE SUPLEMENTAR (ANS), CRIAÇÃO, COMISSÃO, ASSESSORIA, COMPOSIÇÃO.']"
8,788,8_DA EDUCAÇÃO_DE EDUCAÇÃO_DA EDUCAÇÃO MEC_EDUCAÇÃO MEC,"['DA EDUCAÇÃO', 'DE EDUCAÇÃO', 'DA EDUCAÇÃO MEC', 'EDUCAÇÃO MEC', 'MINISTERIO DA EDUCAÇÃO MEC', 'MINISTERIO DA EDUCAÇÃO', 'EDUCAÇÃO BASICA', 'DESENVOLVIMENTO DA EDUCAÇÃO', 'UNIVERSIDADE FEDERAL', 'DESENVOLVIMENTO DA EDUCAÇÃO BASICA', 'DA EDUCAÇÃO BASICA', 'VALORIZAÇÃO DOS PROFISSIONAIS DA', 'DA EDUCAÇÃO BASICA DE', 'DA EDUCAÇÃO FUNDEB', 'EDUCAÇÃO FUNDEB', 'VALORIZAÇÃO DOS PROFISSIONAIS', 'PROFISSIONAIS DA EDUCAÇÃO FUNDEB', 'PROFISSIONAIS DA EDUCAÇÃO', 'BASICA DE VALORIZAÇÃO DOS', 'DOS PROFISSIONAIS DA EDUCAÇÃO']","['UNIVERSIDADE', 'PROFISSIONAIS', 'SUPERIOR', 'CURSO', 'ESCOLAR', 'FORMAÇÃO', 'PESQUISA', 'PROFISSÃO', 'NOTA', 'EXCEPCIONAIS', 'AMIGOS', 'RECONHECIMENTO', 'TRANSPORTE', 'MEDICO', 'VERBA', 'RENOVAÇÃO', 'PRODUÇÃO', 'DISCRIMINAÇÃO', 'FUNÇÃO', 'REPROVAÇÃO', 'CONCENTRAÇÃO', 'COMPOSIÇÃO', 'OFICIAL', 'DISPONIBILIDADE', 'PREFEITURA', 'DEMORA', 'DERMATOLOGIA', 'TRIBUNAIS', '', '']","['ABERTURA, SESSÃO ESPECIAL, COMEMORAÇÃO, DIA NACIONAL, PROFESSOR, COMENTARIO, APROVAÇÃO, ALTERAÇÃO, FUNDO DE MANUTENÇÃO E DESENVOLVIMENTO DA EDUCAÇÃO BASICA E DE VALORIZAÇÃO DOS PROFISSIONAIS DA EDUCAÇÃO (FUNDEB).', 'REGISTRO, CARTA ABERTA, CONFEDERAÇÃO, TRABALHADOR, EDUCAÇÃO, REGULAMENTAÇÃO, FUNDO DE MANUTENÇÃO E DESENVOLVIMENTO DA EDUCAÇÃO BASICA E DE VALORIZAÇÃO DOS PROFISSIONAIS DA EDUCAÇÃO (FUNDEB), PREJUIZO, ESCOLA PUBLICA.\n', 'REGISTRO, APROVAÇÃO, PROPOSTA DE EMENDA A CONSTITUIÇÃO (PEC), FUNDO DE MANUTENÇÃO E DESENVOLVIMENTO DA EDUCAÇÃO BASICA E DE VALORIZAÇÃO DOS PROFISSIONAIS DA EDUCAÇÃO (FUNDEB), EDUCAÇÃO.\n']"
9,778,9_HOMENAGEM POSTUMA_VIDA PUBLICA_ELOGIO VIDA PUBLICA_PESAR,"['HOMENAGEM POSTUMA', 'VIDA PUBLICA', 'ELOGIO VIDA PUBLICA', 'PESAR', 'HOMENAGEM POSTUMA MORTE', 'VIDA PUBLICA HOMENAGEM POSTUMA', 'PUBLICA HOMENAGEM POSTUMA', 'VIDA PUBLICA HOMENAGEM', 'ELOGIO VIDA PUBLICA HOMENAGEM', 'PUBLICA HOMENAGEM', 'VOTO DE PESAR MORTE', 'PESAR MORTE', 'DE PESAR MORTE', 'APRESENTAÇÃO PESAMES', 'APRESENTAÇÃO PESAMES FAMILIA', 'FAMILIA HOMENAGEM', 'FAMILIA HOMENAGEM POSTUMA', 'ENCAMINHAMENTO VOTO DE PESAR', 'FAMILIA ELOGIO VIDA', 'FAMILIA ELOGIO VIDA PUBLICA']","['PESAR', 'PESAMES', '', '', '', '', '', '', '', '', '', '', '', '', '', '', '', '', '', '', '', '', '', '', '', '', '', '', '', '']","['HOMENAGEM POSTUMA, MORTE, YOLANDA QUEIROZ, ELOGIO, VIDA PUBLICA.\nHOMENAGEM POSTUMA, MORTE, PROPRIETARIO, EMPRESA, ALIMENTOS, ESTADO DO CEARA (CE), ELOGIO, VIDA PUBLICA.\n.', 'HOMENAGEM POSTUMA, VOTO DE PESAR, MORTE, BENI VERAS, EX SENADOR, APRESENTAÇÃO, PESAMES, FAMILIA, ELOGIO, VIDA PUBLICA.\nHOMENAGEM POSTUMA, VOTO DE PESAR, MORTE, EX MINISTRO, PAIS ESTRANGEIRO, ALEMANHA, ELOGIO, VIDA PUBLICA.', 'HOMENAGEM POSTUMA, MORTE, EMPRESARIO, ENCAMINHAMENTO, VOTO DE PESAR, APRESENTAÇÃO, PESAMES, FAMILIA, ELOGIO, VIDA PUBLICA.']"
