Topic,Count,Name,Representation,Aspect1,Representative_Docs
10,696,10_TRANSPORTES_DOS TRANSPORTES_TRANSPORTE_ESTRUTURA DOS TRANSPORTES DNIT,"['TRANSPORTES', 'DOS TRANSPORTES', 'TRANSPORTE', 'ESTRUTURA DOS TRANSPORTES DNIT', 'INFRA ESTRUTURA DOS', 'ESTRUTURA DOS TRANSPORTES', 'DE INFRA ESTRUTURA DOS', 'INFRA ESTRUTURA DOS TRANSPORTES', 'DEPARTAMENTO NACIONAL DE INFRA', 'TRANSPORTES DNIT', 'DOS TRANSPORTES DNIT', 'INFRA ESTRUTURA', 'INFRA', 'DEPARTAMENTO', 'RODOVIA', 'MINISTERIO DOS TRANSPORTES', 'MINISTERIO DOS TRANSPORTES MTR', 'MTR', 'TRANSPORTES MTR', 'DOS TRANSPORTES MTR']","['TRANSPORTES', 'TRANSPORTE', 'RODOVIA', 'OBRAS', 'ACIDENTE', 'FALTA', 'DEMORA', 'PESQUISA', 'PARALISAÇÃO', 'ANAIS', 'TRANSCRIÇÃO', 'CONTROLE', 'OFICIAL', 'EQUIPAMENTOS', 'ESPAÇO', 'CONFIRMAÇÃO', 'NOTA', 'REVISÃO', 'AMAZONIA', 'DESLOCAMENTO', 'TOTAL', 'VIGILANCIA', 'MEIOS', 'DELEGAÇÃO', 'AGRAVAÇÃO', 'SIVAM', 'CLANDESTINA', '', '', '']","['ESCLARECIMENTOS, INEXATIDÃO, INFORMAÇÃO, REFERENCIA, NOME, INDICAÇÃO, DIRETOR GERAL, DEPARTAMENTO NACIONAL DE INFRA-ESTRUTURA DOS TRANSPORTES (DNIT), ANALISE, COMISSÃO DE SERVIÇOS DE INFRAESTRUTURA, MOTIVO, SITUAÇÃO, EX SERVIDOR, SENADO, RECEBIMENTO, REMUNERAÇÃO, EMPRESA, AUSENCIA, OMISSÃO, FATO, APRESENTAÇÃO, DOCUMENTO, COMPROVAÇÃO.\nELOGIO, INDICAÇÃO, DIRETOR GERAL, DEPARTAMENTO NACIONAL DE INFRA-ESTRUTURA DOS TRANSPORTES (DNIT), PREVISÃO, COLABORAÇÃO, PROGRAMA, ACELERAÇÃO, CRESCIMENTO.', 'ANUNCIO, REALIZAÇÃO, DILIGENCIA, RODOVIA, AMBITO NACIONAL, LOCAL, ESTADO DE RONDONIA (RO), PARTICIPAÇÃO, ORADOR, DIRETOR, DEPARTAMENTO NACIONAL DE INFRA-ESTRUTURA DOS TRANSPORTES (DNIT), AGENCIA NACIONAL DE TRANSPORTES TERRESTRES (ANTT), MINISTERIO DOS TRANSPORTES (MTR).', 'DEFESA, INDICAÇÃO, OCUPAÇÃO, CARGO, DIRETORIA EXECUTIVA, DEPARTAMENTO NACIONAL DE INFRA-ESTRUTURA DOS TRANSPORTES (DNIT).']"
11,640,11_CANCER_HOSPITAL_MEDICO_UNICO DE SAUDE SUS,"['CANCER', 'HOSPITAL', 'MEDICO', 'UNICO DE SAUDE SUS', 'SAUDE SUS', 'SISTEMA UNICO DE SAUDE', 'DE SAUDE SUS', 'MEDICAMENTOS', 'SAUDE MS', 'DA SAUDE MS', 'MINISTERIO DA SAUDE MS', 'MINISTERIO DA SAUDE', 'MS', 'SAUDE PUBLICA', 'PACIENTE', 'DIAGNOSTICO', 'CANCER MULHER', 'COMBATE CANCER', 'MEDICINA', 'TRATAMENTO CANCER']","['MEDICO', 'DOENÇA', 'PACIENTE', 'MEDICINA', 'VIGILANCIA', 'CIRURGIA', 'CARDIOLOGIA', 'PESQUISA', 'ASSUNTOS', 'UNIVERSIDADE', 'CONTRATAÇÃO', 'FALTA', 'EQUIPAMENTOS', 'CONGRATULAÇÕES', 'FORMAÇÃO', 'MATERNIDADE', 'ENTIDADE', 'ESPECIALIDADE', 'CONDIÇÕES', 'CONCLUSÃO', 'PORTARIA', 'MODERNIZAÇÃO', 'RESOLUÇÃO', 'POSIÇÃO', 'VERBA', 'ADMINISTRATIVA', 'TRANSPORTE', 'DESIGUALDADE', 'PUBLICIDADE', 'BEM']","['REGISTRO, AUMENTO, MORTE, PACIENTE, CANCER, CONFIRMAÇÃO, DADOS, ORGANIZAÇÃO MUNDIAL DE SAUDE (OMS), MUNDO.\nCOMENTARIO, DADOS, SISTEMA UNICO DE SAUDE (SUS), INSTITUTO NACIONAL DO CANCER, SUPERIORIDADE, MORTE, PACIENTE, BRASIL, COMPARAÇÃO, PAIS, PRIMEIRO MUNDO.\nDEFESA, NECESSIDADE, ESFORÇO, GESTOR, SISTEMA UNICO DE SAUDE (SUS), ATENÇÃO, DOENTE, NECESSIDADE, INVESTIMENTO, PROMOÇÃO, SAUDE, ALTERAÇÃO, PADRÃO, EXPOSIÇÃO, FATOR, RISCOS, CANCER, PREVENÇÃO, DOENÇA, IMPORTANCIA, APROVAÇÃO, EMENDA CONSTITUCIONAL, GARANTIA, MELHORIA, QUALIDADE, ATENDIMENTO, AUMENTO, RECURSOS, SISTEMA, SAUDE PUBLICA.\nCOMENTARIO, RELATORIO, ORGANISMO INTERNACIONAL, IMPORTANCIA, ALIMENTAÇÃO, MODERAÇÃO, CONSUMO, ALCOOL, TABAGISMO, MANUTENÇÃO, PESO, PRATICA ESPORTIVA, PREVENÇÃO, REDUÇÃO, INCIDENCIA, CANCER.', 'SESSÃO ESPECIAL, COMEMORAÇÃO, DIA INTERNACIONAL, COMBATE, CANCER, MULHER.\nCOMENTARIO, DIAGNOSTICO, TRATAMENTO DE SAUDE, CANCER, MULHER, REDUÇÃO, RECURSOS FINANCEIROS, FINANCIAMENTO, SISTEMA UNICO DE SAUDE (SUS).', 'PROJETO DE LEI, ALTERAÇÃO, LEI FEDERAL, PREVENÇÃO, DIAGNOSTICO, TRATAMENTO, CANCER, AMBITO, SISTEMA UNICO DE SAUDE (SUS), DIREITOS, MULHER, CRITERIOS, IDADE, REALIZAÇÃO, EXAME MEDICO.']"
12,630,12_DO PIAUI_PIAUI_PIAUI PI_DO PIAUI PI,"['DO PIAUI', 'PIAUI', 'PIAUI PI', 'DO PIAUI PI', 'ESTADO DO PIAUI PI', 'ESTADO DO PIAUI', 'PI ESTADO DO', 'PI ESTADO', 'PI ESTADO DO PIAUI', 'GOVERNADOR ESTADO DO PIAUI', 'GOVERNO ESTADUAL', 'GOVERNADOR ESTADO DO', 'ESTADUAL ESTADO DO PIAUI', 'PIAUI PI REGISTRO', 'DO PIAUI PI REGISTRO', 'AEROPORTO', 'TERESINA PI ESTADO DO', 'TERESINA PI ESTADO', 'POLITICO PARTIDO DOS', 'POLITICO PARTIDO DOS TRABALHADORES']","['OBRAS', 'PROMESSA', 'FALTA', 'MANIPULAÇÃO', 'CONCLUSÃO', 'RODOVIA', 'CAPITAL', 'UNIVERSIDADE', 'PARALISAÇÃO', 'TENTATIVA', 'DIFICULDADE', 'SUPERIOR', 'VERBA', 'MEIO', 'LITORAL', 'ABANDONO', 'POSSE', 'ADMINISTRATIVA', 'DESIGUALDADE', 'AGRAVAÇÃO', 'FRUSTRAÇÃO', 'CARENTE', 'CIENCIA', 'EQUIPAMENTOS', 'OBTENÇÃO', 'CONHECIMENTO', 'DEFASAGEM', 'CONCENTRAÇÃO', 'ESPAÇO', 'MATERNIDADE']","['REGISTRO, VISITA, ORADOR, MUNICIPIO, CAMPO MAIOR (PI), ITAINOPOLIS (PI), TERESINA (PI), ESTADO DO PIAUI (PI), CERIMONIA RELIGIOSA, INAUGURAÇÃO, OBRA PUBLICA.\nCOMENTARIO, ARTIGO DE IMPRENSA, JORNAL, O DIA, ESTADO DO PIAUI (PI), DENUNCIA, MANIPULAÇÃO, NATUREZA POLITICA, ABERTURA, HOSPITAL.\nQUESTIONAMENTO, DECLARAÇÃO, PRESIDENTE, DIRETORIO ESTADUAL, PARTIDO POLITICO, PARTIDO DOS TRABALHADORES (PT), ESTADO DO PIAUI (PI), UTILIZAÇÃO, SUPERIORIDADE, RECURSOS, GOVERNO ESTADUAL, CONCLUSÃO, HOSPITAL, TENTATIVA, MANIPULAÇÃO, OPINIÃO PUBLICA, VIABILIDADE, CANDIDATURA, DEPUTADO FEDERAL, PREFEITURA, MUNICIPIO, TERESINA (PI).\nCRITICA, CAMPANHA ELEITORAL, PARTIDO POLITICO, PARTIDO DOS TRABALHADORES (PT), HORARIO GRATUITO, DIVULGAÇÃO, RESPONSABILIDADE, CONSTRUÇÃO, HOSPITAL, ESTADO DO PIAUI (PI).\nESCLARECIMENTOS, PARTICIPAÇÃO, DIVERSIDADE, GOVERNO ESTADUAL, PREFEITURA, OBRA PUBLICA, HOSPITAL, CAPITAL DE ESTADO, ESTADO DO PIAUI (PI), QUESTIONAMENTO, AUSENCIA, ESCLARECIMENTOS, PRESIDENTE, DIRETORIO ESTADUAL, PARTIDO POLITICO, PARTIDO DOS TRABALHADORES (PT), MOTIVO, SITUAÇÃO, PARALISAÇÃO, OBRA PUBLICA, METRO, PONTE, COMPETENCIA, GOVERNO ESTADUAL.\nCRITICA, ATUAÇÃO, DEPUTADO FEDERAL, PREVISÃO, CANDIDATURA, PREFEITO, CAPITAL DE ESTADO, ESTADO DO PIAUI (PI), INCOERENCIA, CONDUTA, ANTERIORIDADE, OPOSIÇÃO, PARTIDO POLITICO, PARTIDO DOS TRABALHADORES (PT), ATUALIDADE, FILIAÇÃO PARTIDARIA.', 'CRITICA, CONDUTA, GOVERNADOR, ESTADO DO PIAUI (PI), QUESTIONAMENTO, CONSTRUÇÃO, AEROPORTO INTERNACIONAL, LEITURA, TRECHO, ARTIGO DE IMPRENSA, JORNAL, PARALISAÇÃO, ATIVIDADE, AEROPORTO.\nQUESTIONAMENTO, PROMESSA, CAMPANHA ELEITORAL, GOVERNADOR, ESTADO DO PIAUI (PI), EXCESSO, CONSTRUÇÃO, USINA HIDROELETRICA, AUSENCIA, CONCLUSÃO, FERROVIA.\nCOMENTARIO, NOTICIARIO, JORNAL, O DIA, AUMENTO, VIOLENCIA, ESTADO DO PIAUI (PI).\nCONVITE, EDUARDO SUPLICY, SENADOR, VISITA, TEATRO, MUNICIPIO, TERESINA (PI), ESTADO DO PIAUI (PI), ELOGIO, GESTÃO, PREFEITO, INVESTIMENTO, CULTURA.\nLEITURA, NOME, PESSOAL, ACADEMIA, MEDICINA, ESTADO DO PIAUI (PI), ELOGIO, IMPORTANCIA, ENTIDADE, COMPROMISSO, ETICA.\n.', 'REGISTRO, DESENVOLVIMENTO ECONOMICO, AMPLIAÇÃO, IRRIGAÇÃO, ESTADO DO PIAUI (PI), ESTADO DO CEARA (CE), COMENTARIO, DECLARAÇÃO, CONSULTOR, SECRETARIA, INFRAESTRUTURA, RECURSOS HIDRICOS, MINISTERIO DA INTEGRAÇÃO NACIONAL, DADOS, ENTIDADE, SUPERMERCADO, AUMENTO, CULTIVO, CONSUMO, PRODUTO ALIMENTICIO, AUSENCIA, AGROTOXICO, ESPECIFICAÇÃO, MUNICIPIO, BURITI DOS LOPES (PI), PARNAIBA (PI), ESTADO DO PIAUI (PI).\nELOGIO, DEPARTAMENTO NACIONAL DE OBRAS CONTRA AS SECAS (DNOCS), IMPLANTAÇÃO, IRRIGAÇÃO, ASSENTAMENTO RURAL, REGIÃO NORDESTE, REALIZAÇÃO, SEMINARIO, MUNICIPIO, FORTALEZA (CE), ESTADO DO CEARA (CE), DEBATE, REDE DE IRRIGAÇÃO, ESTADO DO PIAUI (PI), ESTADO DO CEARA (CE), DEFINIÇÃO, EQUIPAMENTOS, CULTIVO, REGIÃO, NECESSIDADE, QUALIFICAÇÃO, PEQUENO PRODUTOR RURAL, PARTICIPAÇÃO, UNIVERSIDADE FEDERAL DO CEARA (UFC), EXPECTATIVA, AMPLIAÇÃO, PROGRAMA.\nELOGIO, INVESTIMENTO, GOVERNO FEDERAL, AGRICULTURA, REGIÃO NORDESTE, IMPORTANCIA, FRUTICULTURA, AUSENCIA, AGROTOXICO, EXPORTAÇÃO, CONTINENTE, EUROPA, PAIS ESTRANGEIRO, ESTADOS UNIDOS DA AMERICA (EUA), RELEVANCIA, PRODUÇÃO AGRICOLA, COMBATE, EFEITO, CRISE, ECONOMIA NACIONAL, ESPECIFICAÇÃO, ESTADO DO PIAUI (PI).\nREGISTRO, RECEBIMENTO, ORADOR, MEDALHA, PREFEITO, MUNICIPIO, CAMPO MAIOR (PI), ESTADO DO PIAUI (PI), OPORTUNIDADE, COMEMORAÇÃO, ANIVERSARIO, REVOLTA, CONSOLIDAÇÃO, INDEPENDENCIA.\nCOMENTARIO, VISITA, MINISTRO DE ESTADO, MINISTERIO DO TURISMO, CAPITAL DE ESTADO, ASSINATURA, ATO, CRIAÇÃO, PARQUE, REGIÃO, RESULTADO, EMENDA, AUTORIA, ORADOR, CONSTRUÇÃO, CENTRO DE EXPOSIÇÕES, MUNICIPIO, PARNAIBA (PI), ESTADO DO PIAUI (PI).\nREGISTRO, VIAGEM, ORADOR, INTERIOR, CONHECIMENTO, DIFICULDADE, ADMINISTRAÇÃO MUNICIPAL, CONTROLE, FINANÇAS PUBLICAS, PERIODO, CRISE, ECONOMIA NACIONAL, ESPECIFICAÇÃO, MUNICIPIO, SÃO RAIMUNDO NONATO (PI), BONFIM DO PIAUI (PI), SÃO LOURENÇO DO PIAUI (PI), ESTADO DO PIAUI (PI).\nCOMEMORAÇÃO, VITORIA, COLIGAÇÃO PARTIDARIA, ELEIÇÃO MUNICIPAL, MUNICIPIO, BAIXA GRANDE DO RIBEIRO (PI), ESTADO DO PIAUI (PI).\nREGISTRO, VISITA, MINISTRO DE ESTADO, MINISTERIO DAS COMUNICAÇÕES (MC), INAUGURAÇÃO, MUNICIPIO, TERESINA (PI), ESTADO DO PIAUI (PI), TELEVISÃO, TECNOLOGIA DIGITAL.\nCOMEMORAÇÃO, APROVAÇÃO, SENADO, PROJETO, COOPERAÇÃO, GOVERNO ESTRANGEIRO, ALEMANHA, GOVERNO BRASILEIRO, AUXILIO, ESTADO DO PIAUI (PI), MELHORIA, SANEAMENTO BASICO.\n.']"
13,591,13_FUTEBOL_CAMPEONATO_CAMPEONATO MUNDIAL_MUNDIAL FUTEBOL,"['FUTEBOL', 'CAMPEONATO', 'CAMPEONATO MUNDIAL', 'MUNDIAL FUTEBOL', 'CAMPEONATO MUNDIAL FUTEBOL', 'ESTADIO', 'DE FUTEBOL', 'CONFEDERAÇÃO BRASILEIRA DE', 'CLUBE', 'BRASILEIRA DE FUTEBOL CBF', 'CONFEDERAÇÃO BRASILEIRA DE FUTEBOL', 'DE FUTEBOL CBF', 'FUTEBOL CBF', 'BRASILEIRA DE FUTEBOL', 'CONFEDERAÇÃO BRASILEIRA', 'MT', 'REALIZAÇÃO CAMPEONATO', 'REALIZAÇÃO CAMPEONATO MUNDIAL', 'ESPORTE', 'DE MATO GROSSO MT']","['CONFEDERAÇÃO', 'ESPORTIVA', 'CAPITAL', 'ANAIS', 'CONGRATULAÇÕES', 'LUTA', 'PUNIÇÃO', 'TOTAL', 'DEMONSTRAÇÃO', 'CANDIDATURA', 'FORMAÇÃO', 'ENTIDADE', 'EFETIVAÇÃO', 'EQUIPAMENTOS', 'CONFIRMAÇÃO', 'AVISO', 'URBANIZAÇÃO', '', '', '', '', '', '', '', '', '', '', '', '', '']","['SAUDAÇÃO, ESCOLHA, CAPITAL DE ESTADO, ESTADO DE MATO GROSSO (MT), ESTADO DE MATO GROSSO (MT), SEDE, CAMPEONATO MUNDIAL, FUTEBOL, AGRADECIMENTO, EMPENHO, GOVERNADOR, MANIFESTAÇÃO, APOIO, POPULAÇÃO, DEFESA, REGIÃO.\nEXPECTATIVA, RECURSOS, DESTINAÇÃO, REALIZAÇÃO, CAMPEONATO MUNDIAL, FUTEBOL, GARANTIA, BENEFICIO, CONSCIENTIZAÇÃO, AMBITO INTERNACIONAL, IMPORTANCIA, PRESERVAÇÃO, MEIO AMBIENTE.', 'APOIO, CANDIDATURA, CAPITAL FEDERAL, ABERTURA, CAMPEONATO MUNDIAL, FUTEBOL.', 'CRITICA, ORADOR, RELAÇÃO, DESRESPEITO, COMENTARIO, AUTORIA, SECRETARIA GERAL, FEDERAÇÃO INTERNACIONAL DE FUTEBOL ASSOCIATION (FIFA), ASSUNTO, ATRASO, REALIZAÇÃO, OBRAS, CAMPEONATO MUNDIAL, FUTEBOL, LOCALIZAÇÃO, BRASIL.\nCOMENTARIO, ORADOR, ACUSAÇÃO, CORRUPÇÃO, ADMINISTRAÇÃO PUBLICA, RELAÇÃO, CONTROLE, RECURSOS, DESTINAÇÃO, CAMPEONATO MUNDIAL, FUTEBOL.']"
14,572,14_REFORMA POLITICA_PROPOSTA EMENDA CONSTITUCIONAL_MANIFESTAÇÃO COLETIVA_COMBATE CORRUPÇÃO,"['REFORMA POLITICA', 'PROPOSTA EMENDA CONSTITUCIONAL', 'MANIFESTAÇÃO COLETIVA', 'COMBATE CORRUPÇÃO', 'REFORMULAÇÃO', 'REALIZAÇÃO REFORMA', 'REALIZAÇÃO REFORMA POLITICA', 'POLITICAS PUBLICAS', 'POLITICAS', 'POLITICA COMENTARIO', 'AUTORIA ORADOR ASSUNTO', 'ADMINISTRATIVA', 'ATIVIDADE POLITICA', 'NECESSIDADE REFORMA', 'FINANCIAMENTO CAMPANHA ELEITORAL', 'FINANCIAMENTO', 'FINANCIAMENTO CAMPANHA', 'TRANSPARENCIA ADMINISTRATIVA', 'LEI AUTORIA ORADOR ASSUNTO', 'SERVIÇO PUBLICO']","['MANDATO', 'ADMINISTRATIVA', 'RESPOSTA', 'COLIGAÇÃO', 'CONFIANÇA', 'NUMERO', 'RESPEITO', 'FALTA', 'DOAÇÃO', 'RENOVAÇÃO', 'ENCERRAMENTO', 'ERRADICAÇÃO', 'CONCENTRAÇÃO', 'MODERNIZAÇÃO', 'DESIGUALDADE', 'FUNÇÃO', 'OFICIAL', 'ENTIDADE', 'DISTRITAL', 'EVOLUÇÃO', 'PARALISAÇÃO', 'QUADRO', 'CONSOLIDAÇÃO', 'SECRETA', 'PRODUÇÃO', 'TENTATIVA', 'FABRICA', 'COMPORTAMENTO', 'NOTA', 'ERRO']","['COMENTARIO, FATO, POPULAÇÃO, REALIZAÇÃO, MANIFESTAÇÃO COLETIVA, REIVINDICAÇÃO, MELHORIA, QUALIDADE, SERVIÇOS PUBLICOS, DEFESA, NECESSIDADE, CONGRESSO NACIONAL, ATUAÇÃO, OBJETIVO, ALTERAÇÃO, PACTO FEDERATIVO, MELHORAMENTO, POLITICA ECONOMICO FINANCEIRA, GESTÃO, RECURSOS ORÇAMENTARIOS, REALIZAÇÃO, REFORMA TRIBUTARIA, REFORMA POLITICA.', 'COMENTARIO, FALTA, CONFIANÇA, POPULAÇÃO, POLITICA, AUMENTO, ABSTENÇÃO, ELEITORADO, VOTO NULO, VOTO EM BRANCO, PREJUIZO, DEMOCRACIA, NECESSIDADE, REFORMA POLITICA, RENOVAÇÃO, SISTEMA, POLITICA PARTIDARIA, IMPORTANCIA, APOIO, CAMARA DOS DEPUTADOS, APROVAÇÃO, PROPOSTA DE EMENDA A CONSTITUIÇÃO (PEC), ASSUNTO, CLAUSULA DE BARREIRA, REDUÇÃO, NUMERO, PARTIDO POLITICO, RESPEITO, PRINCIPIO CONSTITUCIONAL, PLURIPARTIDARISMO, AUTORIA, ORADOR.', 'HOMENAGEM, DIA INTERNACIONAL, MULHER.\nCOMENTARIO, NECESSIDADE, REALIZAÇÃO, REFORMA POLITICA, OBJETIVO, EXTINÇÃO, REELEIÇÃO, AUMENTO, PERIODO, MANDATO, CARGO ELETIVO, EXECUTIVO, ALTERAÇÃO, FORMA, FINANCIAMENTO, CAMPANHA ELEITORAL, PROIBIÇÃO, COLIGAÇÃO PARTIDARIA, REFORMULAÇÃO, CRIAÇÃO, PARTIDO POLITICO.\nCOMENTARIO, SITUAÇÃO, ECONOMIA NACIONAL, NECESSIDADE, EFICIENCIA, POLITICAS PUBLICAS, OBJETIVO, MELHORIA, QUALIDADE DE VIDA, POPULAÇÃO.\nSOLICITAÇÃO, INCLUSÃO, REQUERIMENTO, SESSÃO, SENADO, ASSUNTO, SESSÃO ESPECIAL.']"
15,559,15_COMPLEMENTAR_LEI COMPLEMENTAR_PLP_LEI COMPLEMENTAR PLP,"['COMPLEMENTAR', 'LEI COMPLEMENTAR', 'PLP', 'LEI COMPLEMENTAR PLP', 'DE LEI COMPLEMENTAR PLP', 'PROJETO DE LEI COMPLEMENTAR', 'COMPLEMENTAR PLP', 'PLP CRIAÇÃO', 'COMPLEMENTAR PLP CRIAÇÃO', 'LEI COMPLEMENTAR PLP CRIAÇÃO', 'PLP CRIAÇÃO LEI', 'COMPLEMENTAR PLP CRIAÇÃO LEI', 'Imposto Bens Serviços', 'SEGURANÇA NACIONAL', 'PLP ALTERAÇÃO', 'COMPLEMENTAR PLP ALTERAÇÃO', 'LEI COMPLEMENTAR PLP ALTERAÇÃO', 'TRIBUTARIA', 'CRIAÇÃO LEI COMPLEMENTAR', 'PLP CRIAÇÃO LEI COMPLEMENTAR']","['PENAL', 'BASE', 'SEGURIDADE', 'COMPOSIÇÃO', 'UNIFORMIZAÇÃO', 'PROFISSIONAIS', 'COMPENSAÇÃO', 'RESSALVA', 'DISPOSIÇÕES', 'MEIO', 'EFEITO', 'SEGURO', 'FIXAÇÃO', 'INOVAÇÃO', 'CIENCIA', 'ASSUNTOS', 'ZONA', 'DESIGUALDADE', 'DETERMINAÇÃO', 'CIRCULAÇÃO', 'DESONERAÇÃO', 'PRODUÇÃO', 'REVISÃO', 'FECHADA', 'RETIRADA', 'RESOLUÇÃO', 'EDIÇÃO', 'CREDITOS', 'ASSOCIADO', 'TENTATIVA']","['PROPOSTA DE EMENDA A CONSTITUIÇÃO (PEC), ALTERAÇÃO, DISPOSIÇÕES CONSTITUCIONAIS TRANSITORIAS, DESVINCULAÇÃO, RECEITA, ESTADOS, DISTRITO FEDERAL (DF), MUNICIPIOS, EXTINÇÃO, IMPOSTOS, CONTRIBUIÇÃO, SUBSTITUIÇÃO, ALIQUOTA, DISTRIBUIÇÃO, ARRECADAÇÃO, APROVEITAMENTO, SALDO CREDOR, NORMAS, PERIODO, AUSENCIA, LEI COMPLEMENTAR, LEGISLAÇÃO, UNIÃO FEDERAL, CRITERIOS, COMPENSAÇÃO, VALOR, RECEITA TRIBUTARIA, CRIAÇÃO, CESTA DE ALIMENTOS BASICOS, DEFINIÇÃO, BENS, SERVIÇO, REDUÇÃO, CONSTITUIÇÃO FEDERAL, PROCESSO LEGISLATIVO, COMPETENCIA, Conselho Federativo do Imposto sobre Bens e Serviços, INICIATIVA, PROJETO DE LEI COMPLEMENTAR (PLP), Imposto sobre Bens e Serviços (IBS), RESSALVA, PRINCIPIO JURIDICO, ANTERIORIDADE, EFEITO, AUMENTO, TRIBUTOS, MEDIDA PROVISORIA (MPV), INICIO, TRAMITAÇÃO, CAMARA DOS DEPUTADOS, SUPERIOR TRIBUNAL DE JUSTIÇA (STJ), JULGAMENTO, CONFLITO, NORMAS GERAIS, SISTEMA TRIBUTARIO NACIONAL, COOPERATIVA, MICROEMPRESA, PEQUENA EMPRESA, INCIDENCIA, FATO GERADOR, BASE DE CALCULO, ESPECIFICAÇÃO, REGIME JURIDICO, PRODUTO, COORDENAÇÃO, UNIFORMIZAÇÃO, FUNCIONAMENTO, DIVISÃO, FUNDO NACIONAL, DESENVOLVIMENTO REGIONAL, Contribuição Social sobre Bens e Serviços (CBS), FINANCIAMENTO, SEGURIDADE SOCIAL, COMPOSIÇÃO, FUNDO DE MANUTENÇÃO E DESENVOLVIMENTO DA EDUCAÇÃO BASICA E DE VALORIZAÇÃO DOS PROFISSIONAIS DA EDUCAÇÃO (FUNDEB), GARANTIA, MEIO AMBIENTE, EQUILIBRIO ECOLOGICO, REGIME FISCAL, Biocombustível.', 'PROPOSTA DE EMENDA A CONSTITUIÇÃO (PEC), ALTERAÇÃO, DISPOSIÇÕES CONSTITUCIONAIS TRANSITORIAS, DESVINCULAÇÃO, RECEITA, ESTADOS, DISTRITO FEDERAL (DF), MUNICIPIOS, EXTINÇÃO, IMPOSTOS, CONTRIBUIÇÃO, SUBSTITUIÇÃO, ALIQUOTA, DISTRIBUIÇÃO, ARRECADAÇÃO, APROVEITAMENTO, SALDO CREDOR, NORMAS, PERIODO, AUSENCIA, LEI COMPLEMENTAR, LEGISLAÇÃO, UNIÃO FEDERAL, CRITERIOS, COMPENSAÇÃO, VALOR, RECEITA TRIBUTARIA, CRIAÇÃO, CESTA DE ALIMENTOS BASICOS, DEFINIÇÃO, BENS, SERVIÇO, REDUÇÃO, CONSTITUIÇÃO FEDERAL, PROCESSO LEGISLATIVO, COMPETENCIA, Conselho Federativo do Imposto sobre Bens e Serviços, INICIATIVA, PROJETO DE LEI COMPLEMENTAR (PLP), Imposto sobre Bens e Serviços (IBS), RESSALVA, PRINCIPIO JURIDICO, ANTERIORIDADE, EFEITO, AUMENTO, TRIBUTOS, MEDIDA PROVISORIA (MPV), INICIO, TRAMITAÇÃO, CAMARA DOS DEPUTADOS, SUPERIOR TRIBUNAL DE JUSTIÇA (STJ), JULGAMENTO, CONFLITO, NORMAS GERAIS, SISTEMA TRIBUTARIO NACIONAL, COOPERATIVA, MICROEMPRESA, PEQUENA EMPRESA, INCIDENCIA, FATO GERADOR, BASE DE CALCULO, ESPECIFICAÇÃO, REGIME JURIDICO, PRODUTO, COORDENAÇÃO, UNIFORMIZAÇÃO, FUNCIONAMENTO, DIVISÃO, FUNDO NACIONAL, DESENVOLVIMENTO REGIONAL, Contribuição Social sobre Bens e Serviços (CBS), FINANCIAMENTO, SEGURIDADE SOCIAL, COMPOSIÇÃO, FUNDO DE MANUTENÇÃO E DESENVOLVIMENTO DA EDUCAÇÃO BASICA E DE VALORIZAÇÃO DOS PROFISSIONAIS DA EDUCAÇÃO (FUNDEB), GARANTIA, MEIO AMBIENTE, EQUILIBRIO ECOLOGICO, REGIME FISCAL, Biocombustível.', 'PROPOSTA DE EMENDA A CONSTITUIÇÃO (PEC), ALTERAÇÃO, DISPOSIÇÕES CONSTITUCIONAIS TRANSITORIAS, DESVINCULAÇÃO, RECEITA, ESTADOS, DISTRITO FEDERAL (DF), MUNICIPIOS, EXTINÇÃO, IMPOSTOS, CONTRIBUIÇÃO, SUBSTITUIÇÃO, ALIQUOTA, DISTRIBUIÇÃO, ARRECADAÇÃO, APROVEITAMENTO, SALDO CREDOR, NORMAS, PERIODO, AUSENCIA, LEI COMPLEMENTAR, LEGISLAÇÃO, UNIÃO FEDERAL, CRITERIOS, COMPENSAÇÃO, VALOR, RECEITA TRIBUTARIA, CRIAÇÃO, CESTA DE ALIMENTOS BASICOS, DEFINIÇÃO, BENS, SERVIÇO, REDUÇÃO, CONSTITUIÇÃO FEDERAL, PROCESSO LEGISLATIVO, COMPETENCIA, Conselho Federativo do Imposto sobre Bens e Serviços, INICIATIVA, PROJETO DE LEI COMPLEMENTAR (PLP), Imposto sobre Bens e Serviços (IBS), RESSALVA, PRINCIPIO JURIDICO, ANTERIORIDADE, EFEITO, AUMENTO, TRIBUTOS, MEDIDA PROVISORIA (MPV), INICIO, TRAMITAÇÃO, CAMARA DOS DEPUTADOS, SUPERIOR TRIBUNAL DE JUSTIÇA (STJ), JULGAMENTO, CONFLITO, NORMAS GERAIS, SISTEMA TRIBUTARIO NACIONAL, COOPERATIVA, MICROEMPRESA, PEQUENA EMPRESA, INCIDENCIA, FATO GERADOR, BASE DE CALCULO, ESPECIFICAÇÃO, REGIME JURIDICO, PRODUTO, COORDENAÇÃO, UNIFORMIZAÇÃO, FUNCIONAMENTO, DIVISÃO, FUNDO NACIONAL, DESENVOLVIMENTO REGIONAL, Contribuição Social sobre Bens e Serviços (CBS), FINANCIAMENTO, SEGURIDADE SOCIAL, COMPOSIÇÃO, FUNDO DE MANUTENÇÃO E DESENVOLVIMENTO DA EDUCAÇÃO BASICA E DE VALORIZAÇÃO DOS PROFISSIONAIS DA EDUCAÇÃO (FUNDEB), GARANTIA, MEIO AMBIENTE, EQUILIBRIO ECOLOGICO, REGIME FISCAL, Biocombustível.']"
16,546,16_PETROLEO_BRASILEIRO PETROBRAS_PETROLEO BRASILEIRO_PETROLEO BRASILEIRO PETROBRAS,"['PETROLEO', 'BRASILEIRO PETROBRAS', 'PETROLEO BRASILEIRO', 'PETROLEO BRASILEIRO PETROBRAS', 'CORRUPÇÃO PETROLEO', 'CORRUPÇÃO PETROLEO BRASILEIRO', 'CORRUPÇÃO PETROLEO BRASILEIRO PETROBRAS', 'COMBUSTIVEL', 'INVESTIGAÇÃO', 'BRASILEIRO PETROBRAS CRITICA', 'PETROBRAS CRITICA', 'PETROLEO BRASILEIRO PETROBRAS CRITICA', 'CRITICA GOVERNO FEDERAL', 'PREÇO COMBUSTIVEL', 'EXPLORAÇÃO', 'EXPLORAÇÃO PETROLEO', 'DE INQUERITO CPI', 'COMISSÃO PARLAMENTAR DE INQUERITO', 'INQUERITO CPI', 'PARLAMENTAR DE INQUERITO CPI']","['EXPLORAÇÃO', 'PRODUÇÃO', 'TRANSPORTE', 'ALIMENTOS', 'VINCULAÇÃO', 'PUNIÇÃO', 'MEIO', 'ERRADICAÇÃO', 'REMESSA', 'POSTO', 'APROXIMAÇÃO', 'FORMAÇÃO', 'RECONHECIMENTO', 'MAIORIA', 'CONFIRMAÇÃO', 'ANALFABETO', 'ASSALTO', 'PARTE', 'APRENDIZAGEM', '', '', '', '', '', '', '', '', '', '', '']","['CRITICA, INSTALAÇÃO, COMISSÃO PARLAMENTAR DE INQUERITO (CPI), PETROLEO BRASILEIRO S/A (PETROBRAS), MOTIVO, AQUISIÇÃO, REFINARIA, PETROLEO, LOCAL, PAIS ESTRANGEIRO, ESTADOS UNIDOS DA AMERICA (EUA).', 'HOMENAGEM, ANIVERSARIO DE FUNDAÇÃO, PETROLEO BRASILEIRO S/A (PETROBRAS).', 'DEFESA, MOTORISTA, CAMINHÃO, CRITICA, POLITICA, PREÇO, ADOÇÃO, PETROLEO BRASILEIRO S/A (PETROBRAS).']"
17,526,17_ACRE_DO ACRE_ACRE AC_ESTADO DO ACRE,"['ACRE', 'DO ACRE', 'ACRE AC', 'ESTADO DO ACRE', 'DO ACRE AC', 'ESTADO DO ACRE AC', 'AC ESTADO DO', 'AC ESTADO DO ACRE', 'GOVERNO ESTADUAL', 'RIO BRANCO AC', 'ACRE AC MOTIVO', 'DO ACRE AC MOTIVO', 'GOVERNADOR ESTADO DO ACRE', 'ACRE AC REGISTRO', 'DO ACRE AC REGISTRO', 'ESTADUAL ESTADO DO ACRE', 'LOCAL ESTADO DO ACRE', 'ACRE AC COMENTARIO', 'DO ACRE AC COMENTARIO', 'TIÃO VIANA GOVERNADOR']","['MEIO', 'ENERGIA', 'PRODUÇÃO', 'TRANSCRIÇÃO', 'PESQUISA', 'DESMATAMENTO', 'CAPITAL', 'EFEITO', 'FORMAÇÃO', 'OFICIAL', 'DETALHAMENTO', 'FINANCEIROS', 'MODERNIZAÇÃO', 'CURSO', 'RELEVANCIA', 'AÇÃO', 'POSSE', 'LITERATURA', 'NOTA', 'PLANEJAMENTO', 'DISCRIMINAÇÃO', 'NATURAIS', 'DEMONSTRAÇÃO', 'EVOLUÇÃO', 'DISPOSIÇÃO', 'EXPEDIÇÃO', 'MANEJO', 'ESPORTIVA', 'MENOR', 'COMPOSIÇÃO']","['REGISTRO, FESTIVAL, PRAIA, MUNICIPIO, TARAUACA (AC), ESTADO DO ACRE (AC).\n\nHOMENAGEM, ANIVERSARIO, EMANCIPAÇÃO, MUNICIPIO, EPITACIOLANDIA (AC), ESTADO DO ACRE (AC).', 'REGISTRO, GRAVIDADE, SITUAÇÃO, LOCAL, ESTADO DO ACRE (AC), CIRCUNSTANCIAS, INUNDAÇÃO, CIDADE, RIO BRANCO (AC), ASSIS BRASIL (AC), BRASILEIA (AC), XAPURI (AC), PORTO ACRE (AC), MOTIVO, EXCESSO, VOLUME, AGUA, RIO ACRE.\nCOMENTARIO, VISITA, DILMA ROUSSEFF, PRESIDENTE DA REPUBLICA, LOCAL, ESTADO DO ACRE (AC), MOTIVO, ENTREGA, HABITAÇÃO POPULAR.\nAPOIO, SENADOR, ESTADO DO ACRE (AC), MOTIVO, INVESTIGAÇÃO, OPERAÇÃO, AUTORIA, POLICIA FEDERAL, OBJETIVO, APURAÇÃO, IRREGULARIDADE, GESTÃO, PETROLEO BRASILEIRO S/A (PETROBRAS).\n.', 'HOMENAGEM, ESTADO DO ACRE (AC), MOTIVO, ANIVERSARIO, AUTONOMIA ADMINISTRATIVA.\nAPREENSÃO, CRISE, SEGURANÇA PUBLICA, ESTADO DO ACRE (AC).\n.']"
18,515,18_IMPEACHMENT_IMPEACHMENT DILMA_IMPEACHMENT DILMA ROUSSEFF_IMPEACHMENT DILMA ROUSSEFF PRESIDENTE,"['IMPEACHMENT', 'IMPEACHMENT DILMA', 'IMPEACHMENT DILMA ROUSSEFF', 'IMPEACHMENT DILMA ROUSSEFF PRESIDENTE', 'DILMA ROUSSEFF', 'ROUSSEFF PRESIDENTE', 'DILMA ROUSSEFF PRESIDENTE', 'ROUSSEFF PRESIDENTE DA REPUBLICA', 'ROUSSEFF PRESIDENTE DA', 'DILMA ROUSSEFF PRESIDENTE DA', 'PROCESSO IMPEACHMENT', 'PROCESSO IMPEACHMENT DILMA', 'PROCESSO IMPEACHMENT DILMA ROUSSEFF', 'ADMISSIBILIDADE', 'ADMISSIBILIDADE IMPEACHMENT', 'CRIME DE RESPONSABILIDADE', 'ADMISSIBILIDADE IMPEACHMENT DILMA ROUSSEFF', 'ADMISSIBILIDADE IMPEACHMENT DILMA', 'PRESIDENTE DA REPUBLICA MOTIVO', 'DA REPUBLICA MOTIVO']","['ACUSAÇÃO', 'TENTATIVA', 'CONTESTAÇÃO', 'MANDATO', 'COMPOSIÇÃO', 'CONFIANÇA', 'VERDADE', 'NOTA', 'ENTREGA', 'POSIÇÃO', 'DEFERIMENTO', '', '', '', '', '', '', '', '', '', '', '', '', '', '', '', '', '', '', '']","['COMENTARIO, PROCESSO, IMPEACHMENT, DILMA ROUSSEFF, PRESIDENTE DA REPUBLICA.', 'COMENTARIO, PROCESSO, IMPEACHMENT, DILMA ROUSSEFF, PRESIDENTE DA REPUBLICA.', 'COMENTARIO, PROCESSO, IMPEACHMENT, DILMA ROUSSEFF, PRESIDENTE DA REPUBLICA.']"
19,506,19_DO SUL RS_RIO GRANDE DO SUL_GRANDE DO SUL_GRANDE DO SUL RS,"['DO SUL RS', 'RIO GRANDE DO SUL', 'GRANDE DO SUL', 'GRANDE DO SUL RS', 'RIO GRANDE', 'RIO GRANDE DO', 'GRANDE DO', 'DO SUL', 'DO RIO GRANDE DO', 'DO RIO GRANDE', 'ESTADO DO RIO GRANDE', 'ESTADO DO RIO', 'DO RIO', 'RS ESTADO DO RIO', 'RS ESTADO DO', 'CALAMIDADE PUBLICA', 'DO SUL RS REGISTRO', 'INUNDAÇÃO', 'DO SUL RS COMENTARIO', 'RS MOTIVO']","['CHUVA', 'DISCRIMINAÇÃO', 'RACIAL', 'PESAR', 'APOSENTADO', 'JUROS', 'ELETRICA', 'DESTRUIÇÃO', 'ERRADICAÇÃO', 'NOVO', 'RESIDENCIA', 'LIMITE', 'EQUIPARAÇÃO', '', '', '', '', '', '', '', '', '', '', '', '', '', '', '', '', '']","['COMENTARIO, DISCURSO, ORADOR, AULA, UNIVERSIDADE, DIREITO, MUNICIPIO, CAXIAS DO SUL (RS), ESTADO DO RIO GRANDE DO SUL (RS), SOLICITAÇÃO, TRANSCRIÇÃO, PRONUNCIAMENTO, ANAIS DO SENADO.\nELOGIO, UNIVERSIDADE, MUNICIPIO, CAXIAS DO SUL (RS), ESTADO DO RIO GRANDE DO SUL (RS).', 'HOMENAGEM, ANIVERSARIO DE FUNDAÇÃO, SINDICATO, TRABALHADOR, INDUSTRIA GRAFICA, MUNICIPIO, PORTO ALEGRE (RS), ESTADO DO RIO GRANDE DO SUL (RS).\nHOMENAGEM, ANIVERSARIO DE FUNDAÇÃO, CENTRAL SINDICAL, TRABALHADOR, SINDICATO, METALURGICO, MUNICIPIO, VACARIA (RS), ESTADO DO RIO GRANDE DO SUL (RS).\nHOMENAGEM, ANIVERSARIO, MUNICIPIO, CANOAS (RS), ESTADO DO RIO GRANDE DO SUL (RS).\nREGISTRO, REALIZAÇÃO, FEIRA, AMBITO NACIONAL, MUNICIPIO, PELOTAS (RS), ESTADO DO RIO GRANDE DO SUL (RS).', 'COMENTARIO, SUPERIORIDADE, NUMERO, SENADOR, NASCIMENTO, ESTADO DO RIO GRANDE DO SUL (RS), REPRESENTAÇÃO, DIVERSIDADE, ESTADOS.\nLEITURA, TRECHO, EDITORIAL, HOMENAGEM, ANIVERSARIO DE FUNDAÇÃO, JORNAL, CORREIO DO POVO, ESTADO DO RIO GRANDE DO SUL (RS), ELOGIO, CONTRIBUIÇÃO, IMPRENSA.\nSAUDAÇÃO, SUPERIORIDADE, NUMERO, JORNAL, ESTADO DO RIO GRANDE DO SUL (RS), REGISTRO, DADOS.\n.']"
20,503,20_DE JANEIRO RJ_RIO DE JANEIRO RJ_JANEIRO_DE JANEIRO,"['DE JANEIRO RJ', 'RIO DE JANEIRO RJ', 'JANEIRO', 'DE JANEIRO', 'RIO DE JANEIRO', 'ESTADO DO RIO DE', 'DO RIO DE', 'DO RIO DE JANEIRO', 'ESTADO DO RIO', 'DO RIO', 'GLOBO ESTADO DO RIO', 'GLOBO ESTADO DO', 'GLOBO ESTADO', 'JORNAL GLOBO ESTADO DO', 'JORNAL GLOBO ESTADO', 'TRANSCRIÇÃO ANAIS DO', 'TRANSCRIÇÃO ANAIS DO SENADO', 'ANAIS DO SENADO', 'SOLICITAÇÃO TRANSCRIÇÃO', 'ANAIS DO SENADO ARTIGO']","['GLOBO', 'TRANSCRIÇÃO', 'ANAIS', 'CAPITAL', 'RECONHECIMENTO', 'PERDA', 'PASSAGEM', 'MANDATO', '', '', '', '', '', '', '', '', '', '', '', '', '', '', '', '', '', '', '', '', '', '']","['SOLICITAÇÃO, TRANSCRIÇÃO, ANAIS DO SENADO, ARTIGO DE IMPRENSA, JORNAL, O GLOBO, ESTADO DO RIO DE JANEIRO (RJ), AUTORIA, JOSE SERRA, RELAÇÃO, NECESSIDADE, OPOSIÇÃO, FISCALIZAÇÃO, PROGRAMA, GOVERNO FEDERAL.', 'APREENSÃO, AUMENTO, VIOLENCIA, SOLICITAÇÃO, TRANSCRIÇÃO, ANAIS DO SENADO, ARTIGO DE IMPRENSA, JORNAL, O GLOBO, ESTADO DO RIO DE JANEIRO (RJ).', 'SOLICITAÇÃO, TRANSCRIÇÃO, ANAIS DO SENADO, ARTIGO DE IMPRENSA, JORNAL, O GLOBO, ESTADO DO RIO DE JANEIRO (RJ), DISCUSSÃO, DESAPARECIMENTO, COSTUMES, SOCIEDADE, BRASIL.']"
