Topic,Count,Name,Representation,Aspect1,Representative_Docs
21,503,21_HOMENAGEM ANIVERSARIO_ANIVERSARIO DE FUNDAÇÃO_DE FUNDAÇÃO_HOMENAGEM ANIVERSARIO DE,"['HOMENAGEM ANIVERSARIO', 'ANIVERSARIO DE FUNDAÇÃO', 'DE FUNDAÇÃO', 'HOMENAGEM ANIVERSARIO DE', 'HOMENAGEM ANIVERSARIO DE FUNDAÇÃO', 'HOMENAGEM DIA NACIONAL', 'COMENTARIO HISTORIA', 'MAÇONARIA', 'HOMENAGEM CENTENARIO', 'ESTADO DE RORAIMA', 'ESTADO DE RORAIMA RR', 'DE FUNDAÇÃO MUNICIPIO', 'ANIVERSARIO DE FUNDAÇÃO MUNICIPIO', 'BRASIL HOMENAGEM', 'REGISTRO HISTORIA', 'SESSÃO ESPECIAL', 'RELIGIOSA', 'ANIVERSARIO DE NASCIMENTO', 'DE NASCIMENTO', 'DA PARAIBA']","['ENTIDADE', 'GUERRA', 'SEGUNDA GUERRA', 'ABOLIÇÃO', 'RECONHECIMENTO', 'SEGUNDA', 'RELIGIÃO', 'DESIGUALDADE', 'RELEVANCIA', 'MODERNIZAÇÃO', 'TRANSMISSÃO', 'DETALHAMENTO', 'DIVERSIDADE', 'CONSOLIDAÇÃO', 'CRISTÃO', 'EXPERIENCIA', 'LINHA', 'ENCERRAMENTO', 'MEDICINA', 'PACIFICAÇÃO', 'MOVIMENTAÇÃO', 'OCUPAÇÃO', 'NUMERO', 'ESPECIALIDADE', 'XINGU', 'CONVIDADO', 'CONHECIMENTO', 'NOME', 'UNIVERSIDADE', '']","['HOMENAGEM, ANIVERSARIO DE FUNDAÇÃO, ESTADO DA PARAIBA (PB), ELOGIO, POVO, REGIÃO.', 'HOMENAGEM, ANIVERSARIO DE FUNDAÇÃO, ESTADO DA PARAIBA (PB), ELOGIO, POVO, REGIÃO.', 'HOMENAGEM, ANIVERSARIO DE FUNDAÇÃO, ESTADO DA PARAIBA (PB).']"
22,491,22_SUPREMO TRIBUNAL FEDERAL STF_FEDERAL STF_STF_SUPREMO TRIBUNAL,"['SUPREMO TRIBUNAL FEDERAL STF', 'FEDERAL STF', 'STF', 'SUPREMO TRIBUNAL', 'TRIBUNAL FEDERAL STF', 'SUPREMO TRIBUNAL FEDERAL', 'SUPREMO', 'TRIBUNAL FEDERAL', 'TRIBUNAL DE', 'TRIBUNAL DE CONTAS', 'CONTAS DA UNIÃO TCU', 'UNIÃO TCU', 'TRIBUNAL DE CONTAS DA', 'DE CONTAS DA', 'JUDICIAL', 'JUDICIARIO', 'IRREGULARIDADE', 'RR', 'RESERVA INDIGENA', 'INVESTIGAÇÃO']","['INDIGENA', 'ESPECIFICAÇÃO', 'DEMARCAÇÃO', 'ACUSAÇÃO', 'PENAL', 'OBRAS', 'FALTA', 'FUNÇÃO', 'PODERES', 'MANIPULAÇÃO', 'PUNIÇÃO', 'ADMINISTRATIVA', 'ENTIDADE', 'DIVULGAÇÃO', 'CONSTITUCIONAIS', 'PARALISAÇÃO', 'DIVERSIDADE', 'RECURSO', 'PENA', 'OPERAÇÃO', 'NUMERO', 'TRANSCRIÇÃO', 'DEMORA', 'RESPOSTA', 'ANAIS', 'RECONHECIMENTO', 'VINCULAÇÃO', 'TRIBUNAIS', 'DEMONSTRAÇÃO', 'FRUSTRAÇÃO']","['IMPORTANCIA, CONTROLE, FISCALIZAÇÃO, CONTAS, PODER PUBLICO, TRANSPARENCIA ADMINISTRATIVA, FUNCIONAMENTO, REPUBLICA, JUSTIÇA, APLICAÇÃO DE RECURSOS, ARRECADAÇÃO, COMENTARIO, HISTORIA, DEFINIÇÃO, CONSTITUIÇÃO FEDERAL, ASSESSORIA, TRIBUNAL DE CONTAS DA UNIÃO (TCU), CONGRESSO NACIONAL, EXERCICIO, FUNÇÃO FISCALIZADORA, GARANTIA, CONTROLE EXTERNO, SIMULTANEIDADE, CONTROLE INTERNO, PODERES CONSTITUCIONAIS, SAUDAÇÃO, AMPLIAÇÃO, ACESSO, POPULAÇÃO, PUBLICIDADE, INTERNET, ATUAÇÃO, ESTADO.\nQUESTIONAMENTO, PROCESSO, DESIGNAÇÃO, PARTICIPANTE, TRIBUNAL DE CONTAS, TRIBUNAL DE CONTAS DA UNIÃO (TCU), CRITERIOS, NATUREZA POLITICA, PREJUIZO, ISENÇÃO.\nJUSTIFICAÇÃO, PROPOSTA, EMENDA CONSTITUCIONAL, AUTORIA, ORADOR, SELEÇÃO, MINISTRO, SERVIDOR, QUADRO DE PESSOAL, EXIGENCIA, EXPERIENCIA, FUNÇÃO TECNICA, QUALIFICAÇÃO, CONCURSO PUBLICO, TRIBUNAL DE CONTAS DA UNIÃO (TCU), TRIBUNAL DE CONTAS, ESTADOS, MUNICIPIOS, DISTRITO FEDERAL (DF), MODERNIZAÇÃO, AMPLIAÇÃO, INDEPENDENCIA.\n.', 'QUESTIONAMENTO, DECLARAÇÃO, PRESIDENTE DA REPUBLICA, CRITICA, ATUAÇÃO, TRIBUNAL DE CONTAS DA UNIÃO (TCU), PARALISAÇÃO, OBRAS, GOVERNO FEDERAL, DEMONSTRAÇÃO, INTERESSE, ALTERAÇÃO, ORGÃO FISCALIZADOR, POSSIBILIDADE, PUNIÇÃO, FUNCIONARIO PUBLICO, IRREGULARIDADE, SUSPENSÃO, OBRA PUBLICA, CONTESTAÇÃO, OPINIÃO, PRESIDENTE, SUPREMO TRIBUNAL FEDERAL (STF), CRITICA, VIAGEM, VISITA, OBRAS, TRANSPOSIÇÃO, RIO SÃO FRANCISCO, INDICIO, ANTECIPAÇÃO, CAMPANHA ELEITORAL, LEITURA, TRECHO, ARTIGO DE IMPRENSA.\nDEFESA, EFICACIA, TRABALHO, TRIBUNAL DE CONTAS DA UNIÃO (TCU), INVESTIGAÇÃO, DENUNCIA, IRREGULARIDADE, ADMINISTRAÇÃO PUBLICA, ESPECIFICAÇÃO, SUPERFATURAMENTO, OBRA PUBLICA, CRITICA, INTERFERENCIA, EXECUTIVO, LEGISLATIVO.\nCOMENTARIO, ARTIGO DE IMPRENSA, JORNAL, O ESTADO DE S.PAULO, ESTADO DE SÃO PAULO (SP), IMPORTANCIA, ATUAÇÃO, FUNCIONARIO PUBLICO, PARALISAÇÃO, IRREGULARIDADE, OBRAS.\nANUNCIO, ORADOR, RESTRIÇÃO, NATUREZA POLITICA, TRIBUNAL DE CONTAS DA UNIÃO (TCU), MOTIVO, RECRUTAMENTO, MINISTRO, MEMBROS, CONGRESSO NACIONAL, REGISTRO, APRESENTAÇÃO, PROJETO DE LEI, ALTERAÇÃO, INDICAÇÃO, COMPONENTE, ORGÃO PUBLICO.\nANUNCIO, APRESENTAÇÃO, ORADOR, REQUERIMENTO, COMISSÃO DE CONSTITUIÇÃO JUSTIÇA E CIDADANIA, COMISSÃO DE FISCALIZAÇÃO E CONTROLE, REALIZAÇÃO, AUDIENCIA PUBLICA, DEBATE, DIVERGENCIA, AÇÃO ADMINISTRATIVA, AÇÃO JUDICIAL, ORGÃO FISCALIZADOR, EXECUTIVO, CONVOCAÇÃO, MINISTRO DE ESTADO, MINISTERIO DO ORÇAMENTO E GESTÃO (MOG), PRESIDENTE, TRIBUNAL DE CONTAS DA UNIÃO (TCU), PROCURADOR GERAL DA REPUBLICA, INSTITUTO BRASILEIRO, AUDITORIA, OBRA PUBLICA, DIRETOR, ORGANIZAÇÃO NÃO-GOVERNAMENTAL (ONG), JUSTIFICAÇÃO, ESCLARECIMENTOS.\nDEFESA, LEGISLAÇÃO, LICITAÇÃO, APRESENTAÇÃO, SUBSTITUTIVO, PROJETO, EXECUTIVO, UNANIMIDADE, APROVAÇÃO, CAMARA DOS DEPUTADOS, ELOGIO, ATUAÇÃO, PARTIDO POLITICO, PARTIDO DOS TRABALHADORES (PT), COLABORAÇÃO, ELABORAÇÃO, PROPOSTA.\nQUESTIONAMENTO, UTILIZAÇÃO, DINHEIRO, CAIXA ECONOMICA FEDERAL (CEF), REALIZAÇÃO, FESTA, POSSE, MINISTRO, SUPREMO TRIBUNAL FEDERAL (STF), REPUDIO, CRITICA, PRESIDENCIA DA REPUBLICA, ATUAÇÃO, IMPRENSA.', 'ELOGIO, ATUAÇÃO, TRIBUNAL DE CONTAS DA UNIÃO (TCU), CONTRIBUIÇÃO, MELHORIA, ADMINISTRAÇÃO PUBLICA, GARANTIA, DEMOCRACIA, PODERES CONSTITUCIONAIS, CONTENÇÃO, GASTOS PUBLICOS, COOPERAÇÃO, ATIVIDADE, COMISSÃO, SENADO.\nREGISTRO, AMPLIAÇÃO, COMPETENCIA, TRIBUNAL DE CONTAS DA UNIÃO (TCU), VIGENCIA, LEGISLAÇÃO, RESPONSABILIDADE, NATUREZA FISCAL, DETALHAMENTO, ATIVIDADE, FISCALIZAÇÃO, CONTROLE, INVESTIMENTO, EXECUTIVO, POSSIBILIDADE, SUSPENSÃO, RECURSOS ORÇAMENTARIOS, SITUAÇÃO, IRREGULARIDADE, PREVENÇÃO, DESVIO, FUNDOS PUBLICOS.\nQUESTIONAMENTO, COMPETENCIA, ATUAÇÃO, TRIBUNAL DE CONTAS DA UNIÃO (TCU), FISCALIZAÇÃO, AGENCIA, ORGÃO REGULADOR.\nCOMENTARIO, ARTIGO DE IMPRENSA, JORNAL, CORREIO BRAZILIENSE, DISTRITO FEDERAL (DF), REGISTRO, AUMENTO, INCIDENCIA, IRREGULARIDADE, UTILIZAÇÃO, RECURSOS, SETOR PUBLICO, DEMONSTRAÇÃO, IMPORTANCIA, INSTITUIÇÃO PUBLICA, CUMPRIMENTO, ORIENTAÇÃO, TRIBUNAL DE CONTAS DA UNIÃO (TCU), OBJETIVO, APERFEIÇOAMENTO, SERVIÇO PUBLICO.']"
23,489,23_MOVIMENTO DEMOCRATICO BRASILEIRO_MOVIMENTO DEMOCRATICO_DEMOCRATICO BRASILEIRO_DEMOCRATICO,"['MOVIMENTO DEMOCRATICO BRASILEIRO', 'MOVIMENTO DEMOCRATICO', 'DEMOCRATICO BRASILEIRO', 'DEMOCRATICO', 'DEMOCRATICO BRASILEIRO PMDB', 'PARTIDO DO MOVIMENTO DEMOCRATICO', 'DO MOVIMENTO DEMOCRATICO', 'DO MOVIMENTO DEMOCRATICO BRASILEIRO', 'MOVIMENTO DEMOCRATICO BRASILEIRO PMDB', 'SOCIAL DEMOCRACIA', 'DA SOCIAL DEMOCRACIA BRASILEIRA', 'DEMOCRACIA BRASILEIRA', 'BRASILEIRA PSDB', 'DEMOCRACIA BRASILEIRA PSDB', 'SOCIAL DEMOCRACIA BRASILEIRA PSDB', 'PARTIDO DA SOCIAL', 'PARTIDO DA SOCIAL DEMOCRACIA', 'SOCIAL DEMOCRACIA BRASILEIRA', 'DA SOCIAL DEMOCRACIA', 'POLITICO PARTIDO DO']","['CONFIANÇA', 'MAIORIA', 'FALTA', 'DIVERSIDADE', 'ASSUNTOS', 'CAPITAL', 'NUMERO', 'DOUTRINA', 'DIGNIDADE', '', '', '', '', '', '', '', '', '', '', '', '', '', '', '', '', '', '', '', '', '']","['COMENTARIO, REALIZAÇÃO, CONFERENCIA NACIONAL, PARTIDO POLITICO, PARTIDO DO MOVIMENTO DEMOCRATICO BRASILEIRO (PMDB), MUNICIPIOS, PARTICIPAÇÃO, LIDERANÇA, POLITICA, AUTORIDADE, APRESENTAÇÃO, PROPOSTA, DISCUSSÃO, ASSOCIADO.\nAGRADECIMENTO, PARTICIPANTE, CONFERENCIA NACIONAL, PARTIDO DO MOVIMENTO DEMOCRATICO BRASILEIRO (PMDB), MUNICIPIOS.', 'CONGRATULAÇÕES, FILIAÇÃO PARTIDARIA, EMPRESARIO, DEPUTADO FEDERAL, ESTADO DE SÃO PAULO (SP), PARTIDO POLITICO, PARTIDO DO MOVIMENTO DEMOCRATICO BRASILEIRO (PMDB).\nAPOIO, PARTIDO POLITICO, PARTIDO DO MOVIMENTO DEMOCRATICO BRASILEIRO (PMDB), REIVINDICAÇÃO, MOBILIZAÇÃO, PREFEITO, MARCHA, DISTRITO FEDERAL (DF), DEFESA, INTERESSE, MUNICIPIOS.', 'REGISTRO, REUNIÃO, PARTIDO POLITICO, PARTIDO DO MOVIMENTO DEMOCRATICO BRASILEIRO (PMDB), VOTAÇÃO, ESCOLHA, NOME, GARIBALDI ALVES FILHO, SENADOR, PRESIDENTE, SENADO.\nAGRADECIMENTO, COOPERAÇÃO, LIDER, SENADO, PARTIDO POLITICO, DEMOCRATAS (DEM), PARTIDO DA SOCIAL DEMOCRACIA BRASILEIRA (PSDB), PARTIDO SOCIALISMO E LIBERDADE (PSOL), PARTIDO REPUBLICANO (PRE), PARTIDO SOCIALISTA BRASILEIRO (PSB), PARTIDO COMUNISTA DO BRASIL (PC DO B), PARTIDO DO MOVIMENTO DEMOCRATICO BRASILEIRO (PMDB), LIDERANÇA, GOVERNO, CONGRESSO NACIONAL.']"
24,485,24_LEI CRIAÇÃO LEI FEDERAL_DE LEI CRIAÇÃO LEI_LEI CRIAÇÃO LEI_CRIAÇÃO LEI FEDERAL,"['LEI CRIAÇÃO LEI FEDERAL', 'DE LEI CRIAÇÃO LEI', 'LEI CRIAÇÃO LEI', 'CRIAÇÃO LEI FEDERAL', 'PROJETO DE LEI CRIAÇÃO', 'LEI CRIAÇÃO', 'DE LEI CRIAÇÃO', 'LEI ALTERAÇÃO LEI FEDERAL', 'LEI ALTERAÇÃO LEI', 'DE LEI ALTERAÇÃO LEI', 'ALTERAÇÃO LEI FEDERAL', 'CRIAÇÃO LEI', 'PROJETO DE LEI ALTERAÇÃO', 'DE LEI ALTERAÇÃO', 'ALTERAÇÃO LEI', 'DISCUSSÃO PROJETO DE LEI', 'PARECER PROJETO DE LEI', 'RELATOR PARECER PROJETO DE', 'ALTERAÇÃO LEI FEDERAL REQUISITOS', 'FEDERAL REQUISITOS SALARIO MINIMO']","['VAGA', 'REQUISITOS', 'SEPARADO', 'COMPOSIÇÃO', 'PROFISSÃO', 'ENTIDADE', 'MARCA', 'PARTO', 'TRANSMISSÃO', '', '', '', '', '', '', '', '', '', '', '', '', '', '', '', '', '', '', '', '', '']","['DISCUSSÃO, PROJETO DE LEI, ALTERAÇÃO, LEI FEDERAL, REQUISITOS, SALARIO MINIMO, RENDA PER CAPITA, FAMILIA, PREENCHIMENTO, VAGA, INSTITUIÇÃO FEDERAL DE ENSINO, CURSO TECNICO, ENSINO MEDIO, RESERVA, ESTUDANTE, ORIGEM, ESCOLA PUBLICA, COMPETENCIA, ACOMPANHAMENTO, AVALIAÇÃO.', 'DISCUSSÃO, PROJETO DE LEI, ALTERAÇÃO, LEI FEDERAL, REQUISITOS, SALARIO MINIMO, RENDA PER CAPITA, FAMILIA, PREENCHIMENTO, VAGA, INSTITUIÇÃO FEDERAL DE ENSINO, CURSO TECNICO, ENSINO MEDIO, RESERVA, ESTUDANTE, ORIGEM, ESCOLA PUBLICA, COMPETENCIA, ACOMPANHAMENTO, AVALIAÇÃO.', 'DISCUSSÃO, PROJETO DE LEI, ALTERAÇÃO, LEI FEDERAL, REQUISITOS, SALARIO MINIMO, RENDA PER CAPITA, FAMILIA, PREENCHIMENTO, VAGA, INSTITUIÇÃO FEDERAL DE ENSINO, CURSO TECNICO, ENSINO MEDIO, RESERVA, ESTUDANTE, ORIGEM, ESCOLA PUBLICA, COMPETENCIA, ACOMPANHAMENTO, AVALIAÇÃO.']"
25,483,25_AGRICULTURA_PRODUTOR RURAL_AGRICOLA_AGRICULTURA PECUARIA,"['AGRICULTURA', 'PRODUTOR RURAL', 'AGRICOLA', 'AGRICULTURA PECUARIA', 'PRODUÇÃO', 'DA AGRICULTURA', 'DA AGRICULTURA PECUARIA', 'MINISTERIO DA AGRICULTURA', 'MINISTERIO DA AGRICULTURA PECUARIA', 'AGRICULTURA PECUARIA ABASTECIMENTO', 'DA AGRICULTURA PECUARIA ABASTECIMENTO', 'PECUARIA ABASTECIMENTO', 'PECUARIA ABASTECIMENTO MAPA', 'AGRICULTURA PECUARIA ABASTECIMENTO MAPA', 'PEQUENO PRODUTOR RURAL', 'TRABALHADOR RURAL', 'PRODUÇÃO AGRICOLA', 'COMISSÃO DE AGRICULTURA', 'DE AGRICULTURA', 'AGRICULTOR']","['AGRICULTURA', 'PRODUÇÃO', 'AGRICULTOR', 'ZONA', 'CONFEDERAÇÃO', 'PREÇO', 'FORMAÇÃO', 'JUROS', 'RELEVANCIA', 'ENTREGA', 'GADO', 'FALTA', 'CREDITOS', 'PLANEJAMENTO', 'OPERAÇÃO', 'MODERNIZAÇÃO', 'DIVULGAÇÃO', 'EDIÇÃO', 'DOENÇA', 'REVISÃO', 'OCUPAÇÃO', 'DETERMINAÇÃO', 'TENTATIVA', 'DIVERSIDADE', 'CAMINHÃO', 'PERDA', 'ADVOGADO', 'COLORADO', 'AVISO', 'APRENDIZAGEM']","['REGISTRO, LANÇAMENTO, GOVERNO FEDERAL, PLANO, SAFRA, AGRICULTURA FAMILIAR, OBJETIVO, ASSISTENCIA, CREDITO RURAL, PEQUENO PRODUTOR RURAL, GARANTIA, PRODUÇÃO AGRICOLA, SEGURO AGRARIO, ASSISTENCIA TECNICA, IMPORTANCIA, EDUCAÇÃO, FAMILIA, PRODUTOR, MELHORIA, ZONA RURAL.', 'ANUNCIO, AUDIENCIA PUBLICA, COMISSÃO DE AGRICULTURA, REPRESENTANTE, SETOR, AGRICULTURA, CAFE, MINISTERIO DA AGRICULTURA PECUARIA E ABASTECIMENTO (MAPA), DEBATE, OBJETIVO, RESOLUÇÃO, CRISE, GEADA, PREJUIZO, SAFRA, CAFEICULTOR.', 'ELOGIO, GOVERNO FEDERAL, MICHEL TEMER, PRESIDENTE DA REPUBLICA, BLAIRO MAGGI, MINISTRO DE ESTADO, MINISTERIO DA AGRICULTURA PECUARIA E ABASTECIMENTO (MAPA), MOTIVO, LANÇAMENTO, PROGRAMA, PRODUTIVIDADE, AGRONEGOCIO.\n\nREGISTRO, REALIZAÇÃO, AUDIENCIA, COMISSÃO DE AGRICULTURA E REFORMA AGRARIA, SENADO, ASSUNTO, PLANO, ERRADICAÇÃO, FEBRE AFTOSA, PARTICIPAÇÃO, WALDEMIR MOKA, IVO CASSOL, SENADOR, ELOGIO, ATUAÇÃO, MINISTERIO DA AGRICULTURA PECUARIA E ABASTECIMENTO (MAPA).\n']"
26,475,26_AMBIENTE_MEIO AMBIENTE_MEIO_FLORESTAL,"['AMBIENTE', 'MEIO AMBIENTE', 'MEIO', 'FLORESTAL', 'INTERNACIONAL MEIO', 'INTERNACIONAL MEIO AMBIENTE', 'DO MEIO AMBIENTE', 'DESENVOLVIMENTO SUSTENTAVEL', 'CONFERENCIA', 'MINISTERIO DO MEIO AMBIENTE', 'AMBIENTAL', 'DO MEIO AMBIENTE MMA', 'AMBIENTE MMA', 'MEIO AMBIENTE MMA', 'PRESERVAÇÃO MEIO', 'PRESERVAÇÃO MEIO AMBIENTE', 'MEIO AMBIENTE COMENTARIO', 'AMBIENTE COMENTARIO', 'RIO DE JANEIRO RJ', 'DE JANEIRO']","['MEIO', 'DESMATAMENTO', 'PRODUÇÃO', 'LIXO', 'ANAIS', 'TRANSCRIÇÃO', 'RELEVANCIA', 'RECICLAGEM', 'PESQUISA', 'DEMARCAÇÃO', 'ELETRICA', 'DIVULGAÇÃO', 'TRANSMISSÃO', 'DEMORA', 'PUNIÇÃO', 'EXPEDIÇÃO', 'ASSUNTOS', 'GLOBO', 'PLUVIAIS', 'APARTHEID', 'ROTINA', '', '', '', '', '', '', '', '', '']","['HOMENAGEM, DIA INTERNACIONAL, MEIO AMBIENTE.', 'HOMENAGEM, DIA INTERNACIONAL, MEIO AMBIENTE, COMENTARIO, IMPORTANCIA, AMPLIAÇÃO, PRESERVAÇÃO, NATUREZA.\nCOMENTARIO, REALIZAÇÃO, SOLENIDADE, CONFERENCIA INTERNACIONAL, MEIO AMBIENTE, ESTADO DO RIO DE JANEIRO (RJ), OBJETIVO, DEBATE, IMPORTANCIA, UTILIZAÇÃO, SUSTENTABILIDADE, ECONOMIA, FATO, BENEFICIO, MEIO AMBIENTE, AUXILIO, ERRADICAÇÃO, POBREZA.', 'RECOMENDAÇÃO, LEITURA, TEXTO, AUTORIA, CONSULTOR, SENADO, REFERENCIA, PROCESSO, LICENCIAMENTO, MEIO AMBIENTE, COMENTARIO, NECESSIDADE, CONGRESSO NACIONAL, APROVAÇÃO, LEGISLAÇÃO, MODERNIZAÇÃO, AUSENCIA, BUROCRACIA, POLITICA DO MEIO AMBIENTE.\nCOMENTARIO, DEFESA, ORADOR, APROVAÇÃO, CODIGO FLORESTAL, CRITICA, DESMATAMENTO, REGISTRO, REALIZAÇÃO, CONFERENCIA INTERNACIONAL, MEIO AMBIENTE, ESTADO DO RIO DE JANEIRO (RJ), NECESSIDADE, PRODUÇÃO, TEXTO, BENEFICIO, BRASIL, MUNDO, INCENTIVO, PRODUÇÃO AGRICOLA, PRESERVAÇÃO, POLITICA DO MEIO AMBIENTE, DESENVOLVIMENTO SUSTENTAVEL.']"
27,473,27_MT_DE MATO GROSSO_GROSSO MT_MATO GROSSO MT,"['MT', 'DE MATO GROSSO', 'GROSSO MT', 'MATO GROSSO MT', 'DE MATO GROSSO MT', 'ESTADO DE MATO', 'ESTADO DE MATO GROSSO', 'MATO', 'MATO GROSSO', 'MT ESTADO DE', 'MT ESTADO DE MATO', 'MATO GROSSO MT ESTADO', 'GROSSO MT ESTADO', 'GROSSO MT ESTADO DE', 'PRODUÇÃO', 'AGRICOLA', 'PRODUTOR RURAL', 'AGRARIA', 'AMBIENTE', 'AGRICULTURA PECUARIA']","['PRODUÇÃO', 'MEIO', 'AGRICULTOR', 'PRODUTIVIDADE', 'RODOVIA', 'FALTA', 'OBRAS', 'CAPITAL', 'EFEITO', 'ENERGIA', 'DEMONSTRAÇÃO', 'ELETRICA', 'MODERNIZAÇÃO', 'DESIGUALDADE', 'CONCLUSÃO', 'CREDITOS', 'POSSE', 'AGRAVAÇÃO', 'NATURAIS', 'CONSOLIDAÇÃO', 'JUROS', 'FORMAÇÃO', 'SEGURO', 'REVISÃO', 'EXTERNO', 'DEMORA', 'SOLENIDADE', 'LUCRO', 'OCUPAÇÃO', 'CONDIÇÕES']","['DEPOIMENTO, VISITA, MUNICIPIOS, ESTADO DE MATO GROSSO (MT), ESTADO DE MATO GROSSO (MT), ELOGIO, PROCESSO ELEITORAL, COMENTARIO, ACOMPANHAMENTO, MINISTRO DE ESTADO, MINISTERIO DA EDUCAÇÃO (MEC), ANUNCIO, EXPANSÃO, VAGA, UNIVERSIDADE FEDERAL, DESCENTRALIZAÇÃO, ENSINO SUPERIOR, INTERIOR, ABERTURA, CENTRO FEDERAL DE EDUCAÇÃO TECNOLOGICA (CEFET), AMPLIAÇÃO, ORÇAMENTO.\nSAUDAÇÃO, REITOR, CANDIDATO ELEITO, REITORIA, UNIVERSIDADE FEDERAL DE MATO GROSSO (UFMT), ELOGIO, COMPETENCIA.\nCOMPROVAÇÃO, APROVAÇÃO, POPULAÇÃO, ESTADO DE MATO GROSSO (MT), ESTADO DE MATO GROSSO (MT), GOVERNO FEDERAL, PRESIDENTE DA REPUBLICA.\nREGISTRO, VISITA, MUNICIPIO, COCALINHO (MT), ESTADO DE MATO GROSSO (MT), ESTADO DE MATO GROSSO (MT), SAUDAÇÃO, CHEGADA, TELEFONIA, TELEFONE CELULAR, PROGRAMA, ACESSO, ENERGIA ELETRICA.\nCOMENTARIO, ARTIGO DE IMPRENSA, INTERNET, DADOS, SUPERIORIDADE, CRESCIMENTO ECONOMICO, ESTADO DE MATO GROSSO (MT), ESTADO DE MATO GROSSO (MT), INDUSTRIALIZAÇÃO, AGREGAÇÃO, VALOR, MATERIA-PRIMA, APREENSÃO, PARALISAÇÃO, ECONOMIA, REGIÃO, CAPITAL DE ESTADO, NECESSIDADE, INVESTIMENTO, INFRAESTRUTURA, LOGISTICA, REVISÃO, SITUAÇÃO, REGISTRO, GESTÃO, ORADOR, PROMOÇÃO, ENCONTRO, EMPRESARIO, DIRIGENTE, BANCO MUNDIAL, BUSCA, SOLUÇÃO, DIVERSIFICAÇÃO, PRODUÇÃO, DESENVOLVIMENTO SUSTENTAVEL.', 'APREENSÃO, REFERENCIA, PRECARIEDADE, SITUAÇÃO, HOSPITAL, LOCAL, MUNICIPIO, VARZEA GRANDE (MT), ESTADO DE MATO GROSSO (MT), ESTADO DE MATO GROSSO (MT), CRITICA, AUSENCIA, INVESTIMENTO, INFRAESTRUTURA, AQUISIÇÃO, MEDICAMENTOS.\nCRITICA, INFRAESTRUTURA, ESTRADA, LOCAL, ESTADO DE MATO GROSSO (MT), ESTADO DE MATO GROSSO (MT), COBRANÇA, PEDAGIO, MOTIVO, AUSENCIA, MANUTENÇÃO, RODOVIA.\nCOMENTARIO, SITUAÇÃO, SEGURANÇA PUBLICA, AUSENCIA, INVESTIMENTO, EQUIPAMENTOS, RESULTADO, AUMENTO, VIOLENCIA, LOCAL, ESTADO DE MATO GROSSO (MT), ESTADO DE MATO GROSSO (MT).', 'REGISTRO, VISITA, ORADOR, MUNICIPIOS, ESTADO DE MATO GROSSO (MT), ESTADO DE MATO GROSSO (MT), PRESENÇA, SESSÃO, ASSEMBLEIA LEGISLATIVA, DEBATE, ORÇAMENTO, UNIÃO FEDERAL, IMPORTANCIA, DESCENTRALIZAÇÃO.\nCOMENTARIO, RECEBIMENTO, TITULO, CIDADÃO, MUNICIPIO, IPIRANGA DO NORTE (MT), CLAUDIA (MT), ESTADO DE MATO GROSSO (MT), ESTADO DE MATO GROSSO (MT).\nCOMENTARIO, SITUAÇÃO, MUNICIPIO, CLAUDIA (MT), ESTADO DE MATO GROSSO (MT), ESTADO DE MATO GROSSO (MT), ANTERIORIDADE, CRISE, AGRICULTURA, DIVERSIFICAÇÃO, PRODUTO AGROPECUARIO, PROTEÇÃO, MEIO AMBIENTE, CRITICA, AUSENCIA, RODOVIA.\nANALISE, GRAVIDADE, SITUAÇÃO, RODOVIA, INFRAESTRUTURA, LOGISTICA, TRANSPORTE, ESTADO DE MATO GROSSO (MT), ESTADO DE MATO GROSSO (MT), ANUNCIO, PROGRAMA, ACELERAÇÃO, CRESCIMENTO, OBRAS, ESTRUTURAÇÃO, IMPORTANCIA, AMBITO REGIONAL, DEFESA, TRANSPORTE INTERMODAL, AGILIZAÇÃO, ESCOLHA, DIRIGENTE, DEPARTAMENTO NACIONAL DE INFRA-ESTRUTURA DOS TRANSPORTES (DNIT).']"
28,471,28_CATARINA_DE SANTA CATARINA_SANTA CATARINA_DE SANTA,"['CATARINA', 'DE SANTA CATARINA', 'SANTA CATARINA', 'DE SANTA', 'ESTADO DE SANTA CATARINA', 'ESTADO DE SANTA', 'SANTA CATARINA SC', 'CATARINA SC', 'DE SANTA CATARINA SC', 'SANTA', 'SC ESTADO DE SANTA', 'SANTA CATARINA SC REGISTRO', 'CATARINA SC REGISTRO', 'HOMENAGEM POSTUMA', 'GOVERNADOR ESTADO DE SANTA', 'INUNDAÇÃO', 'SANTA CATARINA SC COMENTARIO', 'CATARINA SC COMENTARIO', 'SC ELOGIO', 'CALAMIDADE PUBLICA']","['UNIVERSIDADE', 'PRODUÇÃO', 'PESAR', 'PESQUISA', 'CHUVA', 'EFEITO', 'DIVULGAÇÃO', 'SUPERIOR', 'ENTIDADE', 'FINANCEIROS', 'NUMERO', 'EVOLUÇÃO', 'CAPITAL', 'EXPERIENCIA', 'PREFEITURA', 'DESTRUIÇÃO', 'RECONHECIMENTO', 'DETERMINAÇÃO', 'CURSO', 'APRENDIZAGEM', 'CREDITOS', 'ALIMENTOS', 'FINANCEIRA', 'PROXIMIDADE', 'DEMORA', 'FALTA', 'COMPENSAÇÃO', 'MATERIAL', 'VAGA', 'REGIONALIZAÇÃO']","['COMENTARIO, PARTICIPAÇÃO, ORADOR, REUNIÃO, CRISTIANO ZANIN, MINISTRO, SUPREMO TRIBUNAL FEDERAL (STF), DISCUSSÃO, ACORDO, ESTADO DE SANTA CATARINA (SC), UNIÃO, OBJETIVO, RETOMADA, CONSTRUÇÃO, AEROPORTO, MUNICIPIO, NAVEGANTES (SC).\nSAUDAÇÃO, REALIZAÇÃO, PARCERIA PUBLICO-PRIVADA (PPP), CONCESSÃO, CONSTRUÇÃO, TERMINAL, PASSAGEIRO, AEROPORTO, MUNICIPIO, JAGUARUNA (SC), ESTADO DE SANTA CATARINA (SC).\nSOLICITAÇÃO, SILVIO COSTA FILHO, MINISTRO DE ESTADO, MINISTERIO DE PORTOS E AEROPORTOS, MANUTENÇÃO, LOCALIDADE, MUNICIPIO, ITAJAI (SC), ESTADO DE SANTA CATARINA (SC), GESTÃO, ATIVIDADE PORTUARIA, PORTO DE ITAJAI.', 'HOMENAGEM, BOMBEIRO, CIVIL, ESTADO DE SANTA CATARINA (SC).', 'HOMENAGEM, AGRONOMO, GLAUCO OLINGER, ORIGEM, ESTADO DE SANTA CATARINA (SC), ANIVERSARIO DE NASCIMENTO.']"
29,450,29_FINANCEIRA CPMF_PROVISORIA SOBRE MOVIMENTAÇÃO FINANCEIRA_PROVISORIA SOBRE MOVIMENTAÇÃO_CONTRIBUIÇÃO PROVISORIA,"['FINANCEIRA CPMF', 'PROVISORIA SOBRE MOVIMENTAÇÃO FINANCEIRA', 'PROVISORIA SOBRE MOVIMENTAÇÃO', 'CONTRIBUIÇÃO PROVISORIA', 'CONTRIBUIÇÃO PROVISORIA SOBRE', 'MOVIMENTAÇÃO FINANCEIRA CPMF', 'PROVISORIA SOBRE', 'CONTRIBUIÇÃO PROVISORIA SOBRE MOVIMENTAÇÃO', 'SOBRE MOVIMENTAÇÃO FINANCEIRA CPMF', 'SOBRE MOVIMENTAÇÃO FINANCEIRA', 'MOVIMENTAÇÃO FINANCEIRA', 'FINANCEIRA', 'PRORROGAÇÃO CONTRIBUIÇÃO', 'PRORROGAÇÃO CONTRIBUIÇÃO PROVISORIA SOBRE', 'PRORROGAÇÃO CONTRIBUIÇÃO PROVISORIA', 'EXTINÇÃO CONTRIBUIÇÃO', 'EXTINÇÃO CONTRIBUIÇÃO PROVISORIA SOBRE', 'EXTINÇÃO CONTRIBUIÇÃO PROVISORIA', 'SAUDE PUBLICA', 'REFORMA TRIBUTARIA']","['FINANCEIRA', 'PRORROGAÇÃO', 'TENTATIVA', 'FALTA', 'VERBA', 'MANIPULAÇÃO', 'POSIÇÃO', 'CARGA', 'ANAIS', 'TRANSCRIÇÃO', 'ACUSAÇÃO', 'JUROS', 'FINANCEIROS', 'AGRAVAÇÃO', 'REIVINDICAÇÃO', 'CIRCULAÇÃO', 'DESIGUALDADE', 'PODER', 'CREDITOS', 'RELEVANCIA', 'PRODUÇÃO', 'DIVERSIDADE', 'DEMORA', 'FORMAÇÃO', 'EDITORIAL', 'LAVAGEM', 'MATERIAL', 'OFERTA', 'EXPANSÃO', 'RELACIONAMENTO']","['ELOGIO, DECISÃO, SENADO, DESAPROVAÇÃO, PRORROGAÇÃO, CONTRIBUIÇÃO PROVISORIA SOBRE A MOVIMENTAÇÃO FINANCEIRA (CPMF), REGISTRO, ARTIGO DE IMPRENSA, JORNAL, JORNAL DO BRASIL, ESTADO DO RIO DE JANEIRO (RJ), IMPORTANCIA, EXTINÇÃO, TRIBUTAÇÃO, FAVORECIMENTO, CONSUMIDOR, CRESCIMENTO, ECONOMIA.\nCRITICA, PRESIDENTE DA REPUBLICA, ENCAMINHAMENTO, CARTA, VOTAÇÃO, CONTRIBUIÇÃO PROVISORIA SOBRE A MOVIMENTAÇÃO FINANCEIRA (CPMF), TENTATIVA, NEGOCIAÇÃO, PRORROGAÇÃO, INCLUSÃO, PROPOSTA, DESTINAÇÃO, PERCENTAGEM, RECURSOS, TRIBUTAÇÃO, IDOSO, APOSENTADO, ESCLARECIMENTOS, DIVERGENCIA, CONDUTA, GOVERNO, VETO PARCIAL, PROJETO, AUMENTO, APOSENTADORIA.\nESCLARECIMENTOS, EXTINÇÃO, CONTRIBUIÇÃO PROVISORIA SOBRE A MOVIMENTAÇÃO FINANCEIRA (CPMF), AUSENCIA, AGRAVAÇÃO, SERVIÇO DE SAUDE, SUGESTÃO, GOVERNO FEDERAL, REDISTRIBUIÇÃO, RECURSOS, IMPOSTO SOBRE CIRCULAÇÃO DE MERCADORIAS E SERVIÇOS (ICMS), AUMENTO, VERBA, MUNICIPIOS, ESTADOS, IMPORTANCIA, REDUÇÃO, TRIBUTOS.\nELOGIO, OPINIÃO, FERNANDO HENRIQUE CARDOSO, EX PRESIDENTE DA REPUBLICA, DEFESA, EXTINÇÃO, CONTRIBUIÇÃO PROVISORIA SOBRE A MOVIMENTAÇÃO FINANCEIRA (CPMF), IMPORTANCIA, RECONHECIMENTO, EXPERIENCIA, POLITICO.', 'REGISTRO, REALIZAÇÃO, AUDIENCIA PUBLICA, COMISSÃO DE CONSTITUIÇÃO JUSTIÇA E CIDADANIA, DISCUSSÃO, PRORROGAÇÃO, CONTRIBUIÇÃO PROVISORIA SOBRE A MOVIMENTAÇÃO FINANCEIRA (CPMF).\nCOMENTARIO, PESQUISA, OPINIÃO PUBLICA, DEMONSTRAÇÃO, DESAPROVAÇÃO, PRORROGAÇÃO, CONTRIBUIÇÃO PROVISORIA SOBRE A MOVIMENTAÇÃO FINANCEIRA (CPMF), DEFESA, POSSIBILIDADE, CRESCIMENTO ECONOMICO, MELHORIA, PRODUTO INTERNO BRUTO (PIB), EXTINÇÃO, TRIBUTAÇÃO.\nANALISE, PARTICIPAÇÃO, ANTONIO PALLOCCI, DEPUTADO FEDERAL, EX MINISTRO DE ESTADO, MINISTERIO DA FAZENDA (MF), APRESENTAÇÃO, DADOS, IMPORTANCIA, APROVAÇÃO, CONTINUAÇÃO, CONTRIBUIÇÃO PROVISORIA SOBRE A MOVIMENTAÇÃO FINANCEIRA (CPMF), CONGRESSO NACIONAL.\nDETALHAMENTO, PERIODO, ANTERIORIDADE, CONTRIBUIÇÃO PROVISORIA SOBRE A MOVIMENTAÇÃO FINANCEIRA (CPMF), DEMONSTRAÇÃO, PRECARIEDADE, SITUAÇÃO, ECONOMIA NACIONAL, DEFESA, EVOLUÇÃO, ECONOMIA, ATUALIDADE, NECESSIDADE, SENADO, EXTINÇÃO, CONTRIBUIÇÃO, BENEFICIO, POPULAÇÃO, PAIS.', 'SOLICITAÇÃO, TRANSCRIÇÃO, ANAIS DO SENADO, ARTIGO DE IMPRENSA, COMPROVAÇÃO, INFERIORIDADE, QUANTIDADE, ESTUDANTE, CURSO SUPERIOR, ANTERIORIDADE, APERFEIÇOAMENTO, CURSO TECNICO, COMPARAÇÃO, PAIS INDUSTRIALIZADO, REGISTRO, EMPENHO, LUIZ INACIO LULA DA SILVA, PRESIDENTE DA REPUBLICA, INCENTIVO, AUMENTO, ALUNO, ENSINO PROFISSIONALIZANTE, CONSTRUÇÃO, ESCOLA TECNICA.\nIMPORTANCIA, PRORROGAÇÃO, CONTRIBUIÇÃO PROVISORIA SOBRE A MOVIMENTAÇÃO FINANCEIRA (CPMF), CONTENÇÃO, SONEGAÇÃO, CORRUPÇÃO, AUMENTO, FISCALIZAÇÃO.\nAPRESENTAÇÃO, DADOS, DEMONSTRAÇÃO, INFERIORIDADE, POPULAÇÃO, BAIXA RENDA, CONTRIBUIÇÃO, CONTRIBUIÇÃO PROVISORIA SOBRE A MOVIMENTAÇÃO FINANCEIRA (CPMF), REGISTRO, APREENSÃO, POSSIBILIDADE, EXTINÇÃO, TRIBUTO FEDERAL, PREJUIZO, SAUDE PUBLICA, ANALISE, REDUÇÃO, INVESTIMENTO, PREJUIZO, AFETAÇÃO, FUNDO ESPECIAL, COMBATE, POBREZA.\nCOMENTARIO, DIALOGO, CRISTOVAM BUARQUE, SENADOR, COMPROVAÇÃO, AUMENTO, INVESTIMENTO, EDUCAÇÃO, EXTINÇÃO, INCIDENCIA, DESVINCULAÇÃO, RECEITA, UNIÃO FEDERAL, CONTRIBUIÇÃO PROVISORIA SOBRE A MOVIMENTAÇÃO FINANCEIRA (CPMF).\nAPRESENTAÇÃO, DADOS, DETALHAMENTO, INVESTIMENTO, GOVERNO FEDERAL, UTILIZAÇÃO, CONTRIBUIÇÃO PROVISORIA SOBRE A MOVIMENTAÇÃO FINANCEIRA (CPMF), REGIÃO NORTE, REGIÃO SUL, REGIÃO NORDESTE, REGIÃO SUDESTE, REGIÃO CENTRO OESTE, ESPECIFICAÇÃO, PREVIDENCIA SOCIAL, SAUDE, BOLSA FAMILIA.\nCOMENTARIO, PARTICIPAÇÃO, CONFERENCIA INTERNACIONAL, PAIS ESTRANGEIRO, AMERICA CENTRAL, AMERICA LATINA, DISCUSSÃO, POLICIA, IDOSO, COMENTARIO, RECEBIMENTO, PEDIDO, EMPENHO, ORADOR, APROVAÇÃO, PRORROGAÇÃO, CONTRIBUIÇÃO PROVISORIA SOBRE A MOVIMENTAÇÃO FINANCEIRA (CPMF).\nREGISTRO, PARTICIPAÇÃO, ADIB JATENE, EX MINISTRO DE ESTADO, MINISTERIO DA SAUDE (MS), CRIADOR, CONTRIBUIÇÃO PROVISORIA SOBRE A MOVIMENTAÇÃO FINANCEIRA (CPMF), REUNIÃO, COMISSÃO, DIREITOS HUMANOS, ANALISE, IMPORTANCIA, CONTINUAÇÃO, CONTRIBUIÇÃO.']"
