Topic,Count,Name,Representation,Aspect1,Representative_Docs
40,261,40_TELECOMUNICAÇÕES_DE TELECOMUNICAÇÕES_DE CORREIOS TELEGRAFOS_CORREIOS TELEGRAFOS,"['TELECOMUNICAÇÕES', 'DE TELECOMUNICAÇÕES', 'DE CORREIOS TELEGRAFOS', 'CORREIOS TELEGRAFOS', 'CORREIOS TELEGRAFOS ECT', 'TELEGRAFOS ECT', 'DE CORREIOS TELEGRAFOS ECT', 'BRASILEIRA DE CORREIOS TELEGRAFOS', 'EMPRESA BRASILEIRA DE CORREIOS', 'BRASILEIRA DE CORREIOS', 'NACIONAL DE TELECOMUNICAÇÕES', 'TELECOMUNICAÇÕES ANATEL', 'NACIONAL DE TELECOMUNICAÇÕES ANATEL', 'AGENCIA NACIONAL DE TELECOMUNICAÇÕES', 'DE TELECOMUNICAÇÕES ANATEL', 'TELEVISÃO', 'EMPRESA DE TELECOMUNICAÇÕES', 'TELEFONIA', 'TELECOMUNICAÇÃO', 'COMUNICAÇÕES']","['CORREIOS', 'COMUNICAÇÕES', 'CELULAR', 'RADIO', 'CIENCIA', 'VELOCIDADE', 'UNIVERSIDADE', 'ANAIS', 'TRANSCRIÇÃO', 'ABERTA', 'MODERNIZAÇÃO', 'APOSENTADO', 'DISPONIBILIDADE', 'FORMAÇÃO', 'EQUIPAMENTOS', 'FALTA', 'RECLAMAÇÃO', 'CONTRATAÇÃO', 'REMESSA', 'PRODUÇÃO', 'CARENTE', 'DEMANDA', 'RENOVAÇÃO', 'REVISÃO', 'SEGURO', 'ELETRICA', 'FERIADO', 'DESIGUALDADE', 'RELEVANCIA', 'DEMONSTRAÇÃO']","['JUSTIFICAÇÃO, RETIRADA, ASSINATURA, COMISSÃO PARLAMENTAR DE INQUERITO (CPI), INVESTIGAÇÃO, EMPRESA BRASILEIRA DE CORREIOS E TELEGRAFOS (ECT).\nCOMENTARIO, ORADOR, PARTICIPAÇÃO, REUNIÃO, PRESIDENTE, EMPRESA ESTATAL, EMPRESA BRASILEIRA DE CORREIOS E TELEGRAFOS (ECT), ESCLARECIMENTOS, MOTIVO, RECEITA, PERDA, PREJUIZO, RESULTADO, ATRASO, REAJUSTAMENTO, TARIFAS, REDUÇÃO, VOLUME, ENCOMENDA POSTAL, AMBITO INTERNACIONAL, CONSEQUENCIA, IMPLEMENTAÇÃO, MARCO REGULATORIO.\nCOMENTARIO, EMPRESA BRASILEIRA DE CORREIOS E TELEGRAFOS (ECT), EMPRESA ESTATAL, PLANO DE RECUPERAÇÃO, SUSTENTABILIDADE, FUNDAMENTAÇÃO, NATUREZA FINANCEIRA, INOVAÇÃO, MODERNIZAÇÃO, EXPANSÃO, COMERCIO ELETRONICO.', 'HOMENAGEM, ANIVERSARIO DE FUNDAÇÃO, EMPRESA BRASILEIRA DE CORREIOS E TELEGRAFOS (ECT), SAUDAÇÃO, AUTORIDADE, ESPECIFICAÇÃO, HELIO COSTA, MINISTRO DE ESTADO, MINISTERIO DAS COMUNICAÇÕES (MC), TITULAR, MANDATO PARLAMENTAR, SUPLENCIA, ORADOR.\nREGISTRO, HISTORIA, COMUNICAÇÕES, EVOLUÇÃO, TECNOLOGIA, TRANSFORMAÇÃO, DEPARTAMENTO DE CORREIOS E TELEGRAFOS (DCT), EMPRESA BRASILEIRA DE CORREIOS E TELEGRAFOS (ECT), EVOLUÇÃO, MODERNIZAÇÃO, SISTEMA, RECUPERAÇÃO, CONFIANÇA, USUARIO, AMPLIAÇÃO, OFERTA, SERVIÇO, ALTERNATIVA, BANCOS, FACILITAÇÃO, CIENTISTA, PESQUISADOR, IMPORTAÇÃO, EQUIPAMENTOS, HOMENAGEM, SERVIDOR.', 'HOMENAGEM, ANIVERSARIO DE FUNDAÇÃO, EMPRESA BRASILEIRA DE CORREIOS E TELEGRAFOS (ECT), REGISTRO, HISTORIA, EMPRESA PUBLICA, ATENDIMENTO, TOTAL, TERRITORIO NACIONAL, ELOGIO, TRABALHO, SERVIDOR, APRESENTAÇÃO, DADOS, CONFIANÇA, POPULAÇÃO, RECONHECIMENTO, AMBITO INTERNACIONAL, QUALIDADE, PRESTAÇÃO DE SERVIÇO, ESPECIFICAÇÃO, ESTADO DO CEARA (CE).\nCOMENTARIO, MOBILIZAÇÃO, SERVIDOR, SOCIEDADE, ORADOR, EX-DEPUTADO, IMPEDIMENTO, PRIVATIZAÇÃO, EMPRESA BRASILEIRA DE CORREIOS E TELEGRAFOS (ECT), PERIODO, GOVERNO, FERNANDO HENRIQUE CARDOSO, EX PRESIDENTE DA REPUBLICA.\nREGISTRO, DIVERSIFICAÇÃO, MODERNIZAÇÃO, ATIVIDADE, EMPRESA BRASILEIRA DE CORREIOS E TELEGRAFOS (ECT), COLABORAÇÃO, POLITICA, SETOR PUBLICO, ELOGIO, OFERTA, SERVIÇO BANCARIO, CONVENIO, BANCO PARTICULAR, ATENDIMENTO, POPULAÇÃO, BAIXA RENDA, ENTREGA, LIVRO DIDATICO, REMESSA, MINISTERIO DA EDUCAÇÃO (MEC), INCENTIVO, VALORIZAÇÃO, CULTURA, LANÇAMENTO, SELO POSTAL COMEMORATIVO.\nHOMENAGEM, CARTEIRO, ESTADO DO CEARA (CE), ELEIÇÃO, MODELO, EMPREGADO, SOLICITAÇÃO, SENADOR, AGILIZAÇÃO, APROVAÇÃO, PROJETO DE LEI, ANISTIA, SERVIDOR, EMPRESA BRASILEIRA DE CORREIOS E TELEGRAFOS (ECT), PUNIÇÃO, DEMISSÃO, MOTIVO, GREVE.\nREGISTRO, PATROCINIO, EMPRESA BRASILEIRA DE CORREIOS E TELEGRAFOS (ECT), SELEÇÃO, BRASIL, FUTEBOL, SEDE, ESTADO DO CEARA (CE).']"
41,246,41_DE LEI DA CAMARA_LEI DA CAMARA PLC_DA CAMARA PLC_CAMARA PLC,"['DE LEI DA CAMARA', 'LEI DA CAMARA PLC', 'DA CAMARA PLC', 'CAMARA PLC', 'PLC CRIAÇÃO', 'DA CAMARA PLC CRIAÇÃO', 'CAMARA PLC CRIAÇÃO', 'PLC CRIAÇÃO LEI', 'CAMARA PLC CRIAÇÃO LEI', 'PLC CRIAÇÃO LEI FEDERAL', 'CRIAÇÃO LEI FEDERAL', 'CAMARA PLC ALTERAÇÃO', 'PLC ALTERAÇÃO', 'DA CAMARA PLC ALTERAÇÃO', 'REVOGAÇÃO DISPOSITIVOS CODIGO', 'REGULAMENTAÇÃO CONTRATO', 'CRIAÇÃO LEI FEDERAL REGULAMENTAÇÃO', 'LEI FEDERAL REGULAMENTAÇÃO', 'CODIGO CIVIL', 'FEDERAL REGULAMENTAÇÃO']","['SEGURO', 'MEDICO', 'ALIMENTAÇÃO', 'VINCULAÇÃO', 'PREFEITURA', '', '', '', '', '', '', '', '', '', '', '', '', '', '', '', '', '', '', '', '', '', '', '', '', '']","['DISCUSSÃO, PROJETO DE LEI DA CAMARA (PLC), CRIAÇÃO, LEI FEDERAL, REGULAMENTAÇÃO, CONTRATO, SEGURO PRIVADO, REVOGAÇÃO, DISPOSITIVOS, CODIGO CIVIL.', 'DISCUSSÃO, PROJETO DE LEI DA CAMARA (PLC), CRIAÇÃO, LEI FEDERAL, REGULAMENTAÇÃO, CONTRATO, SEGURO PRIVADO, REVOGAÇÃO, DISPOSITIVOS, CODIGO CIVIL.', 'DISCUSSÃO, PROJETO DE LEI DA CAMARA (PLC), CRIAÇÃO, LEI FEDERAL, REGULAMENTAÇÃO, CONTRATO, SEGURO PRIVADO, REVOGAÇÃO, DISPOSITIVOS, CODIGO CIVIL.']"
42,245,42_PROFESSOR_EDUCAÇÃO MEC_DA EDUCAÇÃO MEC_MINISTERIO DA EDUCAÇÃO MEC,"['PROFESSOR', 'EDUCAÇÃO MEC', 'DA EDUCAÇÃO MEC', 'MINISTERIO DA EDUCAÇÃO MEC', 'MINISTERIO DA EDUCAÇÃO', 'DA EDUCAÇÃO', 'UNIVERSIDADE', 'ESCOLA', 'EDUCAÇÃO BASICA', 'DE EDUCAÇÃO', 'SUPERIOR', 'ENSINO SUPERIOR', 'QUALIDADE ENSINO', 'FORMAÇÃO', 'ESCOLA TECNICA', 'ESCOLA PUBLICA', 'ESTABELECIMENTO DE', 'ESTABELECIMENTO DE ENSINO', 'PISO SALARIAL', 'EDUCACIONAL']","['PROFESSOR', 'UNIVERSIDADE', 'ESCOLAR', 'SUPERIOR', 'FORMAÇÃO', 'PISO', 'SALARIAL', 'CURSO', 'APRENDIZAGEM', 'CIENCIA', 'NUMERO', 'PESQUISA', 'RELEVANCIA', 'DESIGUALDADE', 'VAGA', 'DIFICULDADE', 'NIVEL', 'ALFABETIZAÇÃO', 'VINCULAÇÃO', 'ENTIDADE', 'CORPO', 'DIVERSIDADE', 'DETALHAMENTO', 'CONCLUSÃO', 'CONHECIMENTO', 'EXPERIENCIA', 'EFEITO', 'DESCENTRALIZAÇÃO', 'MODERNIZAÇÃO', 'CONGRATULAÇÕES']","['HOMENAGEM, DIA, PROFESSOR, CRIANÇA, IMPORTANCIA, TRABALHO, MELHORIA, BRASIL, REGISTRO, ESFORÇO, MAGISTERIO, TRANSPOSIÇÃO, DIFICULDADE, ESPECIFICAÇÃO, ESTADO DE RORAIMA (RR), ELOGIO, APROVAÇÃO, SENADO, REINTEGRAÇÃO, ENSINO, MUSICA, LEI DE DIRETRIZES E BASES DA EDUCAÇÃO NACIONAL.\nCOMENTARIO, IMPORTANCIA, EDUCAÇÃO, PROGRESSO, HOMEM, CRITICA, SOCIEDADE, TRANSFERENCIA, PROFESSOR, RESPONSABILIDADE, FAMILIA, REGISTRO, AMPLIAÇÃO, ACESSO, ENSINO FUNDAMENTAL, NECESSIDADE, MELHORIA, QUALIDADE, ENSINO PUBLICO, CONDIÇÕES DE TRABALHO, REMUNERAÇÃO, RECONHECIMENTO, VALORIZAÇÃO, MAGISTERIO.\nCUMPRIMENTO, MINISTRO DE ESTADO, MINISTERIO DA EDUCAÇÃO (MEC), INICIATIVA, CRIAÇÃO, PROGRAMA NACIONAL, FORMAÇÃO, PROFESSOR, SUPRIMENTO, DEFICIENCIA, UNIVERSIDADE, INEFICACIA, ENSINO, LICENCIATURA, DESPREPARO, MAGISTERIO.\nELOGIO, INICIATIVA, GOVERNO FEDERAL, AMPLIAÇÃO, RESPONSABILIDADE, UNIÃO FEDERAL, EDUCAÇÃO BASICA, BRASIL, REDUÇÃO, ONUS, GOVERNO ESTADUAL, GOVERNO MUNICIPAL, CONTRIBUIÇÃO, FORMAÇÃO, PROFESSOR, MELHORIA, ENSINO.\nREGISTRO, DADOS, INSTITUIÇÃO DE PESQUISA, DEMONSTRAÇÃO, PRECARIEDADE, EDUCAÇÃO BASICA, COMENTARIO, PARTICIPAÇÃO, ESTADO DE RORAIMA (RR), MEDIA, AMBITO NACIONAL, SUGESTÃO, COMISSÃO DE EDUCAÇÃO, ACOMPANHAMENTO, GOVERNO FEDERAL, VALORIZAÇÃO, PROFESSOR.', 'COBRANÇA, MINISTERIO DA EDUCAÇÃO (MEC), AUMENTO, PRIORIDADE, ENSINO PROFISSIONALIZANTE, ATENDIMENTO, CARENCIA, MÃO DE OBRA ESPECIALIZADA, INDUSTRIA, ANALISE, INSUFICIENCIA, LEGISLAÇÃO, CRIAÇÃO, PROGRAMA, AMPLIAÇÃO, NUMERO, CENTRO FEDERAL DE EDUCAÇÃO TECNOLOGICA (CEFET), ESCOLA TECNICA, INSTITUTO FEDERAL DE EDUCAÇÃO CIENCIA E TECNOLOGIA, DIFICULDADE, ATRAÇÃO, JUVENTUDE, BAIXA RENDA.\nDEFESA, INTEGRAÇÃO, ENSINO MEDIO, SERVIÇO NACIONAL DE APRENDIZAGEM INDUSTRIAL (SENAI), SERVIÇO SOCIAL DA INDUSTRIA (SESI), SERVIÇO SOCIAL DO COMERCIO (SESC), SERVIÇO NACIONAL DE APRENDIZAGEM COMERCIAL (SENAC), NECESSIDADE, CAMPANHA, MINISTERIO DA EDUCAÇÃO (MEC), DIFUSÃO, CULTURA, APRENDIZAGEM, PROFISSÃO, COMBATE, DISCRIMINAÇÃO, COMPARAÇÃO, ENSINO SUPERIOR.\nCOMENTARIO, EDITORIAL, JORNAL, FOLHA DE S.PAULO, ESTADO DE SÃO PAULO (SP), DADOS, ENSINO PROFISSIONAL, BRASIL, COMPARAÇÃO, PAIS INDUSTRIALIZADO, DEFESA, PARCERIA, INICIATIVA PRIVADA, OFERTA, CURSO TECNICO.\nELOGIO, INICIATIVA, GOVERNADOR, ESTADO DE SÃO PAULO (SP), AUMENTO, VAGA, ENSINO PROFISSIONALIZANTE, UTILIZAÇÃO, ESPAÇO, ESCOLA PUBLICA, EDUCAÇÃO BASICA, OCIOSIDADE, HORARIO NOTURNO, ATENDIMENTO, DEMANDA, INDUSTRIA, REGISTRO, SUPERIORIDADE, INDICE, EMPREGO, FORMANDO.\nJUSTIFICAÇÃO, PROJETO DE LEI, AUTORIA, ORADOR, CRIAÇÃO, ESCOLA TECNICA FEDERAL, CONSTRUÇÃO NAVAL, MUNICIPIO, SANTANA (AP), ESTADO DO AMAPA (AP), IMPLEMENTAÇÃO, ESCOLA TECNICA, ESPECIALIZAÇÃO, GESTÃO, MEIO AMBIENTE, DESENVOLVIMENTO SUSTENTAVEL, CAPITAL DE ESTADO.', 'ANUNCIO, CONFERENCIA, ORADOR, COMISSÃO DE ASSUNTOS SOCIAIS (CAS), ASSUNTO, TRABALHO, MINISTERIO DA EDUCAÇÃO (MEC), AMBITO, DEBATE, DIRETRIZ, FUTURO, BRASIL.\nIMPORTANCIA, DISCUSSÃO, EDUCAÇÃO, DETALHAMENTO, PLANO NACIONAL, DESENVOLVIMENTO EDUCACIONAL, MINISTERIO DA EDUCAÇÃO (MEC), ADESÃO, ESTADOS, MUNICIPIOS, AREA, EDUCAÇÃO BASICA, ENSINO SUPERIOR, ENSINO PROFISSIONALIZANTE, ALFABETIZAÇÃO, DIVERSIDADE, REGISTRO, DADOS, ELOGIO, AUMENTO, PRIORIDADE.\nREGISTRO, NOTICIARIO, IMPORTANCIA, DEBATE, CRESCIMENTO, VIOLENCIA, ESTABELECIMENTO DE ENSINO.\nREGISTRO, RELATORIO, MINISTERIO DA EDUCAÇÃO (MEC), SUGESTÃO, PROGRAMA, REESTRUTURAÇÃO, HOSPITAL ESCOLA, UNIVERSIDADE FEDERAL.\nESCLARECIMENTOS, MANUTENÇÃO, MINISTERIO DA EDUCAÇÃO (MEC), PROGRAMA, LIVRO DIDATICO, ENSINO ESPECIAL, DADOS, APLICAÇÃO DE RECURSOS, INCLUSÃO, CEGO.\nANEXAÇÃO, DOCUMENTO, MOVIMENTO ESTUDANTIL, REIVINDICAÇÃO, JUSTIÇA, PROGRAMA, CREDITO EDUCATIVO, CONCESSÃO, DESCONTO, DETALHAMENTO, SUGESTÃO, RECLAMAÇÃO, DIFICULDADE, PAGAMENTO, ANUNCIO, SOLIDARIEDADE, ORADOR, APOIO, PROJETO, TRAMITAÇÃO, CONGRESSO NACIONAL, AUXILIO, ESTUDANTE, SAUDAÇÃO, DECISÃO, MINISTERIO DA EDUCAÇÃO (MEC), ENCAMINHAMENTO, CASA CIVIL, PROPOSTA, NEGOCIAÇÃO, DIVIDA.\nREGISTRO, PROJETO DE LEI, REGULAMENTAÇÃO, DESCONTO, DIVIDA, CREDITO EDUCATIVO, FORMANDO, TRABALHO, QUALIDADE, PROFESSOR, ESCOLA PUBLICA, INCENTIVO, CARREIRA, MAGISTERIO.\nSOLICITAÇÃO, GOVERNADOR, PAGAMENTO, PISO SALARIAL, PROFESSOR.']"
43,244,43_CPI_PARLAMENTAR DE INQUERITO CPI_COMISSÃO PARLAMENTAR DE INQUERITO_DE INQUERITO CPI,"['CPI', 'PARLAMENTAR DE INQUERITO CPI', 'COMISSÃO PARLAMENTAR DE INQUERITO', 'DE INQUERITO CPI', 'INQUERITO CPI', 'INVESTIGAÇÃO', 'INSTALAÇÃO COMISSÃO PARLAMENTAR', 'INSTALAÇÃO COMISSÃO PARLAMENTAR DE', 'CRIAÇÃO COMISSÃO PARLAMENTAR DE', 'INQUERITO CPI INVESTIGAÇÃO', 'CPI INVESTIGAÇÃO', 'DE INQUERITO CPI INVESTIGAÇÃO', 'CARTÃO DE CREDITO', 'INQUERITO CPI ORGANIZAÇÃO NÃO', 'CPI ORGANIZAÇÃO', 'INQUERITO CPI ORGANIZAÇÃO', 'CPI ORGANIZAÇÃO NÃO', 'CPI ORGANIZAÇÃO NÃO GOVERNAMENTAL', 'DE INQUERITO CPI ORGANIZAÇÃO', 'CPI OBJETIVO']","['CARTÃO', 'TRANSPORTE', 'ERRO', 'DEVOLUÇÃO', 'PROTOCOLO', 'RELEVANCIA', '', '', '', '', '', '', '', '', '', '', '', '', '', '', '', '', '', '', '', '', '', '', '', '']","['COMENTARIO, INSTALAÇÃO, COMISSÃO PARLAMENTAR DE INQUERITO (CPI), INVESTIGAÇÃO, ILEGALIDADE, JUDICIARIO.', 'DEFESA, INSTALAÇÃO, COMISSÃO PARLAMENTAR DE INQUERITO (CPI), INVESTIGAÇÃO, ILEGALIDADE, JUDICIARIO.', 'CRIAÇÃO, COMISSÃO PARLAMENTAR DE INQUERITO (CPI), ASSEDIO MORAL, ELEIÇÕES, VOTO, TRABALHADOR.']"
44,243,44_DE ORDEM_QUESTÃO DE_QUESTÃO DE ORDEM_RESPOSTA QUESTÃO DE ORDEM,"['DE ORDEM', 'QUESTÃO DE', 'QUESTÃO DE ORDEM', 'RESPOSTA QUESTÃO DE ORDEM', 'RESPOSTA QUESTÃO DE', 'RESPOSTA QUESTÃO', 'APRESENTAÇÃO QUESTÃO DE', 'APRESENTAÇÃO QUESTÃO', 'APRESENTAÇÃO QUESTÃO DE ORDEM', 'RESPOSTA', 'DE ORDEM AUTORIA', 'QUESTÃO DE ORDEM AUTORIA', 'ORDEM AUTORIA', 'ORDEM DO DIA', 'QUESTÃO DE ORDEM ASSUNTO', 'ORDEM ASSUNTO', 'DE ORDEM ASSUNTO', 'SENADOR ASSUNTO', 'REGIMENTO', 'RODRIGUES SENADOR']","['RESPOSTA', 'FALTA', 'ACUSAÇÃO', 'CONFIANÇA', '', '', '', '', '', '', '', '', '', '', '', '', '', '', '', '', '', '', '', '', '', '', '', '', '', '']","['APRESENTAÇÃO, QUESTÃO DE ORDEM, PREJUDICIALIDADE, DESTAQUE.', 'RESPOSTA, QUESTÃO DE ORDEM, PREJUDICIALIDADE, DESTAQUE.', 'APRESENTAÇÃO, QUESTÃO DE ORDEM, ASSUNTO, EXIGENCIA, MANIFESTAÇÃO, COMISSÃO, COMPETENCIA.\n\nAPRESENTAÇÃO, QUESTÃO DE ORDEM, ASSUNTO, REQUERIMENTO, URGENCIA, DELIBERAÇÃO, SESSÃO']"
45,233,45_Ambiente_Meio_Meio Ambiente_Meio Ambiente Recursos Naturais,"['Ambiente', 'Meio', 'Meio Ambiente', 'Meio Ambiente Recursos Naturais', 'Brasileiro Meio Ambiente Recursos', 'Naturais Renováveis IBAMA', 'Brasileiro Meio', 'Brasileiro Meio Ambiente', 'Recursos Naturais Renováveis IBAMA', 'Instituto Brasileiro Meio Ambiente', 'Instituto Brasileiro Meio', 'Meio Ambiente Recursos', 'Naturais', 'Renováveis IBAMA', 'Ambiente Recursos Naturais Renováveis', 'Ambiente Recursos Naturais', 'Ambiente Recursos', 'MEIO AMBIENTE', 'AMBIENTE', 'DO MEIO AMBIENTE']","['MEIO', 'OBRAS', 'UNIVERSIDADE', 'COLONIZAÇÃO', 'DIFICULDADE', 'PESQUISA', 'TERRA', 'ELETRICA', 'FALTA', 'DETALHAMENTO', 'DEMORA', 'TRANSPORTE', 'ACUSAÇÃO', 'PROPRIEDADE', 'COMPENSAÇÃO', 'FORMAÇÃO', 'MUNDO', 'DIVERSIDADE', 'DETERMINAÇÃO', 'DESAPROPRIAÇÃO', 'EMISSÃO', 'NUMERO', 'CURSO', 'PARCIAL', 'SUPERIOR', 'BASE', 'FLORESTAIS', 'ESPECIALIZAÇÃO', 'ABANDONO', '']","['SOLIDARIEDADE, LEITURA, CARTA, AUTORIA, MINISTRO DE ESTADO, MINISTERIO DO MEIO AMBIENTE (MMA), DESTINO, SERVIDOR, Instituto Brasileiro do Meio Ambiente e dos Recursos Naturais Renováveis (IBAMA), GREVE, ESCLARECIMENTOS, MODERNIZAÇÃO, ORGANIZAÇÃO ADMINISTRATIVA, REFORMULAÇÃO, CRIAÇÃO, UNIDADE, NATUREZA TECNICA, ASSESSORAMENTO, FISCALIZAÇÃO, POLITICA DO MEIO AMBIENTE.\nEXPECTATIVA, SERVIDOR, Instituto Brasileiro do Meio Ambiente e dos Recursos Naturais Renováveis (IBAMA), CONCLUSÃO, GREVE, SAUDAÇÃO, MINISTERIO DO MEIO AMBIENTE (MMA), APERFEIÇOAMENTO, ORGANIZAÇÃO ADMINISTRATIVA.', 'COMENTARIO, OCORRENCIA, AUDIENCIA PUBLICA, PRESENÇA, MINISTRO DE ESTADO, MINISTERIO DO MEIO AMBIENTE (MMA), SECRETARIO EXECUTIVO, FUNCIONARIOS, Instituto Brasileiro do Meio Ambiente e dos Recursos Naturais Renováveis (IBAMA), ESPECIALISTA, MEIO AMBIENTE, DEBATE, MEDIDA PROVISORIA (MPV), DIVISÃO, ORGÃO PUBLICO, CRIAÇÃO, INSTITUTO CHICO MENDES, DEFESA, ORADOR, SOLUÇÃO, DIVERGENCIA, OBJETIVO, VOTAÇÃO, REESTRUTURAÇÃO, ADMINISTRAÇÃO PUBLICA.\nJUSTIFICAÇÃO, CRIAÇÃO, INSTITUTO CHICO MENDES, DIFICULDADE, Instituto Brasileiro do Meio Ambiente e dos Recursos Naturais Renováveis (IBAMA), ATENDIMENTO, DEMANDA, FISCALIZAÇÃO, AREA DE PROTEÇÃO AMBIENTAL, LICENCIAMENTO, IMPACTO AMBIENTAL, OBRAS, APLICAÇÃO, LEGISLAÇÃO, CRITICA, GREVE, SERVIDOR, CONCLAMAÇÃO, SENADOR, APOIO, MEDIDA PROVISORIA (MPV).\nCOMENTARIO, PROBLEMA, HIERARQUIA, MINISTERIO DO MEIO AMBIENTE (MMA), Instituto Brasileiro do Meio Ambiente e dos Recursos Naturais Renováveis (IBAMA).\nINFORMAÇÃO, REDUÇÃO, REPASSE, RECURSOS FINANCEIROS, SETOR PUBLICO, ORGANIZAÇÃO NÃO-GOVERNAMENTAL (ONG).', 'SOLICITAÇÃO, TRANSCRIÇÃO, ANAIS DO SENADO, ARTIGO DE IMPRENSA, JORNAL, ESTADO DE S.PAULO, ESTADO DE SÃO PAULO (SP), REFORMULAÇÃO, MINISTERIO DO MEIO AMBIENTE (MMA), PREJUIZO, Instituto Brasileiro do Meio Ambiente e dos Recursos Naturais Renováveis (IBAMA), PERDA, PRESIDENTE, DIRETOR.']"
46,229,46_DO SENADO PLS_DE LEI DO SENADO_LEI DO SENADO PLS_LEI DO SENADO,"['DO SENADO PLS', 'DE LEI DO SENADO', 'LEI DO SENADO PLS', 'LEI DO SENADO', 'PROJETO DE LEI DO', 'LEI DO', 'DO SENADO PLS AUTORIA', 'SENADO PLS AUTORIA', 'SENADO PLS AUTORIA ORADOR', 'DEFESA APROVAÇÃO PROJETO DE', 'PLS AUTORIA ORADOR ASSUNTO', 'ORADOR OBJETO', 'PLS AUTORIA ORADOR OBJETO', 'SENADO PLS OBJETO', 'DO SENADO PLS OBJETO', 'PLS OBJETO', 'SENADO PLS ASSUNTO', 'DO SENADO PLS ASSUNTO', 'OBJETO AUMENTO PENA', 'DEFESA PROJETO DE LEI']","['RETIRADA', 'EXPOSIÇÃO', '', '', '', '', '', '', '', '', '', '', '', '', '', '', '', '', '', '', '', '', '', '', '', '', '', '', '', '']","['DEFESA, PROJETO DE LEI DO SENADO (PLS), AUTORIA, ORADOR, ASSUNTO, CONTINUAÇÃO, FABRICAÇÃO, DISTRIBUIÇÃO, PEÇA SOBRESSALENTE, COMPONENTE, REPOSIÇÃO, APARELHO ELETRONICO.', 'ENCAMINHAMENTO, PROJETO DE LEI DO SENADO (PLS).', 'DEFESA, APROVAÇÃO, PROJETO DE LEI DO SENADO (PLS), AUTORIA, ORADOR, OBJETO, PROTEÇÃO, ANIMAL, CRIAÇÃO, ORGÃO, ASSUNTO.']"
47,212,47_RORAIMA RR_RORAIMA_ESTADO DE RORAIMA_ESTADO DE RORAIMA RR,"['RORAIMA RR', 'RORAIMA', 'ESTADO DE RORAIMA', 'ESTADO DE RORAIMA RR', 'DE RORAIMA RR', 'DE RORAIMA', 'BOA', 'VENEZUELA', 'DE RONDONIA RO', 'ESTADO DE RONDONIA RO', 'RONDONIA RO', 'ESTADO DE RONDONIA', 'RO', 'FOLHA DE BOA VISTA', 'RR SOLICITAÇÃO', 'SOLICITAÇÃO TRANSCRIÇÃO', 'ESTRANGEIRO VENEZUELA', 'PAIS ESTRANGEIRO VENEZUELA', 'DE RORAIMA RR SOLICITAÇÃO', 'RORAIMA RR SOLICITAÇÃO']","['TRANSCRIÇÃO', 'ANAIS', 'DEMARCAÇÃO', 'FALTA', 'RELAÇÕES', 'PRODUÇÃO', 'DESAPROPRIAÇÃO', 'DIRETORIA', 'CAPITAL', 'ACIDENTE', 'REPRESENTANTE', 'ENTIDADE', 'SOLENIDADE', 'MEDICINA', 'TENTATIVA', 'CIRCULAÇÃO', '', '', '', '', '', '', '', '', '', '', '', '', '', '']","['HOMENAGEM, ANIVERSARIO DE FUNDAÇÃO, JORNAL, FOLHA DE BOA VISTA, ESTADO DE RORAIMA (RR).\nSOLICITAÇÃO, TRANSCRIÇÃO, MATERIA, ARTIGO DE IMPRENSA, JORNAL, FOLHA DE BOA VISTA, ESTADO DE RORAIMA (RR), RELAÇÃO, CONTRIBUIÇÃO, IMPRENSA.\nSOLICITAÇÃO, TRANSCRIÇÃO, MATERIA, ARTIGO DE IMPRENSA, JORNAL, FOLHA DE BOA VISTA, ESTADO DE RORAIMA (RR), RELAÇÃO, CONTRIBUIÇÃO, IMPRENSA.\nSOLICITAÇÃO, TRANSCRIÇÃO, MATERIA, ARTIGO DE IMPRENSA, JORNAL, FOLHA DE BOA VISTA, ESTADO DE RORAIMA (RR), RELAÇÃO, LIBERDADE DE EXPRESSÃO, DEMOCRACIA.', 'SOLICITAÇÃO, TRANSCRIÇÃO, ANAIS DO SENADO, ARTIGO DE IMPRENSA, JORNAL, FOLHA DE BOA VISTA, ESTADO DE RORAIMA (RR), ASSUNTO, PRODUTOR RURAL, BLOQUEIO, ESTRADA, OBJETIVO, REIVINDICAÇÃO, MELHORIA, RODOVIA.\nREGISTRO, REMESSA, TRIBUNAL DE CONTAS DA UNIÃO (TCU), SOLICITAÇÃO, AUDITORIA, RODOVIA, ESTADO DE RORAIMA (RR).', 'DENUNCIA, GOVERNADOR, ESTADO DE RORAIMA (RR), PERSEGUIÇÃO, ORADOR, ESPECIFICAÇÃO, ACUSAÇÃO, GRILAGEM.\nSOLICITAÇÃO, TRANSCRIÇÃO, ANAIS DO SENADO, ARTIGO DE IMPRENSA, JORNAL, FOLHA DE BOA VISTA, ESTADO DE RORAIMA (RR), DENUNCIA, ABUSO DE PODER, GOVERNADOR.\nSOLICITAÇÃO, TRANSCRIÇÃO, ANAIS DO SENADO, OFICIO, AUTORIA, ORADOR, SOLICITAÇÃO, TRIBUNAL DE CONTAS DA UNIÃO (TCU), REALIZAÇÃO, AUDITORIA, INVESTIMENTO PUBLICO, RODOVIA, ESTADO DE RORAIMA (RR).']"
48,202,48_VETO_VETO VET_VETO VET PRESIDENTE_VETO VET PRESIDENTE DA,"['VETO', 'VETO VET', 'VETO VET PRESIDENTE', 'VETO VET PRESIDENTE DA', 'VET PRESIDENTE DA REPUBLICA', 'VETO VET PROJETO', 'VETO VET PROJETO DE', 'APRECIAÇÃO VETO', 'DERRUBADA VETO', 'REPUBLICA PROJETO', 'DA REPUBLICA PROJETO', 'APRECIAÇÃO VETO VET', 'PRESIDENTE DA REPUBLICA PROJETO', 'VETO PARCIAL', 'CRITICA VETO', 'CRITICA VETO VET', 'DERRUBADA VETO VET', 'REPUBLICA PROJETO DE LEI', 'DA REPUBLICA PROJETO DE', 'REPUBLICA PROJETO DE']","['PARCIAL', 'APOSENTADO', 'EDIÇÃO', 'ANULAÇÃO', 'TENTATIVA', 'ASSUNTOS', 'REPRESENTANTE', '', '', '', '', '', '', '', '', '', '', '', '', '', '', '', '', '', '', '', '', '', '', '']","['DEFESA, REJEIÇÃO, CONGRESSO NACIONAL, VETO (VET), PRESIDENTE DA REPUBLICA, LEI COMPLEMENTAR, REFERENCIA, EXTINÇÃO, PAGAMENTO, MULTA, FUNDO DE GARANTIA POR TEMPO DE SERVIÇO (FGTS), EFEITO, DEMISSÃO, FALTA DE JUSTA CAUSA.', 'DEFESA, REJEIÇÃO, CONGRESSO NACIONAL, VETO (VET), PRESIDENTE DA REPUBLICA, LEI COMPLEMENTAR, REFERENCIA, EXTINÇÃO, PAGAMENTO, MULTA, FUNDO DE GARANTIA POR TEMPO DE SERVIÇO (FGTS), EFEITO, DEMISSÃO, FALTA DE JUSTA CAUSA.', 'DEFESA, REJEIÇÃO, CONGRESSO NACIONAL, VETO (VET), PRESIDENTE DA REPUBLICA, LEI COMPLEMENTAR, REFERENCIA, EXTINÇÃO, PAGAMENTO, MULTA, FUNDO DE GARANTIA POR TEMPO DE SERVIÇO (FGTS), EFEITO, DEMISSÃO, FALTA DE JUSTA CAUSA.']"
49,201,49_MUSICA_COMPOSITOR_CANTOR_CINEMA,"['MUSICA', 'COMPOSITOR', 'CANTOR', 'CINEMA', 'ARTISTICA', 'MUSICO', 'MUSICA POPULAR', 'MUSICA BRASILEIRA', 'ARTISTA', 'TEATRO', 'FILME', 'POETA', 'NASCIMENTO', 'ELOGIO CONTRIBUIÇÃO', 'HOMENAGEM CENTENARIO', 'CONTRIBUIÇÃO MUSICA', 'PAULO SP', 'SÃO PAULO', 'CE', 'DE JANEIRO RJ']","['CULTURAL', 'DIRETOR', 'PESAR', 'PRODUÇÃO', 'TRANSCRIÇÃO', 'ANAIS', 'ESCRITOR', 'UNIVERSIDADE', 'GLOBO', 'PESAMES', 'DANÇA', 'RECONHECIMENTO', 'TRANSFORMAÇÃO', 'PROFESSOR', 'CAPITAL', 'DIVERSIDADE', 'RELEVANCIA', 'EXPOSIÇÃO', 'CARENTE', 'CONCENTRAÇÃO', 'MEIO', 'COMPOSIÇÃO', 'ESPAÇO', 'ADVOGADO', 'DETERMINAÇÃO', 'PROXIMIDADE', 'OBTENÇÃO', 'MODERNIZAÇÃO', 'MOVIMENTAÇÃO', 'LINGUAGEM']","['HOMENAGEM, CENTENARIO, NASCIMENTO, CANTOR, COMPOSITOR, ESTADO DO RIO DE JANEIRO (RJ), ESTADO DE SÃO PAULO (SP), ANALISE, CONTRIBUIÇÃO, MUSICA POPULAR, FORMAÇÃO, IDENTIDADE, CULTURA, BRASIL, REGISTRO, BIOGRAFIA, ELOGIO, OBRA MUSICAL, LEITURA, TEXTO, INTELECTUAL, TRECHO, OBRA MUSICAL, VALORIZAÇÃO, TRABALHO, POETA.', 'HOMENAGEM, CENTENARIO, NASCIMENTO, CANTOR, COMPOSITOR, ESTADO DO RIO DE JANEIRO (RJ), ESTADO DE SÃO PAULO (SP), REGISTRO, TRECHO, OBRA MUSICAL, ELOGIO, CONTRIBUIÇÃO, MUSICA BRASILEIRA, VALORIZAÇÃO, VIDA, POVO.\nREGISTRO, OCORRENCIA, CIDADE, BRASIL, ESPETACULO, COMEMORAÇÃO, CENTENARIO, MUSICO, ELOGIO, FILME DOCUMENTARIO, BIOGRAFIA.', 'HOMENAGEM, CENTENARIO, NASCIMENTO, CANTOR, COMPOSITOR, ESTADO DO RIO DE JANEIRO (RJ), ESTADO DE SÃO PAULO (SP), REGISTRO, TRECHO, OBRA MUSICAL, ELOGIO, CONTRIBUIÇÃO, MUSICA BRASILEIRA.\nANALISE, HISTORIA, PROCESSO, CULTURA, QUESTIONAMENTO, INDUSTRIA FONOGRAFICA, RESTRIÇÃO, DIVULGAÇÃO, QUALIDADE, MUSICA, BRASILEIROS.']"
50,201,50_TRIBUNAL DE CONTAS_CONTAS DA_CONTAS DA UNIÃO TCU_DE CONTAS DA UNIÃO,"['TRIBUNAL DE CONTAS', 'CONTAS DA', 'CONTAS DA UNIÃO TCU', 'DE CONTAS DA UNIÃO', 'DE CONTAS DA', 'TRIBUNAL DE CONTAS DA', 'TRIBUNAL DE', 'MINISTRO TRIBUNAL DE', 'MINISTRO TRIBUNAL DE CONTAS', 'MINISTRO TRIBUNAL', 'CARGO PUBLICO MINISTRO TRIBUNAL', 'PUBLICO MINISTRO TRIBUNAL DE', 'PUBLICO MINISTRO TRIBUNAL', 'AUDITORIA', 'CONTAS GOVERNO FEDERAL', 'PUBLICO MINISTRO', 'UNIÃO TCU ASSUNTO', 'TCU ASSUNTO', 'DA UNIÃO TCU ASSUNTO', 'CONTAS GOVERNO']","['CONTAS', 'POSSE', 'ADMINISTRATIVA', 'TRANSCRIÇÃO', 'ANAIS', 'DIVULGAÇÃO', 'DEMONSTRAÇÃO', 'RELEVANCIA', 'MEIO', 'CONJUNTA', '', '', '', '', '', '', '', '', '', '', '', '', '', '', '', '', '', '', '', '']","['CRITICA, DECISÃO, TRIBUNAL DE CONTAS DA UNIÃO (TCU), CONDENAÇÃO, DELTAN DALLAGNOL, PROCURADOR DA REPUBLICA, DEVOLUÇÃO, DIARIAS, PERIODO, EXECUÇÃO, OPERAÇÃO LAVA JATO, CORRELAÇÃO, COMBATE, CORRUPÇÃO.\nCRITICA, MINISTRO, TRIBUNAL DE CONTAS DA UNIÃO (TCU), RELATOR, PROCESSO.', 'REGISTRO, RELATORIO, ATIVIDADE, TRIBUNAL DE CONTAS DA UNIÃO (TCU), ANALISE, PRESTAÇÃO DE CONTAS, GOVERNO FEDERAL, AUSENCIA, IRREGULARIDADE.\nCOMENTARIO, IMPORTANCIA, ATUAÇÃO, TRIBUNAL DE CONTAS DA UNIÃO (TCU), MELHORIA, ADMINISTRAÇÃO PUBLICA, DIVULGAÇÃO, BALANÇO, CONTAS, GOVERNO FEDERAL, FACILITAÇÃO, FISCALIZAÇÃO, CIDADANIA.\nBALANÇO, ATUAÇÃO, TRIBUNAL DE CONTAS DA UNIÃO (TCU), PREVENÇÃO, IRREGULARIDADE, CONTROLE, ADMINISTRAÇÃO PUBLICA, CONGRATULAÇÕES, SERVIDOR.', 'REGISTRO, IMPORTANCIA, SINDICATO, LEGISLATIVO, TRIBUNAL DE CONTAS DA UNIÃO (TCU).']"
51,199,51_PENAL_VIOLENCIA VITIMA_AUMENTO VIOLENCIA_COMBATE VIOLENCIA,"['PENAL', 'VIOLENCIA VITIMA', 'AUMENTO VIOLENCIA', 'COMBATE VIOLENCIA', 'CRIME HEDIONDO', 'CRIME ORGANIZADO', 'VIOLENCIA VITIMA MULHER', 'VIOLENCIA DOMESTICA', 'COMBATE CRIME', 'VIOLENCIA PAIS', 'APREENSÃO AUMENTO VIOLENCIA', 'PENITENCIARIO', 'CODIGO PENAL', 'IMPUTABILIDADE PENAL', 'DE LEI AUTORIA ORADOR', 'CRIME HOMICIDIO', 'AUMENTO CRIME', 'VIOLENCIA CRIME', 'HOMICIDIO VITIMA', 'SEXUAL']","['PENAL', 'DROGA', 'SEXUAL', 'PENA', 'HOMOSSEXUAL', 'MENOR', 'NUMERO', 'ROUBO', 'PUNIÇÃO', 'LOTAÇÃO', 'EXPLORAÇÃO', 'DISCRIMINAÇÃO', 'FALTA', 'VINCULAÇÃO', 'CELULAR', 'FRUSTRAÇÃO', 'MODERNIZAÇÃO', 'ANAIS', 'POSIÇÃO', 'DEMONSTRAÇÃO', 'LIMITE', 'CLASSIFICAÇÃO', 'MATERIAL', 'CARGA', 'PENALIDADE', 'ENTREGA', 'DEMORA', 'INFORMAÇÕES', 'CENTRAL', 'FORMAÇÃO']","['REPUDIO, VIOLENCIA, VITIMA, MULHER, DEFESA, ALTERAÇÃO, LEGISLAÇÃO PENAL, OBJETIVO, COMBATE, CRIME, COMENTARIO, AGRESSÃO, LOCAL, ESTADO DO ESPIRITO SANTO (ES).\n\nDEFESA, CONSTRUÇÃO, ESTABELECIMENTO DE ENSINO, PRESIDIO.', 'COMENTARIO, INICIO, CAMPANHA, COMBATE, VIOLENCIA, VITIMA, MULHER, APREENSÃO, AUMENTO, VIOLENCIA DOMESTICA, DEFESA, NECESSIDADE, APROVAÇÃO, PROJETO DE LEI, ASSUNTO, ALTERAÇÃO, CODIGO PENAL, TIPICIDADE, HOMICIDIO, ELOGIO, ATUAÇÃO, GOVERNO FEDERAL, DILMA ROUSSEFF, PRESIDENTE DA REPUBLICA, CRIAÇÃO, POLITICAS PUBLICAS.', 'APREENSÃO, AUMENTO, VIOLENCIA, VITIMA, MULHER, REGISTRO, ARTIGO DE IMPRENSA, JORNAL, FOLHA DE S.PAULO, CRIME, HOMICIDIO, ESTUPRO, VIOLENCIA DOMESTICA, CRIME HEDIONDO, LEI MARIA DA PENHA.']"
52,190,52_DEBATES TEMATICOS_DE DEBATES TEMATICOS_DEBATES_SESSÃO DE DEBATES,"['DEBATES TEMATICOS', 'DE DEBATES TEMATICOS', 'DEBATES', 'SESSÃO DE DEBATES', 'SESSÃO DE DEBATES TEMATICOS', 'DE DEBATES', 'DEBATES TEMATICOS OBJETIVO', 'TEMATICOS OBJETIVO', 'DE DEBATES TEMATICOS OBJETIVO', 'DESTINAÇÃO DISCUSSÃO', 'DEBATES TEMATICOS DESTINAÇÃO DISCUSSÃO', 'TEMATICOS DESTINAÇÃO DISCUSSÃO', 'DEBATES TEMATICOS DESTINAÇÃO', 'DE DEBATES TEMATICOS DESTINAÇÃO', 'DEBATES TEMATICOS OBJETIVO DISCUSSÃO', 'TEMATICOS OBJETIVO DISCUSSÃO', 'REALIZAÇÃO SESSÃO DE DEBATES', 'DEBATES TEMATICOS DEBATE', 'DE DEBATES TEMATICOS DEBATE', 'JUROS INFLAÇÃO CRESCIMENTO ECONOMIA']","['GUERRA', 'RELAÇÕES', 'EFEITO', 'CORRELAÇÃO', 'FALTA', 'TRANSPOSIÇÃO', '', '', '', '', '', '', '', '', '', '', '', '', '', '', '', '', '', '', '', '', '', '', '', '']","['SESSÃO DE DEBATES TEMATICOS, DESTINAÇÃO, DISCUSSÃO, PAZ, PROCESSO ELEITORAL.', 'SESSÃO DE DEBATES TEMATICOS, DESTINAÇÃO, DISCUSSÃO, PAZ, PROCESSO ELEITORAL.', 'SESSÃO DE DEBATES TEMATICOS, DESTINAÇÃO, DISCUSSÃO, PAZ, PROCESSO ELEITORAL.']"
