Topic,Count,Name,Representation,Aspect1,Representative_Docs
25,130,25_Brasil está_Brasil_Vanessa_não,"['Brasil está', 'Brasil', 'Vanessa', 'não', 'você', 'quero', 'Roberto', 'autônomo', 'registro', 'está', 'quero aqui', 'Bloco', 'ou não', 'fazer', 'Congresso', 'Congresso Nacional', 'essa', 'Rocha', 'nós', 'Governo']","['meta', 'autônomo', 'registro', 'lei', 'serviço', 'trabalho', 'palavra', 'independente', 'trabalhador', 'exclusivo', 'Presidente', 'situação', 'carga', 'projeto', 'direito', 'Estado', 'promessa', 'medida', 'provisória', 'início']","[""Apenas para lembrar, o art. 58, §3º, da Constituição diz: 'As comissões parlamentares de inquérito, que terão poderes de investigação próprios das autoridades judiciais, além de outros previstos nos regimentos das respectivas Casas, serão criadas pela Câmara dos Deputados e pelo Senado Federal, em conjunto ou separadamente, mediante requerimento de um terço de seus membros, para a apuração de fato determinado e por prazo certo, sendo suas conclusões, se for o caso, encaminhadas ao Ministério Público, para que promova a responsabilidade civil ou criminal dos infratores.'"", 'O Tribunal e o Ministério Público de Contas propugnam pelo cumprimento da lei e da Constituição. Cabe ao Congresso Nacional definir a meta. Se o Congresso Nacional definir uma meta mais larga, mais frouxa, mais flexível, para o Poder Executivo, ele terá essa liberdade. O que não pode é o Congresso Nacional estabelecer que a meta a ser buscada é x e o Poder Executivo entender-se autorizado a buscar outra meta ou não buscar meta nenhuma. Isso é que não pode: mandar um projeto de lei, não conseguir se entender com o Congresso Nacional a respeito de qual meta deve ser buscada e passar então a ignorar o Congresso Nacional - ""vou seguir a meta que eu acho que vou fazer, que acho que é boa"". O Poder Executivo não tem essa delegação na Constituição.', 'Aqui eu dou um exemplo. O trabalhador, esse sim, que tem carteira de trabalho assinada, que é contratado tem todos os direitos e continua a ter. O problema é que, ao lado desse trabalhador, Senador Elmano, criaram outra figura, a do prestador de serviços, o trabalhador autônomo. Não é mais o empregado. Veja, estão voltando, levando, levando, levando, levando, levando, levando, levando, levando, levando, levando, levando, levando, levando, levando, levando, levando, levando, levando, levando, levando, levando, levando, levando, levando, levando, levando, levando, levando, levando, levando, levando, levando, levando, levando, levando, levando, levando, levando, levando, levando, levando, levando, levando, levando, levando, levando, levando, levando, levando, levando, levando, levando, levando, levando, levando, levando, levando, levando, levando, levando, levando, levando, levando, levando, levando, levando, levando, levando, levando, levando, levando, levando, levando, levando, levando, levando, levando, levando, levando, levando, levando, levando, levando, levando, levando, levando, levando, levando, levando, levando, levando, levando, levando, levando, levando, levando, levando, levando, levando, levando, levando, levando, levando, levando, levando, levando, levando, levando, levando, levando, levando, levando, levando, levando, levando, levando, levando, levando, levando, levando, levando, levando, levando, levando, levando, levando, levando, levando, levando, levando, levando, levando, levando, levando, levando, levando, levando, levando, levando, levando, levando, levando, levando, levando, levando, levando, levando, levando, levando, levando, levando, levando, levando, levando, levando, levando, levando, levando, levando, levando, levando, levando, levando, levando, levando, levando, levando, levando, levando, levando, levando, levando, levando, levando, levando, levando, levando, levando, levando, levando, levando, levando, levando, levando, levando, levando, levando, levando, levando, levando, levando, levando, levando, levando, levando, levando, levando, levando, levando, levando, levando, levando, levando, levando, levando, levando, levando, levando, levando, levando, levando, levando, levando, levando, levando, levando, levando, levando, levando, levando, levando, levando, levando, levando, levando, levando, levando, levando, levando, levando, levando, levando, levando, levando, levando, levando, levando, levando, levando, levando, levando, levando, levando, levando, levando, levando, levando, levando, levando, levando, levando, levando, levando, levando, levando, levando, levando, levando, levando, levando, levando, levando, levando, levando, levando, levando, levando, levando, levando, levando, levando, levando, levando, levando, levando, levando, levando, levando, levando, levando, levando, levando, levando, levando, levando, levando, levando, levando, levando, levando, levando, levando, levando, levando, levando, levando, levando, levando, levando, levando, levando, levando, levando, levando, levando, levando, levando, levando, levando, levando, levando, levando, levando, levando, levando, levando, levando, levando, levando, levando, levando, levando, levando, levando, levando, levando, levando, levando, levando, levando, levando, levando, levando, levando, levando, levando, levando, levando, levando, levando, levando, levando, levando, levando, levando, levando, levando, levando, levando, levando, levando, levando, levando, levando, levando, levando, levando, levando, levando, levando, levando, levando, levando, levando, levando, levando, levando, levando, levando, levando, levando, levando, levando, levando, levando, levando, levando, levando, levando, levando, levando, levando, levando, levando, levando, levando, levando, levando, levando, levando, levando, levando, levando, levando, levando, levando, levando, levando, levando, levando, levando, levando, levando, levando, levando, levando, levando, levando, levando, levando, levando, levando, levando, levando, levando, levando, levando, levando, levando, levando, levando, levando, levando, levando, levando, levando, levando, levando, levando, levando, levando, levando, levando, levando, levando, levando, levando, levando, levando, levando, levando, levando, levando, levando, levando, levando, levando, levando, levando, levando, levando, levando, levando, levando, levando, levando, levando, levando, levando, levando, levando, levando, levando, levando, levando, levando, levando, levando, levando, levando, levando, levando, levando, levando, levando, levando, levando, levando, levando, levando, levando, levando, e levando o Brasil à mesma situação da era pré-Vargas, quando não havia direito algum. Então, é isso que nós estamos dizendo. E o que é que nós queremos? Que o Presidente cumpra a sua palavra, que edite a medida provisória, que vete os artigos que ele se comprometeu a vetar e que edite a medida provisória para que possamos, então, discutir e votar. Muito obrigada, Sr. Presidente. Era isso o que eu tinha a dizer. Muito obrigada. (Palmas.)    O SR. PRESIDENTE (José Pimentel. Bloco Parlamentar da Resistência Democrática/PT - CE) – Senadora Vanessa, eu que agradeço a V. Exª. E, como V. Exª disse, é importante que possamos fazer esse debate. E eu, como Presidente, vou garantir que ele aconteça.    Eu passo a palavra ao Senador Roberto Rocha, que havia solicitado um aparte. O Sr. Roberto Rocha (Bloco Socialismo e Democracia/PSB - MA) – Sr. Presidente, eu gostaria de fazer um registro. Amanhã, dia 7 de setembro, é o Dia da Independência do Brasil. E eu gostaria de fazer um registro, Senador Pimentel, Senador Vanessa, de que, no dia 7 de setembro de 1822, o Brasil se libertou de Portugal, mas, em 2017, o Brasil ainda não se libertou do Brasil. O Brasil precisa se libertar de si mesmo. E eu quero aqui fazer uma homenagem ao povo brasileiro, que é um povo extraordinário, que tem uma capacidade de resistência, de resiliência, de superação, de criatividade, de trabalho, de luta, de fé, de esperança, de acreditar no Brasil. E é por isso que eu quero aqui, Senador Pimentel, fazer um registro de um grande brasileiro, que é o ex-Presidente Juscelino Kubitschek. Ele dizia que o Brasil não tem povo, tem público. O Brasil é um país que tem uma capacidade de superação extraordinária. E eu quero aqui, Senadora Vanessa, fazer esse registro, porque eu não tenho dúvida de que nós vamos superar essa crise. O Brasil é um país muito grande, muito rico, e o nosso povo é muito forte. E nós vamos superar essa crise, porque o Brasil é maior do que qualquer crise. Muito obrigado.    A SRª PRESIDENTE (Fátima Bezerra. Bloco Parlamentar da Resistência Democrática/PT - RN) – Senadora Vanessa Grazziotin, parabéns pelo pronunciamento. Eu queria, antes de passar a palavra ao Senador Telmário Mota, registrar a presença do Prefeito de São Gabriel da Cachoeira, Clóvis Curubão, que está aqui nos visitando. Seja muito bem-vindo.    O Sr. Roberto Rocha (Bloco Socialismo e Democracia/PSB - MA) – Senadora Vanessa, eu quero só fazer um registro. Eu não sei se a senhora sabe, mas o Maranhão é o Estado que tem o maior número de reservas indígenas do Brasil. E, quando eu vejo o Governo Federal querendo vender a Eletrobras, eu fico pensando: será que, depois, ele vai querer vender a Amazônia? É uma coisa que me preocupa muito. E eu quero aqui fazer um registro, Senadora Vanessa, de que eu, como Senador do Maranhão, não posso admitir que o Governo brasileiro, que o Governo do Presidente Temer, que o Governo do meu partido, o PSDB, venha a vender a Eletrobras. Isso é um crime de lesa-pátria. Portanto, eu quero aqui fazer esse registro. Muito obrigado.    A SRª VANESSA GRAZZIOTIN (Bloco Socialismo e Democracia/PCdoB - AM) – Eu que agradeço, Senador.    O SR. PRESIDENTE (José Pimentel. Bloco Parlamentar da Resistência Democrática/PT - CE) – Senadora Vanessa, eu quero cumprimentar V. Exª pelo pronunciamento e dizer que V. Exª tem toda a razão. Eu, como Líder do Governo da Presidenta Dilma, fui um dos que mais trabalhou para que nós pudéssemos aprovar o projeto de lei que tratava da questão da desoneração da folha de pagamento. E, na época, nós tínhamos um crescimento econômico de 7% ao ano, e a relação dívida/PIB era de 38%. Hoje, nós estamos com uma relação dívida/PIB de 73%. Portanto, o Brasil está em uma situação de calamidade pública. E o que é mais grave: a dívida pública, que era de 38%, hoje é de 70%. E o Brasil não cresce. O Brasil está parado. O Brasil está em uma situação de estagnação. E o que é pior: o Governo não tem um projeto para o País. O Governo não tem um projeto para o Brasil. O Governo não tem uma proposta para o Brasil. O Governo não tem uma proposta para o Brasil. O que o Governo está fazendo é só aumentar imposto, é aumentar a carga tributária, é aumentar a carga tributária, é aumentar a carga tributária, é aumentar a carga tributária. E o que é que acontece? O Brasil está parado. O Brasil está estagnado. E o que é que acontece? O Brasil está parado. O Brasil está estagnado. E o que é que acontece? O Brasil está parado. O Brasil está na UTI. O Brasil está doente. O Brasil precisa de uma reforma trabalhista. Não se pode admitir que as relações de trabalho hoje sejam as mesmas de anos passados, como não serão daqui a dez anos, Senadora Vanessa. Daqui a 15 anos, pelo menos 20% dos empregos nem existem hoje ainda, de modo que eu quero aqui revelar a minha convicção de que votei pelo bem do País e na certeza de que a reforma trabalhista vai trazer um outro perfil para as nossas relações de trabalho. Agradeço a oportunidade do aparte e já me desculpo por ter-me estendido um pouco. Apenas trouxe um pouquinho de conteúdo daquilo que a gente pensa em relação a essa matéria.    A SRª VANESSA GRAZZIOTIN (Bloco Socialismo e Democracia/PCdoB - AM) – Eu acho isso importante, nobre Senador, pelos menos nesses dias de segunda e sexta-feira, quando temos um plenário mais tranquilo... Tenho certeza de que o Presidente nos garante e nos permite essa possibilidade do diálogo, do debate também, não somente dos pronunciamentos engessados naquele tempo regimental. Todas as segundas e sextas-feiras nos propiciam isso.    Senador Roberto Rocha, primeiro, eu quero dizer que tenho tanto respeito por V. Exª, como sei que V. Exª nutre por mim, o que não significa dizer que tenhamos visões iguais.    Primeiro, eu quero reafirmar o que eu disse, Senador Roberto, e sei que com isso V. Exª concorda. Há e houve uma promessa do Presidente. Houve e há uma promessa. E o que eu cobro é que essa promessa seja cumprida, a palavra seja cumprida e a medida provisória seja editada, visto que a palavra já não foi cumprida, porque a palavra prometia duas coisas, prometia veto e prometia medida provisória. Não houve nenhum veto. Então, que aguardemos a medida provisória para voltarmos a analisar.    E esse debate, como V. Exª mesmo coloca, está incompleto. Sabe por quê? Porque nós ouvimos muito aqui e continuamos a ouvir que os direitos sagrados dos trabalhadores previstos na Constituição brasileira não foram mexidos. É verdade, mesmo porque nós não estávamos elaborando uma reforma baseada na Constituição. Não era uma emenda constitucional. Era uma lei ordinária. E aqui ninguém é tão criança para saber que uma medida, uma lei ordinária não muda a lei maior, a lei máxima, que é a Constituição Federal. Entretanto, o que se faz é permitir figuras, criação de figuras que, até então, nem a Constituição prevê, ou previa, nem a legislação. Aqui eu dou um exemplo. O trabalhador, esse sim, que tem carteira de trabalho assinada, que é contratado tem todos os direitos e continua a ter.    O problema é que, ao lado desse trabalhador, Senador Elmano, criaram outra figura, a do prestador de serviços, o trabalhador autônomo. Não é mais o empregado. Veja, estão voltando, levando o Brasil à mesma situação da era pré-Vargas, mas com o rótulo de modernidade, porque ainda dizem para as pessoas: ""Olha, fulano, você agora não é mais meu empregado,você agora é autônomo, você agora é independente, você só presta serviço para mim, você é independente para fazer o que quiser da sua vida. Você é autônomo e presta serviço para mim."" Que serviço ele poderá prestar? Qualquer um. Durante qual jornada de trabalho? Qualquer uma. Lá na lei está dito: exclusivo ou não – exclusivo ou não –, contínuo ou não.    Eu repito: se, a partir de novembro, uma empregadora de uma empregada doméstica quiser deixar de assinar a carteira de trabalho da sua empregada doméstica, ela pode. Nada na lei a impedirá de dizer assim: ""Olha, você agora não é mais minha empregada, você agora é autônomo, você agora é independente, você só presta serviço para mim, você é independente para fazer o que quiser da sua vida. Você é autônomo e presta serviço para mim."" Que serviço ele poderá prestar? Qualquer um. Durante qual jornada de trabalho? Qualquer uma. Lá na lei está dito: exclusivo ou não – exclusivo ou não –, contínuo ou não.    O trabalho intermitente.']"
26,127,26_Presidente_Federal_nós_não,"['Presidente', 'Federal', 'nós', 'não', 'chega', 'igualdade', 'fato', 'nossa', 'direito fundamental', 'crimes', 'porque', 'quem', 'alterada', 'Supremo', 'depende', 'brasileira', 'União', 'outra', 'saída', 'penal']","['Presidente', 'igualdade', 'fato', 'crimes', 'lugar', 'brasileira', 'União', 'novo', 'saída', 'penal', 'justiça', 'Senado', 'sigilo', 'anos', 'lei', 'democracia', 'golpe', 'leis', 'princípio', 'acesso']","['E essa história de dizer que é golpista quem vem querer impeachment, eu repito: eu não sou golpista, mas acho que se nós tivermos zelo pela verdadeira democracia, nós vamos enfrentar isso de maneira altiva, soberana e democrática, debaixo do que está prescrito na lei e na Constituição. Não é inconstitucional o que foi feito com o ex-Presidente Lula, desculpe-me quem pensa dessa forma.', 'A Constituição Federal, nos arts. 43, 151, 155 e §§6º e 7º do art. 165, garante, o Orçamento da União garante essa segurança e esse subsídio para a Zona Franca, e mesmo assim lá vamos nós de novo, Veneziano, lá vamos nós de novo para a tribuna, como se fôssemos mendigos a pedir favor. De novo. Está na Constituição. E não se respeita mais a Constituição neste país. Isso também não é de assustar, porque, se o Supremo não a respeita, se o Supremo cria suas leis...', '""respeitando o art. 5º da Constituição, que assevera sermos todos iguais perante a lei."" e ""Art. 5º Todos são iguais perante a lei, sem distinção de qualquer natureza, garantindo-se aos brasileiros e aos estrangeiros residentes no País a inviolabilidade do direito à vida, à liberdade, à igualdade, à segurança e à propriedade, nos termos seguintes: [...] XIV - é assegurado a todos o acesso à informação e resguardado o sigilo da fonte, quando necessário ao exercício profissional.""']"
27,123,27_direitos_brasileira_Declaração_públicos,"['direitos', 'brasileira', 'Declaração', 'públicos', 'diz', 'recursos', 'Direitos', 'fundamentais', 'Universal Direitos', 'Declaração Universal Direitos', 'Universal', 'Declaração Universal', 'Federal', 'porque', 'constitucional', 'liberdade', 'condenação', 'não pode', 'previsto Federal', 'incentivos']","['direitos', 'brasileira', 'Declaração', 'públicos', 'recursos', 'fundamentais', 'constitucional', 'relação', 'gente', 'liberdade', 'condenação', 'incentivos', 'previsto', 'princípio', 'mandato', 'acesso', 'fiscais', 'princípios', 'respeito', 'necessário']","['Essa liberação tem como base o direito da liberdade e autonomia, consagrada na Constituição brasileira, na Constituição estadual e na própria Declaração Universal dos Direitos Humanos.', 'A liberdade de locomoção foi consagrada, Sr. Presidente, na Declaração Universal dos Direitos Humanos, igualmente recepcionada em nossa Lei Maior, a Constituição brasileira.', 'O princípio de igual liberdade diz que cada pessoa deve ter um conjunto de liberdades básicas fundamentais, tais como a de livre expressão, de ir e vir, de livre associação, de votar e de ser votado, que precisam ser estendidos a todos na sociedade, inclusive aqueles princípios contidos na Constituição brasileira, como os direitos fundamentais e os direitos fundamentais presentes na Declaração Universal dos Direitos da Pessoa Humana.']"
28,115,28_essa_crime_responsabilidade_Federal,"['essa', 'crime', 'responsabilidade', 'Federal', 'Não', 'aqui', 'Senado', 'incisos VI', 'União', 'crime responsabilidade', 'aprovação', 'mandato', 'Presidente', 'VI', 'regras', 'nossa', 'Não possível', 'Vice Presidente República', 'político', 'Estado']","['crime', 'responsabilidade', 'União', 'aprovação', 'mandato', 'Presidente', 'VI', 'regras', 'suplementares', 'político', 'Estado', 'reeleição', 'caso', 'resolução', 'possibilidade', 'operações', 'normas', 'meio', 'direito', 'golpe']","['Se o crime de responsabilidade é um crime político, se o crime de responsabilidade é uma infração político-administrativa, ele, primeiro, antes de ser responsabilidade, tem que ser crime. Se ele não é crime, não há... Crime é o substantivo; responsabilidade, o adjetivo. O adjetivo não cola no vazio.', 'Sobre esse tema das pedaladas, eu particularmente, Srs. Senadores, não tenho dúvidas de que houve o crime de responsabilidade, com base no art. 85, incisos V, VI e VII, da Constituição Federal, e na Lei Complementar nº 1.079/50, art. 4º, incisos V e VI, visto que infringiram esses dispositivos da Lei Orçamentária.', 'O que é crime de responsabilidade, Senador José Medeiros? É quando o governo realmente se acha acima daquilo que o Congresso Nacional definiu como normas da Lei Orçamentária. Está previsto na Constituição, Senadora Gleisi Hoffmann! Nós não estamos aqui inventando nada. A definição de crime de responsabilidade, Senador José Medeiros? É quando o governo realmente se acha acima daquilo que o Congresso Nacional definiu como normas da Lei Orçamentária.']"
29,114,29_Federal_humano_ordem_direito humano,"['Federal', 'humano', 'ordem', 'direito humano', 'veto', 'República', 'União', 'votação', 'federal', 'votado', 'Presidente', 'nossa', 'prazo', 'nós', 'Tribunal', 'direito humano essencial', 'humano essencial', 'série direitos', 'interpretação', 'atribuiu']","['humano', 'ordem', 'aspas', 'veto', 'União', 'votação', 'objetivos', 'federal', 'Presidente', 'prazo', 'medida', 'dias', 'interpretação', 'mesmo', 'Estados', 'receita', 'Estado', 'fecho', 'líquida', 'recebimento']","['Está escrito no §1º do art. 20 da Constituição Federal: É assegurada, nos termos da lei, aos Estados, ao Distrito Federal e aos Municípios, bem como a órgãos da administração direta da União, participação no resultado da exploração de petróleo ou gás natural.', 'Sob a ótica da constitucionalidade, não há óbice à proposição, porquanto esta cumpre as diretrizes previstas no inciso IX do art. 24 da Constituição Federal, que preceitua a competência da União, em concorrência com os Estados e o Distrito Federal, para legislar sobre cultura.', 'Está na Constituição Federal, artigo 66, §1º - aspas: “Se o Presidente da República considerar o projeto, no todo ou em parte, inconstitucional ou contrário ao interesse público, vetá-lo-á total ou parcialmente, no prazo de quinze dias úteis, contados da data do recebimento, e comunicará, dentro de quarenta e oito horas, ao Presidente do Senado Federal os motivos do veto” - fecho aspas. E acrescenta, o §4º do mesmo artigo determina que - aspas: “O veto será apreciado em sessão conjunta, no prazo de trinta dias a contar do seu recebimento, só podendo ser rejeitado pelo voto da maioria absoluta dos Deputados e Senadores, em escrutínio secreto” - fecho aspas.']"
30,112,30_porque_União_anualmente_não tem,"['porque', 'União', 'anualmente', 'não tem', 'Congresso Nacional', 'Congresso', 'constitucional', 'nossa', 'Estados', 'não', 'Poder', 'mesma forma', 'nacional', 'Nacional', 'legislação', 'acordo', 'Federal', 'República', 'têm', 'Regimento']","['União', 'mesma', 'mesmo', 'constitucional', 'Estados', 'diferentes', 'mesma forma', 'nacional', 'legislação', 'acordo', 'Regimento', 'pauta', 'econômico', 'desenvolvimento', 'Presidente', 'funcionamento', 'pequeno porte', 'direitos', 'bens', 'valor']","['O art. 4º da Constituição da República estabelece que o Brasil pauta-se nas suas relações internacionais pelos princípios da independência nacional, prevalência dos direitos humanos, autodeterminação dos povos, não intervenção, igualdade entre os Estados, defesa da paz e cooperação entre os povos para progresso da humanidade, dentre outros.', 'O projeto de lei que regulamenta a Emenda nº 29 define os recursos da União, dos Estados e dos Municípios destinados à Saúde. Uma vez regulamentada, a União terá de disponibilizar para a Saúde no mínimo 10% das receitas correntes brutas anualmente; os Estados aplicarão, anualmente, valor igual ou superior a 12% da arrecadação dos impostos; e os Municípios, valor igual ou superior a 15%.', '""Não é demais relembrar o que diz o art. 62 da Constituição Federal, que destaca: \'Em caso de relevância e urgência, o Presidente da República poderá adotar medidas provisórias, com força de lei, devendo submetê-las, de imediato, ao Congresso Nacional\'. Mas a medida provisória, ao invés de ser um instrumento excepcional, como prevê a Constituição, tem se transformado em instrumento corriqueiro, ordinário da Presidência da República.""']"
31,105,31_tem base_não tem_Federal_política,"['tem base', 'não tem', 'Federal', 'política', 'interpretação', 'não', 'Estado', 'impeachment', 'constitucional', 'brasileira', 'público', 'direito', 'Estatuto', 'dever', 'processo impeachment', 'nós', 'entraram', 'dinheiro', 'Em', 'Presidente']","['política', 'interpretação', 'lei', 'base', 'Estado', 'impeachment', 'constitucional', 'brasileira', 'público', 'direito', 'dever', 'dinheiro', 'teto', 'Presidente', 'favor', 'plenitude', 'vez', 'forma', 'República', 'digna']","['Do ponto de vista estratégico, o Acordo de Livre Comércio constitui importante fator de aproximação entre o Mercosul e a Aliança do Pacífico, contribuindo para o cumprimento do artigo 4º, parágrafo único, da Constituição Federal, que preceitua: “A República Federativa do Brasil buscará a integração econômica, política, social e cultural dos povos da América Latina, visando à formação de uma comunidade latino-americana de nações.""', 'A soberania popular é um dos pilares sagrados do Estado democrático de direito e ela precisa ser respeitada. Nós não podemos jamais aceitar que prospere qualquer iniciativa de caráter golpista, que não tem base jurídica, que não tem base legal, que não tem base constitucional, que não tem base política, que não tem base social.', 'Por fim, quero citar o artigo 227 da nossa Constituição, que define o compromisso e a responsabilidade de todos nós: ""É dever da família, da sociedade e do Estado assegurar à criança, ao adolescente e ao jovem, com absoluta prioridade, o direito à vida, à saúde, à alimentação, à educação, ao lazer, à profissionalização, à cultura, à dignidade, ao respeito, à liberdade e à convivência familiar e comunitária, além de colocá-los a salvo de toda forma de negligência, discriminação, exploração, violência, crueldade e opressão"".']"
