Topic,Count,Name,Representation,Aspect1,Representative_Docs
42,81,42_duas décadas_décadas_líder_águas,"['duas décadas', 'décadas', 'líder', 'águas', 'Foi assim', 'conquistas', 'enfermagem', 'culturais', 'povo', 'duas', 'sociedade', 'instituições', 'existe', 'Estado', 'também', 'Brasil', 'Congresso', 'nós', 'regulamentado', 'processo legislativo']","['décadas', 'líder', 'águas', 'conquistas', 'enfermagem', 'culturais', 'povo', 'rua', 'sociedade', 'instituições', 'valorização', 'Estado', 'aspectos', 'escolha', 'direito', 'gestão', 'institucional', 'pleno', 'conta', 'processo']","['Esses Conselhos impostos por decreto e a ideia de reforma política por plebiscito configuram um claro ataque ao Poder Legislativo, um atentado ao art. 2º da Constituição, que determina que, abro aspas, ""são Poderes da União, independentes e harmônicos entre si, o Legislativo, o Executivo e o Judiciário"", fecho aspas.', ""Em outras palavras, o Estado Democrático de Direito não tem mais que duas décadas no Brasil. Ele só existe entre nós, rigorosamente, a partir da promulgação da Carta de 1988, a 'Constituição Cidadã', como bem a definiu o Dr. Ulysses Guimarães. É razoável supor que a experiência acumulada nesses vinte anos produza, aos poucos, um efeito pedagógico na população, em termos de valorização da democracia e de tudo o que ela representa, inclusive a crescente repulsa à impunidade."", 'Nossa Carta Magna consagra o valor e o papel da educação para o Brasil, ao estabelecer, em seu artigo 205: Art. 205. A educação, direito de todos e dever do Estado e da família, será promovida e incentivada com a colaboração da sociedade, visando ao pleno desenvolvimento da pessoa, seu preparo para o exercício da cidadania e sua qualificação para o trabalho.']"
43,77,43_dignidade_humana_direitos_Nós,"['dignidade', 'humana', 'direitos', 'Nós', 'político', 'dignidade pessoa humana', 'dignidade pessoa', 'Estatuto', 'impeachment', 'impeachment golpe', 'garantir direito', 'Federal', 'Estados', 'pessoa humana', 'contra', 'Nós somos', 'nossa', 'Ele não', 'direito', 'Brasil']","['dignidade', 'humana', 'direitos', 'político', 'ficha', 'impeachment', 'Estados', 'tipo', 'tratamento', 'direito', 'senso', 'livre iniciativa', 'motivo', 'cidadania', 'propriedade', 'leis', 'vedação', 'sociais', 'constitucional', 'urgência']","['""Não basta estar na Constituição Federal desde o dia 5 de outubro de 1988, lá no art. 3º ou 4º, que um dos fundamentos da República Federativa do Brasil é promover o bem-estar de todos e abolir toda e qualquer forma de discriminação.""', 'Não sou jurista e não vou ficar discutindo se o pedido tem fundamento jurídico ou não. Entendo que esse é um processo absolutamente político. O impeachment é um processo político. Se fosse jurídico, teríamos de remetê-lo ao Supremo Tribunal Federal, aos juízes, ao Ministério Público, ao MPF, a tantos outros que sabem manejar essas coisas e fazer as investigações. Nós aqui não! Nós somos uma Casa política e devemos agir politicamente.', '""Todo o poder emana do povo"", como manda a Constituição. E este mesmo poder é exercido ""por meio de representantes eleitos diretamente"", na sequência deste parágrafo único do primeiro capítulo constitucional, que fundamenta o Estado democrático, através da soberania, da cidadania, da dignidade da pessoa humana, dos valores sociais do trabalho e da livre iniciativa e do pluralismo político.']"
44,75,44_direitos_regionais_desigualdades_muitos,"['direitos', 'regionais', 'desigualdades', 'muitos', 'constitucionais', 'três Poderes', 'fundamentais', 'País', 'Estado Amazonas', 'não fazer', 'estado', 'sociais', 'três', 'constitucionalmente', 'analfabetismo', 'vítimas', 'controle', 'desigualdades regionais', 'doenças', 'Brasil']","['direitos', 'regionais', 'desigualdades', 'constitucionais', 'fundamentais', 'País', 'estado', 'sociais', 'fundamental', 'vítimas', 'analfabetismo', 'controle', 'doenças', 'tratamento', 'percentuais', 'objetivo', 'lei', 'excepcional', 'defesa', 'adequada']","['Lembremos que a Constituição Federal prevê como um dos objetivos fundamentais da República Federativa do Brasil, a erradicação da pobreza, além da redução das desigualdades sociais e regionais.', 'A nossa Constituição Federal, no art. 167, inciso V, diz, caput: Art. 167. São vedados: V - a abertura de crédito suplementar ou especial sem prévia autorização legislativa e sem indicação dos recursos correspondentes;', 'Em 1988, a nossa Constituição já previu, como objetivo da República, a eliminação das desigualdades regionais. (...) Está lá, Srªs e Srs. Senadores, no inciso III do art. 3º: Art 3º Constituem objetivos fundamentais da República Federativa do Brasil: III - erradicar a pobreza e a marginalização e reduzir as desigualdades sociais e regionais.']"
45,75,45_reforma_exigência_reforma política_não,"['reforma', 'exigência', 'reforma política', 'não', 'política', 'cidadã', 'harmonia', 'recursos', 'Constituinte', 'nossa cidadã', 'Federal', 'atentatória', 'preconizado', 'República', 'Constituinte exclusiva', 'educação', 'Estado', 'inclusive', 'emenda', 'nossas']","['reforma', 'exigência', 'política', 'cidadã', 'harmonia', 'recursos', 'atentatória', 'República', 'exclusiva', 'educação', 'Estado', 'emenda', 'mundo', 'vista', 'campanha', 'Senado', 'forma', 'mais', 'alta', 'devida']","[""Defendemos uma reforma política com esse teor, reforma política democrática, porque há uma campanha insana em curso sempre, permanente, desde que Ulysses levantou os braços e disse: 'Esta é a Constituição cidadã', porque ali estavam assentadas reformas democráticas do ponto de vista político-eleitoral, uma campanha de retrocesso nesse campo."", 'Nossa Constituição Federal, no art. 167, V, tão falado já por todos, diz o seguinte: Art. 167. São vedados: V - a abertura de crédito suplementar ou especial sem prévia autorização legislativa e sem indicação dos recursos correspondentes.', 'E aí quero aproveitar – não sei se o momento – para dizer que precisamos repensar a política neste Brasil. Penso que talvez a nossa Constituição cidadã precisa ser revisitada. Penso que talvez a nossa Constituição cidadã precisa ser revisitada. Penso que talvez a nossa Constituição cidadã precisa ser revisitada. E aquela Constituição cidadã foi fundamental para iluminar esses espaços, mas, nesses quase 25 anos, o mundo mudou numa velocidade acima da das nossas instituições.']"
46,71,46_conseguir_vai_esperança_Presidente Dilma,"['conseguir', 'vai', 'esperança', 'Presidente Dilma', 'trazer', 'dela', 'Dilma', 'possível', 'vez', 'Brasil', 'Presidente', 'mais', 'conhece', 'lamentável', 'mandato', 'Federal', 'lei tem', 'afastada', 'povo', 'está acima']","['esperança', 'Cada', 'possível', 'nova', 'própria', 'Presidente', 'lamentável', 'lei', 'mandato', 'povo', 'justiça', 'processo', 'preciso', 'constitucional', 'minerais', 'juízes', 'crime', 'direitos', 'partidária', 'República']","['Concluo aqui, minha gente, reafirmando o meu compromisso com a defesa intransigente daquilo que eu chamo que é a espinha dorsal do Estado democrático de direito: a Constituição da República Federativa do Brasil, que é dar efetividade ao art. 3º, inciso IV, da Constituição, que diz que um dos fundamentos da República Federativa do Brasil é promover o bem-estar de todos e abolir toda e qualquer forma de discriminação.', '""Fiz de tudo para tentar usar intermediários que conseguissem fazer as grandes lideranças, de um lado e de outro, dos dois grandes partidos - PT e PSDB - conversarem. Não consegui. [...] É inevitável que aconteça o lamentável processo de substituição de Presidente no meio de um mandato, ou não? Eu ainda prefiro, Senador Elmano, que, a cada dia que passa, menos confiança eu tenho de que a Presidente Dilma vai conseguir ressurgir, vai conseguir ser a Itamar dela própria, vai conseguir trazer uma nova esperança para o Brasil. Cada vez eu duvido mais que isso seja possível. E se eu duvido que a Presidente Dilma vai conseguir ressurgir, vai conseguir ser a Itamar dela própria, vai conseguir trazer uma nova esperança para o Brasil. Cada vez eu duvido mais que isso seja possível. E se eu duvido que a Presidente Dilma vai conseguir ressurgir, vai conseguir ser a Itamar dela própria, vai conseguir trazer uma nova esperança para o Brasil. Cada vez eu duvido mais que isso seja possível. E se eu duvido que a Presidente Dilma vai conseguir ressurgir, vai conseguir ser a Itamar dela própria, vai conseguir trazer uma nova esperança para o Brasil. Cada vez eu duvido mais que isso seja possível. E se eu duvido que a Presidente Dilma vai conseguir ressurgir, vai conseguir ser a Itamar dela própria, vai conseguir trazer uma nova esperança para o Brasil. Cada vez eu duvido mais que isso seja possível. E se eu duvido que a Presidente Dilma vai conseguir ressurgir, vai conseguir ser a Itamar dela própria, vai conseguir trazer uma nova esperança para o Brasil. Cada vez eu duvido mais que isso seja possível. E se eu duvido que a Presidente Dilma vai conseguir ressurgir, vai conseguir ser a Itamar dela própria, vai conseguir trazer uma nova esperança para o Brasil. Cada vez eu duvido mais que isso seja possível. E se eu duvido que a Presidente Dilma vai conseguir ressurgir, vai conseguir ser a Itamar dela própria, vai conseguir trazer uma nova esperança para o Brasil. Cada vez eu duvido mais que isso seja possível. E se eu duvido que a Presidente Dilma vai conseguir ressurgir, vai conseguir ser a Itamar dela própria, vai conseguir trazer uma nova esperança para o Brasil. Cada vez eu duvido mais que isso seja possível. E se eu duvido que a Presidente Dilma vai conseguir ressurgir, vai conseguir ser a Itamar dela própria, vai conseguir trazer uma nova esperança para o Brasil. Cada vez eu duvido mais que isso seja possível. E se eu duvido que a Presidente Dilma vai conseguir ressurgir, vai conseguir ser a Itamar dela própria, vai conseguir trazer uma nova esperança para o Brasil. Cada vez eu duvido mais que isso seja possível. E se eu duvido que a Presidente Dilma vai conseguir ressurgir, vai conseguir ser a Itamar dela própria, vai conseguir trazer uma nova esperança para o Brasil. Cada vez eu duvido mais que isso seja possível. E se eu duvido que a Presidente Dilma vai conseguir ressurgir, vai conseguir ser a Itamar dela própria, vai conseguir trazer uma nova esperança para o Brasil. Cada vez eu duvido mais que isso seja possível. E se eu duvido que a Presidente Dilma vai conseguir ressurgir, vai conseguir ser a Itamar dela própria, vai conseguir trazer uma nova esperança para o Brasil. Cada vez eu duvido mais que isso seja possível. E se eu duvido que a Presidente Dilma vai conseguir ressurgir, vai conseguir ser a Itamar dela própria, vai conseguir trazer uma nova esperança para o Brasil. Cada vez eu duvido mais que isso seja possível. E se eu duvido que a Presidente Dilma vai conseguir ressurgir, vai conseguir ser a Itamar dela própria, vai conseguir trazer uma nova esperança para o Brasil. Cada vez eu duvido mais que isso seja possível. E se eu duvido que a Presidente Dilma vai conseguir ressurgir, vai conseguir ser a Itamar dela própria, vai conseguir trazer uma nova esperança para o Brasil. Cada vez eu duvido mais que isso seja possível. E se eu duvido que a Presidente Dilma vai conseguir ressurgir, vai conseguir ser a Itamar dela própria, vai conseguir trazer uma nova esperança para o Brasil. Cada vez eu duvido mais que isso seja possível. E se eu duvido que a Presidente Dilma vai conseguir ressurgir, vai conseguir ser a Itamar dela própria, vai conseguir trazer uma nova esperança para o Brasil. Cada vez eu duvido mais que isso seja possível. E se eu duvido que a Presidente Dilma vai conseguir ressurgir, vai conseguir ser a Itamar dela própria, vai conseguir trazer uma nova esperança para o Brasil. Cada vez eu duvido mais que isso seja possível. E se eu duvido que a Presidente Dilma vai conseguir ressurgir, vai conseguir ser a Itamar dela própria, vai conseguir trazer uma nova esperança para o Brasil. Cada vez eu duvido mais que isso seja possível. E se eu duvido que a Presidente Dilma vai conseguir ressurgir, vai conseguir ser a Itamar dela própria, vai conseguir trazer uma nova esperança para o Brasil. Cada vez eu duvido mais que isso seja possível. E se eu duvido que a Presidente Dilma vai conseguir ressurgir, vai conseguir ser a Itamar dela própria, vai conseguir trazer uma nova esperança para o Brasil. Cada vez eu duvido mais que isso seja possível. E se eu duvido que a Presidente Dilma vai conseguir ressurgir, vai conseguir ser a Itamar dela própria, vai conseguir trazer uma nova esperança para o Brasil. Cada vez eu duvido mais que isso seja possível. E se eu duvido que a Presidente Dilma vai conseguir ressurgir, vai conseguir ser a Itamar dela própria, vai conseguir trazer uma nova esperança para o Brasil. Cada vez eu duvido mais que isso seja possível. E se eu duvido que a Presidente Dilma vai conseguir ressurgir, vai conseguir ser a Itamar dela própria, vai conseguir trazer uma nova esperança para o Brasil. Cada vez eu duvido mais que isso seja possível. E se eu duvido que a Presidente Dilma vai conseguir ressurgir, vai conseguir ser a Itamar dela própria, vai conseguir trazer uma nova esperança para o Brasil. Cada vez eu duvido mais que isso seja possível. E se eu duvido que a Presidente Dilma vai conseguir ressurgir, vai conseguir ser a Itamar dela própria, vai conseguir trazer uma nova esperança para o Brasil. Cada vez eu duvido mais que isso seja possível. E se eu duvido que a Presidente Dilma vai conseguir ressurgir, vai conseguir ser a Itamar dela própria, vai conseguir trazer uma nova esperança para o Brasil. Cada vez eu duvido mais que isso seja possível. E se eu duvido que a Presidente Dilma vai conseguir ressurgir, vai conseguir ser a Itamar dela própria, vai conseguir trazer uma nova esperança para o Brasil. Cada vez eu duvido mais que isso seja possível. E se eu duvido que a Presidente Dilma vai conseguir ressurgir, vai conseguir ser a Itamar dela própria, vai conseguir trazer uma nova esperança para o Brasil. Cada vez eu duvido mais que isso seja possível. E se eu duvido que a Presidente Dilma vai conseguir ressurgir, vai conseguir ser a Itamar dela própria, vai conseguir trazer uma nova esperança para o Brasil. Cada vez eu duvido mais que isso seja possível. E se eu duvido que a Presidente Dilma vai conseguir ressurgir, vai conseguir ser a Itamar dela própria, vai conseguir trazer uma nova esperança para o Brasil. Cada vez eu duvido mais que isso seja possível. E se eu duvido que a Presidente Dilma vai conseguir ressurgir, vai conseguir ser a Itamar dela própria, vai conseguir trazer uma nova esperança para o Brasil. Cada vez eu duvido mais que isso seja possível. E se eu duvido que a Presidente Dilma vai conseguir ressurgir, vai conseguir ser a Itamar dela própria, vai conseguir trazer uma nova esperança para o Brasil. Cada vez eu duvido mais que isso seja possível. E se eu duvido que a Presidente Dilma vai conseguir ressurgir, vai conseguir ser a Itamar dela própria, vai conseguir trazer uma nova esperança para o Brasil. Cada vez eu duvido mais que isso seja possível. E se eu duvido que a Presidente Dilma vai conseguir ressurgir, vai conseguir ser a Itamar dela própria, vai conseguir trazer uma nova esperança para o Brasil. Cada vez eu duvido mais que isso seja possível. E se eu duvido que a Presidente Dilma vai conseguir ressurgir, vai conseguir ser a Itamar dela própria, vai conseguir trazer uma nova esperança para o Brasil. Cada vez eu duvido mais que isso seja possível. E se eu duvido que isso seja possível, é preciso que comecemos a trabalhar em qual será a alternativa que vamos ter para conseguir que o processo constitucional continue, que não haja a menor interrupção nisso, o que levaria a que o Vice-Presidente assumisse no lugar da Presidente, no meio do seu mandato, o que é lamentável para o processo democrático, mesmo sendo dentro da democracia e o que é lamentável para o processo pedagógico de formar nossa juventude acreditando que o mandato é algo verdadeiro para se manter como deveria ser.', 'Em todo este processo, em nenhum momento, ficou juridicamente provado que a Presidente Dilma Rousseff cometeu crime de responsabilidade para justificar constitucionalmente o seu impedimento.']"
47,70,47_liberdade organização_nossa_Carta Magna_Magna,"['liberdade organização', 'nossa', 'Carta Magna', 'Magna', 'partidária', 'deficiência', 'qualquer natureza', 'sociais', 'República', 'proprietário', 'Carta', 'ideológica', 'livre exercício qualquer', 'Federal', 'VI Federal', 'artística', 'legislação', 'atividade', 'democracia', 'pessoas deficiência']","['relacionados', 'aumento', 'natureza', 'partidária', 'deficiência', 'sociais', 'proprietário', 'ordem', 'ideológica', 'artística', 'legislação', 'atividade', 'democracia', 'mais', 'dispositivo', 'Grande', 'infância', 'constitucional', 'iguais', 'livre exercício']","[""Sr. Presidente, esse PL 2.630 é flagrantemente inconstitucional, fere pelo menos três artigos da nossa Carta Magna, como o art. 5º, em seu inciso XI, que diz que 'é livre a expressão da atividade intelectual, artística, científica e de comunicação'. Também o art. 220, que diz: 'É vedada toda e qualquer censura de natureza política, ideológica e artística'."", ""Com o caminho aberto, a Constituição Federal promulgada em 1988, assegurou este direito, ainda que de forma muito tímida. Assim o artigo 5°, da nossa Carta Magna que estabelece que 'Todos são iguais perante a lei, sem distinção de qualquer natureza' garante a todos o direito de ir e vir."", 'A Constituição Federal estabeleceu, há duas décadas, um marco na legislação sobre as pessoas com deficiência em nosso País. Seu art. 1º já traz a dignidade da pessoa humana como um dos fundamentos da República Federativa do Brasil. Em outras palavras, a dignidade da pessoa humana - conceito que, evidentemente, inclui a pessoa com deficiência - é um dos princípios que orientarão toda e qualquer interpretação que se faça das normas constitucionais e infraconstitucionais de 1988 em diante. O art. 5º vai além, estabelecendo a igualdade de todos perante a lei, sem distinção de qualquer natureza.']"
48,68,48_estadual_Governador_Brasil_Conselho Nacional,"['estadual', 'Governador', 'Brasil', 'Conselho Nacional', 'Federal', 'República', 'Governo', 'incapacidade', 'Senado Federal', 'indígenas', 'Conselho', 'impostos', 'Casa Legislativa', 'povo', 'nossa', 'parágrafo único', 'coletiva', 'públicas', 'Conselho Nacional Justiça', 'Nacional Justiça']","['estadual', 'Governador', 'tempo', 'direito', 'novas', 'incapacidade', 'indígenas', 'impostos', 'gente', 'povo', 'coletiva', 'meio', 'públicas', 'Prefeito', 'Senado', 'maneira', 'comunidades', 'parágrafo', 'saúde', 'primeira']","['É, por exemplo, o direito à saúde, previsto no § 6º do art. 196, que determina que “a saúde é direito de todos e dever do Estado, garantido mediante políticas sociais e econômicas que visem à redução do risco de doença e de outros agravos e ao acesso universal e igualitário às ações e serviços para sua promoção, proteção e recuperação”.', 'Título IV Da Organização dos Poderes Capítulo I Do Poder Legislativo Seção IV Do Senado Federal Art. 52. Compete privativamente ao Senado Federal: II - processar e julgar os Ministros do Supremo Tribunal Federal, os membros do Conselho Nacional de Justiça e do Conselho Nacional do Ministério Público, o Procurador-Geral da República e o Advogado-Geral da União nos crimes de responsabilidade.', 'O Brasil é craque em brincar, em construir castelos de areia. É como as crianças brincando na praia: ele faz e desfaz. Faz o castelinho, a onda vem e apaga. O castelo fica bonito, mas daqui a pouco desaparece. E assim tem sido o nosso País com relação à educação: vai fazendo castelinhos de areia e vai apagando. E é um efeito sanfona, pois cada Presidente, cada Governador, cada Prefeito que entra no Governo tem uma preocupação com as suas novas prioridades: a de desfazer. Entra um Governo e fala: ""Tudo está errado. Eu vou fazer tudo de novo. Eu tenho novas prioridades"". E coloca gente nova para aprender a trabalhar. E o tempo passa, e ele termina não fazendo nada e desfazendo o que está feito ao longo do tempo. Então, é isso que nós temos que realmente trabalhar: não deixar nós voltarmos. Pelo jeito de muita gente, parece que querem voltar a 1500. Parece que Cabral está chegando ao Brasil hoje para a gente recomeçar tudo de novo. É esse desperdício de trabalho, e assim tem sido a educação brasileira, uma brincadeira de esconde-esconde, e o tempo passa.']"
49,67,49_emenda_Tribunais_poderia_econômica,"['emenda', 'Tribunais', 'poderia', 'econômica', 'TCU', 'julgamento', 'eleição', 'federais', 'nós', 'emenda constitucional', 'cláusula', 'duração', 'universidades', 'Federal', 'Federal Não', 'recursos minerais', 'maioria', 'atividade econômica', 'religião', 'aqui Congresso']","['emenda', 'plebiscito', 'Tribunais', 'econômica', 'julgamento', 'eleição', 'federais', 'jazidas', 'tempo', 'cláusula', 'duração', 'universidades', 'maioria', 'religião', 'preciso', 'ação', 'Presidente', 'estabilidade', 'constitucional', 'minerais']","['Passagem do discurso: ""Passo a analisar a constitucionalidade, juridicidade e a regimentalidade das emendas de Plenário apresentadas ao PL 1.472, de 2021. [...] Passo à análise da constitucionalidade. A proposição é de competência da União, nos termos do art. 22, inciso XII, da Constituição Federal, que estabelece que compete privativamente à União legislar sobre jazidas, minas, outros recursos minerais e metalurgia. Além disso, os recursos naturais, os recursos minerais, melhor dizendo, inclusive os do subsolo, são bens da União e constituem monopólio da União a pesquisa e a lavra das jazidas de petróleo e gás natural; a refinação de petróleo nacional ou estrangeiro; e a importação e exportação dos produtos e seus derivados.""', 'Porém, para o Ministro José Eduardo Martins Cardozo, a questão está mal colocada, porque a Constituição da República é clara ao definir que a redução da idade não pode ocorrer, conforme entende a maioria dos juristas brasileiros, em virtude de ser uma garantia protegida por cláusula pétrea. Nem uma emenda constitucional poderia mudar esse quadro, pois ela seria julgada como inconstitucional. O art. 228 da Constituição diz: ""São penalmente inimputáveis os menores de dezoito anos, sujeitos às normas da legislação especial"". O art. 60 da Constituição, que trata das emendas à Constituição, no §4°, cuida das chamadas cláusulas pétreas, ou seja, aquelas cláusulas que não podem ser modificadas por emenda constitucional.', 'Eu não tenho dúvida, Senador Donizeti, de que a Proposta de Emenda Constitucional nº 20 que nós apresentamos é constitucional e é a única resposta possível neste momento para a crise que vive o País. [...] Eu acho que hoje... Nós apresentamos uma proposta de emenda à Constituição, Senador Jorge Viana, a PEC 20/2016, mas eu diria que hoje quem teria legitimidade moral para puxar esse tema é a própria Presidente da República. Ela, estando ainda no exercício da Presidência da República, poderia mandar, aqui para o Congresso, uma proposta de emenda à Constituição para cá.']"
50,64,50_nossa Federal_Supremo está_orçamentos_votamos,"['nossa Federal', 'Supremo está', 'orçamentos', 'votamos', 'ninguém será considerado culpado', 'Ulysses Guimarães', 'emenda', 'até trânsito julgado sentença', 'será considerado culpado até', 'governante', 'trânsito julgado sentença penal', 'culpado até trânsito', 'considerado culpado até', 'julgado sentença penal', 'julgado sentença penal condenatória', 'culpado até', 'culpado até trânsito julgado', 'considerado culpado até trânsito', 'até trânsito julgado', 'sentença penal']","['profissões', 'orçamentos', 'portaria', 'direito', 'emenda', 'governante', 'condenatória', 'constitucional', 'municipais', 'lei', 'públicos', 'formal', 'despesas', 'sentença', 'trânsito', 'reconhecimento', 'órgão', 'discussão', 'saúde', 'gastos']","['A nossa Constituição Federal, em seu art. 196, assegura que “a saúde é direito de todos e dever do Estado, garantido mediante políticas sociais e econômicas que visem à redução do risco de doença e de outros agravos e ao acesso universal e igualitário às ações e serviços para sua promoção, proteção e recuperação.”', 'Toda polêmica está em torno do item LVII do Artigo 5º da Constituição. Diz o texto que ""ninguém será considerado culpado até o trânsito em julgado de sentença penal condenatória"".', 'A discussão travada entre os ministros no último dia 16 era, em síntese, se uma condenação proferida por órgão colegiado, que, de acordo com o texto da Lei Complementar nº 135, de 2010, a Lei da Ficha Limpa, passa a gerar causa de inelegibilidade, afrontaria o princípio da presunção de inocência. Tal princípio, expresso em nossa Constituição de 1988, afirma que “ninguém será considerado culpado até o trânsito em julgado de sentença penal condenatória” (art. 5º da Constituição).']"
