Topic,Count,Name,Representation,Aspect1,Representative_Docs
15,196,15_não_Senado_Sr Presidente_Federal,"['não', 'Senado', 'Sr Presidente', 'Federal', 'eleições', 'Estado', 'dessa', 'direito', 'Presidente', 'nossa', 'primeiro', 'temos', 'Senado Federal', 'constitucional', 'Lei Maior', 'Brasil', 'democracia', 'verdade', 'Congresso', 'Supremo']","['Senado', 'eleições', 'Estado', 'direito', 'Presidente', 'primeiro', 'constitucional', 'atividades', 'exercício', 'democracia', 'recursos', 'anos', 'PEC', 'verdade', 'Congresso', 'povo', 'lei', 'competência', 'direitos', 'União']","['De acordo com o parágrafo único do art. 1º da nossa Carta Magna, ""todo o poder emana do povo, que o exerce por meio de representantes eleitos ou diretamente, nos termos desta Constituição"". São justamente os representantes escolhidos para o Poder Legislativo - Senadores, Deputados Federais, Estaduais e Distritais e Vereadores - os responsáveis por elaborar e atualizar todo esse corpo normativo.', 'Quero destacar ainda, Sr. Presidente, as palavras do Dr. Marcus Vinicius quando coloca que o Supremo analisou que as doações por empresa ferem diversos dispositivos da Constituição, como: a previsão do tratamento igualitário entre os candidatos; a definição de que o poder emana unicamente do povo - ou seja, dos cidadãos, e não das pessoas jurídicas; a regra que proíbe o abuso do poder econômico nas eleições; e o preceito que prevê a normalidade e a legitimidade das eleições.', '""Está muito claro para todos nós que, naquela Comissão, os debates seguirão um rito formal, dentro da competência constitucional desta Casa prevista no art. 52, inciso I, da Carta Magna, e do disposto no Regimento Interno do Senado Federal, buscando sempre analisar a existência ou não de crime de responsabilidade por parte da Presidente da República, atendendo, assim, também ao disposto no art. 85, incisos VI e VIl da nossa Constituição.""']"
16,184,16_questão_Federal_Estado_não,"['questão', 'Federal', 'Estado', 'não', 'quando', 'cláusula pétrea', 'pago', 'educação', 'mais', 'cláusula', 'Constituinte', 'Poder', 'ocorre', 'País', 'iguais', 'diz', 'desenvolvimento', 'direito', 'iguais perante lei', 'iguais perante']","['questão', 'Estado', 'pétrea', 'pago', 'educação', 'cláusula', 'bem', 'iguais', 'desenvolvimento', 'direito', 'advogado', 'Estados', 'saúde', 'vezes', 'dever', 'forma', 'União', 'lei', 'político', 'brasileira']","['A nossa Constituição reza que a República tem como objetivo fundamental promover o bem de todos, sem preconceito de origem, raça, sexo, cor e idade e quaisquer outras formas de discriminação. O crime de racismo, Sr. Presidente, Srs. Senadores, foi marcado como inafiançável e imprescritível, em norma com status de cláusula pétrea.', '""Imbuído, Sr. Presidente, de sentimento de justiça social e de fraternidade, o constituinte brasileiro, ao enumerar as diretrizes de nossa vida coletiva, no texto da Constituição Cidadã, estabeleceu, no seu art. 3º: \'Art. 3º. Constituem objetivos fundamentais da República Federativa do Brasil: I - construir uma sociedade livre, justa e solidária; II - garantir o desenvolvimento nacional; III - erradicar a pobreza e a marginalização e reduzir as desigualdades sociais e regionais; IV - promover o bem de todos, sem preconceitos de origem, raça, sexo, cor, idade e quaisquer outras formas de discriminação.\'""', 'E, quando nós assistimos a um espetáculo triste, de um ex-Presidente da República preso nas ruas do País e levado à prisão, nós concluímos que é possível, sim, caminharmos celeremente para a consagração de uma nova Justiça no Brasil. Basta a Câmara dos Deputados aprovar um projeto que já passou por aqui, durante anos aqui debatido, passou pela CCJ, pelo Plenário do Senado Federal, foi à Câmara dos Deputados, passou pela CCJ da Câmara da Câmara dos Deputados, foi à uma comissão especial, foi debatido e aprovado, também por unanimidade, sem alterações, e está pronto para a Ordem do Dia daquela Casa. Por que não inclui-lo prioritariamente na Ordem do Dia? Independentemente do desejo de algumas Lideranças, nós estamos tendo, na Câmara, uma ação de Parlamentares visando à obtenção de assinaturas num requerimento de urgência para incluir na Ordem do Dia o projeto que acaba com o foro privilegiado. Será, sim, um salto civilizatório – já repetimos esta frase aqui no Senado inúmeras vezes –, porque nós escaparemos desse estágio de retrocesso, de atraso em matéria de justiça no País para um novo tempo, em que o art. 5º da Constituição, que reza que todos somos iguais perante a lei, haverá de ser respeitado. N3o se compreende mais esta contradie7e3o histf3rica no Texto Constitucional: o art. 5ba diz que todos somos iguais perante a lei, mas he1 um dispositivo que coloca mais de 55 mil autoridades brasileiras num pedestal, como se fossem seres superiores, imunes e0 ae7e3o da Justie7a comum, privilegiados para um julgamento que muitas vezes ne3o ocorre, je1 que a prescrie7e3o e9 o caminho e o re9u ganha, obviamente, os benefedcios da impunidade.']"
17,175,17_respeitado_Federal_saúde_não,"['respeitado', 'Federal', 'saúde', 'não', 'constitucional', 'República', 'qual', 'Nacional', 'controle', 'Senado', 'Código', 'Executivo', 'Civil', 'função', 'direitos', 'nas', 'País', 'Estado', 'até', 'medidas']","['saúde', 'constitucional', 'controle', 'Senado', 'Executivo', 'função', 'direitos', 'País', 'Estado', 'medidas', 'defesa', 'última', 'anos', 'atividades', 'regras', 'segurança', 'provisórias', 'previstas', 'social', 'educação']","['Dispõe o inciso I do art. 71 da Constituição Federal que cabe a ele apreciar as contas da Presidente e emitir parecer prévio... O efetivo julgamento é aqui, perante o Congresso Nacional, por força do disposto no inciso IX do art. 49 da Constituição brasileira.', 'A nossa Constituição é claríssima, ela é taxativa: o porto é um serviço público e, portanto, ele obrigatoriamente tem de ser concessionado.', 'No fundo, no fundo, é disto que se trata, ou seja, o medo de o Presidente Lula voltar ao comando do País, pelo quanto ele é respeitado, pelo quanto ele é respeitado, pelo quanto ele é respeitado, pelo quanto ele é respeitado, pelo quanto ele é respeitado, pelo quanto ele é respeitado, pelo quanto ele é respeitado, pelo quanto ele é respeitado, pelo quanto ele é respeitado, pelo quanto ele é respeitado, pelo quanto ele é respeitado, pelo quanto ele é respeitado, pelo quanto ele é respeitado, pelo quanto ele é respeitado, pelo quanto ele é respeitado, pelo quanto ele é respeitado, pelo quanto ele é respeitado, pelo quanto ele é respeitado, pelo quanto ele é respeitado, pelo quanto ele é respeitado, pelo quanto ele é respeitado, pelo quanto ele é respeitado, pelo quanto ele é respeitado, pelo quanto ele é respeitado, pelo quanto ele é respeitado, pelo quanto ele é respeitado, pelo quanto ele é respeitado, pelo quanto ele é respeitado, pelo quanto ele é respeitado, pelo quanto ele é respeitado, pelo quanto ele é respeitado, pelo quanto ele é respeitado, pelo quanto ele é respeitado, pelo quanto ele é respeitado, pelo quanto ele é respeitado, pelo quanto ele é respeitado, pelo quanto ele é respeitado, pelo quanto ele é respeitado, pelo quanto ele é respeitado, pelo quanto ele é respeitado, pelo quanto ele é respeitado, pelo quanto ele é respeitado, pelo quanto ele é respeitado, pelo quanto ele é respeitado, pelo quanto ele é respeitado, pelo quanto ele é respeitado, pelo quanto ele é respeitado, pelo quanto ele é respeitado, pelo quanto ele é respeitado, pelo quanto ele é respeitado, pelo quanto ele é respeitado, pelo quanto ele é respeitado, pelo quanto ele é respeitado, pelo quanto ele é respeitado, pelo quanto ele é respeitado, pelo quanto ele é respeitado, pelo quanto ele é respeitado, pelo quanto ele é respeitado, pelo quanto ele é respeitado, pelo quanto ele é respeitado, pelo quanto ele é respeitado, pelo quanto ele é respeitado, pelo quanto ele é respeitado, pelo quanto ele é respeitado, pelo quanto ele é respeitado, pelo quanto ele é respeitado, pelo quanto ele é respeitado, pelo quanto ele é respeitado, pelo quanto ele é respeitado, pelo quanto ele é respeitado, pelo quanto ele é respeitado, pelo quanto ele é respeitado, pelo quanto ele é respeitado, pelo quanto ele é respeitado, pelo quanto ele é respeitado, pelo quanto ele é respeitado, pelo quanto ele é respeitado, pelo quanto ele é respeitado, pelo quanto ele é respeitado, pelo quanto ele é respeitado, pelo quanto ele é respeitado, pelo quanto ele é respeitado, pelo quanto ele é respeitado, pelo quanto ele é respeitado, pelo quanto ele é respeitado, pelo quanto ele é respeitado, pelo quanto ele é respeitado, pelo quanto ele é respeitado, pelo quanto ele é respeitado, pelo quanto ele é respeitado, pelo quanto ele é respeitado, pelo quanto ele é respeitado, pelo quanto ele é respeitado, pelo quanto ele é respeitado, pelo quanto ele é respeitado, pelo quanto ele é respeitado, pelo quanto ele é respeitado, pelo quanto ele é respeitado, pelo quanto ele é respeitado, pelo quanto ele é respeitado, pelo quanto ele é respeitado, pelo quanto ele é respeitado, pelo quanto ele é respeitado, pelo quanto ele é respeitado, pelo quanto ele é respeitado, pelo quanto ele é respeitado, pelo quanto ele é respeitado, pelo quanto ele é respeitado, pelo quanto ele é respeitado, pelo quanto ele é respeitado, pelo quanto ele é respeitado, pelo quanto ele é respeitado, pelo quanto ele é respeitado, pelo quanto ele é respeitado, pelo quanto ele é respeitado, pelo quanto ele é respeitado, pelo quanto ele é respeitado, pelo quanto ele é respeitado, pelo quanto ele é respeitado, pelo quanto ele é respeitado, pelo quanto ele é respeitado, pelo quanto ele é respeitado, pelo quanto ele é respeitado, pelo quanto ele é respeitado, pelo quanto ele é respeitado, pelo quanto ele é respeitado, pelo quanto ele é respeitado, pelo quanto ele é respeitado, pelo quanto ele é respeitado, pelo quanto ele é respeitado, pelo quanto ele é respeitado, pelo quanto ele é respeitado, pelo quanto ele é respeitado, pelo quanto ele é respeitado, pelo quanto ele é respeitado, pelo quanto ele é respeitado, pelo quanto ele é respeitado, pelo quanto ele é respeitado, pelo quanto ele é respeitado, pelo quanto ele é respeitado, pelo quanto ele é respeitado, pelo quanto ele é respeitado, pelo quanto ele é respeitado, pelo quanto ele é respeitado, pelo quanto ele é respeitado, pelo quanto ele é respeitado, pelo quanto ele é respeitado, pelo quanto ele é respeitado, pelo quanto ele é respeitado, pelo quanto ele é respeitado, pelo quanto ele é respeitado, pelo quanto ele é respeitado, pelo quanto ele é respeitado, pelo quanto ele é respeitado, pelo quanto ele é respeitado, pelo quanto ele é respeitado, pelo quanto ele é respeitado, pelo quanto ele é respeitado, pelo quanto ele é respeitado, pelo quanto ele é respeitado, pelo quanto ele é respeitado, pelo quanto ele é respeitado, pelo quanto ele é respeitado, pelo quanto ele é respeitado, pelo quanto ele é respeitado, pelo quanto ele é respeitado, pelo quanto ele é respeitado, pelo quanto ele é respeitado, pelo quanto ele é respeitado, pelo quanto ele é respeitado, pelo quanto ele é respeitado, pelo quanto ele é respeitado, pelo quanto ele é respeitado, pelo quanto ele é respeitado, pelo quanto ele é respeitado, pelo quanto ele é respeitado, pelo quanto ele é respeitado, pelo quanto ele é respeitado, pelo quanto ele é respeitado, pelo quanto ele é respeitado, pelo quanto ele é respeitado, pelo quanto ele é respeitado, pelo quanto ele é respeitado, pelo quanto ele é respeitado, pelo quanto ele é respeitado, pelo quanto ele é respeitado, pelo quanto ele é respeitado, pelo quanto ele é respeitado, pelo quanto ele é respeitado, pelo quanto ele é respeitado, pelo quanto ele é respeitado, pelo quanto ele é respeitado, pelo quanto ele é respeitado, pelo quanto ele é respeitado, pelo quanto ele é respeitado, pelo quanto ele é respeitado, pelo quanto ele é respeitado, pelo quanto ele é respeitado, pelo quanto ele é respeitado, pelo quanto ele é respeitado, pelo quanto ele é respeitado, pelo quanto ele é respeitado, pelo quanto ele é respeitado, pelo quanto ele é respeitado, pelo quanto ele é respeitado, pelo quanto ele é respeitado, pelo quanto ele é respeitado, pelo quanto ele é respeitado, pelo quanto ele é respeitado, pelo quanto ele é respeitado, pelo quanto ele é respeitado, pelo quanto ele é respeitado, pelo quanto ele é respeitado, pelo quanto ele é respeitado, pelo quanto ele é respeitado, pelo quanto ele é respeitado, pelo quanto ele é respeitado, pelo quanto ele é respeitado, pelo quanto ele é respeitado, pelo quanto ele é respeitado, pelo quanto ele é respeitado, pelo quanto ele é respeitado, pelo quanto ele é respeitado, pelo quanto ele é respeitado, pelo quanto ele é respeitado, pelo quanto ele é respeitado, pelo quanto ele é respeitado, pelo quanto ele é respeitado, pelo quanto ele é respeitado, pelo quanto ele é respeitado, pelo quanto ele é respeitado, pelo quanto ele é respeitado, pelo quanto ele é respeitado, pelo quanto ele é respeitado, pelo quanto ele é respeitado, pelo quanto ele é respeitado, pelo quanto ele é respeitado, pelo quanto ele é respeitado, pelo quanto ele é respeitado, pelo quanto ele é respeitado, pelo quanto ele é respeitado, pelo quanto ele é respeitado, pelo quanto ele é respeitado, pelo quanto ele é respeitado, pelo quanto ele é respeitado, pelo quanto ele é respeitado, pelo quanto ele é respeitado, pelo quanto ele é respeitado, pelo quanto ele é respeitado, pelo quanto ele é respeitado, pelo quanto ele é respeitado, pelo quanto ele é respeitado, pelo quanto ele é respeitado, pelo quanto ele é respeitado, pelo quanto ele é respeitado, pelo quanto ele é respeitado, pelo quanto ele é respeitado, pelo quanto ele é respeitado, pelo quanto ele é respeitado, pelo quanto ele é respeitado, pelo quanto ele é respeitado, pelo quanto ele é respeitado, pelo quanto ele é respeitado, pelo quanto ele é respeitado, pelo quanto ele é respeitado, pelo quanto ele é respeitado, pelo quanto ele é respeitado, pelo quanto ele é respeitado, pelo quanto ele é respeitado, pelo quanto ele é respeitado, pelo quanto ele é respeitado, pelo quanto ele é respeitado, pelo quanto ele é respeitado, pelo quanto ele é respeitado, pelo quanto ele é respeitado, pelo quanto ele é respeitado, pelo quanto ele é respeitado, pelo quanto ele é respeitado, pelo quanto ele é respeitado, pelo quanto ele é respeitado, pelo quanto ele é respeitado, pelo quanto ele é respeitado, pelo quanto ele é respeitado, pelo quanto ele é respeitado, pelo quanto ele é respeitado, pelo quanto ele é respeitado, pelo quanto ele é respeitado, pelo quanto ele é respeitado, pelo quanto ele é respeitado, pelo quanto ele é respeitado, pelo quanto ele é respeitado, pelo quanto ele é respeitado, pelo quanto ele é respeitado, pelo quanto ele é respeitado, pelo quanto ele é respeitado, pelo quanto ele é respeitado, pelo quanto ele é respeitado, pelo quanto ele é respeitado, pelo quanto ele é respeitado, pelo quanto ele é respeitado, pelo quanto ele é respeitado, pelo quanto ele é respeitado, pelo quanto ele é respeitado, pelo quanto ele é respeitado, pelo quanto ele é respeitado, pelo quanto ele é respeitado, pelo quanto ele é respeitado, pelo quanto ele é respeitado, pelo quanto ele é respeitado, pelo quanto ele é respeitado, pelo quanto ele é respeitado, pelo quanto ele é respeitado, pelo quanto ele é respeitado, pelo quanto ele é respeitado, pelo quanto ele é respeitado, pelo quanto ele é respeitado, pelo quanto ele é respeitado, pelo quanto ele é respeitado, pelo quanto ele é respeitado, pelo quanto ele é respeitado, pelo quanto ele é respeitado, pelo quanto ele é respeitado, pelo quanto ele é respeitado, pelo quanto ele é respeitado, pelo quanto ele é respeitado, pelo quanto ele é respeitado, pelo quanto ele é respeitado, pelo quanto ele é respeitado, pelo quanto ele é respeitado, pelo quanto ele é respeitado, pelo quanto ele é respeitado, pelo quanto ele é respeitado, pelo quanto ele é respeitado, pelo quanto ele é respeitado, pelo quanto ele é respeitado, pelo quanto ele é respeitado, pelo quanto ele é respeitado, pelo quanto ele é respeitado, pelo quanto ele é respeitado, pelo quanto ele é respeitado, pelo quanto ele é respeitado, pelo quanto ele é respeitado, pelo quanto ele é respeitado, pelo quanto ele é respeitado, pelo quanto ele é respeitado, pelo quanto ele é respeitado, pelo quanto ele é respeitado,']"
18,173,18_não_Presidente_direitos_proposta,"['não', 'Presidente', 'direitos', 'proposta', 'Federal', 'democracia', 'CCJ', 'crime', 'previsto', 'nós', 'só', 'Deficiência', 'Ministério', 'anos', 'possibilidade', 'Judiciário', 'vontade', 'Estado', 'Regimento Interno', 'proposta emenda']","['Presidente', 'direitos', 'proposta', 'democracia', 'crime', 'previsto', 'Deficiência', 'direito', 'anos', 'possibilidade', 'Judiciário', 'vontade', 'Estado', 'verdade', 'cargo', 'nacional', 'liberdade', 'garantido', 'responsabilidade', 'administração']","['Art. 225. Todos têm direito ao meio ambiente ecologicamente equilibrado, bem de uso comum do povo e essencial à sadia qualidade de vida, impondo-se ao poder público e à coletividade o dever de defendê-lo e preservá-lo para as presentes e futuras gerações.', 'E a Constituição é muito clara quando diz, no art. 20, § 1º: É assegurado, nos termos da lei, aos Estados, ao Distrito Federal e aos Municípios, bem como a órgãos da administração direta da União a participação no resultado da exploração de petróleo ou gás natural.', '""Desse modo, em seu art. 227, a Constituição Federal assegura às crianças brasileiras que é dever da família, da sociedade e do Estado assegurar \'com absoluta prioridade, o direito à vida, à saúde, à alimentação, à educação, ao lazer, à profissionalização, à cultura, à dignidade, ao respeito, à liberdade e à convivência familiar e comunitária, além de colocá-los a salvo de toda forma de negligência, discriminação, exploração, violência, crueldade e opressão\'.""']"
19,168,19_Federal_Brasil_CPI_direitos,"['Federal', 'Brasil', 'CPI', 'direitos', 'Tribunal', 'fundamentais', 'mulheres', 'normas', 'União', 'Constituições', 'Presidente', 'público', 'não sejam', 'trabalhadores trabalhadoras', 'terceiro', 'proteção', 'independência', 'PEC', 'Congresso', 'porque']","['direito', 'CPI', 'direitos', 'Tribunal', 'fundamentais', 'mulheres', 'normas', 'União', 'Constituições', 'Presidente', 'público', 'terceiro', 'proteção', 'independência', 'lei', 'social', 'trabalhadoras', 'proposta', 'trabalhadores', 'unidade']","['Quando estou dialogando com os colegas, às vezes eu digo: rapaz, imaginemos, sempre é invocado na Constituição o direito de ir e vir, que alguém pudesse ir numa fila indiana que só cabe uma pessoa. Você vai no sentido de lá, outra pessoa vem no sentido de cá: ""Ah, mas eu tenho o direito de ir e vir. Eu vou"". O outro também diz: ""Eu tenho o direito de ir e vir"" e vai. E aí? Um vai passar por cima do outro? Um vai matar o outro? Não pode ser assim. Chega uma hora em que tem que ter as regras, as normas do mundo civilizado.', 'No tocante aos requisitos constitucionais formais, verifica-se que o projeto trata de temática relativa a telecomunicações, que é matéria da competência legislativa privativa da União, conforme dispõe o art. 22, inciso IV, da Constituição Federal, assim como também cuida de política urbanística, que está inscrita no âmbito da competência legislativa concorrente da União, estados e Distrito Federal, segundo prevê o art. 24, inciso I, da Lei Maior.', '""Haveremos de convir que essa organização precisa de independência, e isso está previsto no art. 127 da Constituição Federal, que me permito ler objetivamente: \'O Ministério Público é instituição permanente, essencial à função jurisdicional do Estado, incumbindo-lhe a defesa da ordem jurídica, do regime democrático e dos interesses sociais e individuais\'. E aí o §1º do art. 127 da Constituição: \'São princípios institucionais do Ministério Público a unidade, a indivisibilidade e a independência funcional.\'""']"
20,168,20_não_direito_Estado_liberdade,"['não', 'direito', 'Estado', 'liberdade', 'crime', 'anos', 'brasileira', 'Estados', 'Federal', 'fazer', 'constitucional', 'também', 'democracia', 'direitos', 'pilares', 'Constituinte', 'debate', 'responsabilidade', 'ensino', 'Constitucional']","['direito', 'Estado', 'liberdade', 'crime', 'anos', 'brasileira', 'cotas', 'Estados', 'constitucional', 'parte', 'democracia', 'direitos', 'pilares', 'debate', 'responsabilidade', 'ensino', 'deficiência', 'juiz', 'propriedade', 'lei']","['Lembro, como se fosse hoje, quando aprovamos o Estatuto da Igualdade Racial, há 13 anos, que as cotas estavam lá. Havia um debate se as cotas eram constitucionais ou não. Fomos parar no Supremo. Fui escolhido para defender as cotas lá no Supremo, num debate coordenado pelo Ministro Ricardo Lewandowski. O debate foi de alto nível. Vencemos – aqueles que entendem que é preciso essa compensação das políticas afirmativas – por unanimidade. Acho que até aquele que pensava diferente saiu de lá convencido, e as cotas foram então consideradas constitucionais.', 'Se o ensino fundamental passou a ter a duração de nove anos (ao invés de oito) e se a Constituição está a dizer que a educação infantil será prestada às crianças, em creches e pré-escola, até completarem cinco anos de idade, isso significa que a criança com cinco anos e um dia de idade tem o direito constitucional de estar matriculada na 1ª série do ensino fundamental de nove anos.', 'E o juiz agora - como disse o próprio Ulysses Guimarães, lá nos anos 90, ou Dias Toffoli -, em 2016, será a Câmara dos Deputados. O Deputado, ou o Senador, aqui no Senado, vai, com o voto aberto, ser chamado. E, quando o Presidente perguntar, por exemplo: ""Como vota a Senadora Ana Amélia, do PP, do Rio Grande do Sul?"", eu terei que dizer, em alto e bom som, para que a sociedade saiba como vota a Senadora Ana Amélia; ou como vota qualquer Deputado. Simples assim, Senadora; simples assim!Serão esses Ministros da Suprema Corte golpistas? Eles estão, apenas e tão somente, interpretando o que está escrito na lei.']"
21,162,21_vota_Federal_não_Nacional,"['vota', 'Federal', 'não', 'Nacional', 'direito', 'constitucionais', 'Congresso Nacional', 'União', 'candidato', 'nós', 'República', 'defesa', 'mas', 'nossa', 'cidadão', 'Fundo Constitucional', 'Congresso', 'realidade', 'garantia', 'fala']","['direito', 'constitucionais', 'União', 'candidato', 'República', 'defesa', 'cidadão', 'bem', 'realidade', 'ponto', 'garantia', 'segundo', 'dúvidas', 'forma', 'claro', 'pressupostos', 'competência', 'Estado', 'Presidente', 'transparência']","['Aguardam uma legislação que assegure o direito ao meio ambiente ecologicamente equilibrado, um bem de uso comum do povo e essencial à sadia qualidade de vida de toda a população brasileira, como bem preconiza o art. 225 de nossa Carta Magna, que impõe ao Poder Público e à coletividade o dever de defendê-lo e preservá-lo para a presente e as futuras gerações brasileiras.', 'O § 1º do art. 20 da Constituição diz o seguinte: Art. 20 § 1º - É assegurada, nos termos da lei, aos Estados, ao Distrito Federal e aos Municípios, bem como a órgãos da administração direta da União, participação no resultado da exploração de petróleo ou gás natural (...) no respectivo território.', 'Na verdade, tenho dúvidas se o cidadão vota no candidato; se o cidadão vota no partido ou se vota, de fato, no candidato... Na verdade, tenho dúvidas se o cidadão vota no candidato; se o cidadão vota no partido ou se vota, de fato, no candidato. O eleitor vota mais no senhor, Senador Elmano, não que o nosso partido não seja importante, mas eu creio que o seu nome é bem maior. Por que não discutimos aqui abertamente o modelo de candidatura avulsa? Era aqui a que eu queria chegar porque o STF logo, logo, colocará em pauta esse pedido. Ele foi motivado a isso, a discutir agora sobre a candidatura avulsa. E preciso dizer que no Podemos nós entramos com um pedido para mudar o estatuto, tornar permissiva a candidatura avulsa, independente, uma semelhança à candidatura do Rede, pela qual eu fui eleito no Estado do Rio Grande do Norte.']"
