Topic,Rotulo
88,"universal, saúde, gratuito, Único, atendimento, universalização, sistema, universalidade, direito, integral, serviços, pobres, descentralização, princípio, diferença, eficácia, dever, único, Estado, diretrizes, tratamento, organização, sociedade, , , , , , , "
89,"direito, liberdade, , , , , , , , , , , , , , , , , , , , , , , , , , , , "
90,"soberania, popular, voto, soberana, povo, referendo, sufrágio, supremacia, interferência, direto, nacional, plebiscito, princípio, decisões, universal, secreto, iniciativa, povos, internas, universitária, solo, autodeterminação, subsolo, poder, poderes, guerra, conquista, cooperação, instrumentos, Estado"
91,"domésticos, trabalhadores, domésticas, direitos, trabalhistas, urbanos, empregados, trabalhadoras, rurais, empregadas, mesmos direitos, mesmos, igualdade, novos direitos, parágrafo, único, novos, artigo, categoria, isonomia, sindical, meio, jornada, trabalhador, redução, autonomia, brasileiro, trabalho, emenda, constitucional"
92,"família, idade, infantil, educação, dever, colaboração, anos, dependentes, Estado, gratuita, sociedade, filhos, direito, crianças, assistência, trabalhadores, rurais, ensino, primeiro ano, fundamental, trabalho, primeiro, urbanos, ano, direitos, , , , , "
93,"econômica, econômico, atividade, abuso, imperativos, eleições, poder, necessária, consumidor, exploração, ordem, normalidade, relevante interesse, coletivo, relevante, legitimidade, lei, nacional, direta, segurança, interesse, princípios, uso, lucros, proteção, princípio, concorrência, relevantes, eliminação, aumento"
94,"homens, mulheres, obrigações, iguais, igualdade, direitos, lei, cidadãs, livre organização, direito, conjunto, preceitos, igual, partidária, organização, individuais, cidadãos, livre, garantias, forma, sociais, , , , , , , , , "
95,"popular, iniciativa, participação, projetos, proposição, populares, leis, apresentação, referendo, dispositivos, criação, meio, feitura, temporárias, destinos, iniciativas, lei, avanço, democracia, assinaturas, análise, transição, ditadura, comissões, direta, específico, número, plebiscito, cidadã, população"
96,"Propostas, emenda, propostas, meio, proposta, constitucional, líderes, quorum, completo, discussão, quórum, sessões, específico, votação, , , , , , , , , , , , , , , , "
