Topic,Words,Frequency,Timestamp
18,"emergência reflete, reflete visão deve, deve evoluir, criar fundo, evoluir atender",1,2019
19,"medidas provisórias, caráter meramente, momento votação, Regimento Comum, necessidade mais",5,2019
20,"fortalecendo, brasileira, País pode, todas instituições, enfrentar situação",4,2019
21,"defender, defendemos, democracia liberdade, defende, democracia",7,2019
22,"crime, decisão judicial, penal, judicial, defina",5,2019
23,"cumprimento critica, destaca importância cumprimento, atribui responsabilidades claras, sugerindo necessidade, atribui responsabilidades",4,2019
24,"visão positiva, visão, sugere visão positiva, sugere visão, visa",6,2019
25,"governança, ambiental sugerindo, distorcidas, discurso critica utilização, critica utilização",2,2019
26,"Magna, Carta Magna, Carta, nossa Carta Magna, nossa Carta",4,2019
27,"Casa, liberdades individuais, liberdades, direito liberdades, esta Casa",3,2019
28,"tributária, reforma tributária, reforma, tributária não, tributárias",6,2019
29,"políticas, importância políticas, destaca importância PEC, igualdade oportunidades alinhando, importância PEC",2,2019
30,"ambiente, meio ambiente, ambiental, ecologicamente, ecologicamente equilibrado",10,2019
31,"pétrea só, ajudamos, cláusula pétrea só, dá sustentação, chamada cláusula",4,2019
32,"programa, inclusão social, destacando importância, SUS, criação",1,2019
33,"Câmara Deputados Então, Essa proposição, Deputados Então, anos espera, importante mais",1,2019
34,"educação, educacional, direito educação, discurso enfatiza necessidade cumprir, importância garantia",4,2019
35,"Criança, Adolescente, Criança Adolescente, Estatuto Criança Adolescente, Estatuto Criança",2,2019
36,"reforma, pacto federativo não, federativo não, reforma política, pacto federativo",4,2019
37,"salário mínimo, mínimo, Ministros, Ministra Cármen Lúcia, Ministra Cármen",6,2019
38,"assegurasse, mobilização sociedade, democrática país, constituir, sociedade democrática",1,2019
40,"Judiciário, Poder Judiciário, caso, situação grave, não pode invadir",4,2019
41,"democracia, brasileira disse há pouco, sem ela, democracia brasileira disse há, pior sem ela",1,2019
42,"Transparência publicidade, Transparência publicidade atos, sociedade exige, Transparência publicidade atos públicos, nossos governantes",2,2019
43,"naquela época, época, me lembro, Olívio Dutra, uniram",3,2019
44,"autonomia, forma efetiva, Senado através, emendas bancada, projeto resolução",1,2019
45,"comandar, quem cabe, destinos Nação, destinos, Nação",3,2019
46,"judicial, não está acima, está acima, ativismo judicial, ativismo",2,2019
47,"educacionais, menciona, Constituinte resultou, aspectos positivos, menciona reforma",3,2019
49,"abaixo linha pobreza, pobreza foi, abaixo linha, linha pobreza, benefício salário",1,2019
-1,"discurso enfatiza, enfatiza, democracia, discurso enfatiza necessidade, enfatiza necessidade",73,2020
0,"redemocratização, pacto, atuações, conquista social, governo civil",8,2020
1,"Presidente, penalizando, República meio, rendas, democracia nosso país",4,2020
2,"eles, Federal, possibilidade, porque todos, todos nós sabemos",5,2020
3,"vitória, Brasil, brasileira, brasileiro, população brasileira",8,2020
4,"menciona, destaca importância, democrática país, importância base democracia, democracia",27,2020
5,"preservação, Federal essas, democratas, integrar, essa postura",1,2020
6,"discurso critica, critica, crítica, constitucional todos, excesso normas tributárias",7,2020
7,"fiscal, busca justiça social, Esse verdadeiro, essas medidas, nossa prevê",2,2020
8,"todos aqueles querem, aqueles querem, esse governo, conseguirmos, impeachment presidente",1,2020
9,"tributário diferenciado, tratamento tributário, tratamento tributário diferenciado, diferenciado, nós queremos",1,2020
10,"fala, período, podemos estabelecer, Nós não podemos estabelecer, também falou",4,2020
11,"tanta corrupção, desmandos, País já, tanta, ainda mais",1,2020
12,"Ulysses, Cidadã Ulysses, sobrevivência, restrição, consagrou",2,2020
13,"lei princípio, independentemente quem, jurídica Estado, deve nortear, somos todos iguais perante",2,2020
14,"discurso enfatiza, discurso enfatiza importância, enfatiza importância, discurso, importância",3,2020
15,"democracia, vai definir, garantia nossa democracia, plenitude democracia, democracia construída",3,2020
16,"democracia critica ações possam, democracia critica ações, manutenção democracia critica ações, manutenção democracia critica, impacto social",2,2020
17,"permitirá, educação, Presidente Marcos, esperanças futuro, fundo não",2,2020
18,"necessidades emergenciais, eleitoral sugere, adaptada necessidades, sugere deve adaptada, calendário eleitoral",1,2020
19,"tenha, corte, importante proposta, Estado acho, contrariando",4,2020
20,"anseio, respeito pleno, ataque frontal, Brasil possa continuar, brasileiro direito",3,2020
21,"sair desta, nossa jovem democracia, nossa jovem, news, fake news",1,2020
22,"atentatório, agride brasileira, comete crime, fechamento, solidário",1,2020
25,"proteção oferece, positivamente, essas instituições, Receita Federal, imunidade",1,2020
28,"reforma tributária, necessidade reforma, menciona necessidade, promulgação sugerindo, precisa atualizações",2,2020
40,"xeque, mais forte, forma mais, Brasileira, Poder Judiciário",1,2020
41,"já deixou, ataques democracia, povo brasileiro já, brasileiro já, democracia brasileira",1,2020
42,"exerce papel, respeitar limites, atendimento necessidades, mas precisa, prejudica",1,2020
44,"ganharam, Estados municípios, autonomia, administrativa, autonomia administrativa",1,2020
45,"mandou, porque forma, União educação Estados, Acho Presidente, orçamento Executivo",1,2020
46,"avaliação negativa cumprimento constitucional, sugere avaliação negativa cumprimento, negativa cumprimento constitucional, judicial, cumprimento constitucional",1,2020
-1,"Senado, Federal, democracia, constitucionais, democrático",155,2021
0,"tributárias, Estado Roraima, Constituintes, promulgação, outubro",15,2021
1,"Presidente, Sr Presidente, República, Presidência, esta Presidência",9,2021
2,"Federal, Congresso, abrir espaço, Federal será, Federal espinha dorsal Estado",9,2021
3,"Brasil, brasileiro, brasileiros, brasileira, social",16,2021
4,"manutenção ordem democrática, ordem democrática, menciona, democrática, destaca relevância",28,2021
5,"Tribunal, Supremo Tribunal, Supremo, Tribunal Federal, Supremo Tribunal Federal",12,2021
6,"crítica, discurso critica, critica, sugerindo, direitos humanos",9,2021
7,"fiscal, Fiscal, Responsabilidade, Lei Responsabilidade, Responsabilidade Fiscal",10,2021
9,"agressão, fomos, projeto constitucional, encontra acordo, constitucional nós fomos",6,2021
10,"autorizam, preveem, resoluções, Federal, organização",9,2021
11,"resolver problema, problema, direito até, Nós sempre, poderá nos",8,2021
12,"veio, proteger mais, enraizar, meu partido, Presidente meu",1,2021
13,"nós vivemos numa democracia, sociais porque, cada cumprindo, deveres constitucionais, República cada",2,2021
14,"discurso enfatiza, discurso enfatiza importância, enfatiza importância, importância, discurso destaca importância",10,2021
15,"democracia, colocada, democracia cidadania, maior nossa maior, Cândido",6,2021
16,"critica, critica prática, criticar, sugerindo, expressão sugerindo",7,2021
17,"educação, graças, escola, pública, pré",10,2021
18,"Imposto Renda, Imposto, exatamente porque, renda redução, tem instrumento",2,2021
19,"ilegalidade, proposição, matéria, esse meu, efetividade garantia",8,2021
20,"esse esforço, artigo Presidente, sonho gente, foi sonho, Brasil seria",2,2021
21,"defender, estando, graças, numa, iniciativa",3,2021
22,"criminaliza, garantidora, crime, Nacional Governo, Congresso Nacional Governo",2,2021
23,"inclusão direito, propõe inclusão, emenda propõe, substitutivo, defesa emenda",2,2021
24,"visão positiva, visão, sugere visão positiva, sugere visão, visa",3,2021
25,"critica falta, critica, discurso critica, discurso critica falta, discurso critica falta políticas",3,2021
26,"Magna, Carta Magna, Carta, nossa Carta Magna, nossa Carta",3,2021
27,"Casa, Casa legislativa, grande oportunidade, sob império, dessa casa",4,2021
28,"tributária, propostas, mandou, reforma tributária, própria Câmara",2,2021
29,"previstos necessidade, destaca importância direitos, discurso destaca importância direitos, necessidade políticas públicas, importância direitos",1,2021
30,"ambiente, meio ambiente, ambiental, ecologicamente equilibrado, ecologicamente",3,2021
31,"acessíveis, compete, cidade, cidadania, significa",2,2021
32,"partir importância, construção histórica, discurso reflete, aprimoramento, continuidade",1,2021
33,"Câmara, Câmara Deputados, Deputados, inscrever direito, equivocadas",3,2021
34,"já reconhecido, educação direito social, falta investimento, educação direito, direito social",1,2021
36,"nós podemos, nosso sistema, sistema político nós, político nós, sistema judiciário",1,2021
37,"já consagrada, apoio integral, Ministro Barroso, decisão Ministro, Barroso",1,2021
38,"espinha dorsal Estado democrático, dorsal Estado democrático, dorsal Estado democrático direito, espinha dorsal Estado, República Federativa Brasil",3,2021
40,"respeito decisões, respeito decisões judiciais, Poderes respeito, princípio básico, elementar",1,2021
43,"Exa, perene política, perene política Estado, garantirmos, política perene política Estado",1,2021
46,"precedente, ele desconsidera, legislação vigente País, deplorável, vigente País",1,2021
47,"menciona, histórica, liberdade econômica, social desde, medidas extraordinárias",4,2021
49,"não abrir, permitir Estados, Estados Municípios, permitir, possibilidade",1,2021
-1,"discurso, constitucionais, importância, constitucionalidade, Brasil",163,2022
0,"aconteceu, Federal, predominou, quase três décadas, situação pobreza",10,2022
1,"Presidente, liberdade culto, Tancredo, culto, Sr Presidente",8,2022
2,"Federal, Congresso, Congresso Nacional, dada, Plano Nacional",11,2022
3,"Brasil, Convenção, brasileira, diversidade, nação",12,2022
4,"ordem, importância, democrática, destaca importância PEC, ações políticas",9,2022
5,"Tribunal, Supremo Tribunal, Tribunal Federal, Supremo Tribunal Federal, Federal",16,2022
6,"discurso critica, critica, crítica, sociais discurso critica, garantidos sugerindo",5,2022
7,"fiscal, telecomunicações, fiscalização, teto gastos, chegamos situação",5,2022
8,"impeachment, aqui falando, respeitada Nós, democracia nunca, fatiamento",2,2022
9,"Constituinte até, Constituinte até hoje, parabéns, limite nós, exatamente isto",7,2022
10,"Federal, nos termos, competência, compete, constitucionalidade",18,2022
11,"obedecer, tudo, direito liberdade expressão, menos três, injustiçada",13,2022
12,"roubar, Ulysses, Ulysses Guimarães, Guimarães, não deixar",4,2022
13,"agressão Estado democrático direito, agressão Estado democrático, atuação instituições, agressão Estado, nós estamos sendo",2,2022
14,"discurso destaca importância, destaca importância, importância, nós temos honrar, constitucional parte",3,2022
15,"democracia, prisão, democracia não, apesar, Democracia",6,2022
16,"critica, anos mandato, sociedade Parlamento, garantir controle, secreto sugerindo",4,2022
17,"Educação, educação, nos recursos, fundamento nos, demanda histórica",3,2022
18,"vista, menção proposta emenda, necessidade, proposta emenda, sugere vista",9,2022
19,"constitucionalidade, vislumbramos, constitucionalidade iniciativa, todos aspectos verifica constitucionalidade, Assim sendo todos aspectos",14,2022
20,"não hoje, Cidadã ela, tempos não, hoje aqueles, cumprir brasileira",3,2022
21,"defender, Combater, fake news, industriais, apontar",3,2022
22,"crime, homicídio, simples, secundária, crimes",5,2022
23,"processo eleitoral, menção defesa, indicam avaliação positiva promotora, positiva promotora direitos, promotora direitos",3,2022
24,"visão positiva, visa, suspeita, religiões, mais equilíbrio",2,2022
25,"defesa Zona Franca, defesa Zona Franca Manaus, Zona Franca Manaus, economia, Franca",1,2022
26,"Magna, Carta Magna, Carta, nossa Carta Magna, nossa Carta",7,2022
27,"Casa, pessoas mesmo, Consoante, dizer este, Plenário cada",3,2022
28,"isonomia, tributária, até fato, desse problema, Reforma Tributária",2,2022
29,"políticas, discurso enfatiza, importância políticas públicas, importância políticas, enfatiza importância participação",3,2022
30,"ambiente, meio ambiente, ambiental, ecologicamente equilibrado, ecologicamente",3,2022
31,"alegria, tive, Cidadã, depois, cidadania",1,2022
32,"pública antes, celebra criação Tocantins, Federal destacando, discurso celebra criação Tocantins, criação Tocantins",2,2022
33,"Câmara, Câmara Deputados, Deputados, sociedade cada vez mais, sociedade cada vez",3,2022
34,"educação, previsto sugere vista documento, previsto sugere vista, Sistema Nacional Educação, menciona importância educação",2,2022
35,"discussão obrigatoriedade, avaliação protetora, menção artigo discussão, artigo discussão, direitos crianças adolescentes",1,2022
37,"Ministros, Ministros Supremo, mínimo, deveriam, nossos Ministros",6,2022
40,"outras tantas, existem outras, juristas, aquilo foi, inaceitável",1,2022
41,"defesa, defesa defesa, brasileiros defesa, defesa democracia defesa, defesa liberdade",1,2022
42,"administração pública, administração, orientado, constitucional esses, permanentes",2,2022
43,"fundamentos, dignidade pessoa humana, dignidade pessoa, pessoa humana, humana",1,2022
46,"judicial, ativismo judicial, ativismo, judicialização, orçamentário sugerindo",4,2022
-1,"discurso, Brasil, democracia, Federal, democrático",203,2023
0,"história, Brasil, desde, Federal, nossa história",28,2023
1,"Presidente, Sr Presidente, República, Presidente República, fato",14,2023
2,"Congresso, Federal, Congresso Nacional, Nacional, bolso",22,2023
3,"Brasil, brasileira, guardiões, passa, população",13,2023
4,"menciona, importância, destaca importância, protege, documento",19,2023
5,"Tribunal, Supremo Tribunal, Tribunal Federal, Supremo Tribunal Federal, Supremo",25,2023
6,"discurso critica, critica, crítica, sugerindo, direitos não está sendo",6,2023
7,"Fiscal, Responsabilidade, Lei Responsabilidade, Responsabilidade Fiscal, Lei Responsabilidade Fiscal",3,2023
8,"impeachment, direitos políticos, políticos, rasgada, impitimada",4,2023
9,"infelizmente gente não, anos Supremo, Ou seja não, Senadores podemos, legisla nós",8,2023
10,"outros artigos, Federal, direito propriedade, retirada, palavra",9,2023
11,"gente, previsto, gente tem, está escrito, está previsto",13,2023
12,"Ulysses, Ulysses Guimarães, Guimarães, quando foi promulgada, Pátria",5,2023
13,"democrático, Estado democrático direito, Estado democrático, democrático direito, regime",5,2023
14,"discurso enfatiza, importância, discurso enfatiza importância, enfatiza importância, protege valores",6,2023
15,"democracia, nossa democracia, democracia porque, liberdade, Democracia",9,2023
16,"critica, pró, contrárias, criticar, sugerindo",8,2023
17,"educação, investimento, levamos, Responsabilidade Educacional, educada",7,2023
18,"justificativa, necessidade, ordem segurança, menção cotas, transformação Amapá",5,2023
19,"processo legislativo porque, discussão matéria, robusta, intacta, importante sempre",4,2023
20,"brasileira, Brasil, gente não está, paga imposto, utilidade",6,2023
21,"defender, todo mundo, defendemos, defendendo, todos nós",9,2023
22,"problema, persistir, colegas não, Agora também, fazer reflexão",1,2023
23,"proteção constitucional, avaliação positiva, nacional sugere avaliação, nacional sugere avaliação positiva, constitucional menção",4,2023
24,"visão positiva, visão, indicando visão positiva, indicando visão, sugere visão positiva",5,2023
25,"discurso critica Governo, critica Governo, discurso critica, critica, Governo",3,2023
26,"Magna, Carta Magna, Carta, nossa Carta Magna, nossa Carta",3,2023
27,"Casa, esta Casa, desta Casa, Esta Casa, justo não",7,2023
28,"expressa orgulho, parte Poder Legislativo, através emenda constitucional, parte Poder, tributária",1,2023
29,"discurso enfatiza, discurso enfatiza importância, enfatiza importância, importância políticas, enfatiza importância políticas",4,2023
30,"ambiente favorável, restabelecer ordem, pacíficas, paz social, negociações",1,2023
31,"cidadão, nós estamos comemorando, proteção dados, cidadão comum, anos Cidadã",3,2023
34,"importância educação, educação, discurso enfatiza importância, enfatiza importância, conforme estabelecido",5,2023
37,"Ministro não, não colocou, Senador Girão, está violando, obedecendo",1,2023
38,"confiou, fomos eleitos, povo brasileiro foi, diretamente povo, democrático Brasil",1,2023
39,"Portanto, reforma tributária, não novidade, respeito devido processo legal, vivemos Estado democrático direito",3,2023
40,"Judiciário, Poder Judiciário, Poder Legislativo, Poder Judiciário está, Judiciário está",4,2023
41,"não boa, democracia, juntos, democracia brasileira, Essa mensagem",3,2023
43,"candidatura, coloca, acima, conquista brasileiros, democracia porque não",3,2023
44,"autonomia, autonomia Banco Central, autonomia Banco, Banco Central, Banco",2,2023
45,"tem todo, conhecimento, medo, comandar, quem cabe",3,2023
46,"judicial, ativismo judicial, ativismo, constitucionais discurso critica, insegurança jurídica",6,2023
47,"menciona aprovação PEC, menciona aprovação, momento histórico, aprovação PEC, histórico",1,2023
48,"potências, nosso território, mas futuro, grandes potências, lobbies",1,2023
49,"aumento, regulamentação, Fundo Constitucional, Receita, foi criada",1,2023
-1,"discurso, Senado, democracia, nossa, Brasil",194,2024
0,"batalha, foi, promulgada, promulgação, desde",24,2024
1,"Presidente, Sr Presidente, sentado, direitos políticos, pátria",15,2024
2,"Congresso, Federal, Congresso Nacional, Vocês não, Nacional",13,2024
3,"Brasil, brasileira, brasileiro, aqueles deveriam primeiros respeitá, primeiros respeitá",16,2024
4,"protegem, protege, elas não estão, estão sendo, Deputado",7,2024
5,"Tribunal, Supremo Tribunal, Tribunal Federal, Supremo Tribunal Federal, Supremo",13,2024
6,"discurso critica, critica, discurso, crítica, MST",12,2024
7,"fiscal, dívida, fiscais sugerindo deve, disposições transitórias, seja colocada",4,2024
8,"impeachment, processo impeachment, abusos, processo, processo impeachment Ministro",6,2024
9,"está causando, ele não está, ninguém, privacidade, não está",5,2024
10,"publicidade, Federal, moralidade, brasileiro, Art",10,2024
11,"não tenho, dia, você não, lei, não tem",17,2024
12,"Ulysses, Ulysses Guimarães, Guimarães, palavras, saudoso Ulysses",6,2024
13,"democrático, Estado democrático, democrático direito, Estado democrático direito, aqueles têm",12,2024
14,"importância, discurso destaca importância, discurso destaca, destaca importância, discurso enfatiza",7,2024
15,"democracia, falecida, democracia mas, Casa precisa, respeitam democracia",6,2024
16,"critica, deve respeitada, sugerindo, afirmando não, períodos exceção",9,2024
17,"educação, vou estar, essa premissa constitucional, redução carga tributária, compromisso desta",3,2024
18,"menção, necessidade, povo brasileiro menção, vista adaptável, emenda discussão",4,2024
19,"constitucionalidade, apreciarmos, proposta emenda aprovada, preservando assim, esta minha",5,2024
20,"Brasil, respeito, brasileira, Brasil não, Que Brasil",17,2024
21,"defender, defende, defendendo, defender democracia, fake news",18,2024
22,"crime, penal, palavras votos, organização criminosa, garantia não",7,2024
23,"menção, menciona, aplicação, avaliação positiva, menção falta regulamentação",7,2024
24,"instituições própria, desmoralização instituições, regime autoritário, desmoralização, estabelecimento",2,2024
25,"discurso critica, públicos destacando, ação Ministério Público Federal, importância liberdades, sugerindo deveria proteger esses",2,2024
26,"Magna, Carta Magna, Carta, nossa Carta Magna, nossa Carta",8,2024
27,"Casa, Casa tem, esta Casa, Poderes mais, estão nesta Casa",4,2024
28,"tributária, sistema tributário, tributário, atenuar efeitos, Vale dizer",3,2024
29,"políticas, políticas públicas, discurso menciona necessidade, públicas, discurso menciona",4,2024
30,"ambiente, ambiental, meio ambiente, ecologicamente, ecologicamente equilibrado",3,2024
34,"menção artigo discussão, indicam importância, Plano Nacional Educação, Nacional Educação, menção artigo",1,2024
35,"nesta nação, está determinado, adolescentes, crianças adolescentes, prioridade absoluta",1,2024
36,"simplificação, neutralidade, reforma, nessa reforma, foi discurso",1,2024
37,"Ministros, defender nossa, Ministros STF, deveriam, alguns Ministros STF",7,2024
38,"Estado democrático direito, guardião daquilo chamo espinha, guardião daquilo chamo, guardião daquilo, guardião Estado democrático",1,2024
39,"Portanto, portanto, emenda constitucional, estruturada, Trata portanto instituição",4,2024
40,"Judiciário, Poder Judiciário, independência, ditadura Poder, ditadura Poder Judiciário",3,2024
42,"brasileira têm, dever moral, sociedade brasileira têm, público sociedade, público sociedade brasileira",1,2024
43,"cada Poderes, focada, República deve, bem democracia, Presidente fez",2,2024
44,"melhorou muito, Banco Central, Banco, conferida, autonomia",1,2024
45,"tem todo, conhecimento, todo, Olha, dia",2,2024
46,"judicial, ativismo judicial, ativismo, menciona crescimento, crítica possibilidade",4,2024
48,"militantes, primeiros habitantes, rios, verdadeiros, defesa meio ambiente",1,2024
-1,"parar, Brasil, dia, aqui, vingança",26,2025
0,"não estou falando, estou falando, não estou, falando, Cidadã estava",3,2025
1,"Presidente, Presidente Sarney, Presidente República, República, Brasil",6,2025
2,"expressão mas, jogo aqui, jogo aqui não, está jogo aqui, liberdade expressão mas",1,2025
3,"importantes, fluir, importante essas, Senado Federal particularmente, muitas coisas importantes",2,2025
6,"praças, positiva protetora direitos fundamentais, consulta popular, protetora direitos fundamentais, indicam avaliação positiva protetora",1,2025
11,"retroativamente, prejudicam, forma alguma, ficarmos, vedado",2,2025
12,"importantes direitos, Ulysses, nosso saudoso, nosso arcabouço jurídico, sabiamente",1,2025
15,"nossas obrigações, nas nossas, obrigações constitucionais, obrigações, mão",1,2025
16,"imparcialidade, critica, sugerindo viola princípios constitucionais, sugerindo viola princípios, sugerindo viola",2,2025
17,"hoje encontra, infralegal, legislação federal, Para garantir, garantir permanência",1,2025
19,"óbice, medida proposta, constitucionalidade medida, quanto constitucionalidade, constitucionalidade",1,2025
20,"Estado direito Brasil, afronta nossa, direito Brasil, deliberar, ausência",1,2025
21,"democracia verdadeira absoluta, vontade popular não, respeita vontade, verdadeira absoluta, democracia verdadeira",1,2025
22,"normalização, crime opinião, estamos vendo aqui, vendo aqui, aqui neste",1,2025
27,"Casa, coniventes, calados, vergonhoso, Esta Casa tem",1,2025
30,"Senadoras Senadores, incluído, Pantanal, estivesse, Mato",1,2025
32,"durante Constituinte, Constituinte sugere avaliação, Constituinte sugere avaliação positiva, Constituinte sugere, sugere avaliação positiva marco",1,2025
48,"todo território, públicas voltadas, Ministra Marina, social tem, nossa existência",2,2025
