Topic,Count,Name,Representation,Aspect1,Representative_Docs
-1,3748,-1_defende_deve_garantir_critica,"['defende', 'deve', 'garantir', 'critica', 'Federal', 'constitucionais', 'direitos', 'importância', 'constitucional', 'necessidade', 'Senado', 'destaca importância', 'aprovação', 'PEC', 'visa', 'Nacional', 'Tribunal', 'impeachment', 'Brasil', 'Tribunal Federal']","['constitucionais', 'direitos', 'importância', 'constitucional', 'necessidade', 'Senado', 'aprovação', 'processo', 'direito', 'impeachment', 'princípios', 'reforma', 'decisão', 'forma', 'social', 'política', 'medidas', 'relação', 'pública', 'educação']","['Por causa disso, o orador defende que o Senado deve atuar para limitar o poder do Supremo Tribunal Federal e garantir a estabilidade jurídica, especialmente em relação à prisão após a segunda instância.', 'Por causa disso, o orador apoia a decisão do Supremo Tribunal Federal que reafirma a igualdade de todos, conforme explicitado na Constituição, e critica ações contrárias a essa decisão.', 'Por causa disso, o orador defende que a criação de novas áreas de reserva deve respeitar a decisão do Supremo Tribunal Federal e a Constituição de 1988, que estabelece limites para a demarcação de terras indígenas.']"
0,1786,0_defende_critica_direitos_garantir,"['defende', 'critica', 'direitos', 'garantir', 'importância', 'conforme', 'destaca importância', 'Federal', 'necessidade', 'deve', 'constitucionais', 'aprovação', 'constitucional', 'PEC', 'visa', 'Senado', 'Estados', 'Brasil', 'política', 'Presidente']","['direitos', 'importância', 'necessidade', 'constitucionais', 'aprovação', 'constitucional', 'direito', 'Senado', 'lei', 'Estados', 'processo', 'reforma', 'projeto', 'forma', 'recursos', 'Estado', 'saúde', 'inconstitucional', 'conformidade', 'princípios']","['Por causa disso, o orador destaca a necessidade de uma política eficaz para a demarcação de terras indígenas, conforme previsto na Constituição de 1988, para evitar conflitos e garantir os direitos dos povos indígenas.', 'Por causa disso, o orador defende a manutenção do marco temporal de 5 de outubro de 1988 para a demarcação de terras indígenas, conforme estabelecido pela Constituição e pacificado pelo Supremo Tribunal Federal, para evitar conflitos e garantir segurança jurídica aos proprietários de terras.', 'Por causa disso, o orador destaca a importância de garantir a demarcação e o respeito às terras indígenas, conforme previsto na Constituição, como parte essencial da proteção dos direitos dos povos indígenas no Brasil.']"
1,400,1_importância_defende_destaca importância_critica,"['importância', 'defende', 'destaca importância', 'critica', 'constitucionais', 'necessidade', 'conforme estabelecido', 'educação', 'Senado', 'propõe', 'direitos', 'medidas', 'constitucional', 'Brasil', 'proteção', 'aprovação', 'visa', 'Estado', 'públicas', 'princípios']","['importância', 'constitucionais', 'necessidade', 'educação', 'Senado', 'recursos', 'direitos', 'medidas', 'constitucional', 'proteção', 'aprovação', 'ações', 'Estado', 'públicas', 'relação', 'princípios', 'funcionamento', 'PEC', 'projeto', 'distribuição']","['Por causa disso, o orador critica o uso do veto presidencial como um instrumento que pode comprometer a fiscalização das obras públicas e a atuação do Tribunal de Contas da União, sugerindo que o Congresso Nacional deve apreciar os vetos com rigor para garantir a transparência e a ética na administração pública.', 'Por causa disso, o orador defende a aprovação de emendas ao Projeto de Lei da Câmara 141, de 2009, a Minirreforma Eleitoral, para garantir maior transparência e moralidade nas campanhas eleitorais, em conformidade com o princípio da moralidade previsto na Constituição.', 'Por causa disso, o orador defende que o Congresso Nacional deve considerar o impeachment da Presidente Dilma Rousseff, pois acredita que dispositivos constitucionais foram violados, justificando a necessidade de uma mudança de governo para salvar o Brasil da crise política e econômica.']"
2,383,2_defende_garantir_Federal_constitucionais,"['defende', 'garantir', 'Federal', 'constitucionais', 'importância', 'constitucional', 'políticas', 'visa', 'Senado', 'Brasil', 'garantindo', 'proposta', 'decisão', 'proteção', 'necessidade', 'legislação', 'Supremo', 'Nacional', 'Tribunal', 'Congresso']","['constitucionais', 'importância', 'recursos', 'constitucional', 'políticas', 'Senado', 'proposta', 'decisão', 'proteção', 'necessidade', 'forma', 'legislação', 'lei', 'saúde', 'aprovação', 'direitos', 'falta', 'Estados', 'emenda', 'direito']","['Por causa disso, o orador sugere que o Congresso Nacional deve avaliar e possivelmente revisar a política de armamentos do Brasil, especialmente no que diz respeito à produção e comercialização de bombas de fragmentação, para garantir que esteja em conformidade com os princípios constitucionais de paz e segurança.', 'Por causa disso, o orador critica a decisão do Supremo Tribunal Federal sobre a demarcação da reserva Raposa Serra do Sol, argumentando que ela não atende aos interesses dos próprios indígenas e sugere que a questão deve ser reavaliada com base nos direitos constitucionais dos índios.', 'Por causa disso, o orador defende que o Senado Federal deve agir para garantir que a Constituição seja respeitada, especialmente no que diz respeito ao papel do Supremo Tribunal Federal em relação às leis.']"
3,370,3_defende_Senado_constitucionais_constitucional,"['defende', 'Senado', 'constitucionais', 'constitucional', 'critica', 'deve', 'importância', 'garantir', 'não', 'necessidade', 'direito', 'princípios', 'democracia', 'argumentando', 'proteger', 'Federal', 'projeto lei', 'saúde', 'nacional', 'transparência']","['Senado', 'constitucionais', 'constitucional', 'importância', 'lei', 'necessidade', 'direito', 'projeto', 'princípios', 'democracia', 'função', 'saúde', 'nacional', 'transparência', 'respeito', 'governo', 'processo', 'direitos', 'interesses', 'Estado']","['Por causa disso, o orador defende que o Senado deve proteger suas prerrogativas constitucionais e não aceitar interferências do Supremo Tribunal Federal que possam limitar a liberdade de expressão dos senadores.', 'Por causa disso, o orador defende a aprovação da PEC 10/2013, que visa eliminar o foro privilegiado para a maioria das autoridades, em consonância com o princípio de igualdade perante a lei estabelecido pela Constituição.', 'Por causa disso, o orador critica a atuação do STF e do TSE, alegando que suas ações ferem a liberdade de expressão garantida pela Constituição, e defende que o Senado deve agir para impedir esses abusos.']"
4,344,4_direitos_defende_critica_reforma,"['direitos', 'defende', 'critica', 'reforma', 'PEC', 'constitucional', 'segurança', 'garantir', 'pública', 'Congresso', 'destaca importância', 'manutenção', 'política', 'proposta', 'respeitar', 'crise política', 'Senado', 'necessidade', 'propõe', 'constitucionais']","['direitos', 'reforma', 'importância', 'constitucional', 'segurança', 'pública', 'processo', 'manutenção', 'política', 'proposta', 'Senado', 'recursos', 'necessidade', 'constitucionais', 'devido', 'forma', 'desenvolvimento', 'ordem', 'eleições', 'crise']","['Por causa disso, o orador defende que a solução para a crise política deve respeitar a Constituição, sugerindo a possibilidade de uma emenda constitucional para permitir eleições diretas.', 'Por causa disso, o orador defende que o processo de impeachment é constitucional e que a atuação do Supremo Tribunal Federal reforça a obediência às normas do devido processo legal.', 'Por causa disso, o orador apoia a proposta de emenda à Constituição que permite eleições diretas em caso de vacância da Presidência nos últimos dois anos do mandato, como uma solução para a crise política.']"
5,330,5_defende_Senado_destaca importância_direitos,"['defende', 'Senado', 'destaca importância', 'direitos', 'Congresso', 'impeachment', 'critica', 'constitucional', 'Federal', 'constitucionais', 'PEC', 'responsabilidade', 'princípios', 'garantir', 'públicos', 'Presidente', 'princípios constitucionais', 'proteção', 'fiscal', 'decisão']","['Senado', 'importância', 'direitos', 'Congresso', 'impeachment', 'medida', 'constitucional', 'processo', 'constitucionais', 'responsabilidade', 'direito', 'princípios', 'públicos', 'Presidente', 'proteção', 'fiscal', 'decisão', 'necessidade', 'legislativo', 'parlamentares']","['Por causa disso, o orador defende que o Congresso Nacional deve cumprir seu dever constitucional de avaliar o processo de impeachment da Presidente Dilma Rousseff, como uma forma de responder à crise política e econômica do país.', 'Por causa disso, o orador sugere que a PEC nº 241, que estabelece um teto para os gastos públicos, é uma medida necessária para garantir a responsabilidade fiscal e evitar a necessidade de futuras reformas constitucionais que poderiam desestabilizar o país.', 'Por causa disso, o orador defende a aprovação da PEC 241, que estabelece um limite para os gastos públicos, como uma medida necessária para garantir a responsabilidade fiscal e evitar gastos excessivos que não estão alinhados com a arrecadação do país.']"
6,295,6_impeachment_defende_Presidente_Dilma,"['impeachment', 'defende', 'Presidente', 'Dilma', 'Federal', 'processo impeachment', 'constitucionais', 'responsabilidade', 'Rousseff', 'Dilma Rousseff', 'aprovação', 'constitucional', 'impeachment Presidente', 'necessidade', 'impeachment Presidente Dilma Rousseff', 'Tribunal Federal', 'Supremo Tribunal', 'Supremo Tribunal Federal', 'Supremo', 'impeachment Presidente Dilma']","['impeachment', 'processo', 'Presidente', 'constitucionais', 'responsabilidade', 'aprovação', 'importância', 'constitucional', 'necessidade', 'projeto', 'lei', 'Estado', 'direitos', 'segurança', 'direito', 'atuação', 'forma', 'democracia', 'saúde', 'conformidade']","['Por causa disso, o orador argumenta que o processo de impeachment contra a Presidenta Dilma Rousseff não tem base jurídica sólida, pois não há crime de responsabilidade comprovado, conforme exigido pela Constituição para tal procedimento.', 'Por causa disso, o orador argumenta que o processo de impeachment da Presidente Dilma Rousseff não tem base legal, pois não houve crime de responsabilidade, e critica a utilização do impeachment como um artifício para um recall governamental, o que não é previsto na Constituição.', 'Por causa disso, o orador defende que o processo de impeachment da Presidente Dilma Rousseff deve seguir adiante, pois está em conformidade com a Constituição, conforme estabelecido pelo Supremo Tribunal Federal.']"
7,291,7_garantir_necessidade_defende necessidade_defende,"['garantir', 'necessidade', 'defende necessidade', 'defende', 'importância', 'destaca importância', 'deve', 'constitucional', 'saúde', 'respeitar', 'argumenta', 'constitucionais', 'projeto', 'respeitando', 'contra', 'ação', 'PEC', 'pública', 'critica', 'aplicação']","['necessidade', 'importância', 'constitucional', 'criação', 'saúde', 'constitucionais', 'projeto', 'medidas', 'ação', 'pública', 'aplicação', 'política', 'recursos', 'justiça', 'direito', 'lei', 'instituições', 'ambiental', 'ordem', 'Senado']","['Por causa disso, o orador defende que o processo de impeachment deve seguir rigorosamente o rito estabelecido pela Constituição e pelo Supremo Tribunal Federal, sem atropelos ou antecipações de prazos, para garantir a legalidade e legitimidade do julgamento da Presidente Dilma Rousseff.', 'Por causa disso, o orador argumenta que o processo de impeachment contra a Presidenta Dilma Rousseff não atende aos requisitos constitucionais, pois não há comprovação de crime de responsabilidade, e sugere que o Supremo Tribunal Federal deveria intervir para garantir a soberania popular.', 'Por causa disso, o orador critica a falta de ação da Câmara dos Deputados em relação à PEC do voto aberto, que impacta a transparência e a responsabilidade política, e defende a necessidade de revisão do Pacto Federativo para garantir uma distribuição justa de impostos entre os estados.']"
8,266,8_importância_destaca importância_União_aprovação,"['importância', 'destaca importância', 'União', 'aprovação', 'garantir', 'defende', 'Senado', 'constitucionais', 'propõe', 'critica', 'segurança', 'democracia', 'contra', 'distribuição', 'princípios constitucionais', 'constitucional', 'autonomia', 'Estados', 'princípios', 'Projeto Lei']","['importância', 'União', 'aprovação', 'Senado', 'constitucionais', 'recursos', 'segurança', 'democracia', 'distribuição', 'constitucional', 'autonomia', 'Estados', 'princípios', 'estabelecido', 'mínimo', 'poderes', 'financeira', 'saúde', 'direitos', 'processo']","['Por causa disso, o orador defende que qualquer alteração na distribuição dos royalties do pré-sal deve respeitar o papel constitucional da Marinha na defesa da Pátria e na garantia da lei e da ordem, conforme estabelecido no artigo 142 da Constituição.', 'Por causa disso, o orador propõe as PECs nº 124 e 125, de 2011, que visam alterar a Constituição para melhorar a distribuição de recursos entre a União, Estados e Municípios, promovendo maior autonomia financeira para os entes federativos.', 'Por causa disso, o orador apoia a aprovação do Projeto de Lei nº 3.449, de 2024, que visa alterar a tributação simplificada das remessas postais internacionais e o Programa Mobilidade Verde e Inovação, em conformidade com as competências constitucionais da União.']"
9,226,9_medidas_direitos_defende_constitucionais,"['medidas', 'direitos', 'defende', 'constitucionais', 'garantir', 'destaca importância', 'Brasil', 'medidas provisórias', 'provisórias', 'legitimidade', 'Senado', 'princípios', 'processo legislativo', 'Nacional', 'princípios constitucionais', 'fundamentais', 'Congresso', 'Congresso Nacional', 'necessidade', 'democracia']","['medidas', 'direitos', 'constitucionais', 'importância', 'provisórias', 'legitimidade', 'Senado', 'princípios', 'fundamentais', 'necessidade', 'democracia', 'aprovação', 'processo', 'legislativo', 'proposta', 'eleitoral', 'conformidade', 'trabalhadores', 'políticas', 'decisões']","['Por causa disso, o orador enfatiza a importância de garantir que os princípios constitucionais de democracia, liberdade e solidariedade sejam respeitados e aplicados nas políticas públicas, como o PAC, para promover o desenvolvimento econômico e social.', 'Por causa disso, o orador critica a atuação do Ministério da Justiça e do Governo em relação à proteção dos direitos indígenas, conforme estabelecido pela Constituição, e defende a necessidade de garantir os direitos constitucionais dos povos indígenas, especialmente no que diz respeito à demarcação de terras.', 'Por causa disso, o orador defende que o Congresso Nacional deve cumprir rigorosamente o rito constitucional de tramitação das medidas provisórias, começando pela análise por uma comissão especial mista, para garantir a segurança jurídica e a autonomia legislativa.']"
10,222,10_Brasil_defende_Estado_destaca importância,"['Brasil', 'defende', 'Estado', 'destaca importância', 'critica', 'Federal', 'direitos', 'Tribunal', 'desenvolvimento', 'Senado', 'política', 'constitucional', 'Nacional', 'União', 'representação', 'educação', 'CPI', 'necessidade', 'conforme estabelecido', 'defende importância']","['importância', 'Estado', 'direito', 'direitos', 'desenvolvimento', 'Senado', 'política', 'constitucional', 'atuação', 'União', 'representação', 'criação', 'educação', 'CPI', 'necessidade', 'constitucionais', 'princípio', 'cumprimento', 'brasileiro', 'forma']","['Por causa disso, o orador defende que o julgamento das contas da Presidência da República deve ser feito pelo Congresso Nacional, com base na Constituição, e não apenas pelo Tribunal de Contas da União.', 'Por causa disso, o orador defende que o Senado Federal deve atuar para garantir o direito à saúde para todos os brasileiros, conforme estabelecido pela Constituição Federal, e critica a falta de regulamentação da Emenda Constitucional nº 29, que poderia melhorar as condições de atuação do Ministério da Saúde.', 'Por causa disso, o orador defende que o Supremo Tribunal Federal deve julgar com base na Constituição, garantindo direitos fundamentais como o amplo direito de defesa e a presunção de inocência, especialmente em relação à questão da prisão em segunda instância.']"
11,183,11_defende_política_critica_direitos,"['defende', 'política', 'critica', 'direitos', 'pública', 'transparência', 'constitucional', 'Judiciário', 'respeito', 'Senado', 'impeachment', 'Poder Judiciário', 'necessidade mudanças', 'preservação', 'constitucionais', 'defende continuidade', 'parlamentares', 'reforma', 'presunção inocência', 'segurança']","['política', 'direitos', 'pública', 'transparência', 'constitucional', 'sessão', 'Judiciário', 'respeito', 'Senado', 'impeachment', 'preservação', 'constitucionais', 'parlamentares', 'saúde', 'reforma', 'segurança', 'democracia', 'mandatos', 'direito', 'lei']","['Por causa disso, o orador defende que qualquer tentativa de impeachment da Presidenta Dilma sem base constitucional seria um golpe, violando o Estado de direito e a democracia estabelecidos pela Constituição de 1988.', 'Por causa disso, o orador critica a falta de transparência no orçamento secreto e apoia a necessidade de mudanças para garantir a transparência conforme ordenado pelo Supremo Tribunal Federal.', 'Por causa disso, o orador defende a necessidade de mudanças no sistema de indicação dos Ministros do STF, propondo a PEC 35/2015, que visa alterar esse processo para garantir maior independência dos ministros em relação ao Presidente da República.']"
12,181,12_constitucional_Nacional_garantir_destaca,"['constitucional', 'Nacional', 'garantir', 'destaca', 'importância', 'destaca importância', 'igualdade', 'garantindo', 'Congresso', 'Congresso Nacional', 'constitucionais', 'Senado', 'destaca importância garantir', 'regulamentação', 'política', 'Nacional Educação', 'emenda', 'necessidade', 'importância garantir', 'promovendo']","['constitucional', 'importância', 'igualdade', 'Congresso', 'marco', 'constitucionais', 'Senado', 'regulamentação', 'política', 'emenda', 'necessidade', 'implementação', 'direito', 'direitos', 'cumprimento', 'crise', 'transparente', 'administração', 'uso', 'militar']","['Por causa disso, o orador destaca a importância de garantir os direitos das pessoas com deficiência, conforme estabelecido pela Constituição, e apoia a regulamentação da Lei Complementar nº 142, de 2013, que ajusta o tempo de contribuição para aposentadoria dessas pessoas.', 'Por causa disso, o orador destaca a importância de garantir a continuidade e a efetividade do Plano Nacional de Educação, alinhado aos princípios constitucionais de cooperação federativa na política educacional.', 'Por causa disso, o orador destaca a importância de cumprir o papel constitucional de liderança e representação no Congresso Nacional, especialmente em momentos de crise e desafios institucionais.']"
13,173,13_constitucional_garantir_defende_portos,"['constitucional', 'garantir', 'defende', 'portos', 'constitucionais', 'uso', 'Congresso', 'Congresso Nacional', 'Senado deve', 'provisória', 'Nacional', 'democrático', 'critica', 'públicos', 'provas', 'princípios', 'papel', 'defende manutenção', 'Senado', 'proposta']","['constitucional', 'portos', 'constitucionais', 'uso', 'provisória', 'democrático', 'recomposição', 'públicos', 'provas', 'condenação', 'princípios', 'papel', 'Senado', 'contas', 'forma', 'proposta', 'produtores', 'aprovação', 'Estado', 'segurança']","['Por causa disso, o orador defende que o Supremo Tribunal Federal deve deliberar sobre a constitucionalidade da prisão após condenação em segunda instância, para garantir a interpretação correta da Constituição.', 'Por causa disso, o orador defende a manutenção da prisão após condenação em segunda instância, conforme entendimento do Supremo Tribunal Federal de 2016, para garantir a eficácia da persecução penal e a segurança jurídica no país.', 'Por causa disso, o orador defende que o Congresso Nacional deve aprovar o projeto de lei das fake news para garantir que as plataformas de redes sociais sejam responsabilizadas conforme os princípios constitucionais.']"
14,171,14_salário_direitos_salário mínimo_critica,"['salário', 'direitos', 'salário mínimo', 'critica', 'Estado', 'mínimo', 'Senado', 'defende', 'constitucionais', 'emenda', 'aprovação', 'mulheres', 'reforma', 'defende aprovação', 'Brasil', 'destaca importância', 'necessidade', 'conforme estabelecido', 'emendas', 'elétrica']","['salário', 'direitos', 'Estado', 'mínimo', 'Senado', 'constitucionais', 'conformidade', 'forma', 'importância', 'emenda', 'aprovação', 'mulheres', 'reforma', 'drogas', 'necessidade', 'emendas', 'elétrica', 'atuação', 'povo', 'projeto']","['Por causa disso, o orador considera que a medida provisória que permite o estabelecimento do salário mínimo por decreto é inconstitucional, pois fere a norma constitucional que exige que o salário mínimo seja estabelecido por lei discutida no Parlamento.', 'Por causa disso, o orador argumenta que o projeto de reforma trabalhista é inconstitucional, pois fere direitos garantidos pela Constituição, como o salário mínimo.', 'Por causa disso, o orador critica a proposta de reforma da previdência, argumentando que ela viola direitos constitucionais dos trabalhadores ao não garantir um salário mínimo digno e ao não cortar privilégios de forma justa.']"
15,168,15_destaca importância_Estado_garantir_defende,"['destaca importância', 'Estado', 'garantir', 'defende', 'eleitoral', 'constitucional', 'contra', 'medidas provisórias', 'provisórias', 'constitucionais', 'democrático', 'medidas', 'impeachment', 'Congresso Nacional', 'critica', 'Congresso', 'apenas', 'argumentando', 'devem', 'Ministro']","['importância', 'direito', 'Estado', 'processo', 'eleitoral', 'projeto', 'constitucional', 'provisórias', 'constitucionais', 'democrático', 'medidas', 'impeachment', 'lei', 'Ministro', 'reforma', 'defesa', 'necessidade', 'justiça', 'papel', 'forma']","['Por causa disso, o orador argumenta que o processo de impeachment contra a Presidenta Dilma Rousseff é uma violação da Constituição, pois está sendo utilizado de forma inadequada e sem base legal sólida, configurando um golpe contra a democracia.', 'Por causa disso, o orador defende a abertura do processo de impeachment do Ministro Alexandre de Moraes, argumentando que é uma prerrogativa garantida pela Constituição para restaurar o Estado democrático de direito.', 'Por causa disso, o orador considera que o processo de impeachment contra a Presidenta Dilma Rousseff é inconstitucional, pois não há crime de responsabilidade que justifique a abertura do processo, conforme exigido pela Constituição.']"
16,158,16_impeachment_processo impeachment_Dilma Rousseff_Rousseff,"['impeachment', 'processo impeachment', 'Dilma Rousseff', 'Rousseff', 'Dilma', 'impeachment Presidente', 'Presidente Dilma Rousseff', 'responsabilidade', 'Presidente', 'Presidente Dilma', 'crime responsabilidade', 'impeachment Presidente Dilma Rousseff', 'impeachment Presidente Dilma', 'defende processo impeachment', 'Presidenta Dilma Rousseff', 'processo impeachment Presidente', 'defende', 'Presidenta Dilma', 'Presidenta', 'não há crime responsabilidade']","['impeachment', 'processo', 'responsabilidade', 'base', 'crime', 'direito', 'legal', 'direitos', 'proteção', 'prazo', 'constitucional', 'Senado', 'saúde', 'inconstitucional', 'Congresso', 'importância', 'constitucionais', 'julgamento', 'medida', 'ilegítimo']","['Por causa disso, o orador argumenta que o processo de impeachment em curso é ilegítimo, pois não há crime de responsabilidade comprovado contra a Presidenta Dilma Rousseff, e critica a antecipação da formação de um governo por Michel Temer antes do julgamento final pelo Senado.', 'Por causa disso, o orador argumenta que o impeachment da Presidente Dilma Rousseff não tem base legal, pois não há crime de responsabilidade conforme previsto na Constituição e na legislação pertinente.', 'Por causa disso, o orador argumenta que o processo de impeachment contra a Presidenta Dilma Rousseff não tem base legal, pois não há crime de responsabilidade caracterizado, conforme exigido pela Constituição para a perda de mandato.']"
