Topic,Count,Name,Representation,Aspect1,Representative_Docs
35,84,35_garantir_União_constitucional saúde_pacto federativo garantir,"['garantir', 'União', 'constitucional saúde', 'pacto federativo garantir', 'federativo garantir', 'Estados', 'pacto federativo', 'pacto', 'federativo', 'reforma', 'Senado', 'conforme estabelecido defende', 'Senado deve', 'entre União Estados Municípios', 'estado', 'entre União Estados', 'Estados Municípios', 'deve agir', 'entre União', 'impositivo']","['União', 'Estados', 'dívida', 'pacto', 'federativo', 'reforma', 'ampliação', 'recursos', 'Senado', 'população', 'estado', 'adiamento', 'setor', 'impositivo', 'Presidente', 'moralidade', 'constitucional', 'papel', 'necessidade', 'legalização']","['Por causa disso, o orador defende a necessidade de revisão do Pacto Federativo para melhor adequação às normas constitucionais, especialmente no que tange à distribuição de competências e recursos entre União, Estados e Municípios.', 'Por causa disso, o orador defende a necessidade de uma reforma no pacto federativo para garantir uma distribuição mais equitativa das receitas entre União, Estados e Municípios, fortalecendo a autonomia financeira dos entes subnacionais.', 'Por causa disso, o orador defende a revisão do pacto federativo para garantir uma distribuição mais justa de competências e recursos entre a União, Estados e Municípios, especialmente no que tange ao Fundo de Participação dos Estados (FPE).']"
36,83,36_critica_tais ações_princípios_processo impeachment,"['critica', 'tais ações', 'princípios', 'processo impeachment', 'impeachment', 'princípios constitucionais', 'Federal', 'defende', 'constitucionais', 'Dilma Rousseff', 'Rousseff', 'Dilma Rousseff não', 'argumenta processo impeachment', 'Rousseff não', 'devido processo', 'critica uso', 'argumenta processo', 'Dilma', 'flexibilidade', 'processo impeachment contra']","['processo', 'princípios', 'impeachment', 'uso', 'papel', 'constitucionais', 'devido processo', 'flexibilidade', 'consolidação', 'medidas', 'maior', 'vinculações', 'constitucional', 'essenciais', 'necessidade', 'Estado', 'critérios', 'pública', 'devido', 'legal']","['Por causa disso, o orador argumenta que o processo de impeachment contra a Presidente Dilma Rousseff não possui base jurídica sólida, sugerindo que a decisão é mais política do que jurídica.', 'Por causa disso, o orador argumenta que o processo de impeachment da Presidenta Dilma Rousseff não seguiu o devido processo legal previsto na Constituição, comprometendo a legitimidade do afastamento.', 'Por causa disso, o orador argumenta que o processo de impeachment contra a Presidenta Dilma Rousseff não tem base legal, pois o artigo 11 da Lei nº 1.079 não foi recepcionado pela Constituição de 1988, e, portanto, não pode ser utilizado como fundamento para o impeachment.']"
37,81,37_permitindo_objetivos_público_importância,"['permitindo', 'objetivos', 'público', 'importância', 'cumprir objetivos', 'garantido critica', 'apoia aprovação projeto lei', 'destaca importância', 'garantir independência', 'segurança', 'aprovação', 'apoia aprovação projeto', 'defende', 'concurso público', 'acesso justiça', 'aprovação emenda', 'independência', 'Legislativo defende', 'projeto', 'segurança pública']","['objetivos', 'público', 'importância', 'acordos', 'contratação', 'segurança', 'aprovação', 'concurso', 'independência', 'prisão', 'projeto', 'nomeação', 'tribunais', 'emenda', 'ampliação', 'proposta', 'especial', 'regiões', 'Legislativo', 'justiça']","['Por causa disso, o orador defende que o Congresso Nacional deve ter coragem de devolver medidas provisórias que não cumpram os requisitos constitucionais de relevância e urgência, para restaurar o equilíbrio entre os Poderes e a legitimidade do Legislativo.', 'Por causa disso, o orador defende a aprovação da emenda constitucional que torna obrigatórias as emendas parlamentares, visando garantir a independência e harmonia entre os Poderes Legislativo e Executivo.', 'Por causa disso, o orador apoia a aprovação do projeto de lei que altera o art. 89 do Ato das Disposições Constitucionais Transitórias, permitindo a transposição dos servidores estaduais de Rondônia para o quadro federal, buscando isonomia com outros Estados.']"
38,81,38_defende_aprovação_transparência responsabilidade parlamentares perante_responsabilidade parlamentares perante,"['defende', 'aprovação', 'transparência responsabilidade parlamentares perante', 'responsabilidade parlamentares perante', 'parlamentares perante', 'Brasil', 'Fundo Nacional', 'soberania', 'transparência responsabilidade parlamentares', 'PECs', 'responsabilidade parlamentares', 'evitar', 'apoia aprovação', 'soberania popular', 'reduzir desigualdades regionais', 'objetivos constitucionais', 'direitos', 'República', 'constitucionalmente', 'reforma']","['aprovação', 'soberania', 'financeira', 'extinção', 'legais', 'direitos', 'reforma', 'Estado', 'maior', 'pobreza', 'constitucionais', 'Presidente', 'Ministros', 'Estados', 'necessidades', 'secreto', 'objetivos', 'convocação', 'incentivos', 'impeachment']","['Por causa disso, o orador defende a criação do Pronaf Marajó, que visa estabelecer condições especiais para agricultores familiares no Arquipélago do Marajó, em conformidade com os objetivos constitucionais de erradicar a pobreza e reduzir desigualdades regionais.', 'Por causa disso, o orador defende a aprovação da PEC nº 50, que propõe o fim do voto secreto em todas as situações, para garantir a transparência e a responsabilidade dos parlamentares perante seus eleitores.', 'Por causa disso, o orador defende a aprovação da proposta de emenda constitucional que propõe o voto aberto em casos de quebra de decoro parlamentar, visando aumentar a transparência e a responsabilidade dos parlamentares perante a população.']"
39,75,39_pública_disposições_Emenda Constitucional_ordem,"['pública', 'disposições', 'Emenda Constitucional', 'ordem', 'Constitucional', 'saúde', 'direitos', 'garantir', 'constitucional', 'pública defende', 'saúde pública defende', 'ordem pública', 'defende regulamentação', 'estarem', 'normas', 'resolver questão', 'constitucionais', 'saúde pública', 'proposição', 'regulamentação']","['pública', 'disposições', 'ordem', 'saúde', 'devido', 'direitos', 'constitucional', 'preços', 'normas', 'constitucionais', 'proposição', 'regulamentação', 'Nordeste', 'aprovação', 'legislativa', 'proporcionalidade', 'salários', 'público', 'ações', 'Estado']","['Por causa disso, o orador defende a regulamentação da Emenda Constitucional nº 29 para garantir mais recursos ao SUS, conforme estabelecido pela Constituição de 1988.', 'Por causa disso, o orador apoia a autorização da operação de crédito externo para o Estado do Ceará, pois está em conformidade com a Constituição e as leis brasileiras, garantindo que não haja disposições contratuais que atentem contra a soberania nacional e a ordem pública.', 'Por causa disso, o orador defende a regulamentação da Emenda Constitucional 29 para garantir a correta aplicação dos recursos na saúde pública, conforme os critérios estabelecidos pela Constituição.']"
40,74,40_conforme previsto_constitucionais_tempo serviço_penal,"['conforme previsto', 'constitucionais', 'tempo serviço', 'penal', 'promover justiça', 'privacidade', 'normas constitucionais', 'assegurar', 'profissional', 'importância', 'destaca importância', 'responsabilidade fiscal', 'violação', 'fiscal', 'maioridade penal', 'proposta', 'cláusula', 'eficaz', 'agentes', 'garantias constitucionais']","['constitucionais', 'tempo', 'nova', 'penal', 'privacidade', 'profissional', 'importância', 'violação', 'fiscal', 'maioridade', 'proposta', 'cláusula', 'Câmara', 'eficaz', 'agentes', 'vez', 'normas', 'serviço', 'implementação', 'medidas']","['Por causa disso, o orador propõe a regulamentação do imposto sobre grandes fortunas, conforme previsto na Constituição, para promover justiça tributária e financiar áreas prioritárias como a saúde.', 'Por causa disso, o orador defende a legitimidade do processo de impeachment da Presidente Dilma Rousseff, argumentando que houve violação das normas constitucionais relativas à gestão orçamentária e à responsabilidade fiscal.', 'Por causa disso, o orador apoia a aprovação do Projeto de Lei nº 3.048, de 2021, que visa aumentar as penas para crimes contra a honra cometidos contra mulheres, por entender que está em conformidade com a competência legislativa da União e não fere a iniciativa privativa do Presidente da República.']"
41,73,41_poderes_Federação_entre poderes_defende processo impeachment curso,"['poderes', 'Federação', 'entre poderes', 'defende processo impeachment curso', 'Lei visa alterar', 'Projeto Lei visa alterar', 'visa alterar', 'outros poderes', 'privadas', 'critica concentração', 'pacto federativo', 'garantindo direitos', 'equilíbrio entre poderes', 'processo impeachment curso', 'impeachment curso', 'evitar', 'federativo', 'imposto', 'deve seguir estritamente', 'direito constitucional']","['poderes', 'privadas', 'concentração', 'pacto', 'federativo', 'imposto', 'importância', 'gastos', 'urgência', 'resposta', 'requerimento', 'direito', 'Presidente', 'harmonia', 'aposentadoria', 'Senado', 'conformidade', 'estabelecido', 'constitucionais', 'projeto']","['Por causa disso, o orador defende que o Presidente do Congresso Nacional deve rejeitar medidas provisórias que não atendam aos critérios de relevância e urgência, restaurando a harmonia e o equilíbrio entre os poderes.', 'Por causa disso, o orador apoia a aprovação do Projeto de Lei nº 4.727, de 2020, que visa alterar o art. 265 do Código de Processo Penal para garantir o devido processo legal e a ampla defesa, em conformidade com a Constituição de 1988.', 'Por causa disso, o orador destaca a importância de o Congresso Nacional, especialmente o Senado, exercer seu papel de fiscalização e controle dos outros poderes, conforme estabelecido pela Constituição, para evitar abusos e garantir o equilíbrio entre os poderes.']"
42,72,42_prejudiciais_ações inconstitucionais_argumentando_critica,"['prejudiciais', 'ações inconstitucionais', 'argumentando', 'critica', 'públicos', 'adotar medidas', 'ensino', 'Direitos Humanos', 'ilegal', 'transparência', 'propõe Projeto', 'fiscalização controle', 'defende', 'controle', 'utilizando', 'constitucionais', 'regulamentar', 'Federal apoia', 'proposta emenda', 'proposta emenda constitucional']","['prejudiciais', 'públicos', 'ensino', 'anterior', 'ilegal', 'transparência', 'medidas', 'controle', 'constitucionais', 'fiscalização', 'maior transparência', 'emenda', 'proposta', 'servidores', 'urgente', 'importância', 'parlamentares', 'Ministro', 'Ministros', 'país']","['Por causa disso, o orador defende a aprovação da Emenda Constitucional nº 50, que propõe o fim do voto secreto no Congresso Nacional, para garantir maior transparência e responsabilidade dos parlamentares.', 'Por causa disso, o orador defende que o processo de impeachment de Dilma Rousseff está sendo conduzido de acordo com a Constituição, sob supervisão do Supremo Tribunal Federal, e critica a Comissão Interamericana de Direitos Humanos por questionar esse processo.', 'Por causa disso, o orador propõe o Projeto de Decreto Legislativo 404, de 2019, para sustar os efeitos legislativos da decisão do Supremo Tribunal Federal no caso da Ação Direta de Inconstitucionalidade 26 e do Mandado de Injunção 4.733, argumentando que essas decisões violam a Constituição ao criar tipo penal sem lei anterior que o defina.']"
43,71,43_petróleo_população_apoia indicação_enfatiza necessidade,"['petróleo', 'população', 'apoia indicação', 'enfatiza necessidade', 'constitucionais', 'Legislativo', 'defende', 'necessidade', 'devem', 'respeitar princípios', 'Governo', 'indígenas', 'direitos', 'esteja conformidade', 'distribuição royalties petróleo', 'Código Penal', 'impunidade', 'permitir', 'importância políticas públicas', 'promulgação']","['petróleo', 'população', 'constitucionais', 'necessidade', 'rigorosa', 'indígenas', 'direitos', 'relação', 'precatórios', 'impunidade', 'elaboração', 'promulgação', 'indicação', 'brasileira', 'benefícios', 'constitucional', 'conformidade', 'terras', 'judicial', 'tratamento']","['Por causa disso, o orador critica a utilização excessiva de medidas provisórias pelo governo, que, segundo ele, atenta contra a Constituição ao não respeitar os princípios de urgência e relevância exigidos para sua edição.', 'Por causa disso, o orador defende que a distribuição dos royalties do petróleo deve ser feita de forma a diminuir as diferenças regionais e resolver diferenças sociais, em conformidade com o princípio constitucional de que o petróleo é um bem da sociedade brasileira.', 'Por causa disso, o orador defende a revisão do marco regulatório do petróleo para que esteja em conformidade com a Constituição de 1988, especialmente no que diz respeito à justa distribuição dos royalties do petróleo entre os estados.']"
44,69,44_saúde_nas áreas_social_Estado,"['saúde', 'nas áreas', 'social', 'Estado', 'políticas', 'saúde educação', 'necessidade', 'devido processo legal', 'terras', 'devido processo', 'educação', 'terras indígenas', 'enfrentar crise econômica', 'públicas', 'Seguridade Social', 'brasileiro', 'propõe emenda', 'especialmente nas áreas', 'assistência social', 'políticas públicas']","['saúde', 'áreas', 'social', 'Estado', 'políticas', 'necessidade', 'terras', 'devido processo', 'indígenas', 'educação', 'públicas', 'brasileiro', 'ações', 'devido', 'legal', 'segurança', 'processo', 'eficazes', 'interesse', 'desenvolvimento']","['Por causa disso, o orador critica a implementação insuficiente dos direitos fundamentais previstos na Constituição, como saúde, educação e igualdade, e defende a necessidade de políticas públicas mais eficazes para garantir esses direitos.', 'Por causa disso, o orador defende a manutenção do status quo do Fundo Constitucional do Distrito Federal, argumentando que qualquer alteração nos critérios de correção pode comprometer as finanças do DF, especialmente nas áreas de segurança, saúde e educação.', 'Por causa disso, o orador defende a necessidade de reformas estruturais para que o Estado possa cumprir efetivamente o que a Constituição determina aos cidadãos, especialmente nas áreas de saúde, educação e segurança pública.']"
45,68,45_ministros Supremo Tribunal Federal_ministros Supremo Tribunal_ministros Supremo_defende,"['ministros Supremo Tribunal Federal', 'ministros Supremo Tribunal', 'ministros Supremo', 'defende', 'eleitores', 'ministros', 'revogação', 'prerrogativa constitucional', 'acessibilidade', 'prisão', 'Federal apoia', 'nas eleições', 'prisão após condenação', 'prisão após condenação segunda', 'institucionais', 'públicas', 'apoia Proposta', 'apoia Proposta Emenda', 'constitucional', 'deve']","['aberta', 'eleitores', 'ministros', 'princípio', 'revogação', 'sigilo', 'profissão', 'acessibilidade', 'prisão', 'conformidade', 'institucionais', 'públicas', 'constitucional', 'proteção', 'participação', 'direitos', 'condenação', 'exercício', 'segunda instância', 'segunda']","['Por causa disso, o orador defende a aprovação da PEC que estabelece a prisão após condenação em segunda instância, como forma de garantir a segurança jurídica e combater a impunidade no Brasil.', 'Por causa disso, o orador defende que o Senado Federal deve exercer sua prerrogativa constitucional de investigar e, se necessário, admitir pedidos de impeachment de ministros do Supremo Tribunal Federal.', 'Por causa disso, o orador apoia a Proposta de Emenda à Constituição (PEC) que limita o mandato dos ministros do Supremo Tribunal Federal a dez anos, como forma de garantir que a Constituição seja respeitada e interpretada de maneira consistente.']"
46,67,46_veto presidencial_veto_presidencial_critica falta respeito,"['veto presidencial', 'veto', 'presidencial', 'critica falta respeito', 'defende implementação medidas', 'campanhas', 'ambiente', 'falta respeito', 'eleitorais', 'prerrogativa', 'hierarquia', 'destaca importância reconhecer', 'empresarial campanhas', 'implementação medidas', 'financiamento empresarial campanhas', 'financiamento empresarial', 'importância reconhecer', 'defendendo', 'substitutivo', 'analisar']","['veto', 'presidencial', 'campanhas', 'ambiente', 'relação', 'férias', 'prerrogativa', 'eleitorais', 'aposentados', 'recomposição', 'hierarquia', 'período', 'substitutivo', 'empresarial', 'decisão', 'importância', 'constitucional', 'dias', 'Senado', 'União']","['Por causa disso, o orador defende a derrubada do veto presidencial ao PLC nº 28, que trata da recomposição das perdas salariais dos servidores do Judiciário, argumentando que a Constituição garante essa recomposição.', 'Por causa disso, o orador apoia o veto presidencial ao financiamento empresarial de campanhas eleitorais, alinhando-se à decisão do STF que considera essa prática inconstitucional.', 'Por causa disso, o orador critica a omissão do Banco Central e questiona a atuação do Ministério Público Federal e do Tribunal de Contas da União em relação à fiscalização dos juros abusivos cobrados pelos bancos, sugerindo que essas instituições deveriam agir para proteger os consumidores.']"
47,66,47_Branco_militares_federais_educação,"['Branco', 'militares', 'federais', 'educação', 'Justiça Trabalho', 'democrática defende', 'Judiciário', 'constitucionais', 'defende', 'fidelidade partidária', 'fidelidade', 'critica', 'respeito direitos', 'Presidenta', 'Brasil critica', 'dispositivos constitucionais', 'proposta', 'critica falta', 'Mesa', 'direitos']","['militares', 'federais', 'educação', 'Judiciário', 'constitucionais', 'ordem', 'direito', 'fidelidade', 'sociais', 'Presidenta', 'proposta', 'estaduais', 'direitos', 'investimento', 'partidária', 'mandato', 'falta', 'regulamentação', 'dispositivos', 'forma']","['Por causa disso, o orador argumenta que a reforma da previdência proposta pelo governo Temer é inconstitucional, pois fere o art. 40 da Constituição ao tentar estabelecer regras diferenciadas e mais gravosas para servidores públicos federais, estaduais e municipais.', 'Por causa disso, o orador defende que a distribuição dos royalties do petróleo deve ser feita de forma a atender as exigências constitucionais de investimento em saúde, educação e desenvolvimento regional, promovendo a igualdade entre os municípios.', 'Por causa disso, o orador argumenta que o processo de impeachment contra a Presidenta Dilma Rousseff é inconstitucional, pois não há comprovação de crime de responsabilidade, o que fere a Constituição.']"
48,64,48_Rondônia quadros União_não ter_defende necessidade_Executivo Judiciário,"['Rondônia quadros União', 'não ter', 'defende necessidade', 'Executivo Judiciário', 'necessidade', 'servidores Rondônia', 'quadros União', 'trabalhadores', 'espera Supremo Tribunal Federal', 'espera Supremo Tribunal', 'espera Supremo', 'princípio', 'princípio constitucional', 'injustiça', 'Brasil', 'decisão', 'Brasil defende', 'constitucional', 'garantir', 'defende']","['necessidade', 'medida', 'trabalhadores', 'quadros', 'princípio', 'clara', 'econômico', 'injustiça', 'decisão', 'domésticos', 'constitucional', 'desenvolvimento', 'servidores', 'transposição', 'execução', 'qualidade', 'histórica', 'direitos', 'trabalhistas', 'União']","['Por causa disso, o orador defende a necessidade de garantir o financiamento adequado do Sistema Único de Saúde (SUS) para cumprir o que está estabelecido na Constituição sobre assistência pública gratuita e de boa qualidade.', 'Por causa disso, o orador defende que a transposição dos servidores de Rondônia para os quadros da União deve ser efetivada, corrigindo uma injustiça histórica e assegurando direitos previstos na Emenda Constitucional nº 60.', 'Por causa disso, o orador defende a necessidade de regulamentação da emenda constitucional que trata da transposição dos servidores de Rondônia para os quadros da União, destacando a urgência dessa medida para corrigir uma injustiça histórica.']"
49,64,49_excessos_proteção direitos_créditos suplementares_bancos,"['excessos', 'proteção direitos', 'créditos suplementares', 'bancos', 'brasileiros', 'Presidente', 'corrigir', 'dever', 'créditos', 'todos brasileiros', 'inviolabilidade', 'transposição servidores', 'não cumprir', 'cumprir dever', 'Rousseff', 'Dilma Rousseff', 'Tribunal Federal deve', 'Supremo Tribunal Federal deve', 'políticas', 'Dilma']","['excessos', 'transposição', 'bancos', 'suplementares', 'brasileiros', 'Presidente', 'dever', 'créditos', 'inviolabilidade', 'preservação', 'políticas', 'implementação', 'internacionais', 'importância', 'investigações', 'públicos', 'constitucional', 'ambiental', 'proteção', 'ações']","['Por causa disso, o orador destaca a importância de garantir o financiamento adequado e a gestão eficiente do SUS para cumprir o dever constitucional de promover a saúde de todos os brasileiros.', 'Por causa disso, o orador apoia o prosseguimento do processo de impeachment contra a Presidente Dilma Rousseff, argumentando que as ações da Presidente violaram a Constituição ao abrir créditos suplementares sem autorização do Congresso Nacional e ao contrair dívidas com bancos públicos.', 'Por causa disso, o orador apoia o processo de impeachment da Presidente Dilma Rousseff, argumentando que a abertura indevida de créditos suplementares e o empréstimo de dinheiro de bancos estatais violam a Constituição e justificam o afastamento.']"
50,62,50_impeachment_Dilma Rousseff_Rousseff_Dilma,"['impeachment', 'Dilma Rousseff', 'Rousseff', 'Dilma', 'Presidente', 'Presidente Dilma Rousseff', 'Presidente Dilma', 'golpe parlamentar', 'Projeto Lei regulamenta', 'acusação', 'impeachment Presidente', 'procedimentos constitucionais', 'processo impeachment', 'constitucionais', 'princípios constitucionais', 'processo impeachment Presidente', 'constitucionais legais', 'impeachment Presidente Dilma Rousseff', 'impeachment Presidente Dilma', 'processo impeachment deve seguir']","['impeachment', 'Presidente', 'processo', 'acusação', 'mineração', 'constitucionais', 'econômica', 'diálogo', 'princípios', 'procedimentos', 'Judiciário', 'responsabilidade', 'conformidade', 'transparência', 'golpe', 'públicas', 'constitucional', 'parlamentar', 'corrupção', 'Senado']","['Por causa disso, o orador defende que o Senado Federal deve prosseguir com o processo de impeachment da Presidente Dilma Rousseff, ignorando a decisão do Deputado Waldir Maranhão.', 'Por causa disso, o orador expressa sua intenção de votar a favor da abertura do processo de impeachment da Presidente Dilma Rousseff, mesmo reconhecendo as dificuldades e constrangimentos do processo, como a assinatura do pedido de impeachment pelo então Presidente da Câmara, Eduardo Cunha, que enfrenta acusações de corrupção.', 'Por causa disso, o orador defende que o processo de impeachment deve seguir seu curso no Congresso Nacional, respeitando os procedimentos constitucionais e legais, para que se decida sobre a permanência ou não da Presidente Dilma Rousseff no cargo.']"
51,61,51_CPI_monocrática_decisão monocrática_jurídica,"['CPI', 'monocrática', 'decisão monocrática', 'jurídica', 'garantir segurança', 'segurança', 'improbidade administrativa', 'Governo', 'decisão', 'tal decisão', 'Brasília', 'brasileiro', 'Congresso', 'direitos', 'requisitos constitucionais', 'garantir segurança jurídica', 'desrespeita', 'Petrobras', 'Brasil', 'país defende']","['CPI', 'coletivo', 'monocrática', 'jurídica', 'segurança', 'improbidade', 'transporte', 'decisão', 'brasileiro', 'necessidade', 'Congresso', 'direitos', 'requisitos', 'constitucionais', 'CPIs', 'investimentos', 'recursos', 'administrativa', 'combate', 'públicos']","['Por causa disso, o orador defende que a intervenção federal no Rio de Janeiro deve ser conduzida com atenção aos limites constitucionais, especialmente no que se refere à atuação das forças de segurança e à necessidade de recursos adequados.', 'Por causa disso, o orador critica a utilização das medidas provisórias pelo Executivo, argumentando que muitas delas não cumprem os requisitos constitucionais e que o Congresso deveria rejeitá-las, mas não o faz, contribuindo para a centralização do poder legislativo no Executivo.', 'Por causa disso, o orador defende a aprovação da PEC nº 18/2013, que propõe a perda automática do mandato parlamentar em casos de improbidade administrativa ou condenação por crime contra a Administração Pública, como forma de garantir a efetividade das decisões judiciais e a integridade do Legislativo.']"
