Topic,Count,Name,Representation,Aspect1,Representative_Docs
17,155,17_previsto_defende_conforme_conforme previsto,"['previsto', 'defende', 'conforme', 'conforme previsto', 'garantir', 'Presidente', 'deve', 'Sistema', 'política', 'processo impeachment', 'importância', 'igualdade', 'indígenas', 'propõe', 'públicas', 'econômico', 'políticas', 'redução', 'necessidade', 'Presidente Dilma Rousseff']","['previsto', 'lei', 'Presidente', 'política', 'importância', 'igualdade', 'indígenas', 'recursos', 'públicas', 'econômico', 'políticas', 'redução', 'necessidade', 'Mais', 'processo', 'Médicos', 'direitos', 'projeto', 'segundo', 'maior']","['Por causa disso, o orador apoia a aprovação do projeto de lei que institui o Sistema Nacional Integrado de Atendimento à Pessoa Autista, que visa garantir direitos fundamentais aos autistas, como vida digna, igualdade, saúde, integridade física e moral, livre desenvolvimento de personalidade, educação e trabalho, conforme previsto na Constituição.', 'Por causa disso, o orador argumenta que o processo de impeachment não tem base constitucional, pois não foi comprovado crime de responsabilidade por parte da Presidente Dilma Rousseff, o que é necessário para justificar o impedimento segundo a Constituição.', 'Por causa disso, o orador justifica o processo de impeachment da Presidente Dilma Rousseff, argumentando que ele está previsto na Constituição como um mecanismo legítimo de responsabilização política.']"
18,149,18_importância_PEC_Senado_destaca importância,"['importância', 'PEC', 'Senado', 'destaca importância', 'necessidade', 'importância papel', 'aprovação PEC', 'constitucionais', 'direitos', 'incluir', 'Federal', 'aprovação', 'conforme estabelecido', 'emendas', 'Constitucionais', 'Lula', 'emenda', 'Presidente', 'legislativas', 'juízes']","['importância', 'Senado', 'necessidade', 'forma', 'criação', 'constitucionais', 'direitos', 'aprovação', 'emendas', 'papel', 'emenda', 'Presidente', 'legislativas', 'juízes', 'constitucional', 'regulamentação', 'consistente', 'objetivos', 'federais', 'escolha']","['Por causa disso, o orador defende que o Senado deve cumprir seu dever constitucional de avaliar os processos de impeachment de Ministros do Supremo Tribunal Federal, como uma forma de proteger a liberdade de expressão garantida pela Constituição.', 'Por causa disso, o orador defende a aprovação da PEC nº 19, de 2000, que cria o Fundo de Desenvolvimento da Amazônia Ocidental, alterando o Ato das Disposições Constitucionais Transitórias, para garantir o desenvolvimento sustentável da região.', 'Por causa disso, o orador apoia a aprovação da PEC 24, que visa incluir na Constituição Federal a criação de um Fundo Nacional de Desenvolvimento da Segurança Pública, garantindo orçamento constitucional permanente para a segurança pública.']"
19,148,19_defende_conforme_impeachment_processo impeachment,"['defende', 'conforme', 'impeachment', 'processo impeachment', 'garantir', 'conformidade', 'constitucional', 'destaca importância', 'apoia aprovação Projeto', 'importância', 'Brasil', 'garantindo', 'emenda', 'fundamental', 'crime responsabilidade', 'deve', 'federativo', 'não há', 'Federal', 'distribuição']","['processo', 'impeachment', 'conformidade', 'direito', 'constitucional', 'importância', 'emenda', 'fundamental', 'federativo', 'distribuição', 'aprovação', 'crime', 'saúde', 'Congresso', 'admissibilidade', 'necessidade', 'cobrança', 'pressupostos', 'competência', 'Senado']","['Por causa disso, o orador apoia a aprovação do Projeto de Lei nº 557, de 2022, que visa garantir tratamento humanitário a mulheres presas gestantes ou puérperas, em conformidade com os princípios constitucionais de dignidade humana e direitos fundamentais.', 'Por causa disso, o orador defende que o impeachment da Presidente Dilma Rousseff não tem base constitucional, pois não há crime de responsabilidade comprovado, e sugere que o processo é um golpe contra a democracia.', 'Por causa disso, o orador argumenta que o impeachment da Presidenta Dilma Rousseff não tem base constitucional, pois não há crime de responsabilidade comprovado, e portanto, o processo é ilegítimo segundo a Constituição.']"
20,135,20_defende_ações_seguridade social_seguridade,"['defende', 'ações', 'seguridade social', 'seguridade', 'critica', 'sociais', 'sugere', 'aprovação', 'constitucional', 'ordem constitucional', 'garantir', 'necessidade', 'legislação', 'judiciais', 'projeto', 'transparência', 'sugere necessário', 'garantias constitucionais', 'necessário', 'política']","['ações', 'seguridade', 'sociais', 'aprovação', 'constitucional', 'necessidade', 'direito', 'lei', 'país', 'legislação', 'judiciais', 'projeto', 'processo', 'transparência', 'necessário', 'política', 'políticas', 'medidas', 'caminho', 'constitucionais']","['Por causa disso, o orador sugere que é necessário revisar a Constituição para que ela esteja condizente com a realidade atual do país, especialmente no que diz respeito à segurança pública.', 'Por causa disso, o orador critica a política de financiamento do BNDES, que, segundo ele, descumpre o princípio constitucional de redução das desigualdades regionais, e sugere que o Congresso Nacional deve rever a forma como as medidas provisórias são utilizadas para aprovar financiamentos do BNDES.', 'Por causa disso, o orador argumenta que as ações do Ministro Alexandre de Moraes e do STF violam as garantias constitucionais dos parlamentares, especialmente no que diz respeito às imunidades parlamentares e ao devido processo legal, e defende que essas ações são inconstitucionais.']"
21,134,21_decisão_constitucional_projeto lei_defende,"['decisão', 'constitucional', 'projeto lei', 'defende', 'princípios', 'princípios constitucionais', 'justiça', 'constitucionais', 'Senado', 'visa', 'conformidade', 'concessão', 'deve', 'presunção', 'Brasil', 'aprovação', 'garantir', 'importância', 'justiça social', 'Tribunal']","['decisão', 'constitucional', 'princípios', 'projeto', 'lei', 'justiça', 'constitucionais', 'Senado', 'conformidade', 'concessão', 'renda', 'presunção', 'aprovação', 'fundo', 'importância', 'social', 'marco', 'liberdade', 'criação', 'legal']","['Por causa disso, o orador defende que a decisão do Senado deve seguir a decisão do Supremo Tribunal Federal, respeitando o princípio constitucional de que todos são iguais perante a lei.', 'Por causa disso, o orador considera que o decreto presidencial que altera os incentivos fiscais da Zona Franca de Manaus é inconstitucional e apoia o projeto de decreto legislativo que visa sustar esse decreto, para proteger o modelo constitucional da Zona Franca de Manaus.', 'Por causa disso, o orador defende a aprovação da PEC 42, de 2021, que visa garantir a renda básica como um direito constitucional permanente, assegurando recursos para transferência de renda e pagamento de precatórios.']"
22,131,22_parlamentar_Federal_defende_critica,"['parlamentar', 'Federal', 'defende', 'critica', 'terras', 'constitucionais', 'indígenas', 'critica atuação', 'garantindo', 'processo impeachment', 'princípios estabelecidos', 'terras indígenas', 'propõe', 'STF', 'Estado', 'defendendo', 'nacional', 'princípios', 'constitucionais legais', 'inconstitucional']","['decoro', 'parlamentar', 'processo', 'terras', 'constitucionais', 'indígenas', 'atuação', 'Estado', 'nacional', 'princípios', 'inconstitucional', 'áreas', 'trabalhadores', 'impeachment', 'direitos', 'aumento', 'necessidade', 'responsabilidade', 'respeito', 'forma']","['Por causa disso, o orador denuncia que o processo de impeachment da Presidente Dilma Rousseff é um golpe que viola a Constituição, pois não há crime de responsabilidade que justifique o afastamento.', 'Por causa disso, o orador defende que a inviolabilidade parlamentar deve ser respeitada em todas as circunstâncias, inclusive para Jair Bolsonaro, e critica decisões judiciais que, segundo ele, desrespeitam essa proteção constitucional.', 'Por causa disso, o orador argumenta que o processo de impeachment contra a Presidenta Dilma Rousseff é inconstitucional, pois não há crime de responsabilidade que justifique sua remoção, conforme exigido pela Constituição.']"
23,126,23_importância_percentuais_informações_constitucional,"['importância', 'percentuais', 'informações', 'constitucional', 'defende', 'destaca importância', 'liberdade', 'segurança', 'brasileiro', 'inconstitucional', 'esse direito', 'reputação', 'sugere necessário', 'Estado', 'liberdade expressão', 'democracia', 'direitos constitucionais', 'eleições', 'educação', 'crise']","['importância', 'percentuais', 'informações', 'constitucional', 'liberdade', 'segurança', 'brasileiro', 'inconstitucional', 'país', 'pessoas', 'reputação', 'Estado', 'democracia', 'investidores', 'expressão', 'eleições', 'educação', 'crise', 'direito', 'salariais']","['Por causa disso, o orador defende a instalação da CPI do transporte urbano, argumentando que a Constituição permite tal investigação e que o Regimento Interno do Senado não pode restringir esse direito.', 'Por causa disso, o orador critica a falta de cumprimento do princípio constitucional de que a saúde é um direito de todos e um dever do Estado, destacando a necessidade de uma revisão nas prioridades governamentais para garantir esse direito.', 'Por causa disso, o orador defende a aprovação do Projeto de Lei do Senado nº 121, de 2007, que visa regulamentar o financiamento da saúde pública no Brasil, estabelecendo percentuais mínimos de investimento por parte da União, Estados e Municípios.']"
24,119,24_recursos_trabalho escravo_escravo_fiscal,"['recursos', 'trabalho escravo', 'escravo', 'fiscal', 'Brasil', 'conforme estabelecido', 'Municípios', 'Estados', 'hídricos', 'recursos hídricos', 'royalties', 'petróleo', 'Código Defesa Consumidor', 'distribuição', 'distribuição royalties', 'promover justiça', 'Código Defesa', 'Defesa Consumidor', 'royalties petróleo', 'destaca importância']","['recursos', 'escravo', 'fiscal', 'casos', 'Municípios', 'direito', 'Estados', 'hídricos', 'royalties', 'medida', 'petróleo', 'distribuição', 'produtores', 'trabalho', 'aprovação', 'meio', 'competência', 'importância', 'União', 'implementação']","['Por causa disso, o orador argumenta que a medida aprovada na Câmara dos Deputados, que altera a distribuição dos royalties do petróleo, é inconstitucional e deve ser revista para respeitar os contratos existentes e o tratamento diferenciado para Estados e Municípios produtores.', 'Por causa disso, o orador argumenta que o impeachment da Presidenta Dilma Rousseff não tem base constitucional, pois não há crime de responsabilidade que justifique tal medida, segundo a Constituição.', 'Por causa disso, o orador argumenta que o processo de impeachment da Presidente Dilma Rousseff não tem base constitucional, pois não há crime de responsabilidade caracterizado.']"
25,119,25_contra_defende_Presidente_Federal,"['contra', 'defende', 'Presidente', 'Federal', 'impeachment contra', 'garantir', 'não', 'impeachment', 'contra Presidente', 'Supremo Tribunal Federal', 'Tribunal Federal', 'Supremo Tribunal', 'Supremo', 'deve', 'República conforme', 'Presidente Dilma', 'direitos', 'Tribunal', 'impeachment contra Presidente Dilma', 'pedido impeachment']","['parte', 'processo', 'auxílio', 'preços', 'saúde', 'impeachment', 'direito', 'direitos', 'sistema', 'importância', 'responsabilidade', 'constitucional', 'proteção', 'policiais', 'regulamentação', 'constitucionais', 'pedido', 'pública', 'crime', 'Mesa']","['Por causa disso, o orador argumenta que o pedido de impeachment contra a Presidente Dilma Rousseff é infundado, pois não há crime de responsabilidade conforme exigido pela Constituição para justificar tal medida.', 'Por causa disso, o orador argumenta que o processo de impeachment contra a Presidente Dilma não tem base constitucional, pois não há crime de responsabilidade claro, o que caracteriza um golpe.', 'Por causa disso, o orador argumenta que o processo de impeachment contra a Presidente Dilma Rousseff não tem base constitucional, pois não há crime de responsabilidade comprovado, o que torna o processo ilegítimo.']"
26,108,26_deve_defende_direitos_poder,"['deve', 'defende', 'direitos', 'poder', 'papel', 'necessidade', 'papel constitucional', 'cumprir', 'moderador', 'destaca importância', 'necessário', 'sugere', 'Comunicação', 'evitar', 'destaca importância garantir', 'importância', 'orçamento', 'educação', 'Federal sugere', 'direitos destaca importância']","['direito', 'direitos', 'poder', 'papel', 'necessidade', 'moderador', 'necessário', 'cuidado', 'importância', 'orçamento', 'educação', 'dia', 'dezembro', 'Senado', 'propriedade', 'recriação', 'crimes', 'leis', 'União', 'adequado']","['Por causa disso, o orador defende a necessidade urgente de o Congresso Nacional editar uma lei específica que regulamente o direito de greve dos servidores públicos, conforme previsto na Constituição, para equilibrar o direito de greve com a continuidade dos serviços públicos essenciais.', 'Por causa disso, o orador critica a atuação do Supremo Tribunal Federal por legislar sobre temas como o marco temporal das terras indígenas, o uso de entorpecentes e o aborto, que ele acredita serem claramente definidos pela Constituição e pelas leis vigentes.', 'Por causa disso, o orador destaca a importância de garantir o cumprimento do piso salarial dos professores, conforme estabelecido na Constituição, e sugere que é necessário encontrar soluções para que estados e municípios possam cumprir essa obrigação sem violar a Lei de Responsabilidade Fiscal.']"
27,105,27_destaca importância_Brasil_legislação_necessidade,"['destaca importância', 'Brasil', 'legislação', 'necessidade', 'medidas', 'defende necessidade', 'conformidade', 'regulamentação', 'aprovação', 'critica', 'constitucionais', 'Nacional', 'argumentando ela', 'recursos minerais', 'aprovação Projeto Lei', 'Estado', 'política', 'relações internacionais', 'aprovação Projeto', 'Igualdade Racial']","['importância', 'legislação', 'necessidade', 'medidas', 'conformidade', 'regulamentação', 'penas', 'aprovação', 'constitucionais', 'minerais', 'Estado', 'política', 'crise', 'proteção', 'mulher', 'construção', 'recursos', 'inclusão', 'concorrente', 'ambiental']","['Por causa disso, o orador destaca a importância de continuar o debate e avançar em pontos fundamentais do Estatuto da Igualdade Racial, como a regulamentação das cotas e a titulação das terras quilombolas, que são respaldados pela Constituição de 1988.', 'Por causa disso, o orador apoia a aprovação do Projeto de Lei nº 3.855, de 2020, que institui o Agosto Lilás como mês de proteção à mulher, por estar em conformidade com a competência legislativa concorrente prevista na Constituição.', 'Por causa disso, o orador critica a PEC 55, que propõe um teto de gastos públicos, argumentando que ela desmantela as conquistas sociais garantidas pela Constituição de 1988, especialmente nas áreas de saúde e educação.']"
28,102,28_defende_básica_Direito_educação,"['defende', 'básica', 'Direito', 'educação', 'estudantes', 'governo', 'critica', 'PEC', 'deve', 'responsabilidade', 'maior transparência', 'recursos', 'cursos', 'transparência', 'marco temporal', 'voto', 'direitos', 'respeito', 'outubro', 'legitimidade governo']","['básica', 'educação', 'estudantes', 'governo', 'PEC', 'cargos', 'responsabilidade', 'maior transparência', 'recursos', 'cursos', 'transparência', 'temporal', 'maior', 'voto', 'marco', 'direitos', 'respeito', 'outubro', 'aprovação', 'sindicais']","['Por causa disso, o orador apoia o Projeto de Lei nº 4.727, de 2020, que visa alterar o Código de Processo Penal e o Código de Processo Penal Militar para garantir o devido processo legal e a ampla defesa, evitando penalizações aos advogados sem o devido processo.', 'Por causa disso, o orador defende que o impeachment da Presidenta Dilma Rousseff é inconstitucional, pois não há comprovação de crime de responsabilidade, conforme exigido pela Constituição de 1988.', 'Por causa disso, o orador defende que o processo de impeachment da Presidenta Dilma Rousseff é ilegítimo e inconstitucional, pois não há crime de responsabilidade que justifique tal medida, conforme previsto na Constituição.']"
29,99,29_corrigir distorções_Federal_importância_defende,"['corrigir distorções', 'Federal', 'importância', 'defende', 'corrigir', 'justiça', 'critica', 'Federal deve', 'Federal deve agir', 'soberana', 'destaca importância', 'deve agir', 'direitos', 'necessária', 'tal', 'decisão', 'Projeto Lei', 'justiça social', 'direitos humanos', 'social']","['distorções', 'importância', 'justiça', 'soberana', 'direitos', 'necessária', 'decisão', 'forças', 'humanos', 'social', 'Copa', 'parte', 'previdenciário', 'humano', 'impeachment', 'legais', 'igualdade', 'projeto', 'urgência', 'Senado']","['Por causa disso, o orador defende que o Supremo Tribunal Federal deve agir para corrigir injustiças e restabelecer os direitos e garantias fundamentais, como o habeas corpus, que foram violados no processo contra Lula.', 'Por causa disso, o orador defende que o Senado Federal deve agir como guardião da Constituição e intervir em casos de extrapolação de poderes por parte do Supremo Tribunal Federal, garantindo a legalidade e o respeito ao devido processo legal.', 'Por causa disso, o orador defende que o impeachment da Presidenta Dilma Rousseff não tem base constitucional, pois não há crime de responsabilidade que justifique tal medida.']"
30,98,30_defende_públicos_conforme estabelecido_Ministro,"['defende', 'públicos', 'conforme estabelecido', 'Ministro', 'Comissão', 'salário mínimo conforme', 'mínimo conforme', 'Estado', 'destaca importância garantir', 'devem', 'Rio', 'pedidos impeachment ministros STF', 'estabelecido destaca importância garantir', 'Tribunal Federal relação', 'Estado Rio', 'Supremo Tribunal Federal relação', 'respeitando', 'eleitorais', 'movimentos sociais', 'Federal']","['movimentos', 'públicos', 'Ministro', 'criação', 'petróleo', 'Estado', 'excepcionalidade', 'relação', 'eleitorais', 'tratamento', 'legislação', 'vetos', 'legislativas', 'recursos', 'importância', 'anistia', 'royalties', 'criminalização', 'sistema', 'econômico']","['Por causa disso, o orador critica a atuação do Supremo Tribunal Federal e do Ministro Alexandre de Moraes, sugerindo que suas ações ultrapassam os limites constitucionais e afetam o equilíbrio entre os Poderes.', 'Por causa disso, o orador defende que o Senado deve cumprir seu papel constitucional de analisar pedidos de impeachment de ministros do STF, que, segundo ele, têm invadido competências legislativas.', 'Por causa disso, o orador defende que o Senado deve deliberar sobre os pedidos de impeachment de ministros do STF, como o do Ministro Alexandre de Moraes, para restaurar o equilíbrio entre os Poderes e garantir o devido processo legal.']"
31,96,31_necessidade_impeachment_constitucional_defende,"['necessidade', 'impeachment', 'constitucional', 'defende', 'processo impeachment', 'apoia processo impeachment Presidente', 'apoia processo impeachment', 'impeachment Presidente', 'conformidade defende', 'defende necessidade', 'promovendo', 'deve', 'princípio', 'Rousseff', 'Dilma Rousseff', 'está conformidade', 'pública', 'priorizem', 'defende necessidade ações', 'decretos']","['conformidade', 'necessidade', 'impeachment', 'constitucional', 'escolas', 'processo', 'ações', 'recursos', 'princípio', 'urgente', 'pública', 'decretos', 'constitucionais', 'histórica', 'direito', 'crédito', 'política', 'mínima', 'Executivo', 'princípios']","['Por causa disso, o orador apoia o processo de impeachment da Presidente da República, argumentando que ele está sendo conduzido de acordo com a Constituição e as leis vigentes, garantindo o amplo direito de defesa e o contraditório.', 'Por causa disso, o orador apoia o processo de impeachment da Presidente Dilma Rousseff, argumentando que houve violação da Constituição e da Lei de Responsabilidade Fiscal, justificando a necessidade de sua substituição.', 'Por causa disso, o orador apoia o processo de impeachment da Presidente Dilma Rousseff, argumentando que houve crime de responsabilidade fiscal ao editar decretos de suplementação de crédito sem autorização legislativa prévia, violando a Constituição.']"
32,96,32_impeachment_processo_mulher_partidária,"['impeachment', 'processo', 'mulher', 'partidária', 'impeachment Presidente Dilma Rousseff', 'processo impeachment', 'constitucionais', 'impeachment Presidente Dilma', 'aprovação PEC', 'Dilma Rousseff', 'Rousseff', 'autonomia', 'Dilma', 'impeachment Presidente', 'Ministro', 'deve', 'processo impeachment Presidente Dilma', 'defende aprovação PEC propõe', 'Congresso', 'Presidente Dilma Rousseff']","['impeachment', 'processo', 'mulher', 'cargo', 'partidária', 'constitucionais', 'autonomia', 'importância', 'Ministro', 'forma', 'Congresso', 'reforma', 'petróleo', 'proposta', 'etnia', 'Estados', 'proteção', 'penais', 'inconstitucional', 'financeira']","['Por causa disso, o orador defende que não há base jurídica para o impeachment da Presidenta Dilma Rousseff, pois não há crime de responsabilidade fiscal comprovado, e que o processo de impeachment deve respeitar os preceitos constitucionais.', 'Por causa disso, o orador defende a legitimidade do processo de impeachment da Presidente Dilma Rousseff, afirmando que ele está em conformidade com a Constituição e que o Senado tem a competência para julgar crimes de responsabilidade.', 'Por causa disso, o orador argumenta que o processo de impeachment da Presidente Dilma Rousseff é inconstitucional, pois não há crime de responsabilidade que justifique o afastamento, e que os senadores que votarem a favor estarão manchando suas biografias.']"
33,95,33_garantir_defende necessidade_necessidade_legislativo,"['garantir', 'defende necessidade', 'necessidade', 'legislativo', 'processo legislativo', 'legislativa', 'garantir harmonia', 'alinhando legislação', 'apoia aprovação', 'inconstitucionais', 'inconstitucionais defende', 'destaca importância', 'importância', 'saúde', 'considerados', 'emenda', 'constitucionais', 'bem estar social', 'apoia aprovação Medida Provisória', 'apoia aprovação Medida']","['necessidade', 'legislativo', 'legislativa', 'inconstitucionais', 'importância', 'saúde', 'emenda', 'constitucionais', 'parte', 'sistema', 'equilíbrio', 'essencial', 'deliberação', 'constitucional', 'Estado', 'aprovação', 'processo', 'urgente', 'execução', 'efetividade']","['Por causa disso, o orador defende que o Senado deve cumprir seu papel constitucional de analisar pedidos de impeachment de ministros do Supremo Tribunal Federal, como forma de restabelecer o equilíbrio entre os poderes.', 'Por causa disso, o orador critica a utilização de medidas provisórias que alteram a execução orçamentária, considerando-as inconstitucionais, e defende a necessidade de respeitar a Constituição para garantir a legalidade e a moralidade no processo legislativo.', 'Por causa disso, o orador destaca a necessidade de o Estado brasileiro assumir um papel mais ativo e eficaz na erradicação do analfabetismo, cumprindo os princípios constitucionais de cidadania e bem-estar social.']"
34,92,34_defende_constitucionais_Federal_comissão especial,"['defende', 'constitucionais', 'Federal', 'comissão especial', 'deve', 'má gestão', 'Senado', 'defende necessidade', 'impeachment', 'criação comissão', 'Geral União', 'conforme permitido', 'defende necessidade reformas', 'permitido', 'garantir', 'conforme proposto', 'igualdade oportunidades', 'igualdade', 'garantir efetividade', 'necessidade reformas']","['constitucionais', 'avanços', 'má gestão', 'Senado', 'impeachment', 'criação', 'autoria', 'má', 'igualdade', 'oportunidades', 'projeto', 'comissão', 'recursos', 'greve', 'situações', 'política', 'princípios', 'direito', 'servidores', 'especial']","['Por causa disso, o orador defende que o Senado Federal deve agir para garantir que o Supremo Tribunal Federal não ultrapasse os limites constitucionais, possivelmente através de investigações ou processos de impeachment.', 'Por causa disso, o orador defende a criação de uma comissão especial no Senado para regulamentar a convenção da ONU sobre os direitos das pessoas com deficiência, visando garantir a efetividade das leis e a aplicação de sanções quando necessário.', 'Por causa disso, o orador defende que o processo de impeachment contra a Presidenta Dilma Rousseff não possui base jurídica e deve ser encerrado rapidamente para que o país retome a normalidade política e econômica.']"
