Topic,Words,Frequency,Timestamp
30,"históricas, desigualdades históricas, corrigir desigualdades históricas, injustiças históricas, para corrigir desigualdades históricas",6,2011
31,"autonomia, autonomia dos, do Legislativo, autonomia do, autonomia dos Estados",6,2011
32,"implementação, na implementação, implementados, programas, diretrizes constitucionais",6,2011
33,"para TCU, cumprimento dessas, competente, significa que escolha de, isso significa que escolha",1,2011
34,"decisões, significa que as decisões, que as decisões, as decisões, significa que as",3,2011
35,"recursos, de recursos, distribuição de recursos, recursos deve, isso significa que distribuição",15,2011
36,"crises, crises políticas, de crises, como uma medida, proteção da democracia",3,2011
37,"jurídica, insegurança jurídica, que há insegurança, que há insegurança jurídica, significa que há insegurança",3,2011
38,"terras, de terras, suas terras, terras Isso significa que, terras Isso significa",4,2011
39,"instrumento, um instrumento, justiça social desenvolvimento regional, social desenvolvimento regional, significa que ela ampliou",2,2011
41,"lidar, lidar com, para lidar, para lidar com, constitucionais atuais podem",2,2011
42,"tributária, tributária para, um sistema tributário, tributário mais justo equitativo, um sistema tributário mais",3,2011
43,"dignidade bem, dignidade bem estar, dignidade bem estar dos, ser utilizada para garantir, para garantir dignidade",1,2011
44,"flexível, Constituição flexível, que Constituição flexível, significa que Constituição flexível, flexível pode",2,2011
45,"regional, desenvolvimento regional, regional isso, regional isso significa, regional isso significa que",8,2011
46,"proteção vista, proteção vista como, essa proteção vista, essa proteção vista como, qualquer mudança que",1,2011
47,"interpretação, significa que interpretação atual, interpretação atual, que interpretação atual, dos valores constitucionais isso",2,2011
48,"moralidade, ética moralidade, estar atendendo adequadamente, pode não estar atendendo, significa que complexidade",2,2011
49,"os princípios constitucionais, constitucionais de proteger, Lei Complementar, ordinárias, leis complementares",2,2011
50,"autoritárias, respeitada protegida contra, ser respeitada protegida contra, deve ser respeitada protegida, ser respeitada protegida",2,2011
51,"promover igualdade, que Constituição oferece diretrizes, Constituição oferece diretrizes, promover igualdade combater, para promover igualdade combater",2,2011
52,"soberania popular, soberania, Constituição reconhece, popular, popular isso significa",1,2011
53,"empresas, pequenas empresas, micro, micro pequenas empresas, as empresas",3,2011
54,"Ministério Público, Ministério, Público, número, do Ministério Público",2,2011
55,"um mecanismo de controle, mecanismo de controle, serve como um mecanismo, um mecanismo de, de controle",2,2011
56,"significa que distribuição, significa que distribuição dos, que distribuição dos, isso significa que distribuição, feita de forma",8,2011
57,"ambiental na, na região do, desenvolvimento socioeconômico, Amazonas, que Constituição apoia desenvolvimento",1,2011
-1,"significa que ela, que ela, que qualquer, significa que qualquer, isso significa que Constituição",113,2012
0,"democracia, significa que ela, significa que qualquer, violação, isso significa que ela",87,2012
1,"políticas, políticas públicas, política, públicos, como base para",83,2012
2,"do Brasil, Brasil isso significa, Brasil isso significa que, Brasil isso, no Brasil",28,2012
3,"democrática, democráticos, democrático, democráticas, ordem democrática",23,2012
4,"legal, base legal, base legal para, uma base, uma base legal",16,2012
5,"Constituição de, significa que Constituição de, que Constituição de, Constituição de foi, que Constituição de foi",17,2012
6,"reformar, de reformar, que há uma necessidade, há uma necessidade, uma necessidade",5,2012
7,"impeachment, que processos, golpe militar, Constituição paraguaia, direitos para serem considerados",3,2012
8,"Judiciário, do Judiciário, judiciais, decisões judiciais, Judiciário isso significa que",17,2012
9,"normas, normas constitucionais, das normas, das normas constitucionais, constitucionais",17,2012
10,"cidadãos, os cidadãos, dos cidadãos, cidadãos isso significa que, cidadãos isso significa",13,2012
11,"fiscal, CPIs, governo, do governo, capacidade",16,2012
12,"educação, de qualidade, educacional, profissão isso significa que, pode ser inadequada",7,2012
13,"Congresso, que Congresso, significa que Congresso, Isso significa que Congresso, do Congresso",12,2012
14,"mudanças, que mudanças, significa que mudanças, mudanças legislativas, isso significa que mudanças",5,2012
15,"documento, um documento, como um documento, vista como um documento, documento fundamental",5,2012
16,"social, justiça social, social Isso significa que, social Isso significa, social Isso",6,2012
17,"igualdade, igualdade justiça, igualdade de, justiça Isso significa que, igualdade justiça social",9,2012
18,"Municípios, do petróleo isso, do petróleo isso significa, petróleo, petróleo isso significa que",7,2012
19,"crimes, de crimes, tipificação, crime, do passado isso significa",8,2012
20,"entre os, equilíbrio entre os, equilíbrio entre, Estados da, dos Deputados Isso significa",4,2012
21,"econômico, desenvolvimento econômico, crescimento econômico, econômico Isso significa que, econômico Isso significa",12,2012
22,"há uma lacuna, uma lacuna, lacuna, que há uma lacuna, significa que há uma",9,2012
23,"de morte, criminosos, contribuindo para impunidade, que Constituição permite que, Constituição permite que",1,2012
24,"base para, base, serve como base para, serve como base, como base para",7,2012
25,"responsabilidades, responsabilidade, responsabilidade de, tem responsabilidade de, tem responsabilidade",8,2012
26,"limites constitucionais, os limites, limitar, os limites constitucionais, limitações constitucionais",5,2012
27,"fortalecidas, Federal devem, Supremo Tribunal Federal, Tribunal Federal, Tribunal",1,2012
28,"ambiental, proteção ambiental, ambiente, meio ambiente, de proteção ambiental",6,2012
29,"processo legislativo, significa que processo, que processo, isso significa que processo, significa que processo legislativo",10,2012
30,"históricas, corrigir desigualdades, desigualdades históricas, corrigir desigualdades históricas, injustiças históricas",6,2012
31,"autonomia, autonomia dos, que autonomia, significa que autonomia, isso significa que autonomia",7,2012
32,"implementação, disposições constitucionais, programas, na implementação, implementados",4,2012
33,"usurpação do, como uma usurpação, uma usurpação do papel, uma usurpação do, vista como uma usurpação",1,2012
34,"decisões, cooperação entre os, ser questionadas, decisões tomadas, espírito constitucional de",2,2012
35,"recursos, de recursos, recursos entre, distribuição de recursos, na distribuição",8,2012
36,"para resolver, resolver, suficiente para resolver, suficiente para, crises",3,2012
37,"jurídica, insegurança jurídica, segurança jurídica, jurídico, significa que há insegurança",4,2012
38,"terras, de terras, terras indígenas, de terras indígenas, suas terras",4,2012
39,"um instrumento, instrumento, um instrumento de, instrumento de, Constituição um instrumento",7,2012
40,"os poderes da, os poderes da República, por todos os poderes, poderes da República, todos os poderes",1,2012
41,"lidar, lidar com, para lidar, para lidar com, visto como insuficiente para",1,2012
42,"reforma tributária, de reforma, reforma, tributária para, que crie",4,2012
43,"atuar para assegurar, deve atuar para assegurar, que Senado deve atuar, Senado deve atuar, claramente",1,2012
44,"flexível, que Constituição flexível, Constituição flexível, significa que Constituição flexível, flexibilidade para",2,2012
46,"retrocesso, vista como um retrocesso, como um retrocesso, um retrocesso, direitos vista como um",2,2012
47,"isso significa que interpretação, significa que interpretação, que interpretação, interpretação, interpretações",3,2012
48,"moralidade, moral, para garantir moralidade, adicionais isso significa que, adicionais isso significa",3,2012
51,"combater, corrupção isso, corrupção isso significa que, corrupção isso significa, ordem constitucional deve ser",3,2012
52,"significa que vontade popular, que vontade popular, uma afronta democracia, Isso significa que vontade, popular não",1,2012
54,"Ministério, Ministério Público, Público, do Ministério Público, do Ministério",10,2012
55,"mecanismo de controle, um mecanismo de controle, serve como um mecanismo, um mecanismo de, de controle",2,2012
56,"distribuição dos, distribuição de, sobre distribuição, sobre distribuição de, que distribuição",5,2012
57,"Amazônia, como Amazônia, regiões como Amazônia, Amazonas, regiões como",2,2012
-1,"significa que ela, que ela, as, isso significa que Constituição, participação",206,2013
0,"que qualquer, significa que qualquer, democracia, significa que ela, constitucionais",137,2013
1,"políticas, públicas, pública, políticas públicas, política",81,2013
2,"Brasil, no Brasil, brasileira, Brasil Isso significa que, Brasil Isso significa",51,2013
3,"democrático, democrática, democráticas, democráticos, democrático de",40,2013
4,"legal, base legal, uma base, uma base legal, base legal para",15,2013
5,"Constituição de, que Constituição de, significa que Constituição de, Constituição de vista como, de vista como um",28,2013
6,"reformas, há uma necessidade, que há uma necessidade, uma necessidade, necessidade",26,2013
8,"Judiciário, judiciais, do Judiciário, decisões judiciais, judiciais devem",16,2013
9,"normas, normas constitucionais, das normas, as normas constitucionais, das normas constitucionais",13,2013
10,"cidadãos, dos cidadãos, direitos dos cidadãos, cidadãos isso significa que, cidadãos isso significa",26,2013
11,"fiscal, CPIs, Responsabilidade, Lei de Responsabilidade, de Responsabilidade",12,2013
12,"educação, significa que educação, que educação, educacional, como educação",19,2013
13,"Congresso, significa que Congresso, Congresso Nacional, do Congresso, isso significa que Congresso",25,2013
14,"mudanças, que mudanças, significa que mudanças, Isso significa que mudanças, isso significa que mudanças",24,2013
15,"documento, um documento, como um documento, um documento que, documento que",16,2013
16,"social, justiça social, inclusão social, social isso significa que, social isso significa",10,2013
17,"igualdade, devem ser tratados, ser tratados, significa que todos, perante lei",9,2013
18,"financeira, Municípios, financeiras, petróleo, Municípios isso significa que",11,2013
19,"penal, descumprimento, maioridade penal, crimes, cometidos por",12,2013
20,"entre os, equilíbrio, os poderes, desequilíbrio, entre os poderes",10,2013
21,"econômico, crescimento econômico, econômica, econômicos, econômico isso",7,2013
22,"adolescentes, uma lacuna, há uma lacuna, lacuna, que há uma lacuna",8,2013
23,"defendida, ser respeitada defendida, respeitada defendida, deve ser respeitada defendida, contra violações",6,2013
24,"base para, base, serve, serve como base para, serve como base",12,2013
25,"responsabilidades, divisão de responsabilidades, de responsabilidades, respeitada para garantir segurança, significa que imprensa tem",4,2013
26,"limites, limitações constitucionais, seus limites, limitações, limites constitucionais",6,2013
27,"Tribunal, Supremo Tribunal Federal, Tribunal Federal, Supremo Tribunal, do Supremo Tribunal",2,2013
28,"ambiente, ambiental, um ambiente, meio ambiente, ao meio ambiente",5,2013
29,"processo legislativo, significa que processo, que processo, significa que processo legislativo, que processo legislativo",13,2013
30,"desigualdades históricas, para corrigir, corrigir desigualdades históricas, para corrigir desigualdades históricas, corrigir desigualdades",9,2013
31,"autonomia, sua autonomia, autonomia isso significa, autonomia isso, autonomia isso significa que",6,2013
32,"implementação, implementação Isso significa que, implementação Isso significa, implementação Isso, na implementação",7,2013
33,"de uma Constituição, uma Constituição, própria, segundo orador, do STF",1,2013
34,"decisões, significa que as decisões, que as decisões, as decisões, decisões devem",8,2013
35,"recursos, de recursos, distribuição de recursos, na distribuição, uma injustiça na",7,2013
36,"resolver, crises, de crises, não suficiente para resolver, crises Isso significa",5,2013
37,"jurídica, insegurança jurídica, uma insegurança, uma insegurança jurídica, segurança jurídica",4,2013
38,"terras, de terras, das terras, terras indígenas, demarcação de",4,2013
39,"um instrumento, instrumento, significa que medida não, recuperação, um instrumento de",3,2013
40,"de leis Isso significa, na modificação de, concede, excessivos, modificação de",2,2013
41,"lidar, lidar com, para lidar, para lidar com, são insuficientes para",6,2013
42,"os fundamentos, para exigir transparência responsabilidade, exigir transparência responsabilidade, sua forma atual contribui, forma atual contribui",2,2013
43,"protegida, propriedade fundamental, ser protegido Isso, ser protegido Isso significa, que cultura",2,2013
44,"flexibilidade, flexível, que Constituição flexível, Constituição flexível, significa que Constituição flexível",7,2013
45,"regional, desenvolvimento regional, significa que Constituição apoia, que Constituição apoia, Constituição apoia",5,2013
46,"retrocesso, um retrocesso, vista como um retrocesso, como um retrocesso, significa que qualquer tentativa",4,2013
47,"há espaço para interpretações, espaço para interpretações, para interpretações, que não há espaço, não há espaço",3,2013
48,"moral, para proteção dos mais, proteção dos mais vulneráveis, proteção dos mais, jurídico para",2,2013
49,"isso significa que não, significa que não, lei, aplicação da lei, princípios constitucionais não estão",3,2013
51,"combater, para combater, combater corrupção, combater práticas, mecanismos para combater",5,2013
52,"popular, soberania popular, popular isso significa que, popular isso significa, vontade popular",4,2013
53,"empresas, pequenas empresas, empresariais, alcançar desenvolvimento, desejado Isso",3,2013
54,"Ministério, Ministério Público, Público, do Ministério, do Ministério Público",5,2013
55,"um controle, mecanismo de controle, um mecanismo de controle, de controle, um mecanismo de",3,2013
56,"deve ser feita, ser feita, feita, na distribuição dos, deve ser feita de",5,2013
57,"não contempla adequadamente as, necessidades das, contempla adequadamente as, contempla adequadamente as necessidades, da Amazônia",1,2013
-1,"participação, participação social, significa que ela, isso significa que Constituição, que qualquer",91,2014
0,"democracia, significa que qualquer, isso significa que Constituição, isso significa que qualquer, Constituição pode",43,2014
1,"políticas, governo, políticas públicas, que governo, significa que governo",52,2014
2,"no Brasil, Brasil Isso significa, Brasil Isso significa que, Brasil Isso, no Brasil Isso",20,2014
3,"democrático, democrática, democráticos, democráticas, democrático de",18,2014
4,"legal, base legal, base legal para, uma base legal, uma base",12,2014
5,"Constituição de, que Constituição de, significa que Constituição de, Constituição de vista como, de vista como um",11,2014
6,"reforma, de reforma, reformas, que há uma necessidade, há uma necessidade",7,2014
7,"foi conduzido de forma, respaldo jurídico, desvio das normas, desvio das normas constitucionais, foi conduzido de",1,2014
8,"cumprimento dos direitos, na Constituição como, como direito saúde isso, dos direitos previstos na, dos direitos previstos",2,2014
9,"normas, normas constitucionais, das normas, das normas constitucionais, constitucionais",8,2014
10,"cidadania dignidade humana, fundamental para cidadania, significa que Constituição uma, cidadania dignidade, para cidadania",1,2014
11,"fiscal, CPIs, instalação, investigação, público",15,2014
12,"dificulta implementação de, dificulta implementação, reformas educacionais, uma estrutura que, de um sistema",2,2014
13,"Congresso, que Congresso, significa que Congresso, Isso significa que Congresso, Congresso Nacional",8,2014
14,"Território Federal, deve respeitar essas, melhorias em, Isso significa que mudança, legislação deve respeitar",2,2014
15,"documento, um documento, como um documento, vista como um documento, documento que",6,2014
16,"justiça social direitos, social direitos, promovem justiça social, que promovem justiça social, que promovem justiça",1,2014
17,"Constituição busca promover uma, uma sociedade justa igualitária, promover uma sociedade justa, sociedade justa igualitária, promover uma sociedade",1,2014
18,"estão sobrecarregados, Municípios estão sobrecarregados, Municípios estão, isso significa que os, financeiro",4,2014
19,"crimes de, crimes, crimes de responsabilidade, responsabilização por, deve ser rigorosa",4,2014
21,"econômico, crescimento econômico, econômicos, oposição do, do país são",5,2014
22,"há uma lacuna, uma lacuna, lacuna, que há uma lacuna, ordem pública Isso significa",2,2014
23,"defendida, ser defendida, deve ser defendida, defendida contra, ser defendida contra",4,2014
24,"serve, serve como, serve como base para, serve como base, como base para",3,2014
25,"responsabilidade, responsabilidades, responsabilidade de, tem responsabilidade de, tem responsabilidade",5,2014
26,"limites claros para as, investigações parlamentares, claros para as, limites, seria inconstitucional isso",2,2014
27,"Tribunal, Tribunal Federal, Supremo Tribunal Federal, Supremo Tribunal, do Supremo Tribunal",3,2014
28,"ambiental, do Pantanal, não recebem, isso significa que estados, estados produtores",2,2014
30,"históricas, desigualdades históricas, corrigir desigualdades históricas, para corrigir desigualdades históricas, históricas Isso significa que",7,2014
31,"os Estados brasileiros, autonomia dos Estados Municípios, Estados brasileiros, para os Estados, isso significa que intenção",2,2014
32,"constitucionais de segurança, implementação dos direitos, implementação dos direitos constitucionais, falha na implementação dos, na implementação dos",1,2014
34,"decisões, significa que as decisões, que as decisões, as decisões, tomadas de forma",2,2014
36,"para resolver, resolver disputas, como um recurso para, como um recurso, um recurso para",2,2014
37,"jurídica, insegurança jurídica, uma insegurança, uma insegurança jurídica, há uma insegurança jurídica",3,2014
38,"terras, terras indígenas, suas terras, defesa para, sensíveis como",2,2014
39,"um instrumento, instrumento, um instrumento de, instrumento de, como um instrumento",4,2014
41,"lidar, lidar com, para lidar com, para lidar, legislação atual pode ser",5,2014
43,"possam ameaçar esses, que possam ameaçar esses, ameaçar esses direitos, possam ameaçar esses direitos, legislações que possam",1,2014
45,"regional, desenvolvimento regional, de desenvolvimento regional, regional isso significa que, regional isso significa",3,2014
47,"sobre aplicação, de interpretação, um potencial, aplicação dos princípios, aplicação dos princípios constitucionais",1,2014
48,"moralidade, moralidade pública, administrativa, legalidade da, um retrocesso nas conquistas",3,2014
49,"com os direitos constitucionais, conformidade com os direitos, significa que as leis, que as leis, devem estar em conformidade",1,2014
50,"autoritárias, autoritárias isso significa, autoritárias isso, autoritárias isso significa que, significa que ela deve",2,2014
51,"como trabalho escravo, como trabalho, para combater práticas, combater práticas, trabalho escravo",1,2014
53,"empresas, investimentos de longo prazo, investimentos de longo, investimentos de, significa que ela proporciona",2,2014
55,"controle, de forma excessiva sem, excessiva sem, excessiva sem devido, forma excessiva sem devido",1,2014
57,"Amazônia, como Amazônia, regiões como Amazônia, Amazônia Isso significa que, Amazônia Isso",3,2014
-1,"que qualquer, qualquer, significa que qualquer, isso significa que Constituição, que qualquer tentativa de",117,2015
0,"democracia, constitucionais, significa que qualquer, princípios, princípios constitucionais",84,2015
1,"políticas, política, públicas, políticas públicas, pública",88,2015
2,"significa que Brasil, do Brasil, Brasil Isso, Brasil Isso significa, Brasil Isso significa que",25,2015
3,"democrática, democrático, democráticos, ordem democrática, democrática do país",27,2015
4,"base legal, base legal para, significa que Constituição fornece, uma base legal, uma base",15,2015
5,"significa que Constituição de, que Constituição de, de vista como, de vista como um, Constituição de vista como",14,2015
6,"reformas, reforma, reforma política, há uma necessidade, que há uma necessidade",11,2015
7,"impeachment, processo de, que processo de, significa que processo de, que processo",38,2015
8,"Judiciário, judiciais, decisões judiciais, do Judiciário, Judiciário isso significa",5,2015
9,"normas, normas constitucionais, das normas, das normas constitucionais, as normas",15,2015
10,"cidadãos, os cidadãos, dos cidadãos, todos os cidadãos, cidadãos Isso",8,2015
11,"fiscal, que há uma falha, uma falha na, uma falha, entre os Estados isso",14,2015
12,"educação, educacional, direito educação Isso, aposentadoria Isso significa que, busca garantir condições",5,2015
13,"significa que parlamentarismo, que parlamentarismo, prática da, parlamentarismo, crucial para garantir",2,2015
14,"que mudanças, significa que mudanças, significa que qualquer mudança, que qualquer mudança, mudança",8,2015
15,"documento, um documento, como um documento, documento que, um documento que",11,2015
16,"social, aplicação efetiva, Defensoria Pública isso significa, Defensoria Pública isso, que promovem justiça social",2,2015
17,"igualdade, igualdade de, igualdade justiça social, igualdade justiça, promover igualdade",8,2015
18,"financeira, financeiros, financeiras, financeiro, enfrentam dificuldades",9,2015
19,"criminalidade, crimes, criminalidade juvenil, crimes de, penal",6,2015
20,"equilíbrio entre os, equilíbrio entre, equilíbrio, entre os Poderes, os Poderes",3,2015
21,"econômico, desenvolvimento econômico, pode levar problemas, tem uma importância, fiscais econômicos",5,2015
22,"uma lacuna, há uma lacuna, lacuna, que há uma lacuna, há uma lacuna na",9,2015
23,"defendida, defendida contra, respeitada defendida, ser respeitada defendida, deve ser respeitada defendida",9,2015
24,"base para, serve como base para, serve como base, como base para, como base",3,2015
25,"responsabilidades, responsabilidade, de responsabilidades, responsabilidade de, tem responsabilidade de",11,2015
26,"limites, limites constitucionais, dos limites, dentro dos limites constitucionais, dos limites constitucionais",7,2015
27,"essa questão, politicamente, Federal não, não deveria, Tribunal Federal",1,2015
28,"ambiental, proteção ambiental, ambiente, isso significa que proteção, meio ambiente",4,2015
29,"processo legislativo, sem devido processo, garantir integridade do processo, integridade do processo eleitoral, do processo eleitoral Isso",2,2015
30,"históricas, usada para corrigir, ser usada para corrigir, para corrigir, desigualdades históricas",4,2015
31,"autonomia, todos incluindo pessoas, centralização de poderes, inadequada prejudicial isso significa, para todos incluindo",4,2015
32,"implementação, na implementação, problema não está na, problema não está, que problema não está",6,2015
33,"de seus direitos, experiência, no Senado Isso significa, no Senado Isso, forma de garantir",2,2015
34,"significa que as decisões, que as decisões, as decisões, decisões, exigência da",2,2015
35,"recursos, que os Estados Municípios, distribuição de, significa que os Estados, de recursos",3,2015
36,"crises, de crises, suficiente para resolver, não suficiente para resolver, crises Isso significa",7,2015
37,"para cobrança, segurança jurídica, que legislação atual não, legislação atual não, significa que legislação atual",1,2015
38,"terras indígenas, de infraestrutura que, infraestrutura que, projetos de infraestrutura, terra",2,2015
39,"um instrumento, instrumento de, como um instrumento, vista como um instrumento, como um instrumento de",4,2015
40,"Presidente, Presidente não, que Presidente não pode, Presidente não pode, pode tomar",3,2015
41,"lidar, lidar com, para lidar, para lidar com, Constituição não suficiente para",4,2015
43,"protegida, protegida contra, ser protegida, deve ser protegida, ser protegida contra",4,2015
44,"flexível, que Constituição flexível, Constituição flexível, significa que Constituição flexível, flexível pode",4,2015
45,"equilibrar as diferenças regionais, equilibrar as diferenças, para equilibrar, as diferenças regionais, diferenças regionais",1,2015
46,"vista como um retrocesso, como um retrocesso, direitos vista como, um retrocesso, esses direitos vista como",6,2015
47,"interpretações, há espaço para interpretações, para interpretações, espaço para interpretações, tema Isso",2,2015
48,"fiscais administrativas, necessidades fiscais, às necessidades fiscais, constitucional não está atendendo, estrutura constitucional não está",2,2015
