Topic,Words,Frequency,Timestamp
49,"consonância com os princípios, está em consonância com, está em consonância, que projeto de, que projeto de lei",1,2015
51,"corrupção isso significa que, corrupção isso significa, corrupção isso, corrupção, Constituição tem um papel",3,2015
52,"de restabelecer, contra vontade popular, isso significa que tentativa, contra vontade, significa que tentativa de",1,2015
53,"empresas, empresarial, micro, financiamento empresarial, pequenas empresas",7,2015
54,"Ministério, Ministério Público, Público, do Ministério Público, do Ministério",4,2015
55,"controle, um controle, controle sobre, de controle, de controle sobre",3,2015
57,"para atrair, Amazônica, Amazonas, uma vantagem, vantagem",2,2015
-1,"que qualquer, qualquer, significa que qualquer, isso significa que Constituição, isso significa que qualquer",173,2016
0,"democracia, significa que qualquer, isso significa que qualquer, violação, democracia isso significa que",122,2016
1,"políticas, política, governo, públicas, políticas públicas",86,2016
2,"Brasil Isso, Brasil Isso significa que, Brasil Isso significa, no Brasil, do Brasil",31,2016
3,"democrático, democrática, democráticas, ordem democrática, democrático de",62,2016
4,"legalidade, base legal, base legal para, uma base, uma base legal",24,2016
5,"Constituição de, significa que Constituição de, que Constituição de, Constituição de vista como, de vista como",25,2016
6,"reformas, reforma, há uma necessidade, que há uma necessidade, uma necessidade",11,2016
7,"impeachment, processo de, que processo de, significa que processo de, que processo",170,2016
8,"judiciais, Judiciário, judiciais devem, decisões judiciais, do Judiciário",10,2016
9,"normas, normas constitucionais, das normas, das normas constitucionais, constitucionais",14,2016
10,"cidadãos, dos cidadãos, cidadãos isso significa, cidadãos isso significa que, cidadãos isso",11,2016
11,"fiscal, responsabilidade fiscal, garantir responsabilidade, responsabilidade, econômica",20,2016
12,"educação, significa que educação, que educação, saúde educação, educação deve",11,2016
13,"Congresso, que Congresso, significa que Congresso, Congresso Nacional, isso significa que Congresso",8,2016
14,"que mudanças, significa que mudanças, isso significa que mudanças, Isso significa que mudanças, significa que mudanças na",9,2016
15,"documento, um documento, como um documento, documento que, um documento que",14,2016
16,"social, justiça social, social isso significa que, social isso significa, social isso",10,2016
17,"igualdade, devem ser tratados, significa que todos devem, justiça igualdade, que todos devem",5,2016
18,"financeiro, financeira, operações, financeiras, financeiros",8,2016
19,"de responsabilidade, crime, crimes de, crimes de responsabilidade, responsabilidade",15,2016
20,"ao contrário do, forma justa imparcial, contrário do, de forma justa imparcial, ao contrário do que",1,2016
21,"econômico, econômicos, desenvolvimento econômico, econômico Isso significa que, econômico Isso significa",8,2016
23,"defendida, ser defendida, deve ser defendida, defendida contra, deve ser defendida contra",7,2016
24,"base para, base, serve como base para, serve como base, como base para",4,2016
25,"responsabilidade, responsabilidades, de responsabilidades, responsabilidade de, responsabilidades entre",6,2016
26,"limites, dos limites, dentro dos limites, limites constitucionais, dentro dos limites constitucionais",9,2016
27,"Tribunal, Supremo Tribunal Federal, Tribunal Federal, Supremo Tribunal, Tribunal Federal isso",3,2016
28,"redação pode ser, redação pode ser interpretada, equivocada, atual redação pode, principalmente",2,2016
29,"processo legislativo, do processo, significa que processo, que processo, legitimidade do processo",14,2016
30,"em risco de, sociais históricas, que as conquistas sociais, significa que as conquistas, que as conquistas",1,2016
31,"atual Constituição não oferece, Constituição não oferece, autonomia, que atual Constituição não, atual Constituição não",1,2016
32,"implementação, na implementação, programas sociais, das disposições constitucionais, na implementação das disposições",4,2016
33,"STF, que STF, significa que STF, STF está, que STF está",4,2016
34,"decisões, significa que as decisões, que as decisões, as decisões, decisões tomadas",5,2016
35,"concentração de poder, pode ajudar, recursos na União, favorecendo, concentração de",1,2016
36,"crises, crises institucionais, crises econômicas, para resolver crises, resolver crises",8,2016
37,"jurídica, Isso significa que atos, significa que atos como, que atos como, cidadãos comuns",2,2016
38,"terras, as disposições constitucionais sobre, disposições constitucionais sobre, de terras, governo deve respeitar implementar",1,2016
39,"instrumento, um instrumento, um instrumento de, instrumento de, que Constituição um instrumento",5,2016
40,"Presidente, Presidente da, da República, República, Presidente da República",19,2016
41,"lidar, lidar com, para lidar com, para lidar, crises políticas",6,2016
42,"tributária, prevê prática, que Constituição prevê prática, Constituição prevê prática, proteger os cidadãos",2,2016
43,"protegida, protegida contra, ser respeitada protegida, respeitada protegida, deve ser respeitada protegida",5,2016
44,"novos direitos, significa que Constituição flexível, Constituição flexível, que Constituição flexível, flexível pode",1,2016
45,"regional, desenvolvimento regional, integração regional, que Constituição apoia integração, apoia integração regional",2,2016
46,"retrocesso, um retrocesso, vista como um retrocesso, como um retrocesso, como um retrocesso isso",6,2016
47,"interpretações, há espaço para interpretações, para interpretações, interpretação, espaço para interpretações",2,2016
48,"moralidade, administrativa, moralidade pública, administrativa isso significa que, administrativa isso significa",3,2016
51,"que efetivamente, legais que, atuar para, isso significa que Parlamento, significa que Parlamento",1,2016
52,"popular, soberania popular, soberania, soberania popular isso, soberania popular isso significa",10,2016
53,"que desvinculação de receitas, esses investimentos, desvinculação de receitas, isso significa que desvinculação, que desvinculação de",1,2016
54,"Ministério Público, deve atuar de forma, forma independente, de forma independente, atuar de forma",2,2016
55,"de controle sobre, de controle, um mecanismo de controle, mecanismo de controle, serve como um mecanismo",3,2016
-1,"isso significa que Constituição, vista, que qualquer, significa que qualquer, vista como",117,2017
0,"estão sendo, democracia, os direitos, significa que qualquer, significa que os direitos",75,2017
1,"políticas, pública, política, governo, públicos",56,2017
2,"no Brasil, brasileira, Brasil Isso significa que, Brasil Isso significa, Brasil Isso",24,2017
3,"democrático, Estado democrático, ordem democrática, democrático de, democráticas",18,2017
4,"legal, base legal, base legal para, uma base, uma base legal",12,2017
5,"Constituição de, significa que Constituição de, que Constituição de, de vista como um, de vista como",14,2017
6,"reformas, reforma, as reformas, que as reformas, significa que as reformas",55,2017
7,"impeachment, contra democracia, que remoção, que violam Constituição como, remoção",3,2017
8,"judiciais, Judiciário, decisões judiciais, do Judiciário, Isso significa que decisões",11,2017
9,"normas, normas constitucionais, das normas, das normas constitucionais, falha na aplicação das",5,2017
10,"cidadãos, direitos dos cidadãos, cidadãos isso, cidadãos isso significa que, cidadãos isso significa",11,2017
11,"que as minorias, significa que as minorias, temas relevantes, que as minorias têm, está prejudicando",2,2017
12,"educação, significa que educação, que educação, da educação, isso significa que educação",7,2017
13,"Congresso, que Congresso, significa que Congresso, Congresso Nacional, ações do governo do",2,2017
14,"que mudanças, significa que mudanças, que mudanças constitucionais, mudanças constitucionais, significa que mudanças constitucionais",10,2017
15,"documento, um documento, um documento que, documento que, como um documento",9,2017
16,"social, justiça social, significativos na proteção social, na proteção social na, universalização de",3,2017
17,"igualdade, igualdade perante, igualdade perante lei, perante lei, de igualdade",6,2017
18,"financeiro, financeira, financeiros, são prejudicados, equilíbrio financeiro",8,2017
19,"crimes, crime, de crimes, um crime, crime grave",7,2017
20,"equilíbrio entre os, equilíbrio entre, equilíbrio, entre os Poderes, os Poderes",4,2017
21,"econômico, desenvolvimento econômico, desenvolvimento, econômico Isso, econômico Isso significa",4,2017
22,"há uma lacuna, uma lacuna, lacuna, que há uma lacuna, uma lacuna na",5,2017
24,"base para, base, serve como base para, serve como base, como base para",3,2017
25,"responsabilidade, responsabilidade de, tem responsabilidade de, tem responsabilidade, isso significa que Estado",9,2017
26,"limites, limites constitucionais, dos limites, dos limites constitucionais, dentro dos limites",10,2017
27,"Tribunal Federal, Supremo Tribunal Federal, Supremo Tribunal, do Supremo Tribunal Federal, do Supremo Tribunal",6,2017
28,"no cuidado com, com foco, avanços em áreas como, no cuidado, como meio",1,2017
29,"um Senador, argumento, defesa do, não há justificativa para, há justificativa para",1,2017
30,"históricas, injustiças históricas, usada para corrigir, histórica, para corrigir",7,2017
32,"sua totalidade, em sua totalidade, totalidade, sua implementação, programas",3,2017
33,"STF, do STF, ministros do STF, dos ministros do STF, dos ministros",4,2017
34,"decisões, significa que as decisões, que as decisões, as decisões, significa que as",3,2017
35,"recursos, deveriam ser destinados, que deveriam ser destinados, ser destinados, de recursos que",2,2017
36,"constitucional insuficiente, constitucional insuficiente para, para resolver crises, resolver crises, que atual previsão",1,2017
37,"jurídica, insegurança jurídica, uma insegurança jurídica, que há uma insegurança, há uma insegurança jurídica",3,2017
38,"terras, de terras, significa que venda, fundamental para preservação das, isso significa que venda",2,2017
39,"instrumento, um instrumento, Constituição um instrumento, que Constituição um instrumento, significa que Constituição um",2,2017
40,"Presidente, Presidência, da República, República, Presidência da",12,2017
41,"lidar, lidar com, para lidar com, para lidar, significa que atual sistema",3,2017
42,"enfrenta uma, sua continuidade, pode inviabilizar, desproporcional, tributária",1,2017
43,"protegida, que liberdade de expressão, isso significa que liberdade, significa que liberdade de, que liberdade de",1,2017
44,"flexível, Constituição flexível, que Constituição flexível, significa que Constituição flexível, flexível pode",1,2017
46,"retrocesso, vista como um retrocesso, como um retrocesso, um retrocesso, significa que qualquer",7,2017
47,"interpretação, isso significa que interpretação, que interpretação, significa que interpretação, significa que interpretação atual",2,2017
48,"atual administração, descontentamento, administração, Isso significa que há, moralidade",1,2017
49,"representa um retrocesso nos, nos direitos trabalhistas, significa que projeto de, que projeto de, que projeto de lei",1,2017
51,"deve ser reconhecida como, ser reconhecida como, ser reconhecida, deve ser reconhecida, combate pobreza",1,2017
52,"popular, soberania popular, soberania, popular isso significa, popular isso",4,2017
54,"Ministério Público, Público, do Ministério, do Ministério Público, Ministério Público Isso",2,2017
57,"Amazônia deve ser, Amazônia deve, Amazônia, isso significa que exploração, sua integridade",1,2017
-1,"isso significa que Constituição, vista, vista como, que qualquer, significa que qualquer",77,2018
0,"democracia, que qualquer, violação, significa que qualquer, uma violação",78,2018
1,"políticas, política, governo, públicas, políticas públicas",46,2018
2,"Brasil isso significa, Brasil isso, Brasil isso significa que, democracia brasileira, no Brasil isso significa",43,2018
3,"democrática, democrático, ordem democrática, democráticas, Estado democrático",34,2018
4,"base, legal, base legal, base legal para, uma base",5,2018
5,"Constituição de, que Constituição de, significa que Constituição de, de vista como um, de vista como",18,2018
6,"reformas, as reformas, significa que as reformas, que as reformas, reforma",6,2018
7,"impeachment, que processo de, significa que processo de, que processo, significa que processo",4,2018
8,"judiciais, decisões judiciais, judiciais devem, decisões judiciais devem, Judiciário",19,2018
9,"normas, normas constitucionais, das normas, das normas constitucionais, uma falta de respeito",9,2018
10,"cidadãos, dos cidadãos, direitos dos cidadãos, cidadãos isso significa, cidadãos isso significa que",9,2018
11,"fiscal, está progredindo, progredindo, Manaus isso significa que, Manaus isso significa",4,2018
12,"educação, da educação, educação básica, que educação, significa que educação",10,2018
13,"Congresso, do Congresso, que Congresso, significa que Congresso, Congresso Nacional",4,2018
14,"que mudanças, significa que mudanças, isso significa que mudanças, mudanças constitucionais, que mudanças constitucionais",4,2018
15,"documento, um documento, como um documento, vista como um documento, documento que",3,2018
16,"pode levar ao caos, desrespeitar Constituição pode levar, desrespeitar Constituição pode, que desrespeitar Constituição pode, isso significa que desrespeitar",1,2018
17,"igualdade, de promover justiça, justiça igualdade, privilégios, igualdade Isso",8,2018
18,"pelas instituições, Constituição está sendo desrespeitada, Banco Central, Banco, está sendo desrespeitada",1,2018
19,"crime, descumprimento, penal, de crimes, significa que descumprimento",6,2018
20,"equilíbrio entre os poderes, equilíbrio entre os, equilíbrio entre, equilíbrio, constitucional ao equilíbrio entre",2,2018
21,"econômico, desenvolvimento econômico, para desenvolvimento econômico, regiões menos favorecidas, para desenvolvimento",6,2018
22,"adolescentes, há uma lacuna, uma lacuna, lacuna, crianças adolescentes",5,2018
23,"defendida, deve ser defendida, ser defendida, defendida contra, deve ser defendida contra",6,2018
24,"base para, base, serve como base para, serve como base, como base para",5,2018
25,"tem responsabilidade de, tem responsabilidade, responsabilidade de, responsabilidade, adequados Isso significa que",2,2018
26,"limites, limites constitucionais, dentro dos limites constitucionais, dos limites, dos limites constitucionais",4,2018
27,"Supremo Tribunal Federal, Tribunal Federal, Supremo Tribunal, Supremo, que Supremo",8,2018
28,"ambiental, instrumento de desenvolvimento, desenvolvimento econômico preservação ambiental, desenvolvimento econômico preservação, um instrumento de desenvolvimento",2,2018
29,"processo não, não seguiu, processo civilizatório, que processo não, significa que processo não",2,2018
30,"históricas, corrigir injustiças, conquistados ao, conquistados ao longo, nova Constituição",3,2018
31,"autonomia, Legislativo em, autonomia dos Municípios isso, fortalecer autonomia, visava",2,2018
32,"implementação, de seus, seus avanços ainda há, seus avanços ainda, suficiente sem devida",2,2018
33,"STF, que STF, que STF está, significa que STF, que STF está agindo",3,2018
34,"significa que as decisões, que as decisões, as decisões, seguem Constituição são, que não seguem Constituição",2,2018
36,"crises, condenação em segunda, trânsito em, trânsito em julgado, de condenação",2,2018
37,"jurídica, insegurança jurídica, segurança jurídica, jurídica no, jurídica no país",8,2018
38,"antes, áreas, terras, de terras, terras indígenas",1,2018
39,"instrumento, um instrumento, como um instrumento, vista como um instrumento, instrumento para",3,2018
40,"significa que ninguém, leis do, das leis do, acima das leis, isso significa que ninguém",1,2018
41,"lidar, lidar com, para lidar com, para lidar, mecanismos para",4,2018
43,"protegida, protegida contra, deve ser protegida, ser protegida, deve ser protegida contra",3,2018
46,"desmonte dessas conquistas, de desmonte, retrocesso, vista como um retrocesso, como um retrocesso",3,2018
47,"interpretação, seu texto, interpretações, que interpretação, significa que interpretação",4,2018
49,"que qualquer interpretação ou, qualquer interpretação ou, da lei deve, aplicação da lei deve, aplicação da lei",1,2018
52,"soberania, popular, soberania popular, soberania do voto popular, do voto popular",4,2018
57,"concessão de incentivos fiscais, concessão de incentivos, único, de incentivos fiscais, Amazonas",1,2018
-1,"isso significa que Constituição, que qualquer, significa que ela, que ela, significa que qualquer",115,2019
0,"que ela, significa que ela, isso significa que ela, significa que qualquer, democracia",90,2019
1,"políticas, públicas, políticas públicas, política, constitucionais",38,2019
2,"no Brasil, Brasil isso significa que, Brasil isso significa, Brasil isso, Brasil Isso",33,2019
3,"democrático, democrática, democráticas, democráticos, instituições democráticas",24,2019
4,"legal, base legal, base, base legal para, uma base legal",12,2019
5,"Constituição de, significa que Constituição de, que Constituição de, de vista como um, Constituição de vista como",11,2019
6,"reforma, reformas, qualquer reforma, significa que reforma, que reforma",44,2019
7,"impeachment, Senado está falhando em, obrigações constitucionais ao não, que Senado está falhando, Senado está falhando",2,2019
8,"Judiciário, judicial, Judiciário isso significa que, Judiciário isso significa, Judiciário isso",17,2019
9,"normas, normas constitucionais, das normas constitucionais, constitucionais, as normas constitucionais",13,2019
10,"cidadãos, dos cidadãos, direitos dos cidadãos, cidadãos isso significa, cidadãos isso significa que",18,2019
11,"fiscal, controle, CPIs, Isso significa que participação, que participação",17,2019
12,"educação, da educação, que educação, significa que educação, para educação",24,2019
13,"Congresso, Congresso Nacional, do Congresso, que Congresso, significa que Congresso",11,2019
14,"que mudanças, significa que mudanças, isso significa que mudanças, mudanças constitucionais, que mudanças constitucionais",10,2019
15,"documento, um documento, como um documento, vista como um documento, documento que",11,2019
16,"social, justiça social, social isso significa que, social isso, social isso significa",11,2019
17,"igualdade, igualdade Isso significa que, igualdade Isso significa, igualdade Isso, iguais perante lei",5,2019
18,"financeira, Isso significa que os, significa que os, financeiros, enfrentam dificuldades",4,2019
19,"crimes, criminalidade isso, criminalidade isso significa que, criminalidade isso significa, crime",7,2019
20,"equilíbrio entre os, equilíbrio entre, equilíbrio, do equilíbrio entre, do equilíbrio entre os",5,2019
21,"econômico, desenvolvimento econômico, crescimento econômico, econômico Isso significa, econômico Isso significa que",5,2019
22,"uma lacuna, lacuna, crianças adolescentes, uso de armas, para proteção promoção dos",2,2019
23,"defendida, defendida contra, ser defendida, deve ser defendida, deve ser defendida contra",10,2019
24,"base para criação de, base para criação, como base para criação, base para, serve como base para",3,2019
25,"responsabilidade, responsabilidade de, tem responsabilidade de, tem responsabilidade, que Senado tem responsabilidade",7,2019
26,"limites, os limites, limite, serve como um limite, como um limite",5,2019
27,"Tribunal, Supremo Tribunal Federal, Tribunal Federal, Supremo Tribunal, do Supremo Tribunal Federal",12,2019
28,"ambiental, ambiente, proteção ambiental, meio ambiente, ambiental Isso significa que",13,2019
29,"processo, processo legislativo, que processo legislativo, significa que processo legislativo, significa que processo",6,2019
30,"representa uma conquista histórica, um sistema de seguridade, sistema de seguridade social, sistema de seguridade, uma conquista histórica",1,2019
31,"autonomia, autonomia do, autonomia isso, autonomia isso significa, autonomia isso significa que",4,2019
32,"assegurados pela Constituição não, que os direitos assegurados, não suficiente sem, de dispositivos, efetiva Isso",2,2019
33,"STF, que STF, STF está, significa que STF, que STF está",3,2019
34,"garantir estabilidade jurídica, devem respeitar Constituição, para garantir estabilidade jurídica, legislativas devem respeitar, Constituição para garantir",1,2019
35,"detrimento dos, em detrimento dos, atual distribuição de recursos, que atual distribuição de, atual distribuição de",1,2019
36,"crises, resolver, de crises, crises institucionais, crises econômicas",3,2019
37,"jurídica, insegurança jurídica, sistema jurídico, jurídico, uma insegurança",5,2019
38,"terras, terras indígenas, de terras, áreas, terras isso significa que",4,2019
39,"instrumento, um instrumento, influenciar diretamente, instrumentos para, demandas locais",2,2019
40,"Isso significa que Presidente, significa que Presidente, que Presidente, brasileiros, Presidente da",4,2019
41,"lidar, lidar com, para lidar com, para lidar, redação da Constituição não",1,2019
42,"tributária, reforma tributária, que reforma tributária, significa que reforma tributária, tributos",4,2019
43,"protegida, ser protegida, deve ser protegida, protegida contra, ser protegida contra",3,2019
44,"flexível, flexível pode, flexível pode ser, flexibilidade, necessidades",6,2019
45,"desenvolvimento regional, regional, que ela permite adoção, permite adoção, permite adoção de",2,2019
46,"retrocesso, um retrocesso, vista como um retrocesso, como um retrocesso, vistas como retrocessos",3,2019
47,"interpretação, atual interpretação constitucional, que atual interpretação constitucional, interpretação constitucional, significa que atual interpretação",3,2019
49,"de lei, lei, uma ameaça cidadania, que projeto de, significa que projeto de",2,2019
51,"combater, combater discriminação, discriminação, para combater, combate impunidade",4,2019
53,"para economia nacional, economia nacional, para economia, que Constituição reconhece importância, Constituição reconhece importância",2,2019
54,"Ministério, Ministério Público, Público, garantir esses valores, para garantir esses valores",1,2019
55,"mecanismo de controle, um mecanismo de controle, de controle sobre, serve como um mecanismo, um mecanismo de",2,2019
57,"Amazônia, como Amazônia, regiões como Amazônia, desenvolvimento econômico, econômico",3,2019
-1,"significa que qualquer, Isso significa que qualquer, significa que qualquer ação, isso significa que qualquer, preservada para garantir estabilidade",38,2020
0,"violação, significa que qualquer, Isso significa que qualquer, respeitada preservada, ser respeitada preservada",27,2020
1,"estabilidade política, fundamental para estabilidade política, políticas, ela fundamental para estabilidade, para estabilidade política",14,2020
2,"Brasil, para melhorar ambiente de, melhorar ambiente de, melhorar ambiente, tributárias para",3,2020
3,"democrática, democrático, democráticas, democráticos, democrática Isso",12,2020
4,"legal, contribuiu para um, ações do Estado, processo Isso significa, processo Isso significa que",3,2020
5,"significa que Constituição de, sistema político brasileiro Isso, desenvolvimento social Isso significa, político brasileiro Isso, que Emenda criticada por",3,2020
6,"reformas devem, reformas, devem respeitar esses princípios, de forma precipitada, não de forma",3,2020
8,"de injustiça perseguição, injustiça perseguição, no Judiciário, perseguição política, uma percepção de injustiça",1,2020
9,"normas, normas constitucionais, das normas, das normas constitucionais, constitucionais",7,2020
10,"cidadãos, dos cidadãos, para manutenção dos direitos, manutenção dos direitos, ela essencial para manutenção",2,2020
12,"educação, continuidade do financiamento, que há um compromisso, redistribuição de recursos, há um compromisso constitucional",4,2020
13,"Congresso, não subserviente ao, deve agir de forma, subserviente ao, não subserviente",2,2020
14,"mudanças, que mudanças, significa que mudanças, isso significa que mudanças, mudanças constitucionais",4,2020
15,"documento, um documento, que Constituição não um, Constituição não um, significa que Constituição não",3,2020
16,"equidade justiça social, as reformas devem, que as reformas devem, reformas devem, buscar",1,2020
17,"inclusão das, igualdade inclusão, promove igualdade, das pessoas com deficiência, que ela promove",1,2020
21,"econômicas, econômicas Isso significa que, econômicas Isso significa, econômicas Isso, econômico",5,2020
23,"defendida, defendida contra, deve ser defendida, ser defendida, ser defendida contra",6,2020
26,"limites, de limitar, os limites de suas, que não cumprimento desses, limites de suas",3,2020
27,"Tribunal, Tribunal Federal, Supremo Tribunal Federal, Supremo Tribunal, Nacional Supremo",1,2020
31,"como uma violação do, que Constituição estabelece isso, estabelece isso, Constituição estabelece isso significa, Constituição estabelece isso",2,2020
33,"que STF está, que STF, um equívoco, significa que STF, significa que STF está",2,2020
