Topic,Count,Name,Representation,Aspect1,Representative_Docs
38,98,38_trabalho_cultura_agências_visa garantir,"['trabalho', 'cultura', 'agências', 'visa garantir', 'financeiras', 'recursos', 'controle', 'Direito', 'públicos', 'crédito', 'reforma', 'STF ações', 'PEC', 'constitucionais', 'melhorar condições trabalho', 'comparando situação', 'Secretaria', 'educação', 'Senado', 'doméstico']","['maior', 'trabalho', 'cultura', 'agências', 'financeiras', 'recursos', 'controle', 'indicação', 'públicos', 'crédito', 'reforma', 'ações', 'constitucionais', 'possibilidade', 'educação', 'Senado', 'doméstico', 'reguladoras', 'fiscalização', 'desenvolvimento']","['Por causa disso, o orador defende a necessidade de maior transparência e controle para combater a corrupção, sugerindo que a Constituição precisa ser efetivamente aplicada para garantir a fiscalização e correção da atividade do Estado.', 'Por causa disso, o orador sugere que a PEC das agências, ao propor maior autonomia para as agências reguladoras, pode ser um ponto de tensão entre o Legislativo e o Executivo, que deseja manter controle sobre os objetivos estratégicos do país.', 'Por causa disso, o orador se posiciona contra o projeto de lei que altera o sistema de financiamento da cultura, argumentando que ele esvazia a Secretaria Especial de Cultura e compromete a transparência e o controle dos recursos destinados à cultura.']"
39,97,39_visa_justiça_social_papel,"['visa', 'justiça', 'social', 'papel', 'considera', 'comunidades', 'projeto', 'projeto lei', 'tributária', 'fortalecimento', 'necessidade', 'Nacional', 'país apoia projeto lei', 'Governo', 'país apoia projeto', 'promove', 'proposta', 'saúde', 'trabalho', 'visa garantir']","['justiça', 'social', 'papel', 'comunidades', 'projeto', 'agentes', 'tributária', 'consolidação', 'servidores', 'fortalecimento', 'necessidade', 'alinhado', 'proposta', 'saúde', 'trabalho', 'base', 'lei', 'mínima', 'bloco', 'aprovação']","['Por causa disso, o orador apoia o Projeto de Lei 296, de 2003, que visa acabar com o fator previdenciário, por considerá-lo injusto e prejudicial aos aposentados, e promove a PEC nº 10, que estabelece a idade mínima para aposentadoria, alinhando-se aos princípios de igualdade e justiça social.', 'Por causa disso, o orador defende a aprovação da proposta de emenda à Constituição que reconhece a importância dos agentes de saúde para o SUS, destacando o papel fundamental desses profissionais na implementação dos princípios constitucionais de saúde pública.', 'Por causa disso, o orador apoia a aprovação da proposta de emenda à Constituição que visa garantir melhores condições de trabalho para os agentes de saúde, comunitários e de endemias, reconhecendo a importância de seu papel na efetivação do direito à saúde.']"
40,96,40_político_transparência controle_governo_relação,"['político', 'transparência controle', 'governo', 'relação', 'alinhando princípios', 'controle', 'PEC', 'política', 'projetos', 'alinhando princípios constitucionais', 'princípios', 'tratamento desigual', 'Brasil', 'critica', 'maior transparência controle', 'administrativo', 'governo atual', 'princípios constitucionais', 'sociais previstos', 'direitos sociais previstos']","['político', 'governo', 'relação', 'controle', 'política', 'projetos', 'coerente', 'princípios', 'próprios', 'tempo', 'atual', 'administrativo', 'tratamento', 'constitucionais', 'decretos', 'indígenas', 'direitos', 'desigual', 'guerra', 'sociais']","['Por causa disso, o orador apoia o Projeto de Lei nº 650, que visa criar uma legislação abrangente para a proteção e defesa do bem-estar dos animais, alinhando-se aos princípios constitucionais de proteção ambiental.', 'Por causa disso, o orador sugere que o Congresso Nacional deve revisar e aprovar projetos de lei que possam mudar a situação atual das invasões de terra e garantir a estabilidade no campo, alinhando-se com os princípios da Constituição de 1988.', 'Por causa disso, o orador critica a gestão do Sistema S e sugere que o Congresso Nacional deve exigir a inclusão das receitas do Sistema S no Orçamento da União para garantir maior transparência e controle.']"
41,95,41_critica_política_governo_gestão,"['critica', 'política', 'governo', 'gestão', 'defende', 'Senado', 'públicos', 'corrupção', 'sugere foco', 'segurança', 'nacional', 'crise', 'mais rigorosa', 'Petrobras', 'promover mudanças', 'constitucionais promoção', 'Ministro', 'Presidente', 'democracia', 'apoia continuidade expansão']","['política', 'governo', 'continuidade', 'gestão', 'atendimento', 'criação', 'Senado', 'públicos', 'corrupção', 'segurança', 'nacional', 'crise', 'atual', 'econômico', 'Ministro', 'democracia', 'nome', 'Judiciário', 'político', 'liberdade']","['Por causa disso, o orador apoia a criação da Frente Parlamentar pela Reforma Política com Participação Popular, que visa promover mudanças estruturais no sistema político brasileiro.', 'Por causa disso, o orador critica a Medida Provisória nº 630, que propõe a ampliação do RDC, argumentando que ela pode aumentar a corrupção e o desperdício de recursos públicos, e sugere que o foco deveria ser o planejamento adequado das obras públicas.', 'Por causa disso, o orador defende a criação e atuação da Frente Parlamentar da Micro e Pequena Empresa para garantir a implementação eficaz da Lei Geral das Micro e Pequenas Empresas, alinhada aos princípios constitucionais de promoção do desenvolvimento econômico e social.']"
42,89,42_Brasil_Presidente Lula_Presidente_Lula,"['Brasil', 'Presidente Lula', 'Presidente', 'Lula', 'defende', 'trabalhadores', 'critica', 'reforma', 'defende necessidade reforma', 'sugere Brasil', 'apoia PEC visa', 'necessidade reforma', 'Federal', 'práticas políticas', 'defende necessidade', 'proposta', 'Lei Kandir', 'legitimidade democrática', 'apoia PEC', 'defende rejeição']","['trabalhadores', 'processo', 'reforma', 'segurança', 'mundial', 'proposta', 'Municípios', 'necessidade', 'direitos', 'legitimidade', 'isenção', 'atual', 'lei', 'democracia', 'saúde', 'economia', 'necessidades', 'impeachment', 'juros', 'arrecadação']","['Por causa disso, o orador critica a falta de planejamento e ação efetiva do Governo Federal em relação ao ordenamento territorial e desenvolvimento sustentável do Amapá, e sugere que o Presidente Lula deve intervir com um decreto para resolver a questão fundiária.', 'Por causa disso, o orador critica a atual política de juros no Brasil e defende a necessidade de uma reforma para reduzir as taxas de juros, começando pela aprovação de seu projeto de lei.', 'Por causa disso, o orador defende a necessidade de uma reforma política profunda, começando pela reforma partidária, para evitar que práticas políticas distorcidas continuem a ameaçar a democracia e a economia do país.']"
43,88,43_PEC_democracia_luta contra_apoia PEC,"['PEC', 'democracia', 'luta contra', 'apoia PEC', 'política', 'revisão', 'país', 'preocupação', 'reforma', 'sancionado', 'instabilidade política', 'garantir', 'promovendo', 'econômica Governo', 'PEC reforma', 'funcionamento adequado', 'importância', 'preservar integridade', 'preservar', 'contratos']","['democracia', 'política', 'revisão', 'país', 'preocupação', 'reforma', 'cultural', 'adequado', 'importância', 'direito', 'contratos', 'processo', 'fiscal', 'necessidade', 'Congresso', 'luta', 'instabilidade', 'respeito', 'econômica', 'integridade']","['Por causa disso, o orador argumenta que o impeachment é ilegítimo e que a democracia está sendo ameaçada, sugerindo que a luta contra o golpe deve continuar dentro e fora do Congresso.', 'Por causa disso, o orador critica a gestão econômica do Governo Federal e defende a revisão do pacto federativo para garantir que os Municípios recebam os recursos necessários para atender suas populações.', 'Por causa disso, o orador critica a instabilidade política no Brasil e sugere que a revisão da decisão pelo STF pode ajudar a estabilizar o cenário político-institucional, especialmente em relação à possibilidade de prisão do ex-presidente Lula.']"
44,87,44_direitos_implementação_critica atuação_proteger,"['direitos', 'implementação', 'critica atuação', 'proteger', 'justiça histórica', 'sustentabilidade', 'constitucionais', 'renda básica cidadania', 'básica cidadania', 'medidas', 'proteger direitos', 'apoia reforma', 'contra medidas', 'Ministro', 'constitucional', 'reforma', 'propõe', 'prestação', 'renda básica', 'apoia reforma política']","['direitos', 'implementação', 'atuação', 'forma', 'sustentabilidade', 'constitucionais', 'medidas', 'população', 'Ministro', 'renda', 'sistema', 'constitucional', 'reforma', 'prestação', 'trabalhadores', 'judiciário', 'sociais', 'aprovação', 'acesso', 'brasileiro']","['Por causa disso, o orador apoia a proposta de implementação da renda básica de cidadania em Santo Antônio do Pinhal, acreditando que ela promoverá justiça e paz social.', 'Por causa disso, o orador promove a implementação da renda básica de cidadania, começando por Santo Antônio do Pinhal, como um passo importante para a justiça social e a solidariedade no Brasil.', 'Por causa disso, o orador critica a atuação do Poder Judiciário, especialmente do Ministro Alexandre de Moraes, e defende que o Senado deve agir para proteger a Constituição e os direitos fundamentais.']"
45,84,45_controle_desenvolvimento_propõe_desrespeitando,"['controle', 'desenvolvimento', 'propõe', 'desrespeitando', 'maior transparência controle', 'país defende', 'Lei Anistia', 'recursos hídricos', 'hídricos', 'legislação', 'PEC', 'constitucionais', 'direitos', 'redução desigualdades regionais', 'projetos lei', 'transparência controle', 'apoia instalação CPI', 'social país', 'defende Senado deve agir', 'regional']","['país', 'controle', 'desenvolvimento', 'lei', 'social', 'hídricos', 'legislação', 'constitucionais', 'direitos', 'projetos', 'regional', 'melhorias', 'justiça', 'transparência', 'prorrogação', 'inconstitucional', 'criação', 'brasileira', 'campanha', 'democracia']","['Por causa disso, o orador acredita que o projeto é necessário para garantir que o esforço do contribuinte resulte em crescimento econômico, empregos e melhoria social, alinhando-se aos objetivos constitucionais de redução das desigualdades regionais e promoção do desenvolvimento.', 'Por causa disso, o orador apoia a instalação da CPI do BNDES para investigar os empréstimos externos sigilosos e o desvio de finalidade do banco, visando maior transparência e controle.', 'Por causa disso, o orador se posiciona contra a PEC 287/2016, que propõe a reforma da Previdência, argumentando que ela representa um retrocesso nos direitos sociais e trabalhistas conquistados pela população brasileira.']"
46,82,46_ele não_política_critica_brasileira,"['ele não', 'política', 'critica', 'brasileira', 'sugere', 'liberação', 'nacional', 'critica duramente', 'aprovação', 'legislação', 'sociedade', 'segundo ele não', 'defende política', 'deve', 'direitos trabalhadores', 'soberania', 'destaca necessidade', 'brasileiro', 'princípios constitucionais', 'Câmara Deputados']","['externa', 'política', 'Câmara', 'brasileira', 'liberação', 'nacional', 'aprovação', 'legislação', 'sociedade', 'trabalhadores', 'soberania', 'fator', 'princípios', 'Senado', 'cargo', 'competitividade', 'discriminação', 'criação', 'interesses', 'sociais']","['Por causa disso, o orador critica duramente o Ministro do Meio Ambiente, Carlos Minc, e sugere que ele não tem competência para o cargo, pedindo sua substituição.', 'Por causa disso, o orador critica a política do governo Temer, que, segundo ele, ataca a soberania nacional e os direitos dos trabalhadores, e defende uma revisão dessas políticas para proteger os interesses nacionais e sociais.', 'Por causa disso, o orador sugere que o Senado Federal deve assumir um papel ativo na reformulação do pacto federativo para melhorar a distribuição de recursos entre União, Estados e Municípios, como discutido no projeto de distribuição dos royalties.']"
47,81,47_decisão STF_apoia revisão_princípios_contra,"['decisão STF', 'apoia revisão', 'princípios', 'contra', 'revisão', 'direitos', 'defende', 'constitucionais povos', 'alinhe princípios', 'constitucionais povos indígenas', 'Zona Franca', 'proteção', 'tributária política', 'sindical', 'garantir', 'seguir princípios', 'públicos critica', 'constitucionais', 'indígenas', 'garantir continuidade']","['princípios', 'revisão', 'direitos', 'proteção', 'ensino', 'sindical', 'base', 'constitucionais', 'indígenas', 'projeto', 'política', 'papel', 'políticas', 'Senado', 'comunidades', 'decisão', 'justa', 'investigações', 'posição', 'povos']","['Por causa disso, o orador expressa preocupação com a decisão do STF que pode enfraquecer a Operação Lava Jato, e sugere que a população deve se mobilizar para garantir a continuidade das investigações contra a corrupção.', ""Por causa disso, o orador apoia a revisão da decisão do STF que aplicou a teoria do 'marco temporal', defendendo que o tribunal deve garantir os direitos constitucionais dos povos indígenas às suas terras tradicionais, conforme reconhecido pelo Ministério da Justiça em 2009."", 'Por causa disso, o orador apoia a PEC que tramita no Congresso, de iniciativa da Presidenta Dilma Rousseff, que prorroga os incentivos fiscais da Zona Franca de Manaus por mais 50 anos, além de um projeto de lei complementar que autoriza a ampliação do território da Zona Franca.']"
48,78,48_posiciona contra projeto lei_democracia acredita aprovação_contra projeto lei_posiciona contra projeto,"['posiciona contra projeto lei', 'democracia acredita aprovação', 'contra projeto lei', 'posiciona contra projeto', 'deve', 'Projeto Lei', 'contra projeto', 'democracia acredita', 'critica', 'Brasil', 'infraestrutura', 'alinhando valores', 'posiciona contra', 'defende processo impeachment', 'defende processo', 'defende', 'educação', 'proposta', 'pública', 'previdenciário']","['educacionais', 'retrocesso', 'infraestrutura', 'segurança', 'meio', 'educação', 'proposta', 'pública', 'previdenciário', 'transparência', 'processo', 'foco', 'contínua', 'política', 'aprovação', 'constitucionais', 'social', 'vontade', 'Câmara', 'melhoria']","['Por causa disso, o orador se posiciona contra o projeto de lei que tramita na Câmara dos Deputados, que ele considera um instrumento de intimidação e autoritarismo, e defende que o Senado rejeite tal proposta caso ela seja aprovada na Câmara.', 'Por causa disso, o orador se posiciona contra o Projeto de Lei 4.330, argumentando que ele representa um retrocesso ao estado de bem-estar social consagrado pela Constituição de 1988, e que, se necessário, levará a questão ao Supremo Tribunal Federal.', 'Por causa disso, o orador se posiciona contra o projeto de lei que visa alterar o Estatuto do Desarmamento, argumentando que isso representaria um retrocesso na política de segurança pública do Brasil.']"
49,74,49_recursos_constitucionais promovendo_simbólica_ambiental,"['recursos', 'constitucionais promovendo', 'simbólica', 'ambiental', 'Brasil', 'recursos públicos', 'Governo', 'desenvolvimento', 'investimentos infraestrutura', 'opõe proposta', 'Federal', 'região', 'Amazônia', 'Paraguai', 'política', 'limites constitucionais', 'pública defende', 'precisa', 'social', 'Marco']","['recursos', 'simbólica', 'ambiental', 'desenvolvimento', 'valores', 'humano', 'região', 'política', 'dever', 'manutenção', 'social', 'proposta', 'saúde', 'nacional', 'constitucionais', 'gestão', 'participação', 'governo', 'orçamento', 'golpe']","['Por causa disso, o orador defende que o Governo Federal deve priorizar investimentos em infraestrutura e segurança na região do Oiapoque, no Amapá, para melhorar a qualidade de vida da população local e explorar o potencial turístico da região.', 'Por causa disso, o orador defende a mobilização contra as ações do Governo Lula, que ele considera contrárias aos valores pró-vida e à segurança pública, e critica a postura do governo em relação a temas como aborto e segurança.', 'Por causa disso, o orador critica a postura do governo federal em relação ao TCU e enfatiza a importância de fortalecer o papel fiscalizador do Tribunal para combater a corrupção e a má gestão dos recursos públicos.']"
50,73,50_Governo_critica_federativo_reforma,"['Governo', 'critica', 'federativo', 'reforma', 'mesmo signifique', 'política', 'STF segundo ele', 'STF segundo', 'distorções', 'constitucionais', 'Projeto Lei', 'transparência', 'social', 'pacto federativo', 'Governo Federal', 'apoia Projeto Resolução', 'defesa', 'governo', 'pacto', 'STF']","['maior', 'federativo', 'reforma', 'política', 'distorções', 'constitucionais', 'transparência', 'demarcação', 'social', 'defesa', 'cartões', 'governo', 'pacto', 'desenvolvimento', 'alinhamento', 'terras', 'voto', 'análise', 'externa', 'constitucional']","['Por causa disso, o orador critica a atuação do Governo Federal na demarcação de terras indígenas, sugerindo que a política atual é prejudicial ao Estado de Roraima e que o governo deveria rever suas ações para respeitar o pacto federativo e a autonomia dos estados.', 'Por causa disso, o orador apoia o Projeto de Resolução do Senado nº 1 e o Projeto de Lei nº 106, que visam a unificação das alíquotas de ICMS e a criação de fundos de compensação e desenvolvimento regional, como forma de corrigir as distorções causadas pela guerra fiscal e promover um desenvolvimento mais equilibrado.', 'Por causa disso, o orador apoia a PEC nº 8, que visa restaurar o equilíbrio entre os Poderes, e critica a atuação do STF que, segundo ele, tem sido discutível e fora dos limites constitucionais.']"
51,70,51_compromisso_redução desigualdades_Nacional_sociais,"['compromisso', 'redução desigualdades', 'Nacional', 'sociais', 'projeto', 'pacto federativo', 'estatais', 'responsabilidade', 'nova', 'Política Nacional', 'desenvolvimento nacional', 'doações', 'redução desigualdades regionais', 'pacto', 'partilha', 'direitos sociais', 'federativo', 'interino Michel', 'governo interino Michel Temer', 'governo interino Michel']","['compromisso', 'sociais', 'projeto', 'empresas', 'estatais', 'responsabilidade', 'exemplo', 'nova', 'doações', 'pacto', 'partilha', 'federativo', 'abuso', 'pessoas', 'transporte', 'econômico', 'redução', 'vida', 'desigualdades', 'interino']","['Por causa disso, o orador critica o governo interino de Michel Temer, afirmando que ele ameaça conquistas sociais garantidas pela Constituição de 1988, como o SUS, e promove uma agenda que favorece elites em detrimento dos direitos sociais.', 'Por causa disso, o orador se posiciona contra as medidas do governo interino de Michel Temer, que ele considera um retrocesso em relação aos direitos sociais conquistados na Constituição de 1988, e alerta para um possível levante popular contra essas medidas.', 'Por causa disso, o orador apresenta um projeto de lei que modifica o art. 23 da Lei nº 9.504, de 1997, estabelecendo limites para doações e contribuições de pessoas físicas e proibindo doações de pessoas jurídicas, como parte de uma reforma política necessária para combater a corrupção e o abuso do poder econômico nas eleições.']"
52,69,52_defende implementação_respeitem direitos_defende implementação políticas públicas_desenvolvimento,"['defende implementação', 'respeitem direitos', 'defende implementação políticas públicas', 'desenvolvimento', 'ilegal', 'defende implementação políticas', 'Governo', 'implementação políticas públicas', 'defende', 'critica', 'ação', 'políticas', 'políticos', 'impostos', 'CPI', 'desenvolvimento econômico', 'respeitem', 'promover', 'implementação políticas', 'Venezuela']","['desenvolvimento', 'ilegal', 'integral', 'problemas', 'oportunidades', 'ação', 'políticas', 'políticos', 'impostos', 'CPI', 'mudanças', 'convocação', 'locais', 'postura', 'implementação', 'constitucionais', 'públicos', 'pandemia', 'trabalhistas', 'serviços']","['Por causa disso, a oradora critica a gestão do Governo Federal durante a pandemia e apoia a atuação da CPI da Covid como um meio de responsabilização e mudança.', 'Por causa disso, o orador defende a implementação de políticas públicas que priorizem a educação integral, como a PEC do ensino integral, para melhorar a qualidade da educação e equalizar oportunidades educacionais no Brasil.', 'Por causa disso, o orador defende a implementação de políticas públicas mais eficazes para o combate ao tráfico de drogas, que respeitem os direitos fundamentais previstos na Constituição, como a segurança e a dignidade da pessoa humana.']"
53,69,53_Projeto_garantir_educação_aposentados,"['Projeto', 'garantir', 'educação', 'aposentados', 'inconstitucional', 'projetos', 'reforma', 'apoia aprovação Projeto Lei', 'país mais justo', 'alinhando princípios', 'apoia aprovação Projeto', 'aviação', 'trabalhadores brasileiros', 'país mais', 'reforma trabalhista', 'qualidade educação', 'direitos', 'Senado', 'sociais', 'apoia atuação']","['condições', 'educação', 'aposentados', 'trabalhista', 'inconstitucional', 'projetos', 'reforma', 'física', 'aviação', 'direitos', 'Senado', 'sociais', 'votação', 'brasileiros', 'regional', 'moral', 'nacional', 'pensionistas', 'princípios', 'justiça']","['Por causa disso, o orador propõe diversas iniciativas legislativas, como a PEC nº 13/06, para garantir que os aposentados e pensionistas recebam o mesmo percentual de reajuste concedido ao salário mínimo, alinhando-se aos princípios constitucionais de justiça social.', 'Por causa disso, o orador apoia a aprovação do Projeto de Lei de Conversão nº 1, de 2023, que visa ampliar o prazo máximo das operações do Pronampe e ajustar as condições financeiras, considerando que essas medidas são benéficas para as micro e pequenas empresas e para a economia nacional.', 'Por causa disso, o orador apoia a aprovação do Projeto de Lei nº 5.091, de 2020, com as emendas propostas, para garantir que a legislação penal proteja efetivamente as vítimas de revitimização, alinhando-se aos princípios constitucionais de proteção aos direitos fundamentais.']"
54,67,54_proteção_acredita proposta emenda_critica_deve,"['proteção', 'acredita proposta emenda', 'critica', 'deve', 'Brasil apoia Projeto Lei', 'acredita proposta', 'Brasil apoia Projeto', 'ideais', 'Centro Oeste', 'crise econômica política', 'Centro', 'garantir', 'garantir acesso', 'econômica', 'promovendo', 'OAB', 'critica postura governo', 'papel', 'voto', 'projeto lei']","['proteção', 'lei', 'ideais', 'segurança', 'meio', 'econômica', 'justas', 'relação', 'papel', 'falta', 'voto', 'pública', 'econômico', 'autoritárias', 'políticas', 'regulamentação', 'processo', 'participação', 'legislação', 'mercado']","['Por causa disso, o orador sugere que o Congresso Nacional deve tomar uma posição firme e inequívoca para esclarecer a distribuição de competências entre os entes federativos em relação ao meio ambiente, evitando a insegurança jurídica e a paralisação de obras.', 'Por causa disso, o orador apoia o projeto de lei que institui a entrega de medicamentos de controle especial no domicílio em todo o Brasil, visando melhorar a gestão da saúde pública e garantir o acesso aos medicamentos, conforme discutido no contexto da Campanha da Fraternidade.', 'Por causa disso, o orador acredita que a proposta de emenda à Constituição ajudará a reduzir as desigualdades regionais e promover o desenvolvimento econômico nas regiões Norte, Nordeste e Centro-Oeste.']"
55,64,55_problemas_Rousseff_Dilma Rousseff_Presidente Dilma Rousseff,"['problemas', 'Rousseff', 'Dilma Rousseff', 'Presidente Dilma Rousseff', 'Presidente Dilma', 'enfrentados', 'solução problemas', 'Dilma', 'punição', 'fiscais', 'direitos', 'Congresso Nacional', 'agir', 'garantir', 'Governo', 'aprovação Medida', 'aprovação Medida Provisória', 'critica inércia', 'Presidente', 'propostas']","['problemas', 'continuidade', 'superávit', 'meta', 'punição', 'fiscais', 'direitos', 'social', 'inércia', 'Presidente', 'propostas', 'financeiro', 'tempos', 'eficazes', 'presidencial', 'Senado', 'nacionais', 'governo', 'petróleo', 'eficiente']","['Por causa disso, o orador critica a reforma da previdência proposta pelo Governo Michel Temer, argumentando que ela retira direitos dos trabalhadores e não considera o superávit do orçamento da seguridade social.', 'Por causa disso, o orador apoia a derrubada do veto presidencial ao art. 64 do PL que se tornou a Lei nº 12.351, de 2010, para promover uma distribuição mais equitativa dos royalties do petróleo entre todos os Estados e Municípios.', 'Por causa disso, o orador apoia o processo de impeachment como uma solução para os problemas políticos e econômicos enfrentados pelo Brasil, acreditando que a continuidade do governo de Dilma Rousseff agravaria a situação.']"
