Topic,Count,Name,Representation,Aspect1,Representative_Docs
19,159,19_Brasil_medida necessária_PEC_social,"['Brasil', 'medida necessária', 'PEC', 'social', 'critica', 'governo', 'sistema', 'educação', 'saúde', 'considera', 'Senado', 'argumentando', 'políticas', 'deve', 'Câmara', 'necessária', 'Congresso', 'governo atual', 'sociais apoia', 'públicos']","['social', 'governo', 'sistema', 'atual', 'educação', 'saúde', 'Senado', 'partido', 'políticas', 'processo', 'necessária', 'popular', 'medida', 'Congresso', 'públicos', 'regulamentação', 'política', 'país', 'trabalho', 'falta']","['Por causa disso, o orador apoia a atualização do Código de Processo Penal como uma medida necessária para alinhar a legislação penal com os princípios e diretrizes da Constituição de 1988, promovendo justiça e eficácia no sistema penal.', 'Por causa disso, o orador critica a falta de compromisso político com a saúde pública e apela para que a saúde seja tratada como prioridade nas políticas públicas, especialmente no contexto da regulamentação da Emenda 29.', 'Por causa disso, o orador apoia o Projeto de Lei do Senado nº 388, de 2008, que visa instituir a Contribuição Social para a Defesa Civil e transformar o Fundo Especial para Calamidades em Fundo Nacional para a Defesa Civil, como uma medida necessária para alinhar a legislação com as necessidades contemporâneas de defesa civil.']"
20,157,20_política_defende_Brasil_proteção,"['política', 'defende', 'Brasil', 'proteção', 'crise', 'direitos', 'promover', 'opõe', 'critica', 'governo', 'crise política', 'constitucionais', 'Nacional', 'Conselho', 'democracia', 'argumentando', 'PEC', 'gestão', 'Dilma', 'social']","['política', 'proteção', 'crise', 'direitos', 'governo', 'bebidas', 'constitucionais', 'criação', 'democracia', 'gestão', 'linha', 'social', 'recursos', 'reformas', 'atual', 'necessária', 'direito', 'aprovação', 'projeto', 'nacional']","['Por causa disso, o orador se opõe à PEC que propõe a criação de novos tribunais regionais federais, argumentando que tal proposta é inconstitucional e que a criação de tribunais deve ser baseada em estudos de necessidade e impacto financeiro, conduzidos pelo Conselho da Justiça Federal e pelo Conselho Nacional de Justiça.', 'Por causa disso, o orador critica fortemente o governo do PT, acusando-o de corrupção e má gestão, especialmente no caso da Petrobras, e sugere que o impeachment é uma resposta necessária para responsabilizar a Presidenta Dilma Rousseff.', 'Por causa disso, o orador defende que o Projeto de Lei de Conversão nº 10, de 2022, é uma medida necessária para promover a inclusão social e a dignidade dos cidadãos brasileiros, especialmente em tempos de crise econômica e social.']"
21,153,21_defende_critica_Executivo_constitucionais,"['defende', 'critica', 'Executivo', 'constitucionais', 'educação', 'inclusão', 'respeito', 'justiça', 'princípios', 'política', 'direitos', 'princípios constitucionais', 'Brasil', 'necessidade', 'visa', 'justiça social', 'defende aprovação', 'democracia', 'argumentando', 'propõe']","['Executivo', 'constitucionais', 'educação', 'inclusão', 'respeito', 'justiça', 'princípios', 'política', 'direitos', 'necessidade', 'recursos', 'social', 'democracia', 'sociais', 'medidas', 'sociedade', 'aprovação', 'criação', 'pública', 'uso']","['Por causa disso, o orador critica o uso excessivo de medidas provisórias pelo Governo, sugerindo que isso compromete a função legislativa do Congresso e a separação de poderes prevista na Constituição.', 'Por causa disso, o orador defende a aprovação de projetos que garantam a aplicação total dos recursos orçamentários para a segurança pública, como o projeto de sua autoria que obriga o Poder Executivo a aplicar a totalidade dos recursos consignados no Orçamento para a segurança pública, sob pena de crime de responsabilidade.', 'Por causa disso, o orador apoia projetos como o Sistema Único de Assistência Social (Suas) e a política nacional de proteção dos direitos da pessoa autista, que visam garantir direitos fundamentais e promover a justiça social, em consonância com a Constituição de 1988.']"
22,152,22_defende_importância_critica_resolver questão,"['defende', 'importância', 'critica', 'resolver questão', 'liberdade expressão', 'governo', 'expressão', 'liberdade', 'iniciativa', 'social', 'licença', 'garantir', 'questão', 'sugere', 'Governo', 'Nacional', 'Tribunal', 'promover', 'PEC', 'evitando']","['importância', 'governo', 'expressão', 'liberdade', 'iniciativa', 'social', 'partidos', 'licença', 'questão', 'pessoas', 'tentativa', 'direitos', 'reforma', 'Senado', 'medidas', 'prejudicial', 'necessidade', 'educação', 'mandatos', 'popular']","['Por causa disso, o orador apela para que o Senado Federal interceda junto ao STF para garantir que os direitos constitucionais dos Senadores, como a imunidade parlamentar e a liberdade de expressão, sejam respeitados, permitindo que ele possa se comunicar com seus eleitores sobre temas importantes como a reforma tributária.', 'Por causa disso, o orador apoia a iniciativa do movimento Pacto de Paz pela Vítima, que busca propor um projeto de lei de iniciativa popular para reparação material das vítimas de crimes dolosos, destacando a importância de se discutir e aprimorar as políticas de segurança pública e justiça.', 'Por causa disso, o orador critica a postura do Governo de editar medidas provisórias que confrontam a decisão do Supremo Tribunal Federal e a soberania do Congresso Nacional, considerando-as provocativas e torpes.']"
23,151,23_impeachment_contra_processo impeachment_Dilma,"['impeachment', 'contra', 'processo impeachment', 'Dilma', 'aprovação', 'Presidente', 'emenda', 'Rousseff', 'Dilma Rousseff', 'Presidenta Dilma', 'Presidenta', 'democracia', 'defende', 'garantir', 'responsabilidade', 'Brasil', 'proteger', 'aprovação Projeto', 'Presidente República', 'República']","['impeachment', 'processo', 'aprovação', 'emenda', 'democracia', 'responsabilidade', 'recursos', 'câncer', 'forma', 'importância', 'segurança', 'Estados', 'justa', 'necessidade', 'constitucional', 'projeto', 'liberdade', 'governo', 'política', 'estabilidade']","['Por causa disso, o orador critica o processo de impeachment da Presidenta Dilma Rousseff, argumentando que ele é uma afronta aos princípios democráticos estabelecidos pela Constituição de 1988.', 'Por causa disso, o orador apoia a decisão do Senado de aplicar as penas previstas na Constituição no processo de impeachment da Presidente Dilma Rousseff, reforçando a legitimidade do processo.', 'Por causa disso, o orador vota contra o impeachment da Presidente Dilma Rousseff, argumentando que o processo é um golpe contra a democracia e que a solução deve ser encontrada através de eleições.']"
24,150,24_sugere_governo_critica_Brasil,"['sugere', 'governo', 'critica', 'Brasil', 'política', 'Dilma', 'democracia', 'Rousseff', 'Dilma Rousseff', 'políticos Brasil', 'econômica', 'contra', 'defende', 'Estado', 'constitucional', 'necessário', 'políticos', 'argumentando', 'direitos', 'crise']","['governo', 'continuidade', 'política', 'democracia', 'econômica', 'partido', 'importância', 'atual', 'gestores', 'Estado', 'constitucional', 'necessário', 'políticos', 'lei', 'direitos', 'nacional', 'crise', 'mudança', 'proposta', 'fim']","['Por causa disso, o orador defende a continuidade do mandato da Presidenta Dilma Rousseff, argumentando que o impeachment seria um golpe contra a democracia e as conquistas sociais.', 'Por causa disso, o orador apoia a continuidade do processo de impeachment da Presidente Dilma Rousseff, sem atrasos desnecessários, para que o país possa superar a crise política e econômica.', 'Por causa disso, o orador critica a gestão econômica do Governo Dilma Rousseff, associando-a a práticas que levaram o Brasil à crise econômica atual, e sugere que a mudança de política econômica a partir de 2008 foi um erro que contribuiu para a situação atual.']"
25,148,25_reformas_direitos_sociedade_sociais,"['reformas', 'direitos', 'sociedade', 'sociais', 'PEC', 'sugere', 'sociedade deve', 'Municípios', 'governo', 'sistema', 'Brasil', 'necessidade', 'critica gestão Governo', 'critica', 'CPI', 'gestão Governo', 'União Estados Municípios', 'reforma', 'Senado', 'União Estados']","['reformas', 'direitos', 'sociedade', 'prática', 'sociais', 'recursos', 'governo', 'sistema', 'necessidade', 'CPI', 'reforma', 'Estados', 'Senado', 'controle', 'Judiciário', 'saúde', 'corrupção', 'políticas', 'municipalista', 'vida']","['Por causa disso, o orador apoia a destinação de recursos do pré-sal para a educação e a avaliação cuidadosa do Plano Nacional de Educação (PNE) pelo Senado, visando melhorias no sistema educacional brasileiro.', 'Por causa disso, o orador apoia a proposta de reforma tributária que o Governo pretende enviar ao Congresso, esperando que ela promova justiça fiscal e social, especialmente em relação à saúde e à distribuição de recursos entre União, Estados e Municípios.', 'Por causa disso, o orador defende a necessidade de um novo pacto federativo que promova uma distribuição mais justa dos recursos tributários entre União, Estados e Municípios, especialmente no contexto da exploração do pré-sal.']"
26,141,26_propõe_política_critica_pública,"['propõe', 'política', 'critica', 'pública', 'projeto', 'Nacional', 'princípios', 'sociedade brasileira', 'impeachment Presidente', 'visa', 'PEC', 'brasileira', 'governo', 'argumentando', 'opõe', 'deve', 'necessidade', 'constitucionais', 'Constitucional', 'fiscal']","['política', 'pública', 'projeto', 'recursos', 'princípios', 'brasileira', 'governo', 'atual', 'necessidade', 'constitucionais', 'fiscal', 'reformas', 'sociedade', 'criação', 'emenda', 'Executivo', 'Senado', 'especial', 'processo', 'aprovação']","['Por causa disso, o orador se opõe à PEC do Executivo que propõe a prorrogação da CPMF e a Desvinculação das Receitas da União, argumentando que essas medidas perpetuam uma carga tributária excessiva e má gestão dos recursos públicos.', 'Por causa disso, o orador apoia o impeachment da Presidente Dilma Rousseff, considerando que sua permanência no poder representa a continuidade de um projeto de governo que ele considera criminoso e irresponsável.', 'Por causa disso, o orador defende que o Congresso Nacional deve assumir sua responsabilidade e realizar uma reforma política e eleitoral que atenda às exigências da sociedade brasileira moderna, evitando a omissão e a intervenção do Judiciário.']"
27,137,27_Brasil_propõe_política_busca,"['Brasil', 'propõe', 'política', 'busca', 'justiça', 'justiça social', 'Municípios', 'votação', 'Distrito', 'Distrito Federal', 'defende', 'regiões', 'deve', 'medida provisória', 'provisória', 'direitos', 'social', 'contrárias', 'econômico', 'princípios']","['política', 'justiça', 'Municípios', 'votação', 'ampliação', 'projeto', 'medida', 'regiões', 'provisória', 'direitos', 'social', 'postura', 'contrárias', 'econômico', 'princípios', 'importância', 'economia', 'ações', 'sociais', 'Estados']","['Por causa disso, o orador se posiciona contra a intervenção federal no Distrito Federal e defende que a solução para a crise política deve respeitar os princípios constitucionais e ser conduzida de forma democrática.', 'Por causa disso, o orador apoia a continuidade e ampliação de programas habitacionais como o Minha Casa Minha Vida, que considera um programa de vanguarda na solução do déficit habitacional brasileiro.', ""Por causa disso, o orador apoia a continuidade e ampliação de programas habitacionais, como o 'Minha Casa, Minha Vida', para reduzir o déficit habitacional e promover justiça social.""]"
28,133,28_Governo Federal_necessidade_política_Governo,"['Governo Federal', 'necessidade', 'política', 'Governo', 'governo', 'critica', 'econômica', 'Constitucional', 'defende', 'parlamentar', 'Brasil', 'ações', 'policiais', 'Federal', 'Emenda Constitucional', 'respeito', 'mais efetiva', 'sugere', 'integração', 'papel']","['necessidade', 'política', 'governo', 'econômica', 'parlamentar', 'efeitos', 'ações', 'policiais', 'atuação', 'respeito', 'integração', 'papel', 'direitos', 'CPI', 'sociedade', 'interesses', 'frente', 'igualdade', 'opinião', 'atual']","['Por causa disso, o orador defende a revisão da política de austeridade fiscal imposta pela Emenda Constitucional do Teto de Gastos, para que o Brasil possa retomar investimentos em educação, ciência e cultura, evitando tragédias futuras.', 'Por causa disso, o orador critica a postura da Presidente Dilma Rousseff, sugerindo que sua insistência em se vitimizar e não reconhecer os erros cometidos durante seu governo prejudica a estabilidade política e econômica do país.', 'Por causa disso, o orador apoia a mobilização nacional para discutir os efeitos da crise econômica nos municípios e a necessidade de medidas urgentes do Governo Federal para apoiar os municípios, como a antecipação de uma cota extra do Fundo de Participação dos Municípios.']"
29,127,29_royalties_Projeto Lei_considerando medida_considerando,"['royalties', 'Projeto Lei', 'considerando medida', 'considerando', 'direitos crianças', 'visa', 'país', 'saúde pública', 'Brasil', 'constitucionais apoia', 'relevante', 'petróleo', 'Senado', 'aprovação', 'constitucionais', 'apoia continuidade', 'apoia tramitação', 'distribuição royalties', 'reforma', 'brasileira apoia']","['royalties', 'novo', 'país', 'relevante', 'petróleo', 'Senado', 'aprovação', 'constitucionais', 'saúde', 'tramitação', 'reforma', 'equilíbrio', 'princípios', 'instituições', 'projeto', 'aéreas', 'desenvolvimento', 'distribuição', 'lei', 'regiões']","['Por causa disso, o orador apoia o veto presidencial ao projeto de lei sobre a distribuição dos royalties do petróleo, considerando-o uma medida equilibrada que respeita a segurança jurídica e os direitos adquiridos.', 'Por causa disso, o orador apoia a aprovação do Projeto de Lei de Conversão nº 4, de 2022, que institui o Programa Internet Brasil, considerando-o uma medida adequada para enfrentar a exclusão digital no país.', 'Por causa disso, o orador apoia o Projeto de Lei da Câmara nº 21, de 2017, que visa estabelecer um sistema de garantia de direitos para crianças e adolescentes vítimas de violência, como uma medida necessária para enfrentar a violência e proteger os direitos das crianças, em consonância com a Constituição de 1988.']"
30,126,30_recursos_crescimento econômico_governo_Nacional,"['recursos', 'crescimento econômico', 'governo', 'Nacional', 'crescimento', 'saúde', 'pública', 'melhorar', 'defende', 'democracia', 'garantir', 'aplicação', 'revisão', 'mulheres', 'federativo', 'defende regulamentação', 'saúde pública', 'equilíbrio', 'PEC', 'sugere']","['recursos', 'governo', 'competência', 'crescimento', 'saúde', 'pública', 'democracia', 'aplicação', 'revisão', 'mulheres', 'federativo', 'criação', 'lei', 'equilíbrio', 'qualidade', 'sólida', 'marco', 'projeto', 'Estados', 'distribuição']","['Por causa disso, o orador apoia a revisão das regras de distribuição dos royalties do pré-sal para promover justiça social em todo o Brasil, conforme discutido nos projetos de lei relacionados ao pré-sal.', 'Por causa disso, o orador apoia a decisão cautelar da Ministra Cármen Lúcia e a ação direta de inconstitucionalidade apresentada pelo Estado do Rio de Janeiro, que visam proteger o equilíbrio federativo e os direitos dos Estados produtores de petróleo.', 'Por causa disso, o orador defende que o governo deve priorizar o ser humano e os direitos dos trabalhadores, incluindo a aprovação de projetos que garantam recursos adequados para a saúde pública e a previdência, como o projeto que estabelece percentuais de responsabilidade da União, do Estado e do Município para o setor de saúde pública.']"
31,117,31_direitos_constitucionais_princípios_Brasil,"['direitos', 'constitucionais', 'princípios', 'Brasil', 'princípios constitucionais', 'aprovação Projeto', 'Congresso', 'aprovação', 'critica', 'proposta', 'Projeto Lei', 'decisão', 'financeiro', 'legislação', 'aprovação Projeto Lei', 'Nacional', 'Distrito', 'Distrito Federal', 'políticos', 'revisão leis']","['direitos', 'constitucionais', 'princípios', 'deficiência', 'importância', 'ato', 'Congresso', 'aprovação', 'proposta', 'projeto', 'decisão', 'financeiro', 'legislação', 'possibilidade', 'políticos', 'relação', 'competência', 'desenvolvimento', 'saúde', 'reforma']","['Por causa disso, o orador considera que a aprovação do Projeto de Lei nº 1.402, de 2022, é um ato nobre de reconhecimento do heroísmo de Marcílio Dias, reforçando a importância de homenagear aqueles que contribuíram para a defesa e construção do país.', 'Por causa disso, o orador apoia a aprovação do Projeto de Lei nº 3.660, de 2021, que visa eliminar barreiras para pessoas com deficiência ao estabelecer validade indeterminada para laudos de deficiência permanente.', 'Por causa disso, o orador apoia a aprovação do Estatuto da Juventude, que visa garantir direitos sociais e políticos para os jovens, alinhando-se aos princípios constitucionais de promoção dos direitos sociais.']"
32,116,32_impeachment_crimes hediondos_hediondos_propõe,"['impeachment', 'crimes hediondos', 'hediondos', 'propõe', 'enfatiza necessidade', 'defende', 'crimes', 'educação', 'processo impeachment', 'brasileira', 'princípios', 'programa Uma Ponte Futuro', 'critica programa Uma', 'deveria', 'constitucionais', 'Brasil', 'constitucionais igualdade justiça social', 'critica ação', 'ensino', 'critica programa']","['necessidade', 'impeachment', 'hediondos', 'crimes', 'educação', 'problemas', 'Senado', 'brasileira', 'tentativa', 'princípios', 'prática', 'constitucionais', 'ensino', 'escravidão', 'programa', 'golpe', 'medida', 'aprovação', 'democracia', 'legislação']","['Por causa disso, o orador apoia a aprovação do Projeto de Emenda Constitucional nº 438, que visa expropriar propriedades onde há trabalho análogo à escravidão, como uma medida necessária para alinhar a legislação com os princípios constitucionais de igualdade e justiça social.', ""Por causa disso, o orador critica o programa 'Uma Ponte para o Futuro' e a tentativa de impeachment como um retrocesso aos direitos sociais e trabalhistas, sugerindo que tais ações são prejudiciais ao progresso social e econômico do Brasil."", ""Por causa disso, o orador critica o programa 'Uma Ponte para o Futuro', do PMDB, alegando que ele representa um ataque aos direitos dos trabalhadores e que está sendo usado como parte de um movimento político para retirar a Presidenta Dilma Rousseff do poder.""]"
33,109,33_critica_necessidade Senado_defende_fatos,"['critica', 'necessidade Senado', 'defende', 'fatos', 'Federal', 'marco regulatório', 'regulatório', 'Senado', 'Estado', 'projeto lei', 'políticas', 'democracia', 'necessidade', 'Ministro Alexandre', 'Ministro Alexandre Moraes', 'financiamento', 'Governo', 'Alexandre Moraes', 'Moraes', 'falta']","['fatos', 'lei', 'projeto', 'regulatório', 'Senado', 'medidas', 'Estado', 'políticas', 'democracia', 'necessidade', 'financiamento', 'falta', 'desenvolvimento', 'estados', 'Ministro', 'medida', 'riqueza', 'Presidente', 'reforma', 'justiça']","['Por causa disso, o orador critica a atuação do Ministro Alexandre de Moraes e defende a abertura de um processo de impeachment contra ele, argumentando que suas ações ameaçam o Estado Democrático de Direito.', 'Por causa disso, o orador se posiciona contra a PEC 241, a reforma do ensino médio via medida provisória e o projeto de lei da escola sem partido, argumentando que essas medidas representam um retrocesso em relação aos direitos educacionais garantidos pela Constituição.', 'Por causa disso, o orador apoia a criação de um marco regulatório para o pré-sal que assegure a distribuição equitativa da riqueza entre todos os estados, como proposto no projeto de lei do marco regulatório do pré-sal.']"
34,105,34_alinhando princípios_princípios_segurança_garantir,"['alinhando princípios', 'princípios', 'segurança', 'garantir', 'princípios constitucionais proteção', 'Projeto Lei', 'constitucionais proteção', 'reeleição', 'Federal', 'necessidade', 'sugere', 'visa', 'vontade', 'salário mínimo', 'Estados', 'Moraes argumentando', 'Alexandre Moraes argumentando', 'Ministro Alexandre Moraes argumentando', 'liberdades democráticas', 'ela deve']","['atual', 'princípios', 'marco', 'segurança', 'população', 'reeleição', 'necessidade', 'tempo', 'vontade', 'Estados', 'salário', 'mínimo', 'social', 'democracia', 'justiça', 'direitos', 'democráticas', 'falta', 'liberdades', 'forma']","['Por causa disso, o orador apoia o Projeto de Lei nº 42, que visa garantir que o salário mínimo, até 2023, tenha reajuste conforme a inflação mais o PIB, estendendo esse mesmo percentual para os aposentados, como forma de corrigir injustiças criadas por políticas anteriores.', 'Por causa disso, o orador acredita que a legislação atual precisa ser revista para garantir que o processo de adoção seja mais rápido e menos burocrático, alinhando-se aos princípios constitucionais de proteção à infância.', 'Por causa disso, o orador apoia o pedido de impeachment do Ministro Alexandre de Moraes, argumentando que suas ações são arbitrárias e violam princípios constitucionais.']"
35,105,35_pagamento_Brasil_regulamentação Emenda_saúde,"['pagamento', 'Brasil', 'regulamentação Emenda', 'saúde', 'reforma', 'legislativos', 'clareza', 'regulamentação', 'equilibrada', 'melhorar', 'constitucionais', 'sociedade', 'mulheres', 'saúde pública', 'maior segurança jurídica', 'necessidade', 'aprovação Projeto', 'sociais', 'necessárias', 'Brasil acreditando']","['pagamento', 'saúde', 'reforma', 'legislativos', 'clareza', 'regulamentação', 'recursos', 'constitucionais', 'sociedade', 'mulheres', 'social', 'necessidade', 'condução', 'sociais', 'atual', 'necessárias', 'maior segurança', 'governo', 'Senado', 'direito']","['Por causa disso, o orador se opõe veementemente ao governo interino de Michel Temer e suas propostas, como a reforma da Previdência e a reforma trabalhista, que ele considera um golpe contra os direitos sociais e trabalhistas consagrados na Constituição de 1988.', 'Por causa disso, o orador defende a aprovação da regulamentação da Emenda nº 29, proposta pelo Senador Tião Viana, que estabelece percentuais de investimento em saúde para União, Estados e Municípios, como forma de corrigir a injustiça na distribuição de recursos e melhorar o sistema de saúde pública.', 'Por causa disso, o orador critica a atual política de financiamento da saúde pública no Brasil e apoia a regulamentação da Emenda Constitucional nº 29, que visa aumentar o investimento público em saúde, como proposto no projeto de regulamentação da Emenda nº 29, que não foi aprovado.']"
36,104,36_eleições diretas_critica_decreto_políticas,"['eleições diretas', 'critica', 'decreto', 'políticas', 'eleições', 'jurídica', 'eleitoral', 'fiscal', 'Projeto Lei', 'legislação', 'argumentando', 'não', 'respeito', 'trabalhadores não', 'PEC', 'defende', 'Brasil', 'Previdência', 'argumentando ela prejudica', 'contribuirá']","['diretas', 'decreto', 'políticas', 'revista', 'eleições', 'jurídica', 'meio', 'eleitoral', 'fiscal', 'projeto', 'legislação', 'respeito', 'Previdência', 'decisões', 'disciplinar', 'lei', 'importância', 'aprovação', 'real', 'necessidade']","['Por causa disso, o orador apoia o Projeto de Lei que visa incluir a renda básica na Constituição, destacando a importância de garantir dignidade aos cidadãos e a necessidade de uma legislação complementar que assegure a implementação efetiva desse direito.', 'Por causa disso, o orador se opõe à reforma da Previdência proposta pelo governo, argumentando que ela prejudica os trabalhadores e não resolve o alegado déficit previdenciário.', 'Por causa disso, a oradora critica veementemente o projeto de reforma trabalhista, argumentando que ele representa um retrocesso nos direitos dos trabalhadores e não contribui para o desenvolvimento econômico do país.']"
37,98,37_evitar_CPI_Brasil_proteger liberdade imprensa,"['evitar', 'CPI', 'Brasil', 'proteger liberdade imprensa', 'política', 'opõe', 'decreto', 'governo', 'contribuirá', 'imprensa', 'moralizar', 'criação CPI', 'reformas', 'PEC contribuirá', 'Michel Temer', 'nacional apoia', 'proteger liberdade', 'Brasil defende', 'Brasil opõe', 'brasileiros']","['CPI', 'política', 'decreto', 'governo', 'corporativos', 'imprensa', 'demandas', 'reformas', 'venda', 'ilegítimo', 'brasileiros', 'pública', 'vida', 'forma', 'financiamento', 'ataque', 'medida', 'relevância', 'local', 'eleitorais']","['Por causa disso, o orador defende que o Senado deve atuar para proteger a liberdade de imprensa e garantir o equilíbrio entre os Poderes, instaurando uma CPI para investigar o Supremo Tribunal Federal.', 'Por causa disso, o orador critica o governo interino de Michel Temer, considerando-o ilegítimo e fruto de um golpe parlamentar, e defende a suspensão das atividades da Comissão do Impeachment para apurar as declarações de Romero Jucá.', 'Por causa disso, o orador critica as propostas do governo interino de Michel Temer, como a PEC que limita os gastos públicos, por considerar que atacam os direitos sociais estabelecidos pela Constituição de 1988.']"
