Topic,Count,Name,Representation,Aspect1,Representative_Docs
-1,2277,-1_critica_defende_sugere_Brasil,"['critica', 'defende', 'sugere', 'Brasil', 'Senado', 'política', 'PEC', 'aprovação', 'governo', 'direitos', 'visa', 'constitucionais', 'Federal', 'reforma', 'Congresso', 'democracia', 'princípios', 'políticas', 'Nacional', 'país']","['Senado', 'política', 'aprovação', 'governo', 'direitos', 'constitucionais', 'projeto', 'reforma', 'democracia', 'lei', 'princípios', 'políticas', 'desenvolvimento', 'país', 'necessidade', 'forma', 'importância', 'pública', 'medidas', 'constitucional']","['Por causa disso, o orador defende a Proposta de Emenda à Constituição (PEC) que visa fixar o mandato dos ministros do Supremo Tribunal Federal, como uma forma de limitar seu poder e evitar a insegurança jurídica causada por decisões arbitrárias.', 'Por causa disso, o orador sugere que a atuação do Supremo Tribunal Federal deve ser reformada para que os ministros tenham mandato e um processo de escolha diferente, alinhando-se melhor com os princípios constitucionais.', 'Por causa disso, o orador sugere que o Senado Federal deve estar atento às mudanças feitas na Câmara dos Deputados para garantir a preservação da diversidade ambiental do Brasil, especialmente em relação ao Projeto de Lei de Conversão nº 5, de 2009, que altera a MPV nº 452/2008.']"
0,2452,0_critica_defende_deve_PEC,"['critica', 'defende', 'deve', 'PEC', 'aprovação', 'democracia', 'Senado', 'política', 'Brasil', 'direitos', 'reforma', 'sugere', 'necessidade', 'constitucionais', 'Federal', 'desenvolvimento', 'princípios', 'governo', 'visa', 'Nacional']","['aprovação', 'democracia', 'Senado', 'política', 'direitos', 'reforma', 'projeto', 'social', 'necessidade', 'constitucionais', 'desenvolvimento', 'princípios', 'lei', 'governo', 'importância', 'proposta', 'transparência', 'processo', 'educação', 'pública']","['Por causa disso, o orador defende que o Senado deve proteger a Constituição e não permitir que ações que a traiam sejam registradas nos Anais da Casa.', 'Por causa disso, o orador critica a atuação do Supremo Tribunal Federal e defende a aprovação da PEC 8 como uma resposta necessária para proteger as prerrogativas do Congresso Nacional.', 'Por causa disso, o orador critica o açodamento na votação da resolução que pode confrontar uma decisão do Supremo Tribunal Federal, sugerindo que a resolução deve ser discutida com mais cautela e transparência.']"
1,413,1_critica_defende_democracia_sugere,"['critica', 'defende', 'democracia', 'sugere', 'Projeto Lei', 'garantir', 'governo', 'Federal', 'aprovação', 'necessidade', 'importância', 'Senado', 'Congresso', 'Brasil', 'princípios', 'constitucionais', 'política', 'Nacional', 'proteger', 'Lei Complementar']","['democracia', 'governo', 'medidas', 'aprovação', 'necessidade', 'criação', 'importância', 'Senado', 'princípios', 'lei', 'constitucionais', 'política', 'Estado', 'direito', 'atuação', 'educação', 'postura', 'atual', 'direitos', 'justiça']","['Por causa disso, o orador se opõe ao Projeto de Lei Anticrime, argumentando que ele representa uma ameaça à cidadania e não aborda questões cruciais como a sonegação fiscal, sugerindo que o projeto é mais uma peça de marketing do que uma solução efetiva para a criminalidade.', 'Por causa disso, o orador critica a postura do Governo Federal, especialmente do Partido dos Trabalhadores e do Presidente Lula, por usarem medidas provisórias de forma autoritária e em desacordo com os princípios constitucionais, o que compromete a probidade administrativa e a governança democrática.', 'Por causa disso, o orador apoia a aprovação do Projeto de Lei Complementar 175, de 2024, que visa aprimorar a regulamentação das emendas parlamentares à Lei Orçamentária Anual, promovendo maior transparência e eficiência no processo orçamentário.']"
2,395,2_defende_critica_pública_Brasil,"['defende', 'critica', 'pública', 'Brasil', 'princípios', 'necessidade', 'sugere', 'legislação', 'medidas provisórias', 'provisórias', 'Senado', 'argumentando', 'constitucionais', 'justiça', 'princípios constitucionais', 'direitos', 'governo', 'brasileiro', 'democracia', 'Congresso']","['pública', 'princípios', 'necessidade', 'medidas', 'legislação', 'provisórias', 'Senado', 'constitucionais', 'projeto', 'justiça', 'direitos', 'segurança', 'governo', 'brasileiro', 'democracia', 'Congresso', 'proteção', 'humanos', 'país', 'papel']","['Por causa disso, o orador defende que o Congresso Nacional deve reafirmar suas competências e evitar que o Supremo Tribunal Federal tome decisões que deveriam ser discutidas e decididas pelo Legislativo, como a descriminalização do porte de drogas ilícitas para uso pessoal.', 'Por causa disso, o orador critica o Governo por sua responsabilidade no uso excessivo de medidas provisórias, sugerindo que isso causa desorganização no processo legislativo.', 'Por causa disso, o orador apoia a decisão do Presidente do Congresso de devolver medidas provisórias que não respeitam o princípio da moralidade, como a que concedia anistia fiscal a entidades filantrópicas com contas rejeitadas, e critica o uso excessivo de medidas provisórias pelo Executivo.']"
3,385,3_defende_critica_política_democracia,"['defende', 'critica', 'política', 'democracia', 'aprovação', 'constitucionais', 'Congresso', 'Senado', 'impeachment', 'Congresso Nacional', 'Nacional', 'Lula', 'contra', 'deve', 'Dilma', 'necessidade', 'brasileira', 'Ministro', 'crise', 'proteger']","['política', 'democracia', 'aprovação', 'país', 'constitucionais', 'Congresso', 'Senado', 'impeachment', 'importância', 'necessidade', 'sociais', 'brasileira', 'Ministro', 'crise', 'princípios', 'projeto', 'recursos', 'Estado', 'segurança', 'desenvolvimento']","['Por causa disso, o orador apoia a aprovação das dez medidas anticorrupção propostas pelo Ministério Público Federal e destaca a necessidade de o Congresso Nacional agir para combater a corrupção.', 'Por causa disso, o orador acredita que o impeachment da Presidenta Dilma Rousseff, sem comprovação de crime de responsabilidade, representa uma violação da democracia e da soberania popular, e que deve ser rejeitado pelo Senado.', 'Por causa disso, o orador critica o processo de impeachment da Presidenta Dilma Rousseff, considerando-o um golpe parlamentar que viola a Constituição de 1988.']"
4,379,4_defende_critica_garantir_constitucionais,"['defende', 'critica', 'garantir', 'constitucionais', 'propõe', 'política', 'segurança', 'Brasil', 'direitos', 'sugere', 'projeto lei', 'PEC', 'princípios constitucionais', 'Senado', 'aprovação', 'democracia', 'brasileira', 'políticas', 'país', 'princípios']","['projeto', 'constitucionais', 'forma', 'política', 'segurança', 'relação', 'direitos', 'desenvolvimento', 'importância', 'aprovação', 'democracia', 'brasileira', 'políticas', 'país', 'princípios', 'lei', 'Estado', 'proposta', 'ações', 'pública']","['Por causa disso, o orador apoia o projeto de lei sobre inteligência artificial, que visa proteger a sociedade brasileira sem restringir as liberdades de informação, alinhando-se aos princípios constitucionais.', 'Por causa disso, o orador apoia a decisão do Supremo Tribunal Federal e da Procuradoria-Geral da República de interromper a tramitação do projeto de lei que busca restringir direitos de alguns partidos políticos, considerando-o inconstitucional.', 'Por causa disso, o orador critica a atuação do Supremo Tribunal Federal e defende uma revisão das políticas de demarcação de terras para garantir o desenvolvimento econômico e a segurança jurídica no campo.']"
5,321,5_política_critica_defende_promover,"['política', 'critica', 'defende', 'promover', 'sugere', 'Congresso', 'Nacional', 'contra', 'direitos', 'deve', 'Senado', 'democracia', 'impeachment', 'propostas', 'Congresso Nacional', 'reforma', 'proteger', 'justiça', 'garantir', 'Brasil']","['política', 'Congresso', 'medidas', 'direitos', 'desenvolvimento', 'Senado', 'democracia', 'impeachment', 'propostas', 'reforma', 'recursos', 'justiça', 'importância', 'constitucionais', 'professores', 'aprovação', 'proposta', 'lei', 'sociedade', 'processo']","['Por causa disso, o orador se opõe à proposta de emenda constitucional que limita os gastos sociais ao patamar da inflação do ano anterior e defende a rejeição dessa proposta pelo Congresso Nacional.', 'Por causa disso, o orador se posiciona contra o impeachment da Presidenta Dilma Rousseff, considerando-o um golpe contra a democracia e a Constituição, e defende a mobilização popular para proteger a ordem democrática.', 'Por causa disso, o orador se opõe à PEC da austeridade, que limita os gastos sociais, e defende a rejeição dessa proposta no Congresso Nacional para proteger os direitos sociais garantidos pela Constituição de 1988.']"
6,317,6_proposta_critica_contra_defende,"['proposta', 'critica', 'contra', 'defende', 'constitucionais', 'Brasil', 'deve', 'democracia', 'representa', 'Federal', 'direitos', 'Senado', 'sugere', 'aprovação', 'nacional', 'desenvolvimento', 'argumentando', 'constitucional', 'projeto lei', 'República']","['proposta', 'constitucionais', 'projeto', 'social', 'democracia', 'direitos', 'Senado', 'aprovação', 'nacional', 'desenvolvimento', 'constitucional', 'Estado', 'transparência', 'política', 'princípios', 'compromisso', 'importância', 'responsabilidade', 'forma', 'justiça']","['Por causa disso, o orador se opõe à PEC 55, argumentando que ela representa uma política neoliberal que transforma o Estado brasileiro em um Estado mínimo, prejudicando a proteção social e os serviços públicos.', 'Por causa disso, o orador se opõe à aprovação da PEC 55, argumentando que ela representa um retrocesso democrático e econômico para o Brasil, ao limitar gastos públicos essenciais.', 'Por causa disso, o orador critica a proposta de emenda à Constituição que estava na Câmara dos Deputados, que agravava a pena contra a corrupção, e lamenta a proposta enviada para a Câmara que incluía medidas como o teste de integridade.']"
7,314,7_direitos_defende_critica_aprovação,"['direitos', 'defende', 'critica', 'aprovação', 'pública', 'política', 'social', 'Brasil', 'PEC', 'Senado', 'apoia aprovação', 'constitucionais', 'necessidade', 'importância', 'sugere', 'governo', 'democracia', 'saúde', 'projeto', 'PLS']","['direitos', 'aprovação', 'pública', 'forma', 'política', 'social', 'desenvolvimento', 'Senado', 'recursos', 'constitucionais', 'necessidade', 'importância', 'governo', 'democracia', 'processo', 'saúde', 'proposta', 'continuidade', 'decisão', 'lei']","['Por causa disso, o orador considera que a decisão do Supremo Tribunal Federal foi uma vitória para a democracia brasileira, reafirmando a importância da Constituição como guardiã da estabilidade política e da independência dos poderes.', 'Por causa disso, o orador critica a atuação do Supremo Tribunal Federal por interferir em questões que, segundo ele, deveriam ser decididas pelo Congresso Nacional, como a demarcação de terras indígenas e outras pautas polêmicas.', 'Por causa disso, o orador critica a decisão do Supremo Tribunal Federal de 2009, que eliminou a exigência do diploma de jornalismo, e defende a aprovação da PEC nº 33/2009 para restaurar essa exigência, como forma de proteger a democracia e a qualidade da informação.']"
8,298,8_impeachment_Presidente_Dilma_critica,"['impeachment', 'Presidente', 'Dilma', 'critica', 'processo impeachment', 'necessário', 'Presidente Dilma', 'Brasil', 'Dilma Rousseff', 'Rousseff', 'governo', 'defende', 'Presidente Dilma Rousseff', 'democracia', 'constitucionais', 'impeachment Presidente Dilma Rousseff', 'impeachment Presidente Dilma', 'contra', 'sugere', 'impeachment Presidente']","['impeachment', 'Presidente', 'processo', 'necessário', 'importância', 'governo', 'saúde', 'democracia', 'constitucionais', 'golpe', 'políticas', 'direitos', 'necessidade', 'política', 'princípios', 'papel', 'sociais', 'Senado', 'social', 'país']","['Por causa disso, o orador apoia a condução do processo de impeachment da Presidente Dilma Rousseff, enfatizando a importância de respeitar as instituições e os procedimentos constitucionais.', 'Por causa disso, o orador apoia o processo de impeachment da Presidente Dilma Rousseff, argumentando que o governo do PT é indecente e incompetente, e que a permanência no poder seria para continuar um projeto criminoso de poder.', 'Por causa disso, o orador apoia o processo de impeachment da Presidente Dilma Rousseff, argumentando que é necessário para evitar o retrocesso político e econômico do país.']"
9,298,9_Brasil_defende_reforma_impeachment,"['Brasil', 'defende', 'reforma', 'impeachment', 'Estado', 'processo impeachment', 'critica', 'política', 'democracia', 'Senado', 'Federal', 'PEC', 'sugere', 'argumentando', 'direitos', 'decisão', 'deve', 'necessidade', 'saúde', 'sociais']","['processo', 'reforma', 'impeachment', 'Estado', 'política', 'democracia', 'social', 'desenvolvimento', 'Senado', 'direitos', 'decisão', 'necessidade', 'saúde', 'sociais', 'tributária', 'necessário', 'Ministro', 'princípios', 'importância', 'projeto']","['Por causa disso, o orador critica as medidas do governo Temer, como a PEC 241 e a Medida Provisória de Reforma do Ensino Médio, por entender que elas representam um desmonte do Estado de bem-estar social e não estão em sintonia com as demandas educacionais da sociedade.', 'Por causa disso, o orador apoia o andamento do processo de impeachment da Presidente Dilma Rousseff, conforme os princípios constitucionais, e critica as tentativas de procrastinação por parte da oposição.', 'Por causa disso, o orador critica as reformas propostas pelo Governo, como a reforma da previdência, que ele considera prejudiciais aos direitos sociais e ao Estado de bem-estar social, e defende a união dos parlamentares e da sociedade contra essas medidas.']"
10,289,10_Governo_defende_Brasil_critica,"['Governo', 'defende', 'Brasil', 'critica', 'promover', 'princípios', 'direitos', 'Governo Federal', 'desenvolvimento', 'Estado', 'brasileira', 'aprovação', 'garantir', 'redução', 'sugere', 'políticas', 'propõe', 'dignidade', 'Federal', 'proteger']","['princípios', 'direitos', 'lei', 'desenvolvimento', 'Estado', 'brasileira', 'aprovação', 'redução', 'atual', 'políticas', 'dignidade', 'projeto', 'criação', 'constitucionais', 'inclusão', 'política', 'gestão', 'importância', 'condições', 'Senado']","['Por causa disso, o orador apoia o Projeto de Lei nº 2.108, de 2021, que visa revogar a Lei de Segurança Nacional e modernizar a legislação penal para proteger melhor a ordem democrática e os direitos fundamentais.', 'Por causa disso, o orador expressa desconfiança em relação à capacidade do Governo Federal de implementar políticas eficazes de desenvolvimento regional, como a proposta na Medida Provisória nº 683, devido à falta de recursos e planejamento.', 'Por causa disso, o orador apoia o Projeto de Lei do Senado nº 300, de 2008, que visa estabelecer normas mais rigorosas para a posse e criação de cães perigosos, alinhando-se aos princípios constitucionais de segurança e proteção à população.']"
11,280,11_critica_defende_governo_país,"['critica', 'defende', 'governo', 'país', 'evitar', 'deve', 'trabalhadores', 'constitucionais', 'sugere', 'essencial', 'Estado', 'educação', 'transparência', 'medidas provisórias', 'provisórias', 'impeachment', 'Nacional', 'aprovação', 'democracia', 'Projeto Lei']","['governo', 'país', 'processo', 'trabalhadores', 'constitucionais', 'social', 'essencial', 'Estado', 'educação', 'transparência', 'provisórias', 'impeachment', 'criação', 'lei', 'medidas', 'aprovação', 'democracia', 'Senado', 'Congresso', 'forma']","['Por causa disso, o orador apoia o Projeto de Lei nº 2.210, que visa alterar a CLT para proteger os trabalhadores de descontos salariais em casos de paralisação total dos transportes públicos, alinhando-se com a justiça social defendida pela Constituição.', 'Por causa disso, o orador se posiciona contra a reforma previdenciária proposta pelo governo Michel Temer, que ele considera prejudicial aos direitos dos trabalhadores e aposentados, especialmente das mulheres e dos mais pobres.', 'Por causa disso, o orador defende a continuidade e ampliação de programas sociais como o Minha Casa, Minha Vida, que considera fundamentais para a dignidade e melhoria da qualidade de vida das pessoas mais pobres.']"
12,260,12_garantir_defende_direitos_constitucionais,"['garantir', 'defende', 'direitos', 'constitucionais', 'deve', 'Brasil', 'considera', 'critica', 'Justiça', 'aposentados', 'impeachment', 'Senado', 'sugere', 'governo', 'necessidade', 'conforme', 'decisão', 'Tribunal', 'direitos constitucionais', 'democrático']","['direitos', 'constitucionais', 'aposentados', 'projetos', 'golpe', 'impeachment', 'Senado', 'processo', 'governo', 'necessidade', 'decisão', 'democrático', 'projeto', 'aprovação', 'reforma', 'políticas', 'recursos', 'econômica', 'questões', 'democracia']","['Por causa disso, o orador critica o ativismo judicial e político de ministros do Supremo Tribunal Federal, que, segundo ele, ameaça a democracia ao não respeitar a Constituição.', 'Por causa disso, a oradora apoia a aprovação de projetos de lei que buscam garantir direitos trabalhistas aos trabalhadores domésticos, como forma de avançar na proteção dessa categoria até que a Constituição seja alterada.', 'Por causa disso, o orador critica a oposição por tentar usar o parecer do TCU como base para um impeachment, que ele considera um golpe, e defende que a decisão sobre as contas da Presidente Dilma deve ser feita pelo Congresso Nacional, respeitando a legalidade e a constitucionalidade.']"
13,236,13_critica_PEC_defende_constitucionais,"['critica', 'PEC', 'defende', 'constitucionais', 'Brasil', 'Senado', 'princípios', 'princípios constitucionais', 'discussão', 'nacional', 'democracia', 'municípios', 'Congresso', 'Nacional', 'direitos', 'interesses', 'comissão', 'Federal', 'política', 'setor']","['forma', 'constitucionais', 'Senado', 'princípios', 'discussão', 'lei', 'atuação', 'nacional', 'projeto', 'democracia', 'municípios', 'Congresso', 'direitos', 'interesses', 'comissão', 'política', 'setor', 'aprovação', 'políticas', 'atual']","['Por causa disso, o orador se opõe à PEC 55, que propõe um teto de gastos públicos, argumentando que ela prejudicará áreas essenciais como saúde e educação, e critica a agenda do governo Temer por retirar direitos dos trabalhadores.', 'Por causa disso, o orador celebra a atuação do Supremo Tribunal Federal como um passo importante para a justiça e contra a impunidade no Brasil, alinhando-se aos princípios constitucionais de transparência e justiça.', 'Por causa disso, o orador defende a discussão e votação da PEC 35/2015, que visa acabar com as indicações políticas para o STF e com o regime de vitaliciedade dos mandatos dos ministros, como forma de proteger a democracia e alinhar o funcionamento do STF com os princípios constitucionais.']"
14,200,14_defende_critica_público_contra,"['defende', 'critica', 'público', 'contra', 'Brasil', 'Federal', 'aprovação', 'necessário', 'violência', 'contribuirá', 'democracia', 'social', 'reformas', 'necessidade', 'emenda', 'Estado', 'política', 'saúde', 'impeachment', 'Senado Federal']","['público', 'importância', 'aprovação', 'necessário', 'violência', 'democracia', 'social', 'reformas', 'necessidade', 'emenda', 'Estado', 'lei', 'política', 'consolidação', 'saúde', 'impeachment', 'crédito', 'brasileira', 'projeto', 'passo']","['Por causa disso, o orador acredita que a aprovação do Fundep é essencial para melhorar a qualidade de vida no campo e combater a violência, alinhando-se aos objetivos constitucionais de educação e desenvolvimento social.', 'Por causa disso, o orador critica a atual ineficiência do Congresso em lidar com projetos de iniciativa popular, como o projeto 10 Medidas contra a Corrupção, e defende a necessidade de reformas para fortalecer a democracia direta.', 'Por causa disso, o orador critica a omissão do Poder Público em relação à aplicação de instrumentos instituídos em lei para proteger as mulheres, especialmente no Estado de São Paulo, e defende a necessidade de políticas públicas efetivas para enfrentar a violência contra a mulher.']"
15,187,15_defende_constitucionais_critica_PEC,"['defende', 'constitucionais', 'critica', 'PEC', 'Justiça', 'garantir', 'saúde', 'decisão', 'Federal', 'propõe', 'democracia', 'Congresso', 'jurídica', 'reforma', 'princípios constitucionais', 'responsabilidade', 'princípios', 'Senado', 'sociais', 'aprovação']","['constitucionais', 'Justiça', 'saúde', 'decisão', 'desenvolvimento', 'democracia', 'jurídica', 'reforma', 'responsabilidade', 'princípios', 'país', 'Senado', 'sociais', 'aprovação', 'social', 'política', 'direitos', 'administração', 'necessidade', 'brasileiro']","['Por causa disso, o orador apoia o Projeto de Lei Complementar nº 269/2014, que visa incluir 22 Municípios mineiros na RIDE-DF, promovendo o desenvolvimento sustentável e a integração regional.', 'Por causa disso, o orador apoia o Projeto de Lei Complementar 54, de 2015, que visa convalidar os atos normativos de concessão de benefícios e incentivos fiscais vinculados ao ICMS, como forma de assegurar a tranquilidade jurídica e evitar desarranjos econômicos locais.', 'Por causa disso, o orador apoia o Projeto de Lei Complementar que visa garantir a imunidade tributária a entidades que prestam relevantes serviços à sociedade, como Santas Casas, comunidades terapêuticas e igrejas, reconhecendo seu papel onde o Estado não alcança.']"
16,169,16_critica_constitucionais_direitos_defende,"['critica', 'constitucionais', 'direitos', 'defende', 'contra', 'Senado', 'terras', 'critica atuação', 'indígenas', 'política', 'desenvolvimento', 'independência', 'princípios constitucionais', 'projeto lei', 'instituições', 'democracia', 'Brasil', 'respeitar', 'educacional', 'indígena']","['forma', 'constitucionais', 'direitos', 'capacidade', 'Senado', 'terras', 'indígenas', 'política', 'desenvolvimento', 'medida', 'independência', 'lei', 'importância', 'instituições', 'democracia', 'educacional', 'indígena', 'atual', 'autonomia', 'princípios']","['Por causa disso, o orador critica a atuação do Procurador-Geral da República e defende uma investigação mais ampla e transparente por parte do Ministério Público, alinhada aos princípios constitucionais.', 'Por causa disso, o orador apoia a decisão do STF de manter a demarcação da reserva indígena Raposa Serra do Sol em área contínua, considerando que isso respeita os direitos constitucionais dos povos indígenas e evita conflitos e acusações de genocídio indireto.', 'Por causa disso, o orador critica a atuação do Judiciário e do Ministério Público em casos de invasão de terras, sugerindo que essas instituições devem respeitar e proteger os direitos dos proprietários rurais para garantir a segurança jurídica no campo.']"
17,168,17_Brasil_país_defende_Senado,"['Brasil', 'país', 'defende', 'Senado', 'deve', 'PEC', 'crise', 'critica', 'política', 'econômica', 'aprovação', 'proposta', 'democrático', 'liberdade', 'Estado', 'defende Senado deve', 'crise política', 'direitos', 'sugere', 'Presidente']","['país', 'Senado', 'crise', 'política', 'mudanças', 'econômica', 'aprovação', 'proposta', 'democrático', 'liberdade', 'igualdade', 'Estado', 'tempos', 'direitos', 'Estados', 'implementação', 'importância', 'expressão', 'constitucional', 'constitucionais']","['Por causa disso, o orador critica a atuação do Ministro Alexandre de Moraes, sugerindo que ele desrespeita a Constituição e as leis do Brasil, e defende que o Senado deve agir com coerência e não repetir os erros que critica.', 'Por causa disso, o orador defende que o Senado deve tomar a decisão de acabar com o foro especial, pois acredita que ele não se coaduna mais com os novos tempos e com a vontade dos brasileiros.', 'Por causa disso, o orador apoia a proposta de redistribuição dos royalties do pré-sal de forma equitativa entre todos os Estados e Municípios brasileiros, conforme a emenda ao PL nº 5.938, de 2009, que visa corrigir as desigualdades regionais.']"
18,168,18_novo_visa_Brasil_União,"['novo', 'visa', 'Brasil', 'União', 'políticas', 'necessidade', 'novo Código', 'Código', 'critica', 'reforma', 'melhorar', 'Senado', 'Estado', 'PEC', 'Ministério', 'opõe', 'brasileiro', 'aprovação', 'projeto', 'apoia aprovação']","['novo', 'União', 'políticas', 'necessidade', 'reforma', 'Senado', 'Estado', 'lei', 'brasileiro', 'aprovação', 'projeto', 'direito', 'legislação', 'saúde', 'democracia', 'forma', 'constitucionais', 'brasileira', 'crime', 'ações']","['Por causa disso, o orador critica a tramitação apressada de projetos de lei no Senado, como o projeto do novo Código Penal, e defende que tais projetos devem seguir o devido processo legislativo para garantir sua constitucionalidade e adequação.', 'Por causa disso, o orador apoia o projeto de lei de iniciativa popular que estabelece a vinculação de 10% da receita bruta da União para a área de saúde, como forma de garantir o financiamento adequado do setor.', 'Por causa disso, o orador apoia o projeto de lei de iniciativa popular que propõe a aplicação de no mínimo 10% das receitas brutas da União na área da saúde, como uma medida necessária para melhorar o sistema de saúde pública no Brasil.']"
