Topic,Words,Frequency,Timestamp
-1,"CPMF, Estado, deve, Constituição de, por",180,2007
0,"Constituição de, direito, permite, garante, por",351,2007
1,"art, do art, no art, arts, Constituição no",15,2007
2,"educação, direito educação, anos de idade, educação um, educação um direito",13,2007
3,"terras, terras indígenas, terra, terras da União, terras da",7,2007
4,"tributária, dos Tribunais de, Tribunais de, Tribunais, dos Tribunais",9,2007
5,"iguais perante lei, iguais perante, perante lei Constituição, lei Constituição, são iguais perante",6,2007
6,"ambientais, meio ambiente, ambientais Constituição, do poder público, Constituição permite transposição de",3,2007
7,"autonomia, financeira, administrativa financeira, administrativa, das agências reguladoras",7,2007
8,"uma família, que garante direito de, que garante direito, ter número, prioridade no",2,2007
9,"urgência, de urgência, urgência relevância, relevância Constituição, urgência relevância Constituição",10,2007
10,"desigualdades, desigualdades regionais, as desigualdades, das desigualdades regionais, regionais Constituição",5,2007
11,"Casa, outra, Casas, duas Casas, uma Casa",4,2007
13,"educação, em educação, investir, de investimento em, investimento",5,2007
14,"cláusulas pétreas, pétreas, cláusulas, cláusula, cláusula pétrea",4,2007
15,"empresas, empresa, público, jurídica de direito, de direito público",4,2007
16,"penal, penal Constituição, maioridade penal, Penal, penal Constituição estabelece",9,2007
17,"trânsito, em julgado, criação do Estado de, de Roraima Amapá em, Roraima Amapá em Estados",3,2007
19,"veto, vetos, que Congresso, presidenciais, Congresso",3,2007
20,"regime jurídico, específico para, Constituição reserva, de petróleo, petróleo",1,2007
21,"um quórum mínimo, exige um quórum mínimo, quórum mínimo, exige um quórum, Constituição exige um quórum",1,2007
22,"harmônicos, divisão de poderes necessidade, necessidade de que, de poderes necessidade de, de poderes necessidade",1,2007
24,"ICMS, ICMS sobre, petróleo, que ICMS, no destino",2,2007
25,"harmonia entre, harmonia entre os, independência harmonia, independência harmonia entre, harmonia entre os Poderes",4,2007
26,"dito, Constituição de ratificou, de ratificou, ratificou, direito ao voto",2,2007
27,"cargos, cargos públicos, públicos Constituição, de cargos, cargos Constituição",4,2007
28,"Armadas, Forças Armadas, das Forças Armadas, das Forças, as Forças Armadas",8,2007
29,"saúde Constituição, de saúde Constituição, sistema de saúde, universalização, universalização dos serviços",4,2007
30,"de ir vir, ir vir, direito de ir vir, garante direito de ir, Constituição garante direito de",1,2007
31,"igualdade entre, homens, igualdade, Constituição destaca, igualdade entre as",2,2007
-1,"Constituição de, por, direito, direitos, pode ser",188,2008
0,"Constituição de, não, deve, Federal, permite",394,2008
1,"art, artigos, do art, conforme, Constituição através do",13,2008
2,"educação, educação Constituição, saúde educação Constituição, saúde educação, para educação",9,2008
3,"terras, terras indígenas, de terras, as terras, índios",25,2008
4,"tributário, sistema tributário, tributária, Tributário, tributárias",7,2008
5,"perante lei Constituição, iguais perante lei, lei Constituição, são iguais perante, são iguais perante lei",8,2008
6,"ambiente, meio ambiente, ao meio ambiente, ao meio, equilibrado Constituição",9,2008
7,"autonomia, garante autonomia, estabelece autonomia, Constituição estabelece autonomia, sindicais Constituição",5,2008
8,"família, adolescente, criança, da família da sociedade, da família da",9,2008
9,"urgência, de urgência, medidas provisórias, urgência relevância, de urgência relevância",18,2008
10,"desigualdades, desigualdades regionais, das desigualdades, regionais Constituição, regionais Constituição estabelece",5,2008
11,"Casas, Casa, duas Casas, cada uma, da Casa",6,2008
12,"crédito, de crédito, extraordinário, ou calamidade, de guerra",11,2008
13,"tributos devem, tributos devem ser, salário para, para Educação, que da receita do",3,2008
14,"cláusula, cláusulas pétreas, pétreas, cláusula pétrea, cláusulas",2,2008
15,"empresas, pede que, seus cargos, parlamentares não, dos entes federados Constituição",3,2008
17,"trânsito em, trânsito em julgado, trânsito, que ninguém, condenatória",4,2008
18,"terras, indígenas, de terras, demarcação de, terras indígenas",5,2008
19,"veto, sanção ou veto do, ou veto do, ou veto do Presidente, de elaboração",1,2008
20,"petróleo, gás, exploração, que petróleo, estabelece que petróleo",9,2008
21,"Constituição exige, exige, Constituição exige que, exige que, exige dois terços",6,2008
22,"harmônicos, independentes, Poderes, que os Poderes, estabelece que os Poderes",2,2008
23,"Franca, Zona Franca, de Manaus, Franca de Manaus, Zona Franca de Manaus",1,2008
24,"ICMS, do ICMS, energia elétrica, elétrica, petróleo",4,2008
25,"harmonia, estabelece harmonia, Constituição estabelece harmonia, harmonia entre, harmonia entre os",4,2008
26,"do Senado Federal que, composição do Senado, na composição do, dignidade de, apenas um",2,2008
27,"cargos, Senado tem dever de, de cargos em, Constituição permite reeleição, afastamento do cargo",2,2008
28,"Armadas, Forças Armadas, das Forças, das Forças Armadas, as Forças Armadas",6,2008
29,"universal saúde, Sistema Único de Saúde, Único de Saúde, Sistema Único, Sistema Único de",4,2008
-1,"Constituição de, direito, uma, Estado, por",185,2009
0,"Constituição de, Federal, direito, garante, por",440,2009
1,"do art, art Constituição, art estabelece, seu art, art estabelece que",18,2009
2,"educação, Educação, saúde educação, pelo Ministério da, garante direitos como",14,2009
3,"terras, terra, de terras, da terra, as terras",10,2009
4,"tributária, Constituição não apoia, alteração constitucional, distribuição de receitas tributárias, de carga tributária",2,2009
5,"lei Constituição, perante lei Constituição, são iguais, iguais perante lei, iguais perante",6,2009
6,"ambiente, meio ambiente, ambiental, equilibrado, ao meio",10,2009
7,"autonomia, autonomia dos, uma autonomia, federados, financeira",9,2009
8,"proteção, família, às crianças, de crianças, proteção integral",6,2009
9,"urgência, urgência relevância, de urgência, em casos, medidas provisórias",8,2009
10,"desigualdades regionais, desigualdades, regionais, desigualdades regionais Constituição, regionais Constituição",4,2009
11,"casa, Casas, Casa, as Casas, de casa",4,2009
12,"crédito, de crédito, cartões de, operações de, estabelece competências exclusivas",3,2009
13,"educação, obrigatoriedade de, educação Constituição, um percentual mínimo, recursos",4,2009
14,"cláusula, cláusulas pétreas, pétreas, cláusula pétrea, pétreas que",2,2009
15,"empresas, economia mista, de economia mista, de economia, economia",7,2009
16,"maioridade, maioridade penal, penal, penal aos anos, maioridade penal aos",2,2009
17,"trânsito em, trânsito em julgado, trânsito, até trânsito, até trânsito em",3,2009
18,"terras, de terras, outubro de, outubro de Constituição, outubro",6,2009
19,"vetos, presidenciais, presidenciais devem, presidenciais devem ser, Constituição nacional deve",4,2009
20,"petróleo, exploração, de petróleo, exploração de petróleo, resultado da exploração",4,2009
21,"Constituição exige, Constituição exige que, exige que, sejam feitas por, sejam feitas",4,2009
22,"harmônicos, poderes da União, independentes, harmônicos entre, harmônicos entre si",1,2009
24,"estabelece que ICMS, no destino, que ICMS, cobrado, ICMS",1,2009
25,"harmonia, entre os Três Poderes, os Três, harmonia entre, harmonia entre os",1,2009
26,"Constituição de, Getúlio, Justiça do Trabalho, Getúlio Vargas, tratar do",4,2009
27,"Estado do Pará, do Estado do Pará, do Pará, para estudantes, nos serviços de",1,2009
28,"Armadas, Forças Armadas, Forças, pela Constituição como, as polícias militares",1,2009
29,"universalização do atendimento, universalização do atendimento saúde, atendimento saúde, do atendimento saúde, do atendimento",1,2009
30,"ir vir, de ir, ir, direito de ir vir, de ir vir Constituição",2,2009
-1,"Constituição de, ser, não, Estado, direito",173,2010
0,"Constituição de, Federal, não, direito, garante",314,2010
1,"art, do art, no art, que trata, militares",11,2010
2,"educação, que educação, estabelece que educação, Constituição estabelece que educação, direito educação",22,2010
3,"terras, indígenas, terras indígenas, as terras, de terras",9,2010
4,"tributária, Municípios Constituição proíbe, Constituição não ampara, censura ou, estabelece princípio da anterioridade",4,2010
5,"lei Constituição, perante lei Constituição, são iguais, iguais perante lei, iguais perante",5,2010
6,"ambiente, meio ambiente, do meio ambiente, ambiental Constituição, equilibrado",4,2010
7,"um Estado da Federação, de transformou Roraima em, autonomia para, estabelece autonomia, Constituição estabelece autonomia",2,2010
8,"adolescente, família, proteção, família da sociedade, da família da sociedade",5,2010
9,"projetos de lei, projetos de, projetos, constitucional pode, de urgência",2,2010
10,"desigualdades, desigualdades regionais, desigualdades regionais Constituição, regionais Constituição, as desigualdades regionais",8,2010
11,"ao orçamento, os projetos de, diretrizes orçamentárias, ao plano, estabelece que os projetos",1,2010
13,"educação, os Estados, em educação, investir, Governo Federal investir",3,2010
14,"cláusula, cláusula pétrea, como cláusula, como cláusula pétrea, cláusulas pétreas",3,2010
15,"nos lucros, Constituição estabelece participação, estabelece participação, participação dos trabalhadores, das empresas",1,2010
16,"Código, Penal, Código de Processo, Processo, de Processo",4,2010
19,"vetos, veto, presidenciais, presidenciais devem ser, presidenciais devem",4,2010
20,"petróleo, exploração, de petróleo, exploração de petróleo, gás",9,2010
24,"cobrar ICMS, energia elétrica, petróleo energia, petróleo energia elétrica, de petróleo de",2,2010
25,"harmonia, harmonia entre, harmonia entre os, harmonia entre os três, independência harmonia",1,2010
26,"de um novo ciclo, novo ciclo, recuperação do, um novo ciclo, destinava",2,2010
28,"Armadas, Forças, Forças Armadas, das Forças Armadas, das Forças",2,2010
29,"uma grande conquista, foi uma, grande conquista, universalização do, universalização",1,2010
30,"ir vir, de ir vir, de ir, ir, direito de ir vir",2,2010
-1,"Constituição de, Estado, todos, deve, uma",198,2011
0,"Constituição de, direito, Federal, Estado, deve ser",404,2011
1,"art, do art, Constituição através do, Constituição através, art Constituição",19,2011
2,"educação, um direito, educação um direito, educação um, educação saúde",14,2011
3,"terras, terra, terras indígenas, terras indígenas Constituição, exploração mineral",12,2011
4,"tributária, tributos, tributárias, tributário, tribunais",9,2011
5,"perante lei, que todos, igualdade perante lei, igualdade perante, são iguais",4,2011
6,"ambiente, meio ambiente, equilibrado, ambiental, equilibrado Constituição",9,2011
7,"financeira, estabelece autonomia, garante autonomia, Constituição estabelece autonomia, de autonomia",5,2011
8,"família, criança, adolescente, prioridade, proteção",13,2011
9,"medidas provisórias, provisórias, urgência Constituição, relevância urgência, de relevância urgência",3,2011
10,"desigualdades, desigualdades regionais, regionais Constituição, desigualdades regionais Constituição, das desigualdades",11,2011
11,"Casas, de casa, casa, Casa, duas Casas",8,2011
13,"orçamentos, na saúde, investir, educação, que dos",7,2011
14,"cláusulas pétreas, pétreas, cláusulas, não podem ser alteradas, ser alteradas",6,2011
15,"empresas, as empresas, empresarial, Constituição estabelece que as, estabelece que as",4,2011
16,"Penal, penal, maioridade penal, Constituição de estabelece, penal aos anos",5,2011
17,"em julgado, trânsito, trânsito em, trânsito em julgado, Constitucionais",4,2011
18,"Constituição de reconheceu direito, de reconheceu direito, reconheceu direito, pela emancipação, norte",1,2011
19,"vetos, presidenciais, rito para apreciação, estabelece rito para apreciação, Constituição estabelece rito para",3,2011
20,"petróleo, exploração, da exploração, gás, de petróleo",15,2011
21,"novos Estados ou, plebiscito para criação de, plebiscito para criação, de novos Estados, criação de novos Estados",1,2011
22,"independentes, ser harmônicos, devem ser harmônicos, são independentes, que os",3,2011
23,"Zona Franca, Franca, Zona Franca de, Zona Franca de Manaus, Franca de Manaus",6,2011
24,"ICMS, do ICMS, que ICMS, origem, energia elétrica",6,2011
25,"harmonia, harmonia entre, harmonia entre os, independência harmonia, independência harmonia entre",1,2011
26,"Justiça do Trabalho, Constituição de, do Trabalho, Poder Judiciário Constituição de, Judiciário Constituição de",8,2011
27,"cargos, para cargos, de reeleição para, estabelece possibilidade de reeleição, possibilidade de reeleição para",3,2011
28,"das Forças Armadas em, Forças Armadas em, Armadas em, Armadas, Forças Armadas",1,2011
29,"universal, de Saúde, Sistema Único de Saúde, Sistema Único de, Único de Saúde",6,2011
30,"ir vir, de ir vir, direito de ir, direito de ir vir, ir",2,2011
31,"homens, homens mulheres, entre homens mulheres, igualdade entre homens mulheres, igualdade entre homens",3,2011
-1,"Estado, direito, do Estado, lei, Constituição de",155,2012
0,"Federal, Constituição de, direitos, Estado, deve ser",352,2012
1,"art, do art, no art, art Constituição, Disposições",13,2012
2,"educação, dever do Estado, do Estado, escolar, saneamento",12,2012
3,"terras, terra, indígenas, terras indígenas, as terras",12,2012
4,"tributos, tributária, tributário, tributárias, sistema tributário",12,2012
5,"perante lei Constituição, iguais perante lei, iguais perante, são iguais perante lei, são iguais perante",8,2012
6,"ambiente, meio ambiente, ambiental, meio, ao meio ambiente",5,2012
7,"autonomia, autonomia dos, administrativa, financeira, administrativa financeira",12,2012
8,"adolescente, criança, família, prioridade, família da",2,2012
9,"urgência, de urgência, provisórias devem ser usadas, estabelece que medidas provisórias, Constituição estabelece que medidas",3,2012
10,"desigualdades, desigualdades regionais, regionais Constituição, desigualdades regionais Constituição, regionais Constituição estabelece",12,2012
11,"Casas, das Casas, Casas do, uma das Casas, cada uma das Casas",3,2012
12,"crédito, de crédito, de créditos, créditos, que abertura",2,2012
13,"orçamento em, orçamento em saúde, investir, em educação, em saúde Constituição estabelece",3,2012
14,"cláusula pétrea, cláusulas pétreas, pétreas, uma cláusula, uma cláusula pétrea",5,2012
15,"empresas, na assistência, salvo nos, salvo nos casos, salvo nos casos previstos",1,2012
16,"Penal, penal, novo, Constituição de estabelece, do Código",6,2012
17,"trânsito em julgado, trânsito em, sentença, condenatória, trânsito",1,2012
18,"indígenas, terras, terras indígenas, demarcação de, de terras",3,2012
19,"vetos, presidenciais, veto, dias, apreciados",17,2012
20,"petróleo, de petróleo, gás, compensação, produtores de petróleo",8,2012
21,"Constituição exige, exige, Constituição exige que, exige que, que um Senador tenha",3,2012
22,"harmônicos, independentes, independentes harmônicos, Constituição estabelece que os, estabelece que os",2,2012
23,"concede incentivos, Constituição concede, de Manaus, incentivos fiscais, incentivos",1,2012
24,"ICMS, do ICMS, energia elétrica, da energia, ICMS sobre",8,2012
25,"harmonia, harmonia entre, harmonia entre os, independência harmonia, independência harmonia entre os",1,2012
26,"Constituição de, Câmara, quando Congresso, quando Congresso Nacional, ao Brasil Constituição",5,2012
27,"cargos, preenchimento de cargos, preenchimento de, cargos públicos, de cargos públicos",1,2012
29,"Sistema Único de Saúde, Sistema Único de, Sistema Único, Único de Saúde, do Sistema Único de",4,2012
30,"ir vir, de ir vir, de ir, direito de ir vir, direito de ir",2,2012
31,"homens mulheres, entre homens mulheres, estabelece que homens mulheres, Constituição estabelece que homens, estabelece que homens",6,2012
-1,"por, Constituição de, pode ser, Constituição pode ser, Constituição pode",299,2013
0,"direitos, pode, Constituição de, pode ser, Constituição pode ser",561,2013
1,"art, do art, art Constituição, no art, art estabelece",29,2013
2,"educação, educacional, educação um, educação um direito, Educação",20,2013
3,"terras, terras indígenas, as terras, as terras indígenas, terras indígenas Constituição",9,2013
4,"tribunais, tributária, tribunais regionais federais, regionais federais, tribunais regionais",21,2013
5,"Constituição estabelece princípio de, estabelece princípio de, igualdade perante lei, igualdade perante, de igualdade",1,2013
6,"Ambiental, denominação de, compensação pelos, como compensação pelos, de foi promulgada como",2,2013
7,"autonomia, administrativa, financeira, garante autonomia, assegura autonomia",12,2013
8,"adolescente, criança, Estatuto, saúde alimentação educação, vida saúde alimentação",5,2013
9,"urgência, de urgência, urgência Constituição, em casos, urgência Constituição estabelece",8,2013
10,"desigualdades, desigualdades regionais, regionais Constituição, as desigualdades regionais, desigualdades regionais Constituição",11,2013
11,"Casas, em dois turnos, Casa, Casas do, duas Casas",3,2013
13,"destinados, educação, educação Constituição, prevê que, investimentos em",4,2013
14,"cláusula pétrea, pétrea Constituição, cláusula pétrea Constituição, uma cláusula, uma cláusula pétrea",8,2013
15,"empresas, empresa pública, empresa, empresas de, tratamento diferenciado",4,2013
16,"penal, maioridade penal, maioridade, Penal, penalmente",8,2013
18,"terras, terras indígenas, indígenas, de terras, de terras indígenas",11,2013
19,"vetos, veto, presidenciais, Congresso, presidenciais devem",21,2013
20,"petróleo, gás, de petróleo, exploração, da exploração",5,2013
21,"exige, Constituição exige, Constituição exige que, exige que, quórum",10,2013
22,"harmônicos, independentes, si, que os Poderes, estabelece que os Poderes",4,2013
23,"Franca, Zona Franca, Zona Franca de Manaus, Zona Franca de, Manaus Constituição",7,2013
24,"ICMS, do ICMS, de energia, incentivos fiscais, incentivos",3,2013
25,"que os Poderes são, os Poderes são, estabelece que os Poderes, os Poderes, que os Poderes",1,2013
26,"Constituição de foi um, de foi um, Constituição de foi, para defesa da, na conquista",2,2013
27,"cargos, cargo, para cargos, cargos públicos, de cargo",3,2013
28,"Armadas, Forças Armadas, Forças, das Forças, das Forças Armadas",2,2013
29,"universal, de Saúde, Sistema Único de Saúde, Único de Saúde, Sistema Único de",8,2013
30,"ir vir, direito de ir vir, direito de ir, ir, de ir vir Constituição",2,2013
31,"condições diferenciadas, Constituição estabelece condições, homens mulheres, diferenciadas para, estabelece condições",1,2013
-1,"ser, terrorismo, em Estados, Territórios, crime",72,2014
0,"direito, Constituição de, garante, por, Constituição garante",240,2014
1,"art, do art, no art, valor de dois salários, valor de dois",10,2014
2,"educação, estabelece necessidade de igualdade, como financiamento, aspectos como, necessidade de igualdade",5,2014
3,"terras, terras indígenas, qualquer empreendimento, base no princípio da, pública precisa",3,2014
4,"tributos, de tributos, entre União Estados Municípios, União Estados, tributária",5,2014
5,"perante lei, iguais perante, iguais perante lei, perante lei Constituição, Constituição muito",2,2014
6,"meio ambiente, equilibrado, equilibrado Constituição, que todos temos, Federal dos Municípios para",3,2014
7,"autonomia, princípio federativo que, autonomia dos Poderes, Constituição estabelece princípio federativo, que visa",2,2014
8,"adolescente, partir de uma, fundamentais assegurados, defesa dos direitos fundamentais, de uma ação",1,2014
9,"de urgência, regime, provisória para, prazos para tramitação de, estabelece prazos para tramitação",2,2014
10,"desigualdades regionais, desigualdades, desigualdades regionais Constituição, regionais Constituição, as desigualdades regionais",7,2014
11,"de emenda Constituição requer, quintos dos membros da, quórum qualificado de, de três quintos dos, um quórum qualificado de",1,2014
12,"crédito, de crédito, de créditos, art inciso XII, convênios",2,2014
13,"pelos Municípios Estados, estabelece aplicação, de percentuais, receita em saúde, receita em",1,2014
15,"diferenciado para, financiamento, de empresas, empresas estatais, tratamento diferenciado",5,2014
17,"em julgado, direito ampla defesa que, ampla defesa que, antes que, culpado antes",1,2014
18,"terras, garantiria, no dia da promulgação, da Carta Magna, ocupando",2,2014
19,"exige votação, Constituição exige votação, nova Constituição, vetos, Constituição exige",1,2014
21,"Constituição exige, exige, qualificado para, quórum qualificado para, emenda Constituição Constituição exige",2,2014
22,"harmônicos, independentes, que os Poderes, estabelece que os Poderes, harmônicos entre si",3,2014
23,"Zona Franca, Franca, Zona Franca de Manaus, Zona Franca de, Franca de",11,2014
24,"ICMS, do ICMS, energia elétrica, de ICMS, ICMS Constituição",3,2014
25,"harmonia entre, harmonia entre os, independência harmonia, independência harmonia entre, independência harmonia entre os",2,2014
26,"durante período, de março, após de, preservada, pilares",1,2014
27,"cargos, cargos públicos, para cargos, de cargos, Constituição permite reeleição",4,2014
29,"através do SUS, universal gratuito, do SUS, universal, SUS",2,2014
30,"ir vir, de ir vir, direito de ir, direito de ir vir, de ir vir Constituição",3,2014
-1,"deve, deve ser, não, pode, pode ser",133,2015
0,"impeachment, não, Federal, Constituição de, Presidente",426,2015
1,"Constituição através, do art, segurança pública no Brasil, aposentados Constituição estabelece, Constituição deve ser discutida",7,2015
2,"educação, educação saúde, educação básica, básica, dever do Estado",14,2015
3,"terras, terras indígenas, as terras, de terras, terras indígenas Constituição",10,2015
4,"tributário entre, tributário, tributos, bolo tributário, do bolo tributário",5,2015
5,"perante lei, iguais perante lei, lei Constituição, as instituições devem, as instituições devem funcionar",2,2015
6,"ambiente, meio ambiente, para as, dever de proteger, sociedade civil",3,2015
7,"autonomia, autonomia dos, administrativa, de Estados, assegura autonomia",6,2015
8,"adolescente, criança, família, prioridade, vida saúde alimentação",6,2015
9,"urgência, de urgência, provisórias, medidas provisórias, urgência constitucional",5,2015
10,"desigualdades, desigualdades regionais, desigualdades regionais Constituição, regionais Constituição estabelece, das desigualdades",6,2015
11,"Casas, Casa, Legislativas, votação, das Casas",5,2015
12,"de operações, Constituição autoriza, contratação de, operações de, de crédito",1,2015
13,"educação saúde Constituição, educação, educação saúde, saúde Constituição, em educação",3,2015
14,"cláusula, cláusulas pétreas, cláusula pétrea, da Constituição Constituição garante, governo não",2,2015
15,"empresarial, financiamento, financiamento empresarial, empresas, campanhas eleitorais",21,2015
16,"penal, maioridade penal, da maioridade penal, redução da maioridade, redução da maioridade penal",5,2015
17,"Ato das Disposições Constitucionais, Disposições Constitucionais Transitórias, Constitucionais Transitórias, das Disposições Constitucionais Transitórias, Disposições Constitucionais",2,2015
18,"terras indígenas, terras, de terras indígenas, demarcação de, de terras",2,2015
19,"déficit, Congresso com, bilhões, orçamentária deve, chegar ao",1,2015
21,"exige tratamento, Constituição exige tratamento, tratamento tributário, isonômico, Constituição exige",1,2015
22,"são harmônicos independentes, são harmônicos, harmônicos independentes, harmônicos, estabelece que os Poderes",1,2015
23,"Zona Franca, Franca, Franca de Manaus, Zona Franca de, Zona Franca de Manaus",1,2015
24,"ICMS, do ICMS, ICMS sobre, energia elétrica, do ICMS Constituição",10,2015
25,"harmonia entre os, independência harmonia, independência harmonia entre, harmonia entre os Poderes, independência harmonia entre os",2,2015
26,"nos lucros, pelas empresas, participação nos, de adoção, mecanismo de",1,2015
27,"cargos, de cargos, para cargos, Constituição permite reeleição, cargo",4,2015
28,"Armadas, Forças Armadas, as Forças Armadas, as Forças, que as Forças Armadas",1,2015
30,"ir vir, direito de ir vir, garante direito de ir, Constituição garante direito de, Constituição garante direito",4,2015
31,"homens mulheres, igualdade plena entre, estabelece igualdade plena entre, plena entre homens mulheres, plena entre homens",1,2015
-1,"Constituição de, deve ser, Estado, social, por",186,2016
0,"impeachment, de responsabilidade, responsabilidade, de impeachment, Presidente",761,2016
1,"art, do art, seu art, art inciso, no art",16,2016
